1001	IDNUM	13	23	88Y206206L
1001	MEDICALRECORD	24	35	8892062.BPL
1001	PATIENT	37	54	Vatterott, Jerrie
1001	IDNUM	64	89	88Y20620\nIDNUM: 88Y20620
1001	CITY	98	149	DECEPTION BAY\nSTATE: Northern Territory\nZIP: 6845
1001	DATE	170	180	15/11/2004	2004-11-15
1001	DATE	200	209	20/5/2064	2064-05-20
1001	DEPARTMENT	214	260	PARKES 8\nHOSPITAL: GUNNEDAH DISTRICT HOSPITAL
1001	DOCTOR	263	299	Edison\nDOCTOR: Edison\nDATE: 3.5/63	2063-05-03
1001	DATE	400	404	2059	2059
1001	DATE	1071	1077	33.5mm	2059
1001	DOCTOR	1198	1270	Sek\nDOCTOR: X Standerman\nDOCTOR: X Standerman\nTIME: 9:30am on 18/3/14	2014-03-18T09:30
1001	DATE	1808	1815	21/5/64	2064-05-21
1001	DOCTOR	1846	1853	X Karma
1001	HOSPITAL	2215	2235	HALLS CREEK HOSPITAL
1001	IDNUM	2444	2452	88Y20620
1001	DATE	2476	2483	30.5.64	2064-05-30
1001	HOSPITAL	2505	2541	TRANGIE MULTI PURPOSE HEALTH SERVICE
1002	IDNUM	14	24	46U2273647
1002	MEDICALRECORD	25	36	4672273.RKT
1002	PATIENT	37	46	Parmar,ba
1002	IDNUM	65	73	46U22736
1002	STREET	74	83	Underdale
1002	CITY	83	114	TRAFALGAR\nSTATE: NT\nZIP: 3660
1002	DATE	129	138	7/12/1999	1999-07-12
1002	TIME	158	177	21/03/2014 at 13:26	2014-03-21T13:26
1002	DEPARTMENT	177	263	3HR STAY SURGICALUNIT\nHOSPITAL: ROBINVALE DISTRICT HEALTH SERVICES - ROBINVALE CAMPUS
1002	DOCTOR	269	282	GENARO ARMAND
1002	DOCTOR	2092	2101	L. Zewski
1002	DATE	2930	2937	27/5/64	2064-05-27
1003	IDNUM	13	23	94Q248422C
1003	MEDICALRECORD	24	35	9462484.GGC
1003	PATIENT	37	50	Pullon, Loren
1003	IDNUM	67	75	94Q24842
1003	PATIENT	76	84	Bellanca
1003	CITY	84	115	COOKTOWN\nSTATE: VIC\nZIP: 2739
1003	DATE	130	139	29/9/2000	2000-09-29
1003	TIME	159	178	18/03/2014 at 19:04	2014-03-18T19:04
1003	DEPARTMENT	178	231	2.PARKES 8\nHOSPITAL: TULLAMORE MULTI PURPOSE SERVICE
1003	DOCTOR	239	262	FELIPE Eldridge ALLDALE
1003	DATE	515	529	42, 20/10/2063	2063-10-20
1003	DATE	617	626	16/1/2062	2062-01-16
1003	DATE	3527	3534	23/5/64	2064-05-23
1004	IDNUM	13	23	52N379480L
1004	MEDICALRECORD	24	35	5253794.VBL
1004	PATIENT	36	58	KLAAMEYER, Gaye WADDER
1004	IDNUM	62	87	52N37948\nIDNUM: 52N37948
1004	STREET	90	99	Schroeder
1004	CITY	99	132	HURSTBRIDGE\nSTATE: SA\nZIP: 2464
1004	DATE	156	165	7/12/2004	2004-07-12
1004	DATE	185	194	26/5/2064	2064-05-26
1004	DEPARTMENT	198	254	DAY SURGERY\nHOSPITAL: RENMARK PARINGA DISTRICT HOSPITAL
1004	DOCTOR	261	277	SYBIL RIVA SMIDT
1004	DATE	1907	1914	27/5/64	2064-05-27
1004	DOCTOR	1947	1955	O Lenski
1005	IDNUM	14	24	10J399538T
1005	MEDICALRECORD	25	36	1033995.KWT
1005	PATIENT	37	63	attermeanne, REGGIE YOLACU
1005	IDNUM	74	82	10J39953
1005	STREET	83	93	Shady Wood
1005	CITY	93	124	CESSNOCK\nSTATE: ACT\nZIP: 3700
1005	DATE	139	148	11/5/2032	2032-05-11
1005	DATE	168	177	21/5/2064	2064-05-21
1005	DEPARTMENT	182	225	DICKINSON 3 NORTH\nHOSPITAL: MOURA HOSPITAL
1005	DOCTOR	228	385	LEONEL MEL FIONJES BEL BEL BEL BEL BEL BEL BEL BEL BEL BEL BEL BEL BEL BEL BEL BEL BEL BEL BEL BEL BEL BEL BEL BEL BEL BEL BEL BEL BEL BEL BEL BEL BEL TELSEY
1005	DOCTOR	228	263	LEONEL MEL BEL BEL BEL BEL TELOTRIS
1005	DOCTOR	670	722	C Nix\nDOCTOR: C Nappendorf\nTIME: 10.17 on 19.03.14	2014-03-19T10:17
1005	DATE	3247	3254	22.5.64	2064-05-22
1005	DOCTOR	3285	3293	C Zornes
1006	MEDICALRECORD	1	12	2109904.YSE
1006	PATIENT	12	27	SHANSKY, NANESA
1006	IDNUM	44	69	21A99049\nIDNUM: 21A99049
1006	DATE	77	86	30/5/2064	2064-05-30
1006	DOCTOR	1225	1254	UJ\nDOCTOR: WN\nDATE: 29.5.64	2064-05-29
1006	DOCTOR	1280	1287	H Huser
1006	IDNUM	1428	1436	21A99049
1007	MEDICALRECORD	1	12	8889114.NNN
1007	PATIENT	12	23	Jerod Deane
1007	IDNUM	37	45	88W91145
1007	DATE	61	70	29/5/2064	2064-05-29
1007	DOCTOR	535	546	Lon GRAYDON
1007	DATE	1680	1687	27.5.64	2064-05-27
1007	DOCTOR	1717	1724	W Dilts
1008	MEDICALRECORD	2	13	4670325.CIW
1008	PATIENT	13	31	Bialccow, GEOFFREY
1008	IDNUM	33	41	46S03251
1008	DATE	57	66	27/5/2064	2064-05-27
1008	DOCTOR	539	593	K Cazzell\nDOCTOR: K Mcdonagh\nTIME: 4:15pm on 20.3.14	2014-03-20T16:15
1008	DATE	781	788	23.5.64	2064-05-23
1008	DOCTOR	790	799	K Windenl
1009	MEDICALRECORD	1	11	673633.LRE
1009	PATIENT	12	25	CECCHI, Hilar
1009	IDNUM	28	36	67K63346
1009	DATE	52	61	22/5/2064	2064-05-22
1009	DOCTOR	730	738	Devillez
1009	DATE	2166	2175	22/5/2064	2064-05-22
1011	IDNUM	14	24	15G653429Q
1011	MEDICALRECORD	25	36	1526534.GZQ
1011	PATIENT	37	55	ROTHSCHILD, Yvonne
1011	IDNUM	82	90	15G65342
1011	STREET	91	98	Franich
1011	CITY	98	140	SUNBURY\nSTATE: South Australia\nZIP: 6987
1011	DATE	155	165	20/12/2013	2013-12-20
1011	TIME	185	204	12/03/2014 at 11:14	2014-03-12T11:14
1011	DEPARTMENT	204	243	MEDIC/SURGERY WARD\nHOSPITAL: COLERAINE
1011	DOCTOR	278	301	Tyler ERIK LUIGI-FELDON
1011	DATE	396	404	3.5.2064	2064-05-03
1011	DATE	2967	2974	15.5.64	2064-05-15
1011	DOCTOR	3007	3015	E Netzel
1011	ORGANIZATION	4584	4634	Qwest Communications\nHOSPITAL: WARRNAMBOOL CAMPUS
1012	MEDICALRECORD	1	12	7317745.VUY
1012	PATIENT	13	33	HICKSON, SHANE-FARAH
1012	IDNUM	33	58	73C77458\nIDNUM: 73C77458
1012	DATE	67	75	5/3/2064	2064-05-03
1012	DATE	1492	1499	30.5.64	2064-05-30
1012	DOCTOR	1531	1541	S Quintano
1012	DATE	2195	2203	previous	2066
1013	MEDICALRECORD	1	12	9473754.JQJ
1013	PATIENT	12	34	Boly-off, LAURI DONALD
1013	IDNUM	34	59	94U37543\nIDNUM: 94U37543
1013	DATE	68	76	5/3/2064	2064-05-03
1013	DATE	1267	1274	28.5.64	2064-05-28
1013	DOCTOR	1305	1317	X Hargreaves
1014	IDNUM	14	24	42Q306494S
1014	MEDICALRECORD	25	36	4263064.YLS
1014	PATIENT	37	59	YALE, Catrice DELINITY
1014	IDNUM	70	78	42Q30649
1014	PATIENT	79	86	Milbank
1014	CITY	86	115	MACKAY\nSTATE: QLD\nZIP: 6346
1014	DATE	130	140	20/11/2021	2021-11-20
1014	TIME	160	179	20/03/2014 at 10:30	2014-03-20T10:30
1014	DEPARTMENT	179	227	Med Onc\nHOSPITAL: DALBY HOSPITAL HEALTH SERVICE
1014	DOCTOR	228	247	BRITT Elvis Brazola
1014	DOCTOR	1442	1448	A-CorD
1014	DOCTOR	1532	1559	D\nDOCTOR: JC\nDOCTOR: Hold
1014	DOCTOR	1602	1621	Badeau\nTIME: 1310H	2013-10-06T13:10
1014	DATE	5143	5150	26/5/64	2064-05-26
1015	MEDICALRECORD	1	11	004326.ONG
1015	PATIENT	12	26	Rotch, Forrest
1015	IDNUM	34	42	00M32655
1015	DATE	58	67	29/5/2064	2064-05-29
1015	DOCTOR	470	487	CI\nDATE: 27.5.64	2064-05-27
1015	DOCTOR	487	511	A Scho\nDOCTOR: A Schoen
1019	MEDICALRECORD	0	11	0562081.PEA
1019	PATIENT	12	28	Verdell, Verfiri
1019	IDNUM	36	61	05Q20816\nIDNUM: 05Q20816
1019	DATE	69	77	3/6/2064	2064-06-03
1019	DOCTOR	1260	1277	ZA\nDATE: 28.5.64	2064-05-28
1019	DOCTOR	1306	1313	B Cusic
1019	DATE	2043	2051	3/6/2064	2064-06-03
1021	IDNUM	13	23	79Z048569U
1021	MEDICALRECORD	24	35	7990485.RXU
1021	PATIENT	36	63	Gerberbach, Virgilio-Martha
1021	IDNUM	64	89	79Z04856\nIDNUM: 79Z04856
1021	STREET	92	100	Fulready
1021	CITY	100	133	CABOOLTURE\nSTATE: QLD\nZIP: 1113
1021	DATE	157	167	21/12/2007	2007-12-21
1021	DATE	187	196	29/5/2064	2064-05-29
1021	DEPARTMENT	201	267	Douglas Hanly Moir\nHOSPITAL: WEST WIMMERA HEALTH SERVICE - KANIVA
1021	DOCTOR	274	295	Kelley Rodney FORBESS
1021	DATE	1726	1733	30.5.64	2064-05-30
1021	DOCTOR	1765	1774	T Devotie
1021	DATE	2352	2374	previous\nDATE: 5.7.64	2064-07-05
1021	DATE	2599	2605	6.3.64	2064-06-03
1021	IDNUM	2654	2662	79Z04856
1022	IDNUM	13	23	37W069527D
1022	MEDICALRECORD	24	35	3780695.GSD
1022	PATIENT	37	59	Lorenzana, MEG Lyndsay
1022	IDNUM	60	85	37W06952\nIDNUM: 37W06952
1022	STREET	87	91	Alth
1022	CITY	98	145	MOSS VALE\nSTATE: Northern Territory\nZIP: 2803
1022	DATE	169	177	8/3/2004	2004-08-03
1022	DATE	197	206	9/10/2063	2063-10-09
1022	DEPARTMENT	211	258	UROLOGY OPD\nHOSPITAL: COLLIE DISTRICT HOSPITAL
1022	DOCTOR	261	283	Jett Omer\nTIME: 11:00
1022	AGE	339	341	64
1022	DOCTOR	976	1063	Feath\nDOCTOR: I Grantier\nDOCTOR: I Mendier\nDOCTOR: I Menes\nTIME: 9.50am on 07.08.13	2013-08-07T09:50
1022	DOCTOR	2686	2716	RH\nDOCTOR: WM\nDATE: 10.10.63	2063-10-10
1022	DOCTOR	2744	2753	I Ruhmann
1023	IDNUM	14	24	32A841134C
1023	MEDICALRECORD	25	36	3208411.IKC
1023	PATIENT	38	56	Garthwaite, CRISTA
1023	IDNUM	57	82	32A84113\nIDNUM: 32A84113
1023	STREET	85	93	Parkhall
1023	CITY	93	135	BLI BLI\nSTATE: South Australia\nZIP: 4627
1023	DATE	159	167	6/3/2008	2008-03-06
1023	TIME	187	206	29/05/2013 at 10:37	2013-05-29T10:37
1023	DEPARTMENT	206	267	PRINCE OF WALESPRIVATE\nHOSPITAL: LAUNCESTON GENERAL HOSPITAL
1023	DOCTOR	274	282	Gregorio
1023	DATE	344	350	6.8.63	2063-06-08
1023	DOCTOR	2738	2766	RR\nDOCTOR: RR\nDATE: 2.7.63	2063-02-07
1023	DOCTOR	2793	2801	J Todora
1023	DATE	4193	4199	6.8.63	2063-06-08
1024	IDNUM	13	23	90W9612824
1024	MEDICALRECORD	24	35	9089612.XFL
1024	PATIENT	37	59	CUMBLIDGE, KALI HOBERT
1024	IDNUM	70	78	90W96128
1024	PATIENT	78	90	Claibour-and
1024	CITY	89	122	PEARCEDALE\nSTATE: TAS\nZIP: 3902
1024	DATE	137	146	30/3/1999	1999-03-30
1024	DATE	166	175	18/9/2063	2063-09-18
1024	DEPARTMENT	180	251	PRINCE OF WALESPRIVATE\nHOSPITAL: SHOALHAVEN DISTRICT MEMORIAL HOSPITAL
1024	DOCTOR	258	275	VIDYA SADE Chiola
1024	DATE	397	400	Now	2013-02-03
1024	DOCTOR	1679	1696	BY\nDATE: 19.9.63	2063-09-19
1024	DOCTOR	1724	1734	X Spritzer
1024	DATE	2756	2766	22/10/2063	2063-10-22
1024	DATE	3122	3131	10/1/2063	2063-01-10
1025	IDNUM	13	23	63F711591F
1025	MEDICALRECORD	24	35	6327115.YEF
1025	PATIENT	36	59	Maggi, RUSSELL KELSIEST
1025	IDNUM	77	85	63F71159
1025	PATIENT	86	94	Bautista
1025	CITY	94	124	SUFFOLK\nSTATE: ACT\nZIP: 3815
1025	DATE	144	152	1/1/2020	2020-01-01
1025	DATE	172	182	28/10/2063	2063-10-28
1025	DEPARTMENT	187	245	Pathology North\nHOSPITAL: BRAIDWOOD MULTI PURPOSE SERVICE
1025	DOCTOR	252	265	RUFUS Seckler
1025	DOCTOR	265	285	Larry\nDOCTOR: Larry
1025	AGE	335	337	47
1025	DOCTOR	3236	3266	KB\nDOCTOR: EY\nDATE: 29.10.63	2063-10-29
1025	DOCTOR	3290	3300	L Barsness
1025	DOCTOR	5526	5534	L Josich
1026	IDNUM	14	24	68J583108E
1026	MEDICALRECORD	25	36	6835831.AWE
1026	PATIENT	38	56	Gracie, NEAL Flynn
1026	IDNUM	67	75	68J58310
1026	STREET	76	84	Farthing
1026	CITY	84	127	THE OAKS\nSTATE: South Australia\nZIP: 7307
1026	DATE	142	151	23/2/1983	1983-02-23
1026	DEPARTMENT	183	276	PRINCE OF WALES PRIVATE\nHOSPITAL: PRINCE OF WALES PRIVATE\nHOSPITAL: PRINCE OF WALES PRIVATE
1026	DOCTOR	244	253	LEVI NXDE
1026	DOCTOR	1448	1477	HM\nDOCTOR: HM\nDATE: 17.7.63	2063-07-17
1026	DOCTOR	1558	1565	Q Avera
1027	IDNUM	-1	26	26F60426F\nIDNUM: 26F60426F
1027	MEDICALRECORD	24	34	262604.GPR
1027	STREET	35	49	Huys\nG6: Gwen
1027	IDNUM	57	65	26F60426
1027	PATIENT	66	75	Chisholme
1027	CITY	75	94	SMITHTON\nZIP: 7250
1027	DATE	118	127	22/6/2003	2003-06-22
1027	DATE	147	156	17/3/2063	2063-03-17
1027	DEPARTMENT	161	216	8 GOOLAGONG CRESCENT\nHOSPITAL: SCOTT MEMORIAL HOSPITAL
1027	DOCTOR	221	232	Ted Randall
1027	DATE	318	324	3.9.63	2063-09-03
1027	DOCTOR	441	447	Jeffry
1027	DOCTOR	2856	2885	EJ\nDOCTOR: JH\nDATE: 18.3.63	2063-03-18
1027	DOCTOR	2912	2921	F Setzler
1027	HOSPITAL	7823	7844	LISMORE BASE HOSPITAL
1027	HOSPITAL	10480	10486	LAVIEW
1027	DATE	10689	10695	3.9.63	2063-09-03
1027	HOSPITAL	10711	10727	WHYALLA HOSPITAL
1027	DOCTOR	11060	11089	F Dicleyard\nDOCTOR: F Fandon
1028	IDNUM	13	23	90P453566I
1028	MEDICALRECORD	24	35	9054535.RQI
1028	PATIENT	37	51	BARNO, XIOMARA
1028	IDNUM	62	70	74C63521
1028	STREET	71	84	Silver Meadow
1028	CITY	84	125	WINTON\nSTATE: New South Wales\nZIP: 3930
1028	DATE	140	149	4/12/1997	1997-12-04
1028	DATE	169	178	24/5/2063	2063-05-24
1028	DEPARTMENT	183	240	2.23HR STAY SURGICAL UNIT\nHOSPITAL: HEYWOOD RURAL HEALTH
1028	DOCTOR	241	266	DERRICK ANTONE SPRENTIONE
1028	DOCTOR	2768	2797	VM\nDOCTOR: MG\nDATE: 27.5.63	2063-05-27
1028	DOCTOR	2822	2830	T Grivno
1029	IDNUM	14	24	95T235173H
1029	MEDICALRECORD	25	35	957235.ETI
1029	PATIENT	36	56	Anstey, Yarr Barkier
1029	IDNUM	64	72	95T23517
1029	STREET	73	85	Maroon Bells
1029	CITY	85	123	BLAXLAND\nSTATE: Queensland\nZIP: 6440
1029	DATE	138	148	28/10/1994	1994-10-28
1029	DATE	168	176	8/6/2063	2063-06-08
1029	DEPARTMENT	181	248	INTENSIVE CARE UNIT SOUTH\nHOSPITAL: GRENFELL MULTI PURPOSE SERVICE
1029	DOCTOR	253	272	SIGMUND Brian Macey
1029	DOCTOR	326	329	Ewy
1029	DATE	339	347	18/12/63	2063-12-18
1029	DOCTOR	1792	1808	CA\nDATE: 8/7/63	2063-07-08
1029	DOCTOR	1810	1840	Y Tulis\nDOCTOR: Y ALLEN-Rauen
1029	DOCTOR	2919	2938	Server\nIDNUM: 7633
1029	DATE	3389	3396	28.8.63	2063-08-28
1029	DOCTOR	3418	3456	I Klamn\nDOCTOR: I Lidey\nTIME: 9/3/15	2015-03-09
1031	IDNUM	13	23	53P256231Q
1031	MEDICALRECORD	24	35	5362562.IDQ
1031	PATIENT	37	60	MAZZARA, JAYMIE Armando
1031	IDNUM	61	108	53P256,53P256\nIDNUM: 53P25623\nIDNUM: 53P25623
1031	CITY	97	140	DRYSDALE\nSTATE: South Australia\nZIP: 4127
1031	DATE	164	173	7/12/2004	2004-07-12
1031	DATE	193	202	26/5/2064	2064-05-26
1031	DEPARTMENT	207	242	SYDPATH\nHOSPITAL: CUMMINS HOSPITAL
1031	DOCTOR	245	271	MARYANNA KIESHA CLINKSCALE
1031	DATE	1903	1910	27/5/64	2064-05-27
1031	DOCTOR	1943	1951	W Engard
1031	DOCTOR	2756	2776	W Raub\nDATE: 6.4.64	2064-04-06
1031	DATE	2926	2932	5.3.64	2064-05-03
1032	IDNUM	14	24	01L3773899
1032	MEDICALRECORD	25	36	0143773.XZY
1032	PATIENT	38	54	LUCKADOO, GERARD
1032	IDNUM	65	73	01L37738
1032	STREET	73	81	Millauve
1032	CITY	83	132	NORTH MACKAY\nSTATE: Western Australia\nZIP: 5049
1032	DATE	147	155	1/5/1989	1989-01-05
1032	TIME	175	194	21/08/2013 at 14:42	2013-08-21T14:42
1032	DEPARTMENT	194	238	PaLMS\nHOSPITAL: GUYRA MULTI PURPOSE SERVICE
1032	DOCTOR	243	261	NEIL Raleigh SUDOL
1032	DOCTOR	2626	2644	RR\nDATE: 24/10/63	2063-10-24
1032	DOCTOR	2673	2680	B Soito
1033	IDNUM	13	23	69I398347H
1033	MEDICALRECORD	24	35	6933983.MUH
1033	PATIENT	37	50	NAGATA, Bruno
1033	IDNUM	61	69	69I39834
1033	CITY	77	107	MAITLAND\nSTATE: WA\nZIP: 0812
1033	DATE	122	130	8/3/1999	1999-08-03
1033	TIME	150	169	04/06/2013 at 13:36	2013-06-04T13:36
1033	DEPARTMENT	169	202	PaLMS\nHOSPITAL: KAPUNDA HOSPITAL
1033	DOCTOR	207	228	Lynwood BART HOUCHINS
1033	DATE	301	308	17.9.63	2063-09-17
1033	DOCTOR	1667	1695	AU\nDOCTOR: UW\nDATE: 8.7.63	2063-07-08
1033	DOCTOR	1722	1734	Q Rubenstein
1033	DATE	3484	3491	17.9.63	2063-09-17
1034	IDNUM	13	23	17E318405P
1034	MEDICALRECORD	24	35	1713184.BPP
1034	PATIENT	36	50	Cervix, Kurtis
1034	IDNUM	55	107	17E31840\nIDNUM: 17E31840\nIDNUM: 17E31840\nPATIENT:
1034	STREET	83	92	Tule Lake
1034	CITY	92	121	DAMPIER\nSTATE: NT\nZIP: 2340
1034	DATE	145	154	27/1/2000	2000-01-27
1034	TIME	174	193	04/07/2012 at 18:35	2012-07-04T18:35
1034	DEPARTMENT	193	254	SA Pathology\nHOSPITAL: WEST WIMMERA HEALTH SERVICE - RAINBOW
1034	DOCTOR	261	282	VALDA Cherry BELMONTE
1034	DOCTOR	3296	3312	FS\nDATE: 7/9/62	2062-07-09
1034	DOCTOR	3311	3323	E Langsworth
1035	IDNUM	14	24	38V919364B
1035	MEDICALRECORD	25	36	3889193.PLB
1035	PATIENT	38	48	REUL, Jean
1035	IDNUM	59	67	38V91936
1035	STREET	68	76	Shelgate
1035	CITY	76	111	HADSPEN\nSTATE: Victoria\nZIP: 3525
1035	DATE	126	135	5/11/1999	1999-11-05
1035	TIME	155	174	02/07/2012 at 16:21	2012-07-02T16:21
1035	DEPARTMENT	174	233	Hereditary\nHOSPITAL: WEST WIMMERA HEALTH SERVICE - RAINBOW
1035	DOCTOR	238	252	Charley OHYAMA
1035	DOCTOR	252	260	Reitzer,
1035	DATE	2272	2278	9/5/62	2062-09-05
1035	DOCTOR	2281	2287	S Nine
1036	IDNUM	13	23	96R040312J
1036	MEDICALRECORD	24	35	9660403.EGJ
1036	PATIENT	37	54	Oseguera, Lorilee
1036	IDNUM	61	86	96R04031\nIDNUM: 96R04031
1036	STREET	89	101	Piccotts End
1036	CITY	101	131	MAITLAND\nSTATE: WA\nZIP: 2834
1036	DATE	152	161	7/12/1966	1966-07-12
1036	DATE	180	189	28/8/2062	2062-08-28
1036	DEPARTMENT	194	243	ONCOLOGY (GYNAE)\nHOSPITAL: LYELL MCEWIN HOSPITAL
1036	DOCTOR	246	263	LOISE JRURE KERRY
1036	DOCTOR	714	763	X Beem\nDOCTOR: X Kurien\nTIME: 3:55pm on 26.6.12	2012-06-26T15:55
1036	DOCTOR	3045	3062	VP\nDATE: 29.8.62	2062-08-29
1036	DOCTOR	3092	3099	X Heine
1037	IDNUM	13	23	44N0614707
1037	MEDICALRECORD	24	35	4450614.TBS
1037	PATIENT	37	49	Lesney, DONG
1037	IDNUM	50	75	44N06147\nIDNUM: 44N06147
1037	STREET	78	85	Maranie
1037	CITY	85	124	KURRI KURRI\nSTATE: Tasmania\nZIP: 2747
1037	DATE	145	154	14/5/1998	1998-05-14
1037	TIME	174	193	17/07/2012 at 18:14	2012-07-17T18:14
1037	DEPARTMENT	193	241	MEDIC/SURGERYWARD\nHOSPITAL: QUAIRADING HOSPITAL
1037	DOCTOR	248	265	Jacky LELIA Marti
1037	AGE	326	328	69
1037	DOCTOR	3362	3379	KH\nDATE: 20/9/62	2062-09-20
1037	DOCTOR	3412	3419	M Solan
1038	IDNUM	14	24	02K081438A
1038	MEDICALRECORD	25	36	0230814.IWA
1038	PATIENT	38	54	OVERTURF, RANDEE
1038	IDNUM	55	80	02K08143\nIDNUM: 02K08143
1038	STREET	83	92	Hilliards
1038	CITY	92	129	TOOWOOMBA\nSTATE: Victoria\nZIP: 5223
1038	DATE	150	158	6/9/2008	2008-06-09
1038	TIME	175	194	25/07/2012 at 13:11	2012-07-25T13:11
1038	DEPARTMENT	194	229	RHW\nHOSPITAL: CHARLEVILLE HOSPITAL
1038	DOCTOR	230	247	Alonso Dri KENDER
1038	DOCTOR	2163	2180	KJ\nDATE: 28/9/62	2062-09-28
1038	DOCTOR	2209	2220	A Passwater
1039	IDNUM	13	23	22B782387M
1039	MEDICALRECORD	24	35	2207823.XSM
1039	PATIENT	36	48	Murrioy, KAY
1039	IDNUM	51	110	22B78238\nIDNUM: 22B78238\nIDNUM: 22B78238\nIDNUM: 22B78238
1039	DOCTOR	78	106	Shockey\nTIME: 11:11/11/11es	T11:11
1039	CITY	92	141	ROCKHAMPTON\nSTATE: Northern Territory\nZIP: 5136
1039	DATE	162	171	27/6/1989	1989-06-27
1039	DATE	191	201	10/10/2062	2062-10-10
1039	DEPARTMENT	206	248	RECOVERY\nHOSPITAL: GOULBURN BASE HOSPITAL
1039	DOCTOR	251	271	ANNSARIA Dusty TUNKS
1039	DOCTOR	2550	2568	JZ\nDATE: 11/10/62	2062-10-11
1039	DOCTOR	2763	2781	LS\nDATE: 11.10.62	2062-10-11
1039	DOCTOR	2810	2820	F Eslinger
1040	IDNUM	14	24	70X703445U
1040	MEDICALRECORD	25	36	7097034.MNU
1040	PATIENT	38	58	VANDOVER, ULI AVERIE
1040	IDNUM	59	84	70X70344\nIDNUM: 70X70344
1040	PATIENT	87	95	Granniss
1040	CITY	95	127	WONTHAGGI\nSTATE: TAS\nZIP: 4342
1040	DATE	148	157	16/1/2001	2001-01-16
1040	DATE	177	187	16/10/2062	2062-10-16
1040	DEPARTMENT	192	258	3/9 JENNIE COX CLOSE\nHOSPITAL: BAIRNSDALE REGIONAL HEALTH SERVICE
1040	DOCTOR	261	274	DOMINGA Delca
1040	DOCTOR	2940	2958	HM\nDATE: 16/10/62	2062-10-16
1040	DOCTOR	2988	2995	U Flatt
1041	IDNUM	13	23	38T7244031
1041	MEDICALRECORD	24	35	3877244.BID
1041	PATIENT	37	51	BOLUDA, Karrie
1041	IDNUM	60	95	38T72440\nIDNUM: 38T72440\nPATIENT:
1041	CITY	95	128	COORANBONG\nSTATE: QLD\nZIP: 2843
1041	DATE	152	161	19/8/2010	2010-08-19
1041	DATE	181	191	29/10/2062	2062-10-29
1041	DEPARTMENT	196	229	Laverty\nHOSPITAL: BOWEN HOSPITAL
1041	DOCTOR	232	250	Nanda\nDOCTOR: Nal
1041	DOCTOR	323	352	HV\nDOCTOR: JR\nDATE: 1.11.63	2063-11-01
1041	DOCTOR	1863	1881	KI\nDATE: 30.10.62	2062-10-30
1041	DOCTOR	1913	1923	I Reichler
1041	DOCTOR	2722	2746	I Bustard\nDATE: 6.11.62	2062-11-06
1041	DOCTOR	2779	2799	Gynae\nDATE: 5.11.62	2062-11-05
1042	IDNUM	13	23	59L325361O
1042	MEDICALRECORD	24	35	5943253.PEO
1042	PATIENT	36	53	Reinoso, Olimpola
1042	IDNUM	54	79	59L32536\nIDNUM: 59L32536
1042	PATIENT	82	88	Ogilby
1042	CITY	88	133	BELL BAY\nSTATE: Western Australia\nZIP: 2371
1042	DATE	154	162	6/7/1999	1999-07-06
1042	TIME	182	201	29/08/2012 at 18:33	2012-08-29T18:33
1042	DEPARTMENT	201	269	3HR STAY SURGICAL UNIT\nHOSPITAL: TIMBOON & DISTRICT HEALTHCARE UNIT
1042	DOCTOR	273	288	CLAUDE Altag017
1042	DOCTOR	2003	2020	PU\nDATE: 10.2.62	2062-02-10
1042	DOCTOR	2024	2052	N Hernandes\nDATE: 10.3.2062	2062-10-03
1042	DOCTOR	2866	2875	N Gutmann
1043	IDNUM	14	24	07H446419X
1043	MEDICALRECORD	25	36	0724464.EZX
1043	PATIENT	37	58	ANGELO, ANGELO MERTIE
1043	IDNUM	59	272	07H44641\nIDNUM: 07H44641\nIDNUM: 07H44641\nPATIENT: 07H44641\nPATIENT: 07H44641\nPATIENT: FIR32641\nPATIENT: FIR32641\nPATIENT: FIR32641\nPATIENT: FIR32641\nPATIENT: FIR32641\nPATIENT: FIR32641\nPATIENT: FIR32641
1043	CITY	100	137	LITHGOW\nSTATE: Queensland\nZIP: 2602
1043	DATE	158	167	17/9/2023	2023-09-17
1043	TIME	187	206	26/09/2012 at 11:38	2012-09-26T11:38
1043	DEPARTMENT	206	279	ACUTECARE WARD\nHOSPITAL: BARWON HEALTH - SOUTH GEELONG RENAL UNIT CAMPUS
1043	DOCTOR	286	306	Elanor Daniele Baton
1043	DOCTOR	2682	2700	PG\nDATE: 29/11/62	2062-11-29
1043	DOCTOR	2702	2715	C Maginferior
1043	DATE	3722	3729	6/12/62	2062-12-06
1044	IDNUM	13	23	28Y046378I
1044	MEDICALRECORD	24	35	2890463.TVI
1044	PATIENT	37	52	Wolbeck, DIEDRA
1044	IDNUM	63	71	28Y04637
1044	CITY	81	111	QUIRINDI\nSTATE: WA\nZIP: 5132
1044	DATE	126	135	18/2/2021	2021-02-18
1044	DATE	155	164	19/2/2062	2062-02-19
1044	DEPARTMENT	169	222	Douglass Hanly Moir\nHOSPITAL: BENTLEY HEALTH SERVICE
1044	DOCTOR	229	242	TARKA BRAWNER
1044	DOCTOR	1663	1691	MK\nDOCTOR:SZ\nDATE: 19.2.62	2062-02-19
1044	DOCTOR	1717	1727	H Bjorkman
1044	DOCTOR	2328	2366	Lale BERGFALK\nDOCTOR: Everett Biceman
1045	IDNUM	13	23	86U077336R
1045	MEDICALRECORD	23	33	8680773.PD
1045	PATIENT	37	50	Pollot, MERLE
1045	IDNUM	51	76	86U07733\nIDNUM: 86U07733
1045	PATIENT	79	86	Eppling
1045	CITY	86	128	DROMANA\nSTATE: South Australia\nZIP: 2610
1045	DATE	152	160	4/4/1994	1994-04-04
1045	TIME	180	199	06/02/2013 at 11:50	2013-02-06T11:50
1045	DEPARTMENT	199	252	Anatomical Pathology\nHOSPITAL: PORT AUGUSTA HOSPITAL
1045	DOCTOR	255	268	Laueneekutoic
1045	DOCTOR	321	326	Roman
1045	DOCTOR	2843	2871	GY\nDOCTOR: XG\nDATE: 4/9/63	2063-04-09
1045	DOCTOR	2931	2938	V Fencl
1046	MEDICALRECORD	2	13	3460984.XLZ
1046	PATIENT	14	27	Lulow, Bailey
1046	IDNUM	28	36	34R09848
1046	DATE	52	60	6/8/2062	2062-08-06
1046	DOCTOR	2217	2233	PG\nDATE: 3.8.62	2062-08-03
1046	DOCTOR	2263	2274	J Schlimmer
1047	IDNUM	13	23	55I799342K
1047	MEDICALRECORD	24	35	5537993.LHK
1047	PATIENT	37	51	DAIRE, Thurman
1047	IDNUM	59	84	92N11954\nIDNUM: 92N11954
1047	PATIENT	87	96	Kellerman
1047	CITY	96	136	PORT HEDLAND\nSTATE: Victoria\nZIP: 3276
1047	DATE	160	169	15/8/1999	1999-08-15
1047	TIME	189	208	04/06/2012 at 11:52	2012-06-04T11:52
1047	DEPARTMENT	208	262	Forensic Medicine\nHOSPITAL: TIBOOBURRA HEALTH SERVICE
1047	DOCTOR	269	295	Paisley LEILANI Casagranda
1047	DATE	367	375	25.10.62	2062-10-25
1047	DOCTOR	2892	2908	JG\nDATE: 8/7/62	2062-07-08
1047	DOCTOR	2952	2959	Y Cirzi
1047	DOCTOR	4032	4037	Y Lin
1047	DATE	4981	4989	25.10.62	2062-10-25
1048	IDNUM	13	23	13E710301T
1048	MEDICALRECORD	24	35	1317103.ACT
1048	PATIENT	36	60	MEINBERG, CHERLYN HEALTH
1048	IDNUM	61	86	13E71030\nIDNUM: 13E71030
1048	STREET	88	95	Gladley
1048	CITY	98	133	NEW NORFOLKRA\nSTATE: WA\nZIP: 3779
1048	DATE	168	178	14/10/2002	2002-10-14
1048	DATE	198	206	6/8/2062	2062-08-06
1048	DEPARTMENT	210	252	PARKES 8\nHOSPITAL: ORBOST REGIONAL HEALTH
1048	DOCTOR	259	281	Madge DORIE Swearinger
1048	DOCTOR	726	792	Haley\nDOCTOR: D Liddell\nDOCTOR: D Fagley\nTIME: 3.30pm on 4/6/12	2012-06-04T15:30
1048	DOCTOR	3303	3319	CW\nDATE: 7/8/62	2062-07-08
1048	DOCTOR	3351	3363	D Shigemitsu
1049	IDNUM	14	24	61A730469C
1049	MEDICALRECORD	25	36	6107304.PXC
1049	PATIENT	37	48	Pedel, MAYE
1049	IDNUM	58	83	61A73046\nIDNUM: 61A73046
1049	STREET	86	94	Amethyst
1049	CITY	94	135	GATTON\nSTATE: South Australia\nZIP: 2810
1049	DATE	159	167	1/7/1979	1979-01-07
1049	TIME	187	206	20/06/2012 at 11:39	2012-06-20T11:39
1049	DEPARTMENT	206	249	RHW\nHOSPITAL: QUEANBEYAN DISTRICT HOSPITAL
1049	DOCTOR	252	274	KACI MOLLIE PIERSCHMAN
1049	DOCTOR	2454	2470	P\nDATE: 23/8/62	2062-08-23
1049	DOCTOR	2498	2506	R Lovett
1050	IDNUM	13	23	29W851517K
1050	MEDICALRECORD	24	35	2988515.ETK
1050	PATIENT	37	53	NERPIO, Clotilde
1050	IDNUM	54	79	29W85151\nIDNUM: 29W85151
1050	PATIENT	82	85	ZOo
1050	CITY	85	127	CORINDA\nSTATE: New South Wales\nZIP: 6440
1050	TIME	175	194	11/07/2012 at 17:17	2012-07-11T17:17
1050	DEPARTMENT	194	242	L7 CONSULTING ROOMS\nHOSPITAL: LAVERTON HOSPITAL
1050	DOCTOR	249	263	GREGORIO Enick
1050	DATE	335	342	26.9.62	2062-09-26
1050	DATE	436	441	today	2066-09-03
1050	DOCTOR	2374	2391	QU\nDATE: 14/9/62	2062-09-14
1050	DOCTOR	2421	2429	G Artale
1050	DATE	3279	3286	26.9.62	2062-09-26\nDOCTOR: G Simon\nDATE: 26.9.62=>2062-09-26
1051	IDNUM	14	24	77T8825757
1051	MEDICALRECORD	25	36	7778825.TOT
1051	PATIENT	38	55	BRAMLITT, Arvilla
1051	IDNUM	56	116	77T88257\nIDNUM: 77T88257\nIDNUM: 77T88257\nPATIENT:77T88257
1051	PATIENT	83	96	West Plttesna
1051	CITY	95	125	GUNNEDAH\nSTATE: WA\nZIP: 1630
1051	DATE	146	154	4/5/1995	1995-05-04
1051	TIME	174	193	18/07/2012 at 13:18	2012-07-18T13:18
1051	DEPARTMENT	193	238	EMERGENCY\nHOSPITAL: MANNUM DISTRICT HOSPITAL
1051	DOCTOR	241	268	HANK LAURGER\nDOCTOR: MATER
1051	AGE	325	327	72
1051	DATE	1989	1996	21.9.62	2062-09-21
1051	DOCTOR	1998	2008	U Rumbhire
1051	DOCTOR	3021	3045	U Blacher\nDATE: 26.9.62	2062-09-26
1051	DATE	3149	3156	25.9.62	2062-09-25
1052	IDNUM	13	23	97K483433E
1052	MEDICALRECORD	24	35	9744834.IKE
1052	PATIENT	37	52	BAUTISTA, Darce
1052	IDNUM	54	79	97K48343\nIDNUM: 97K48343
1052	CITY	90	127	PORT MACQUARIE\nSTATE: VIC\nZIP: 2085
1052	DATE	151	160	28/2/1977	1977-02-28
1052	DATE	180	190	22/10/2062	2062-10-22
1052	DEPARTMENT	195	255	ACUTECARE WARD\nHOSPITAL: QUEEN ELIZABETH II MANION HOSPITAL
1052	DOCTOR	260	280	Oscar GREGORIA WORTZ
1052	DOCTOR	2043	2061	OI\nDATE: 23.10.62	2062-10-23
1052	DOCTOR	2069	2075	Z Tsev
1053	IDNUM	13	23	55G403581N
1053	MEDICALRECORD	24	35	5524035.XFN
1053	PATIENT	36	62	DUCHESNEY, Corazon Ynez-15
1053	IDNUM	66	91	55G40358\nIDNUM: 55G40358
1053	STREET	94	107	Garden Meadow
1053	CITY	107	142	PORT LINCOLN\nSTATE: QLD\nZIP: 6397
1053	DATE	166	175	16/7/1987	1987-07-16
1053	DATE	195	205	23/10/2062	2062-10-23
1053	DEPARTMENT	210	255	South Western Area\nHOSPITAL: NANNUP HOSPITAL
1053	DOCTOR	262	276	Anh SHYLA Conn
1053	DOCTOR	821	832	O Margarrie
1053	DOCTOR	898	944	Raeuten\nDOCTOR: O'er\nTIME: 2.55pm on 21/8/12	2012-08-21T14:55
1053	DOCTOR	2750	2768	BA\nDATE: 24.10.62	2062-10-24
1053	DOCTOR	3233	3251	GL\nDATE: 24/10/62	2062-10-24
1053	DOCTOR	3279	3288	O Solwold
1054	MEDICALRECORD	2	13	0315245.MAV
1054	PATIENT	13	27	Klepch, SOLOMY
1054	IDNUM	33	41	03C52454
1054	DATE	57	65	8/9/2062	2062-08-09
1054	DATE	1425	1431	6/9/62	2062-06-09
1054	DOCTOR	1433	1444	C Alexzelly
1055	IDNUM	13	23	24U125408G
1055	MEDICALRECORD	24	34	247125.MAW
1055	PATIENT	36	55	Villaneda, WILLIAMS
1055	IDNUM	66	74	24U12540
1055	STREET	74	85	Cooriengale
1055	CITY	93	122	ORBOST\nSTATE: QLD\nZIP: 7187
1055	DATE	137	146	2/11/2022	2022-11-02
1055	DATE	166	176	27/11/2062	2062-11-27
1055	DEPARTMENT	181	232	PRINCE OF WALESPRIVATE\nHOSPITAL: KONDININ HOSPITAL
1055	DOCTOR	237	258	GONZALO GUS MIDDLETON
1055	DOCTOR	1057	1104	Regine\nDOCTOR: H Bivans\nTIME: 25/9/12 at 10am	2012-09-25T10:12
1055	DOCTOR	2193	2211	XB\nDATE: 28/11/62	2062-11-28
1055	DOCTOR	2243	2249	H Fair
1055	DATE	4389	4397	24/12/62	2062-12-24
1055	DOCTOR	4399	4449	H Martinsen\nHOSPITAL: THE PRINCE CHARLES HOSPITAL
1056	IDNUM	13	23	82Q146566P
1056	MEDICALRECORD	24	34	826146.NPR
1056	PATIENT	35	48	Lahman, ELISE
1056	IDNUM	65	73	82Q14656
1056	STREET	74	82	Irondale
1056	CITY	82	102	THIRLMERE\nZIP: 3494
1056	DATE	126	135	17/7/2004	2004-07-17
1056	DATE	155	164	6/11/2063	2063-11-06
1056	DEPARTMENT	169	238	105 HAMRUN CIRCUIT\nHOSPITAL: EDENHOPE AND DISTRICT MEMORIAL HOSPITAL
1056	DOCTOR	243	261	Brent CARSON DALBA
1056	HOSPITAL	677	693	EXMOUTH HOSPITAL
1056	DOCTOR	1896	1913	SM\nDATE: 6/12/63	2063-06-12
1056	DOCTOR	1916	1925	W Quantoo
1056	DATE	3209	3216	28.6.63	2063-06-28
1056	HOSPITAL	3240	3257	YARRAWONGA HEALTH
1056	DOCTOR	3284	3291	W Vasso
1056	DOCTOR	3310	3311	W
1057	IDNUM	14	24	03H747414A
1057	MEDICALRECORD	25	36	0327474.EMA
1057	PATIENT	38	57	Nipps, Fred Milford
1057	IDNUM	66	74	03H74741
1057	STREET	75	86	West Taylor
1057	CITY	86	146	MUSWELLBROOK\nSTATE: Australian Capital Territory\nZIP: 4614
1057	DATE	161	169	3/3/2029	2029-03-03
1057	DATE	189	198	23/1/2062	2062-01-23
1057	DEPARTMENT	203	259	MACQUARIE WARD\nHOSPITAL: PORTLAND TABULAM HEALTH CENTRE
1057	DOCTOR	260	271	CARLO Antza
1057	DATE	570	580	22/12/2062	2062-12-22
1057	DOCTOR	1570	1587	ED\nDATE: 21/1/62	2062-01-21
1057	DOCTOR	1590	1597	B Stals
1057	DOCTOR	2551	2592	ROGELIO OSTER\nDOCTOR: CHOP\nDOCTOR: CHOP
1057	DATE	2853	2860	20/2/62	2062-02-20
1057	IDNUM	2897	2900	38M
1057	IDNUM	3019	3027	40M26651
1057	DEPARTMENT	3206	3215	Dear Xerk
1057	DOCTOR	4136	4144	K/Eberby
1057	STREET	4331	4336	Yours
1057	DOCTOR	4356	4390	Erasmo Green\nDOCTOR: Erasmo Green
1057	DOCTOR	4408	4413	Kirby
1057	DOCTOR	4504	4518	DEON BALCKWELL
1057	DOCTOR	4548	4553	Tarka
1057	DOCTOR	4792	4806	Brittaney Farr
1057	DOCTOR	4816	4848	KAMS\nDOCTOR: KAMS\nTIME: 11.3mm	2066-03-11T11:00
1057	DOCTOR	5473	5495	Montana\nDATE: 16/2/62	2062-02-16
1057	DOCTOR	5651	5676	Mal Picazo\nDATE: 19/2/62	2062-02-19
1057	DATE	5732	5739	21/2/62	2062-02-21
1057	DATE	5836	5843	20/2/62	2062-02-20
1057	DATE	6066	6074	40-11/62	2062-11-40
1057	DOCTOR	6357	6367	K. Dintino
1057	DATE	6419	6426	23.2.62	2062-02-23
1057	DOCTOR	7185	7218	Mariana K'Degalaix\nDATE: 21/2/62	2062-02-21
1057	DOCTOR	7239	7250	Bill DAMORE
1057	DOCTOR	7610	7643	Beverly K'Hawrylak\nDATE: 22/2/62	2062-02-22
1057	DATE	7685	7692	13.3.63	2063-03-13
1057	HOSPITAL	7693	7716	GREEN HEALTH WESSNENTRE
1057	DOCTOR	8270	8272	K.
1057	DOCTOR	8272	8294	Mar and\nDATE: 12/3/63	2063-12-03
1058	IDNUM	13	23	51D867473J
1058	MEDICALRECORD	24	35	5118674.TIJ
1058	PATIENT	36	51	Stemmerton, DEF
1058	IDNUM	63	71	51D86747
1058	STREET	72	81	Lake Elmo
1058	CITY	81	114	YARRA GLEN\nSTATE: QLD\nZIP: 6101
1058	DATE	129	138	11/1/2012	2012-11-01
1058	TIME	158	177	13/03/2013 at 12:53	2013-03-13T12:53
1058	DEPARTMENT	177	212	Orana\nHOSPITAL: INNISFAIL HOSPITAL
1058	DOCTOR	213	230	Jardi BRADY Howte
1058	DOCTOR	1789	1806	QV\nDATE: 16/5/63	2063-05-16
1058	DOCTOR	1808	1833	P Krausz\nDATE: 20.5.2063	2063-05-20
1059	IDNUM	13	23	19A888531S
1059	MEDICALRECORD	24	35	1908885.IDS
1059	PATIENT	37	52	DECLET, Lavenia
1059	IDNUM	63	71	19A88853
1059	PATIENT	72	76	Glos
1059	CITY	76	121	STANTHORPE\nSTATE: South Australia\nZIP: 2733
1059	DATE	135	144	11/3/2041	2041-11-03
1059	TIME	164	183	01/05/2013 at 16:43	2013-05-01T16:43
1059	DEPARTMENT	183	230	SOUTH SURGICAL UNIT\nHOSPITAL: BONALBO HOSPITAL
1059	DOCTOR	242	266	GARRETT ZACHARIOH WARTLY
1059	DATE	344	351	10.7.63	2063-07-10
1059	DATE	456	464	May 2063	2063-05
1059	DOCTOR	640	657	TEMPESTONE HOODEL
1059	DOCTOR	1087	1131	Mitchell\nDOCTOR: Mitchell\nDOCTOR: Mitchell
1059	DOCTOR	2534	2562	AT\nDOCTOR: JZ\nDATE: 4/7/63	2063-07-04
1059	DOCTOR	2587	2595	D Grenke
1059	IDNUM	2769	2777	19A88853
1059	DATE	4839	4846	10.7.63	2063-07-10
1059	DOCTOR	4921	4928	D Sharp
1060	IDNUM	13	23	77W819589A
1060	MEDICALRECORD	24	35	7788195.XYA
1060	PATIENT	37	55	Germond, DION Ezra
1060	IDNUM	66	74	77W81958
1060	PATIENT	75	84	Bronstein
1060	CITY	84	115	KINGAROY\nSTATE: QLD\nZIP: 1295
1060	DATE	130	138	7/7/2039	2039-07-07
1060	DATE	158	167	15/8/2063	2063-08-15
1060	DEPARTMENT	172	229	Envoi\nHOSPITAL: BALLARAT HEALTH SERVICES (BASE HOSPITAL)
1060	DOCTOR	230	247	Vance Bolesington
1060	DOCTOR	5161	5178	JA\nDATE: 13/8/63	2063-08-13
1060	DOCTOR	5181	5193	O Didomanico
1060	DATE	8246	8252	9.5.63	2063-05-09
1060	DOCTOR	8266	8276	O Edelmann
1060	DOCTOR	8297	8305	O Outten
1061	IDNUM	13	23	09E111396X
1061	MEDICALRECORD	24	35	0911113.ZPX
1061	PATIENT	36	53	Cindrich, SHAWNDA
1061	IDNUM	65	73	09E11139
1061	PATIENT	74	81	Candace
1061	CITY	81	127	WONTHAGGI\nSTATE: Western Australia\nZIP: 2807
1061	DATE	142	151	23/7/1991	1991-07-23
1061	DATE	171	180	30/4/2063	2063-04-30
1061	DEPARTMENT	185	241	MEDIC/SURGERY WARD\nHOSPITAL: INVERELL DISTRICT HOSPITAL
1061	DOCTOR	242	268	FREDERICK BRANDEN BERRICAL
1061	DATE	344	351	20.5.63	2063-05-20
1061	HOSPITAL	808	846	WEST WIMMERA HEALTH SERVICE - JEFFEREY
1061	DOCTOR	1139	1174	C Schmutz\nTIME: 11.38am on 28/2/13	2013-02-28T11:38
1061	DOCTOR	2804	2820	MN\nDATE: 3/5/63	2063-05-03
1061	DOCTOR	2850	2858	C Ingram
1061	HOSPITAL	3623	3639	WHYALLA HOSPITAL
1061	DOCTOR	4069	4082	C Buddsiewski
1061	DATE	4232	4241	20/5/2063	2063-05-20
1061	HOSPITAL	4242	4272	GANNBONE MULTI PURPOSE SERVICE
1061	DOCTOR	4302	4311	C Dudding
1061	DOCTOR	4344	4351	C Ortea
1061	PHONE	4651	4660	8382 9154
1062	IDNUM	14	24	67B131454F
1062	MEDICALRECORD	25	35	670131.LPL
1062	PATIENT	36	50	NISSILA, REINA
1062	IDNUM	62	70	67B13145
1062	STREET	70	98	Parkway\nSTREET: Cannon Hill
1062	CITY	91	129	MAITLAND\nSTATE: Queensland\nZIP: 2771
1062	DATE	144	153	12/5/2008	2008-12-05
1062	DATE	173	182	28/5/2063	2063-05-28
1062	DEPARTMENT	187	237	Forensic Medicine\nHOSPITAL: OSBORNE PARK HOSPITAL
1062	DOCTOR	238	263	Gastala\nDOCTOR: Gastalan
1062	DOCTOR	2824	2841	PG\nDATE: 28/5/63	2063-05-28
1062	DOCTOR	2872	2880	Q Nedman
1063	IDNUM	13	23	25X152412O
1063	MEDICALRECORD	24	35	2581524.EGO
1063	PATIENT	37	54	MENZIES, DOMINICK
1063	IDNUM	65	73	25X15241
1063	STREET	74	88	Howard Gleason
1063	CITY	88	131	THE OAKS\nSTATE: New South Wales\nZIP: 5075
1063	DATE	146	154	4/7/1974	1974-07-04
1063	DATE	174	183	14/9/2062	2062-09-14
1063	DEPARTMENT	188	238	3HR STAY SURGICALUNIT\nHOSPITAL: WESTMEAD HOSPITAL
1063	DOCTOR	239	253	Mellisa Laurow
1063	IDNUM	414	422	25X15241
1063	DOCTOR	1494	1511	TD\nDATE: 15.9.62	2062-09-15
1063	DOCTOR	1511	1522	F Akiereven
1064	MEDICALRECORD	1	11	727273.OTB
1064	PATIENT	12	26	Levert, Dorian
1064	IDNUM	27	35	72T27357
1064	DATE	51	59	4/6/2063	2063-06-04
1064	DOCTOR	1124	1141	GG\nDATE: 29.5.63	2063-05-29
1064	DOCTOR	1143	1172	T Felps\nDOCTOR: T Stoudemire
1064	IDNUM	1634	1642	72T27357
1065	IDNUM	14	24	93K874428I
1065	MEDICALRECORD	25	35	934874.LHX
1065	PATIENT	37	60	Parrilla, PRINCE MICHAL
1065	IDNUM	71	79	93K87442
1065	STREET	80	89	Coastland
1065	CITY	89	129	COBAR\nSTATE: South Australia\nZIP: 3155
1065	DATE	144	154	19/10/2030	2030-10-19
1065	TIME	174	193	23/07/2012 at 09:32	2012-07-23T09:32
1065	DEPARTMENT	193	221	DHM\nHOSPITAL: TARA HOSPITAL
1065	DOCTOR	226	237	Gale Philip
1065	DOCTOR	245	259	Arturo RheinsV
1065	DOCTOR	336	344	Gazzillo
1065	DOCTOR	397	410	Brow\nDOCTOR:
1065	DATE	1129	1136	25/9/62	2062-09-25
1065	DOCTOR	1138	1146	Y Farham
1065	DATE	1863	1869	9/3/62	2062-09-03
1065	DOCTOR	1918	1928	MILES Fung
1066	IDNUM	-1	9	51G894473Q
1066	MEDICALRECORD	24	34	512894.MWS
1066	PATIENT	35	51	Wade, Wade, Wade
1066	IDNUM	56	64	51G89448
1066	PATIENT	65	69	Rudd
1066	CITY	69	114	MANDURAH\nSTATE: Western Australia\nZIP: 3767
1066	DATE	129	139	17/10/1992	1992-10-17
1066	DATE	159	168	19/9/2063	2063-09-19
1066	DEPARTMENT	173	229	3HR STAY SURGICAL UNIT\nHOSPITAL: MANILLA HEALTH SERVICE
1066	DOCTOR	234	246	JAE WARSTLER
1066	DATE	320	328	17/10/63	2063-10-17
1066	HOSPITAL	483	503	OMEO DISTRICT HEALTH
1066	DOCTOR	890	907	XA\nDATE: 20.9.63	2063-09-20
1066	DOCTOR	981	1052	N Tomkus\nDOCTOR: N Tomkus\nDOCTOR: N Ivanian\nTIME: 4:54pm on 17.07.13	2013-07-17T16:54
1066	DOCTOR	1067	1074	N Hildz
1066	DATE	2630	2634	2057	2057
1066	DOCTOR	3562	3571	N Jemenez
1066	DATE	3844	3852	17/10/63	2063-10-17
1066	HOSPITAL	3865	3901	CHILDERS MULTIPURPOSE HEALTH SERVICE
1066	DOCTOR	4684	4693	N. Virgen
1066	TIME	4700	4716	09/08/13 6:20 pm	2013-08-09T18:20
1067	MEDICALRECORD	1	11	091825.OLN
1067	PATIENT	12	28	Parrilla, Karrak
1067	IDNUM	29	37	09D82554
1067	DATE	52	61	27/9/2062	2062-09-27
1067	IDNUM	99	122	09D8255\nIDNUM: 09D8255
1067	DOCTOR	832	849	LB\nDATE: 25.9.62	2062-09-25
1067	DOCTOR	878	886	B Harrod
1068	IDNUM	14	24	67Z946603H
1068	MEDICALRECORD	25	36	6799466.AIH
1068	PATIENT	38	52	Wurth, JEFFERY
1068	IDNUM	63	71	67Z94660
1068	STREET	71	81	Golden Pae
1068	CITY	87	131	EMERALD\nSTATE: Northern Territory\nZIP: 045
1068	DATE	147	156	29/4/2017	2017-04-29
1068	DATE	176	185	16/1/2062	2062-01-16
1068	DEPARTMENT	190	290	Cure For Life Foundation Neuro-oncology Laboratory Adult Cancer\nHOSPITAL: HAYLAND DISTRICT HOSPITAL
1068	DOCTOR	291	312	JEFFRY FREDERICK Sero
1068	DOCTOR	312	338	Teschler\nDOCTOR: Teschler
1068	DATE	466	470	4/52	2066-04-04
1068	IDNUM	586	594	67Z94660
1068	DOCTOR	2713	2742	KJ\nDOCTOR: KJ\nDATE: 17.1.62	2062-01-17
1068	DOCTOR	2769	2777	P Eggett
1068	DATE	4608	4615	14/2/62	2062-02-14
1068	DEPARTMENT	4639	4655	ST GEORGEPRIVATE
1068	DOCTOR	4884	4893	P Uselton
1069	IDNUM	13	23	88Q547551T
1069	MEDICALRECORD	24	35	8865475.PET
1069	PATIENT	36	50	NICOME,OWS,OWS
1069	IDNUM	59	118	88Q54755\nIDNUM: 88Q54755\nIDNUM: 88Q54755\nIDNUM: 88Q54755
1069	CITY	93	124	TRAFALGAR\nSTATE: WA\nZIP: 1885
1069	DATE	148	156	1/7/2002	2002-01-07
1069	TIME	176	195	19/03/2013 at 15:58	2013-03-19T15:58
1069	DEPARTMENT	195	267	South Eastern Area\nHOSPITAL: WESTERN DISTRICT HEALTH SERVICE - HAMILTON
1069	DOCTOR	274	287	DARA Jackelyn
1069	DOCTOR	1977	1994	MP\nDATE: 22/5/63	2063-05-22
1069	DOCTOR	2026	2038	V Drumheiser
1069	DATE	2495	2502	30/5/63	2063-05-30
1070	IDNUM	14	24	36M568519B
1070	MEDICALRECORD	25	36	3645685.EZB
1070	PATIENT	37	55	GURT, MARIYA DEBOR
1070	IDNUM	63	122	36M56851\nIDNUM: 36M56851\nIDNUM: 36M56851\nPATIENT: BACTOR
1070	PATIENT	91	96	Foray
1070	CITY	96	139	HAHNDORF\nSTATE: South Australia\nZIP: 4218
1070	DATE	161	169	7/9/2005	2005-09-07
1070	TIME	189	208	20/03/2013 at 14:29	2013-03-20T14:29
1070	DEPARTMENT	208	252	Pathwest\nHOSPITAL: WAIKERIE HEALTH SERVICES
1070	DOCTOR	255	269	OrjEROLD BRINN
1070	DATE	362	366	2061	2061
1070	DOCTOR	2149	2166	JL\nDATE: 23/5/63	2063-05-23
1070	DOCTOR	2198	2205	J Shoen
1071	IDNUM	13	23	94J688678K
1071	MEDICALRECORD	24	34	943688.QTU
1071	PATIENT	36	53	Beerling, FRANKIE
1071	IDNUM	63	88	94J68867\nIDNUM: 94J68867
1071	CITY	103	142	FRANKSTON\nSTATE: Queensland\nZIP: 6063
1071	DATE	166	175	22/8/1979	1979-08-22
1071	TIME	195	214	16/04/2013 at 19:56	2013-04-16T19:56
1071	DEPARTMENT	214	288	PRINCE OF WALESPRIVATE\nHOSPITAL: NORTH EASTERN SOLDIERS MEMORIAL HOSPITAL
1071	DOCTOR	290	325	Rosette ROSALEE MONIGIE Bottiglieri
1071	DOCTOR	1365	1382	XY\nDATE: 19.6.63	2063-06-19
1071	DOCTOR	2597	2614	IP\nDATE: 19.6.63	2063-06-19
1071	DOCTOR	2643	2651	X Dottin
1071	DATE	3865	3872	25/6/63	2063-06-25
1072	MEDICALRECORD	1	12	4216096.IQT
1072	PATIENT	12	28	CHEEK,-PEB, UNIT
1072	IDNUM	43	68	42F60963\nIDNUM: 42F60963
1072	DATE	76	84	6/5/2064	2064-06-05
1072	DOCTOR	1226	1255	TO\nDOCTOR: HO\nDATE: 29.5.64	2064-05-29
1072	DOCTOR	1281	1287	M Rady
1072	IDNUM	1428	1436	42F60963
1072	DATE	1772	1778	5/6/64	2064-06-05
1074	MEDICALRECORD	2	13	6382005.WLE
1074	PATIENT	13	36	Senethavilouk, Leonarda
1074	IDNUM	41	49	63W20058
1074	DATE	65	73	5/6/2064	2064-06-05
1074	DATE	121	125	2062	2062
1074	DOCTOR	660	680	Holtz\nTIME: 11.20am	2013-09-11T11:20
1074	DOCTOR	746	751	Lanby
1074	DATE	1048	1054	6/5/64	2064-06-05
1075	IDNUM	13	23	05F402391A
1075	MEDICALRECORD	24	35	0524023.ZDA
1075	PATIENT	37	52	SUNFORD, Maisie
1075	IDNUM	53	111	05F40239\nIDNUM: 05F40239\nIDNUM: 05F40239\nDATE: 05F40239	2013-09-05
1075	STREET	81	89	Linksley
1075	CITY	89	120	MERIMBULA\nSTATE: WA\nZIP: 2721
1075	DATE	139	148	2/11/2003	2003-11-02
1075	DATE	168	177	23/7/2062	2062-07-23
1075	DEPARTMENT	182	250	Tissue Pathology and Diagnostic Oncology\nHOSPITAL: HEATHCOTE HEALTH
1075	DOCTOR	257	275	Senaida RYAN Hubel
1075	AGE	348	350	63
1075	DOCTOR	724	759	B Kemnick\nTIME: 11:15am on 21.5.12	2012-05-21T11:15
1075	DOCTOR	2849	2866	PK\nDATE: 24.7.62	2062-07-24
1075	DOCTOR	2896	2905	B Braxton
1075	DOCTOR	5885	5893	B Baesty
1075	DOCTOR	5946	5969	B Stelter\nDATE: 1.7.62	2062-01-07
1075	DATE	6067	6074	30.7.62	2062-07-30
1076	MEDICALRECORD	1	12	6305234.OYJ
1076	PATIENT	13	34	STEUART, Tatiana Mana
1076	IDNUM	34	59	63B52345\nIDNUM: 63B52345
1076	DATE	68	76	8/9/2062	2062-08-09
1076	DOCTOR	1120	1136	KS\nDATE: 8.8.62	2062-08-08
1076	DOCTOR	1166	1176	P Bergsman
1077	IDNUM	14	24	84S123317U
1077	MEDICALRECORD	25	35	847123.HCU
1077	PATIENT	36	56	BEDDOME, Joseph BILL
1077	IDNUM	71	79	84S12331
1077	PATIENT	80	86	Runner
1077	CITY	86	126	MAROOCHYDORE\nSTATE: Victoria\nZIP: 1480
1077	DATE	141	149	1/9/1977	1977-01-09
1077	TIME	169	188	13/06/2012 at 15:02	2012-06-13T15:02
1077	DEPARTMENT	188	241	ENVOI Pathology\nHOSPITAL: GUNDAGAI DISTRICT HOSPITAL
1077	DOCTOR	244	270	Gudruntera\nDOCTOR: Gudorf
1077	DOCTOR	2548	2565	PG\nDATE: 16.8.62	2062-08-16
1077	DOCTOR	2594	2601	U Sozio
1078	IDNUM	13	23	32P154365D
1078	MEDICALRECORD	24	34	325154.JRP
1078	PATIENT	35	46	INGANS, AYS
1078	IDNUM	62	70	32P15436
1078	STREET	71	77	Teresi
1078	CITY	77	122	SPRINGWOOD\nSTATE: South Australia\nZIP: 3396
1078	DATE	137	145	6/4/1989	1989-06-04
1078	TIME	165	184	27/06/2012 at 18:05	2012-06-27T18:05
1078	DEPARTMENT	184	226	Peter Mac\nHOSPITAL: WYONG PUBLIC HOSPITAL
1078	DOCTOR	227	250	Yang DEBBI\nTIME: 11:00
1078	AGE	313	315	78
1078	DOCTOR	4195	4212	GQ\nDATE: 30/8/62	2062-08-30
1078	DOCTOR	4244	4253	J Gasaway
1079	IDNUM	13	23	05Y994675X
1079	MEDICALRECORD	23	32	0599946.X
1079	PATIENT	36	50	Rod, Brittneys
1079	IDNUM	51	76	05Y99467\nIDNUM: 05Y99467
1079	PATIENT	79	86	Vervain
1079	CITY	86	129	COOKTOWN\nSTATE: New South Wales\nZIP: 3165
1079	DATE	153	162	16/3/1999	1999-03-16
1079	TIME	182	201	25/07/2012 at 16:43	2012-07-25T16:43
1079	DEPARTMENT	201	246	DICKINSON 3 SOUTH\nHOSPITAL: MAREEBA HOSPITAL
1079	DOCTOR	253	269	Koori DAKU Bijou
1079	DOCTOR	2883	2900	DF\nDATE: 28.9.62	2062-09-28
1079	DOCTOR	2931	2938	B Halik
1080	IDNUM	13	23	10C8763828
1080	MEDICALRECORD	24	35	1018763.VGW
1080	PATIENT	36	45	Klei, BON
1080	IDNUM	59	67	10C87638
1080	STREET	68	77	Duckettes
1080	CITY	77	107	MERRIMAC\nSTATE: SA\nZIP: 1110
1080	DATE	122	130	5/9/1988	1988-09-05
1080	DATE	150	159	23/1/2062	2062-01-23
1080	DEPARTMENT	164	229	INTENSIVE CARE UNIT\nHOSPITAL: YEA AND DISTRICT MEMORIAL HOSPITAL
1080	DOCTOR	236	254	JAKE Taylor LINZEY
1080	DOCTOR	2499	2527	OF\nDOCTOR: Z\nDATE: 24.1.62	2062-01-24
1080	DOCTOR	2555	2565	C Allevato
1081	MEDICALRECORD	1	12	8446156.WFR
1081	PATIENT	12	38	Samuelsen\nDOCTOR: Carissa
1081	IDNUM	31	56	84M61568\nIDNUM: 84M61568
1081	DATE	65	74	25/1/2062	2062-01-25
1081	AGE	139	141	32
1081	DOCTOR	1980	1997	TI\nDATE: 24/1/62	2062-01-24
1081	DOCTOR	2025	2035	V Nicolaus
1082	IDNUM	14	24	32I636740A
1082	MEDICALRECORD	25	36	3236367.LAA
1082	PATIENT	38	56	Ebbs, DWAYNE GLENN
1082	IDNUM	67	75	32I63674
1082	PATIENT	75	82	Hustles
1082	CITY	85	135	PORT LINCOLN\nSTATE: Northern Territory\nZIP: 5066
1082	DATE	150	160	23/11/1986	1986-11-23
1082	TIME	180	199	20/03/2013 at 11:58	2013-03-20T11:58
1082	DEPARTMENT	199	242	EMERGENCY\nHOSPITAL: KARRATHA HEALTH CAMPUS
1082	DOCTOR	245	263	Judealphonse LAVEY
1082	AGE	328	330	81
1082	DOCTOR	2024	2041	CA\nDATE: 23/5/63	2063-05-23
1082	DOCTOR	2070	2080	J Chrisman
1083	IDNUM	13	23	53Z237598L
1083	MEDICALRECORD	24	35	5392375.ZVL
1083	PATIENT	36	58	Lantebbe, YAGNE RAYDEN
1083	IDNUM	67	126	53Z23759\nIDNUM: 53Z23759\nIDNUM: 53Z23759\nIDNUM: 53Z23759
1083	PATIENT	95	101	Zarick
1083	CITY	101	161	BATEMANS BAY\nSTATE: Australian Capital Territory\nZIP: 3722
1083	DATE	182	191	12/4/1979	1979-04-12
1083	TIME	211	230	02/04/2013 at 08:56	2013-04-02T08:56
1083	DEPARTMENT	230	273	Peter Mac\nHOSPITAL: KARRATHA HEALTH CAMPUS
1083	DOCTOR	276	299	MELODI\nDOCTOR: LOVERDI
1083	DOCTOR	319	326	Lathern
1083	AGE	395	397	88
1083	DOCTOR	761	808	West\nDOCTOR: K Greg\nTIME: 11.00am on 02.04.13	2013-04-02T11:00
1083	DOCTOR	1735	1763	TK\nDOCTOR: QF\nDATE: 5.6.63	2063-06-05
1083	DOCTOR	1790	1796	K Riek
1083	DATE	2345	2352	13/6/63	2063-06-13
1084	IDNUM	13	23	11V368656U
1084	MEDICALRECORD	24	35	1183686.PRU
1084	PATIENT	36	55	BORNESKO, Wendolmal
1084	IDNUM	65	107	11V36865\nIDNUM: 11V36865\nIDNUM: 11V36865
1084	PATIENT	102	108	Belfry
1084	CITY	108	141	COOBER PEDY\nSTATE: NT\nZIP: 6018
1084	DATE	165	173	1/9/2008	2008-01-09
1084	DATE	193	201	3/7/2063	2063-07-03
1084	DEPARTMENT	206	265	DARLING POINT\nHOSPITAL: YEA AND DISTRICT MEMORIAL HOSPITAL
1084	DOCTOR	268	345	Gale HEATH Thi+)nDOCTOR: Gale HEATH Thi-)nTIME: 36 lymph nodes from 1 to 2 mm
1084	DOCTOR	268	312	Gale HEATH\nTIME: 36 lymph nodes from 1 to 2
1084	DATE	365	371	5.8.63	2063-05-08
1084	DATE	397	403	8.7.63	2063-07-08
1084	DATE	532	540	Previous	2066-09-03
1084	DATE	746	750	2060	2060
1084	DOCTOR	1244	1334	D Bielicki\nDOCTOR: D Lemache\nDOCTOR: D Lemache\nDOCTOR: D Lemache\nTIME: 10:35 on 1/5/13	2013-05-01T10:35
1084	DOCTOR	2918	2946	PM\nDOCTOR: WH\nDATE: 4/7/63	2063-07-04
1084	DOCTOR	2971	2982	D Arvanitis
1084	DATE	5201	5207	8.7.63	2063-07-08
1084	DATE	5785	5793	5.8.2063	2063-05-08
1084	HOSPITAL	5808	5824	BILOELA HOSPITAL
1084	DOCTOR	5855	5862	D Halas
1084	DATE	5955	5964	19/7/2063	2063-07-19
1084	DOCTOR	5964	6023	V36865 C7 CONS\nIDNUM: 11V36865 C7 CONS\nIDNUM: 11V36865 C7
1084	DOCTOR	6103	6129	D Bombich\nDATE: 22/7/2063	2063-07-22
1084	DATE	6339	6348	23/7/2063	2063-07-23
1084	IDNUM	7038	7044	118368
1085	IDNUM	14	24	69S389714C
1085	MEDICALRECORD	25	36	6963897.EMC
1085	PATIENT	38	50	IVORY, BELLE
1085	IDNUM	61	69	69S38971
1085	STREET	70	82	Saint Andrew
1085	CITY	82	109	COOM\nSTATE: ACT\nZIP: 2090
1085	DATE	125	133	6/9/1995	1995-06-09
1085	DATE	153	162	17/7/2063	2063-07-17
1085	DEPARTMENT	167	216	105 HAMRUN CIRCUIT\nHOSPITAL: STANTHORPE HOSPITAL
1085	DOCTOR	223	247	Virgilio Yarran ZABROCKI
1085	DOCTOR	2353	2370	JL\nDATE: 18.7.63	2063-07-18
1085	DOCTOR	2399	2407	R Picton
1085	DATE	2976	2983	10/1/63	2063-01-10
1086	IDNUM	13	23	80J9896735
1086	MEDICALRECORD	24	35	8039896.SIN
1086	PATIENT	37	54	SICKINGER, ERLINE
1086	IDNUM	71	79	74W15132
1086	STREET	80	96	White Pine Knoll
1086	CITY	96	149	DUBBO\nSTATE: Australian Capital Territory\nZIP: 5630
1086	DATE	164	173	4/11/1982	1982-11-04
1086	DATE	193	202	24/7/2063	2063-07-24
1086	DEPARTMENT	207	246	PARKES 4 EAST\nHOSPITAL: MONTO HOSPITAL
1086	DOCTOR	249	276	Emerson Bennett\nDOCTOR: XS
1086	DOCTOR	917	969	Portland\nDOCTOR: S Olivero\nTIME: 15:25 on 22/05/13	2013-05-22T15:25
1086	DOCTOR	1233	1250	LZ\nDATE: 25.7.63	2063-07-25
1086	DOCTOR	1249	1275	S Haros\nDOCTOR: S Debbins
1086	DATE	2317	2324	16.8.63	2063-08-16
1086	DOCTOR	2341	2402	S Fearon\nDOCTOR: S Lahaye\nHOSPITAL: THOMAS EMBLING HOSPITAL
1087	IDNUM	13	23	48F000621W
1087	MEDICALRECORD	23	33	483006.HDW
1087	STREET	36	48	Samms, Kayce
1087	IDNUM	50	75	48F00062\nIDNUM: 48F00062
1087	STREET	78	93	Liddington Hall
1087	CITY	93	138	YEPPOON\nSTATE: Northern Territory\nZIP: 4005
1087	DATE	162	171	26/7/2004	2004-07-26
1087	DATE	191	199	3/9/2063	2063-09-03
1087	DEPARTMENT	204	255	POST OPERATIVE RECOVERY\nHOSPITAL: BILOELA HOSPITAL
1087	DOCTOR	258	278	MIGDALIA KARLA JEARD
1087	DATE	356	363	11.9.63	2063-09-11
1087	DOCTOR	1959	1987	GZ\nDOCTOR: MO\nDATE: 4.9.63	2063-09-04
1087	DOCTOR	2009	2020	G Kunselman
1087	DATE	2656	2663	11.9.63	2063-09-11
1088	IDNUM	14	24	96B021789F
1088	MEDICALRECORD	25	36	9600217.WYF
1088	PATIENT	38	58	STURN, KAMI LUCIENNE
1088	IDNUM	59	84	96B02178\nIDNUM: 96B02178
1088	STREET	87	99	Brandon Oaks
1088	CITY	99	134	NEWCASTLE\nSTATE: Tasmania\nZIP: 27
1088	DATE	160	169	28/2/1998	1998-02-28
1088	TIME	189	208	11/06/2013 at 11:11	2013-06-11T11:11
1088	DEPARTMENT	208	286	Radiation Oncology\nHOSPITAL: EASTERN EYRE HEALTH AND AGED CARE - CLEVE CAMPUS
1088	DOCTOR	293	316	Franklin HORACIO DERKAS
1088	DOCTOR	3355	3384	HM\nDOCTOR: HM\nDATE: 14.8.63	2063-08-14
1088	DOCTOR	3379	3389	Z Lagordas
1089	IDNUM	13	23	01F803396E
1089	MEDICALRECORD	24	35	0128033.YQE
1089	PATIENT	37	50	LICATA, Hyman
1089	IDNUM	51	76	01F80339\nIDNUM: 01F80339
1089	PATIENT	78	86	Churston
1089	CITY	86	143	MOUNT ISA\nSTATE: Australian Capital Territory\nZIP: 6105
1089	DATE	167	177	12/11/2002	2002-11-12
1089	TIME	197	216	29/05/2013 at 18:31	2013-05-29T18:31
1089	DEPARTMENT	216	256	NSW Health\nHOSPITAL: GERALDTON HOSPITAL
1089	DOCTOR	259	272	MERVIN GOWORN
1089	DOCTOR	295	305	Majerowski
1089	DATE	340	346	6.8.63	2063-06-08
1089	DOCTOR	2054	2082	EL\nDOCTOR: JI\nDATE: 2.7.63	2063-07-02
1089	DOCTOR	2109	2120	A Achenbach
1089	DATE	3084	3090	6.8.63	2063-06-08
1090	IDNUM	14	24	75P643695Z
1090	MEDICALRECORD	25	36	7556436.ZPZ
1090	PATIENT	38	55	Helm, Grant BILLY
1090	IDNUM	56	81	75P64369\nIDNUM: 75P64369
1090	PATIENT	84	90	Armell
1090	CITY	90	121	LONGFORD\nSTATE: ACT\nZIP: 6011
1090	DATE	145	154	27/7/1999	1999-07-27
1090	DATE	174	183	20/8/2063	2063-08-20
1090	DEPARTMENT	188	255	DEPT OF CORRECTIVE SERVICES\nHOSPITAL: PALMERSTON REGIONAL HOSPITAL
1090	DOCTOR	256	275	JanellROSETTA NUBER
1090	DOCTOR	2475	2492	JL\nDATE: 21/8/63	2063-08-21
1090	DOCTOR	2523	2530	T Dahme
1091	MEDICALRECORD	1	12	2247637.PKH
1091	PATIENT	13	29	Chacon, Tallulah
1091	IDNUM	29	207	22L76375\nIDNUM: 22L76375\nIDNUM: 22L76375\nIDNUM: 22L76375\nIDNUM: 22L76375\nIDNUM: 22L76375\nIDNUM: 22L76375\nIDNUM: 22L76375\nIDNUM: 22L76375\nIDNUM: 22L76375\nIDNUM: 22L76375
1091	DATE	63	72	16/8/2063	2063-08-16
1091	DOCTOR	1248	1275	Z\nDOCTOR: Q\nDATE: 15.8.63	2063-08-15
1091	DOCTOR	1272	1279	H Tovae
1092	IDNUM	13	23	43C364612S
1092	MEDICALRECORD	24	35	4313646.DGS
1092	PATIENT	36	49	Vascer, DENNY
1092	IDNUM	61	69	43C36461
1092	PATIENT	69	76	Giralai
1092	CITY	79	136	RASMUSSEN\nSTATE: Australian Capital Territory\nZIP: 2083
1092	DATE	151	161	15/10/1996	1996-10-15
1092	DATE	181	190	21/8/2063	2063-08-21
1092	DEPARTMENT	195	263	ST GEORGEPRIVATE\nHOSPITAL: MURRAY BRIDGE SOLDIERS MEMORIAL HOSPITAL
1092	DOCTOR	270	286	TESSA Tiana Maud
1092	DOCTOR	849	882	M Zeisler\nTIME: 14:30 on 19/6/13	2013-06-19T14:30
1092	DOCTOR	2303	2320	CY\nDATE: 22/8/63	2063-08-22
1092	DOCTOR	3916	3933	VJ\nDATE: 22/8/63	2063-08-22
1092	DOCTOR	3932	3941	I Washple
111	IDNUM	13	23	01Z395670B
111	MEDICALRECORD	24	34	019395.RSB
111	PATIENT	36	52	WILLARS, Felicia
111	IDNUM	63	71	01Z39567
111	PATIENT	72	80	Casimere
111	CITY	80	96	COLAC\nZIP: 5139
111	DATE	120	129	22/3/1999	1999-03-22
111	DATE	149	158	12/2/2063	2063-12-02
111	DEPARTMENT	163	202	Pathwest\nHOSPITAL: TOWNSVILLE HOSPITAL
111	DOCTOR	214	238	Fernando DYAN BM-MANGARO
111	DOCTOR	910	926	Ahmad\nDOCTOR: A
111	DOCTOR	3971	4000	VM\nDOCTOR: OD\nDATE: 13.2.63	2063-02-13
111	DOCTOR	4024	4033	A Hessell
111	ORGANIZATION	5228	5268	Humana Inc\nHOSPITAL: WARRNAMBOOL CAMPUS
111	HOSPITAL	7370	7378	Grainger
162	IDNUM	13	23	22Q9965284
162	MEDICALRECORD	24	35	2269965.GXM
162	PATIENT	37	52	POLEE, Shawanna
162	IDNUM	63	71	22Q99652
162	STREET	72	79	W Aspen
162	CITY	79	110	LEONGATHA\nSTATE: SA\nZIP: 3165
162	DATE	125	134	5/10/1980	1980-05-10
162	TIME	154	173	09/12/2013 at 13:47	2013-12-09T13:47
162	DEPARTMENT	173	250	CORONARYCARE UNIT\nHOSPITAL: MOUNT BARKER DISTRICT SOLDIERS MEMORIAL HOSPITAL
162	DOCTOR	255	267	KULIN Luther
162	DATE	320	326	4/3/64	2064-03-04
162	DOCTOR	1728	1745	KO\nDATE: 2/12/63	2063-02-12
162	DOCTOR	1808	1817	P Sheerin
162	DATE	3019	3025	3/4/64	2064-03-04
162	PHONE	3276	3285	8382 9154
162	DOCTOR	3356	3369	P. Featherman
162	TIME	3386	3394	24/12/13	2013-12-24
180	IDNUM	13	23	64Z288335J
180	MEDICALRECORD	24	35	6492883.JOJ
180	PATIENT	37	47	Renn, LONG
180	IDNUM	48	73	64Z28833\nIDNUM: 64Z28833
180	STREET	76	84	Spinaker
180	CITY	84	114	KAPUNDA\nSTATE: QLD\nZIP: 2069
180	DATE	138	147	22/2/2032	2032-02-22
180	DATE	167	175	1/7/2063	2063-07-01
180	DEPARTMENT	180	231	OPERATING THEATRES\nHOSPITAL: BOORT DISTRICT HEALTH
180	DOCTOR	234	254	Bernetta LUANA McFON
180	AGE	319	321	35
180	DOCTOR	1260	1282	Q Cococell\nDOCTOR: Q.
180	DOCTOR	2377	2393	DD\nDATE: 1.8.63	2063-01-08
180	DOCTOR	2421	2428	Q Pruyn
24	IDNUM	13	23	38I037645D
24	MEDICALRECORD	24	35	3830376.KND
24	PATIENT	36	51	LAURENCE, Seema
24	IDNUM	69	77	38I03764
24	PATIENT	78	84	Ridler
24	CITY	84	113	NORTHAM\nSTATE: WA\nZIP: 2573
24	DATE	128	137	23/3/2010	2010-03-23
24	TIME	154	173	24/09/2013 at 13:22	2013-09-24T13:22
24	DEPARTMENT	173	226	SEALS Central\nHOSPITAL: MILDURA BASE PUBLIC HOSPITAL
24	DOCTOR	229	266	Val Josh Danilo-L-IHC\nDOCTOR: S Xeno
24	DATE	304	311	5/12/63	2063-05-12
24	DOCTOR	797	798	I
24	DOCTOR	2268	2298	FU\nDOCTOR: YK\nDATE: 27.11.63	2063-11-27
24	DOCTOR	2321	2330	I Pugmire
24	DATE	3404	3411	3/12/63	2063-03-12
24	DOCTOR	3535	3550	WALLACE CAMERON
24	HOSPITAL	3708	3728	ALICE ALLINGHOSPITAL
24	DATE	3921	3928	5/12/63	2063-05-12
24	HOSPITAL	3929	3952	TRACY DISTRICT HOSPITAL
24	DEPARTMENT	4268	4293	Met\nIDNUM: 11\nIDNUM: 11
250	IDNUM	13	23	70R239451A
250	MEDICALRECORD	24	35	7062394.NEA
250	PATIENT	37	52	NEGRETE, JESSIE
250	IDNUM	63	71	70R23945
250	STREET	71	82	Cheney Phth
250	CITY	83	115	NARACOORTE\nSTATE: WA\nZIP: 2292
250	DATE	130	138	3/4/2013	2013-03-04
250	DATE	158	168	25/11/2063	2063-11-25
250	DEPARTMENT	173	222	CARDIOTHORACIC ICU\nHOSPITAL: HERVEY BAY HOSPITAL
250	DOCTOR	223	238	Sandy Nealcraft
250	DOCTOR	1857	1934	Gaylord\nDOCTOR: RUSSEL CHOPELAS\nTIME: 16:07pm on the 23rd of September 2013	2013-09-23T16:07
250	DOCTOR	1943	1973	ES\nDOCTOR: TQ\nDATE: 26.11.63	2063-11-26
250	DOCTOR	1997	2003	T Sarp
353	IDNUM	13	23	28N3505103
353	MEDICALRECORD	24	34	285350.NCA
353	PATIENT	35	54	BASTEDO, SKYLAR NIX
353	IDNUM	70	78	28N35051
353	STREET	79	86	Almeria
353	CITY	86	104	ALDGATE\nZIP: 2727
353	DATE	128	136	5/5/1999	1999-05-05
353	DATE	156	165	22/5/2063	2063-05-22
353	DEPARTMENT	170	231	UROLOGY DAY ONLY\nHOSPITAL: LIGHTNING RIVER DISTRICT HOSPITAL
353	DOCTOR	246	269	JEREMY JEFFRY SMOLINSKY
353	DATE	318	324	3/7/63	2063-07-03
353	DOCTOR	2216	2233	HZ\nDATE: 23/5/63	2063-05-23
353	DOCTOR	2233	2242	H Delarza
353	DATE	5033	5039	3/7/63	2063-07-03
353	DEPARTMENT	5064	5071	Laverty
353	DOCTOR	5773	5786	H. Princiotta
353	DOCTOR	5804	5805	H
353	TIME	5822	5830	10/04/13	2013-04-10
358	IDNUM	14	24	86J371568R
358	MEDICALRECORD	25	35	863371.PRV
358	PATIENT	36	54	TENNES, ANTIONETTE
358	IDNUM	57	82	86J37156\nIDNUM: 86J37156
358	CITY	92	131	GOONDIWINDI\nSTATE: Tasmania\nZIP: 2530
358	DATE	155	164	25/5/1991	1991-05-25
358	TIME	184	203	16/03/2013 at 18:21	2013-03-16T18:21
358	DEPARTMENT	203	260	Envoi Specialist\nHOSPITAL: WARIALDA MULTIPURPOSE SERVICE
358	DOCTOR	265	283	SHILOH SHERON Erie
358	DOCTOR	283	288	AGRon
358	DATE	365	371	5.1.63	2063-05-01
358	DOCTOR	2646	2663	VZ\nDATE: 20.5.63	2063-05-20
358	DOCTOR	2663	2687	V Stoud\nDATE: 21.5.2063	2063-05-21
358	DOCTOR	3504	3512	V Weldin
358	DATE	3887	3893	5.1.63	2063-05-01\nDOCTOR: V Maresco
47	IDNUM	14	24	34F3916260
47	MEDICALRECORD	25	36	3423916.GQA
47	PATIENT	37	49	LETLOW, SELY
47	IDNUM	54	113	34F39162\nIDNUM: 34F39162\nIDNUM: 34F39162\nIDNUM: 34F39162
47	STREET	82	94	Braithwaithe
47	CITY	94	126	EDEN\nSTATE: Victoria\nZIP: 4818
47	DATE	150	159	20/6/1997	1997-06-20
47	DATE	179	187	5/2/2063	2063-05-02
47	DEPARTMENT	192	248	DAYSURGERY UNIT\nHOSPITAL: WOMENS AND CHILDRENS HOSPITAL
47	DOCTOR	255	278	SHELDON LAURENCE Mulzer
47	DOCTOR	875	877	K.
47	DOCTOR	892	894	40
47	DOCTOR	1837	1853	HZ\nDATE: 6.2.63	2063-06-02
47	DOCTOR	1881	1888	K Pipho
470	IDNUM	13	23	55X992584L
470	MEDICALRECORD	24	34	558992.NVM
470	PATIENT	35	54	Economies, Leopoldo
470	IDNUM	67	75	55X99258
470	STREET	75	81	Offier
470	CITY	86	148	LAKES ENTRANCE\nSTATE: Australian Capital Territory\nZIP: 2165
470	DATE	163	173	28/10/2015	2015-10-28
470	TIME	192	211	24/06/2013 at 09:19	2013-06-24T09:19
470	DEPARTMENT	211	289	Forensic Medicine\nHOSPITAL: GOULBURN VALLEY HEALTH - CENTRE FOR OLDER PERSONS
470	DOCTOR	290	323	Tommie Herschel DISTRICT\nZIP: 16
470	DOCTOR	1189	1256	OZELL MARTINDole\nDOCTOR: P Angers\nDOCTOR: P Angers\nDOCTOR: P JOS
470	DOCTOR	1489	1527	Perry Lavell\nTIME: 2:05pm on 24.06.13	2013-06-24T14:05
470	DOCTOR	3114	3131	IF\nDATE: 27.8.63	2063-08-27
470	DOCTOR	3851	3859	Y Wakink
473	IDNUM	13	23	13T023532U
473	MEDICALRECORD	24	35	1370235.KHU
473	PATIENT	36	50	Serous, Danita
473	IDNUM	53	78	13T02353\nIDNUM: 13T02353
473	STREET	80	89	Bush Pind
473	CITY	90	123	HERVEY BAY\nSTATE: QLD\nZIP: 3111
473	DATE	144	153	10/6/1988	1988-10-06
473	DATE	173	181	6/8/2063	2063-08-06
473	DEPARTMENT	185	231	Forensic Medicine\nHOSPITAL: MENINGIE HOSPITAL
473	DOCTOR	238	257	Evita LOIDA WOETZEL
473	DOCTOR	885	960	D\nDOCTOR: D.clie\nDOCTOR: D.clie\nDOCTOR: D.clie\nTIME: 4:25pm on 4/6/2013	2013-06-04T16:25
473	DOCTOR	941	959	Roya\nDOCTOR: J. D
473	DOCTOR	2287	2303	OE\nDATE: 7.8.63	2063-07-08
473	DOCTOR	2331	2340	D Buergel
473	DOCTOR	3497	3506	D Chasten
528	IDNUM	14	24	61P044690C
528	MEDICALRECORD	25	36	6160446.ZCC
528	PATIENT	38	65	Humphreys, WARREN JACQUETTA
528	IDNUM	75	83	61P04469
528	PATIENT	84	91	Kellogg
528	CITY	91	124	TOWNSVILLE\nSTATE: VIC\nZIP: 2558
528	DATE	139	148	15/1/2001	2001-01-15
528	DEPARTMENT	180	229	SEALS central\nHOSPITAL: COLLIE DISTRICT HOSPITAL
528	DOCTOR	232	249	JAYSON ANGEL Ivan
528	AGE	521	523	66
528	DOCTOR	987	1040	Krewege\nDOCTOR: S Hoppins\nTIME: 12.37am on 07.08.13	2013-08-07T12:37
528	DOCTOR	1683	1731	Koning\nDOCTOR: Gulden\nTIME: 1.05pm on 07.08.13	2013-08-07T14:05
528	DOCTOR	3959	3989	IS\nDOCTOR: IS\nDATE: 10.10.63	2063-10-10
528	DOCTOR	4017	4027	S Wojenski
545	IDNUM	13	23	28L064759L
545	MEDICALRECORD	24	35	2840647.OXL
545	PATIENT	37	63	Schempp, FRANKIE Nathanial
545	IDNUM	64	89	28L06475\nIDNUM: 28L06475
545	STREET	92	98	E Swan
545	CITY	98	124	EDEN\nSTATE: WA\nZIP: 6910
545	DATE	148	157	20/9/2018	2018-09-20
545	DATE	175	185	29/10/2063	2063-10-29
545	DEPARTMENT	190	236	CORONARY CARE UNIT\nHOSPITAL: HEATHCOTE HEALTH
545	DOCTOR	243	265	Laurence MELIDA MARVEL
545	DOCTOR	809	873	Sherdecker\nDOCTOR: G Tid155\nDOCTOR: G Tidgle\nDOCTOR: G Tidgle
545	DOCTOR	3010	3028	KB\nDATE: 29/10/63	2063-10-29
545	DOCTOR	3057	3063	G Maas
545	DATE	3498	3506	28L06475	2063-04-28
545	DOCTOR	3560	3561	G
545	DATE	3572	3579	2/10/63	2063-10-02
563	IDNUM	14	24	86I185717T
563	MEDICALRECORD	25	35	863185.TDS
563	PATIENT	37	43	BOCHE,
563	IDNUM	64	72	86I18571
563	PATIENT	72	79	Elmeter
563	CITY	82	125	DERBY\nSTATE: Northern Territory\nZIP: 5321
563	DATE	140	150	28/10/1985	1985-10-28
563	TIME	170	189	22/01/2013 at 14:28	2013-01-22T14:28
563	DEPARTMENT	201	212	ACT Genetic
563	DOCTOR	212	236	Ethan Florentino Hevilla
563	DOCTOR	647	664	EF\nDATE: 25.3.63	2063-03-25
563	DOCTOR	693	703	U Vigueras
563	DATE	1983	1990	13/4/63	2063-04-13
563	HOSPITAL	2022	2088	JACARANDA PLACE V QUEENSLAND ADOLESCENT EXTENDED TREATMENT CENTRE
563	DATE	2129	2137	4/3/2063	2063-04-03
563	DOCTOR	2137	2183	PEARL Beskom\nDOCTOR: U Stauc\nDOCTOR: U Staus
563	DOCTOR	2726	2741	CHIARA Gennaria
563	DOCTOR	2946	2948	U.
563	PATIENT	2949	2965	Humberto Bernson
583	IDNUM	14	24	97Z786665F
583	MEDICALRECORD	25	36	9797866.ROF
583	PATIENT	38	50	Katis, Linda
583	IDNUM	61	69	97Z78666
583	PATIENT	70	77	Langner
583	CITY	77	107	PORTLAND\nSTATE: SA\nZIP: 2582
583	DATE	122	131	18/6/1989	1989-06-18
583	DATE	151	160	14/4/2063	2063-04-14
583	DEPARTMENT	177	196	INTENSIVE CARE UNIT
583	DOCTOR	200	221	Randall Joaquin Waren
583	DATE	270	276	5.6.63	2063-06-05
583	DATE	295	302	27.4.63	2063-04-27
583	DATE	364	372	previous	2066-03-16
583	DOCTOR	771	776	Busie
583	DOCTOR	2136	2153	TT\nDATE: 15/4/63	2063-04-15
583	DOCTOR	2152	2159	Z Ravor
583	DOCTOR	6847	6848	Z
583	HOSPITAL	6849	6882	Werblow\nHOSPITAL: MOUNT BLEASIAH
583	DOCTOR	7560	7561	Z
583	HOSPITAL	7574	7609	WEST WIMMERA HEALTH SERVICE - NHILL
583	DATE	7684	7690	5.6.63	2063-06-05
583	HOSPITAL	7704	7738	COLLARENEBRI MULTI PURPOSE SERVICE
583	DOCTOR	7770	7771	V
59	IDNUM	14	24	55V707723N
59	MEDICALRECORD	25	36	5587077.GJN
59	PATIENT	38	56	HOLWAY, Jaime SADE
59	IDNUM	57	82	55V70772\nIDNUM: 55V70772
59	STREET	76	88	Robert Evans
59	CITY	88	120	THIRLMERE\nSTATE: TAS\nZIP: 3632
59	DATE	135	143	1/6/2034	2034-01-06
59	DATE	163	171	6/7/2062	2062-06-07
59	DEPARTMENT	176	235	Hunter Area Pathology\nHOSPITAL: RIVERLAND GENERAL HOSPITAL
59	DOCTOR	236	244	ALECUCKY
59	DATE	304	311	28.6.62	2062-06-28
59	DOCTOR	1975	1992	QM\nDATE: 6.12.62	2062-12-06
59	DOCTOR	2022	2031	O Feusier
59	DATE	3737	3744	28.6.62	2062-06-28
59	DOCTOR	3874	3925	O Weynand\nDOCTOR: O Weynand\nDEPARTMENT: O Weynand
59	DOCTOR	4224	4225	O
59	DEPARTMENT	4226	4253	Songer\nHOSPITAL: StVincent
591	IDNUM	14	24	13R838781W
591	MEDICALRECORD	25	36	1368387.VEW
591	PATIENT	38	59	ROSWELL, CLETUS ALANA
591	IDNUM	70	78	13R83878
591	STREET	79	85	Wannyl
591	CITY	85	139	BURNIE\nSTATE: Australian Capital Territory\nZIP: 1003
591	DATE	154	163	13/7/1991	1991-07-13
591	DATE	183	192	16/1/2062	2062-01-16
591	DEPARTMENT	197	238	ACUTECARE WARD\nHOSPITAL: MURGON HOSPITAL
591	DOCTOR	241	257	SCOT DALE POUBLE
591	DOCTOR	2007	2036	QE\nDOCTOR: BA\nDATE: 17.1.62	2062-01-17
591	DOCTOR	2066	2076	C Maritato
591	DATE	2824	2831	20/3/63	2063-03-20
634	MEDICALRECORD	2	13	1886003.XWV
634	PATIENT	14	32	MARSICO, Rosemarie
634	IDNUM	33	41	18V60039
634	DATE	57	66	19/3/2064	2064-03-19
634	DATE	1318	1325	18.3.64	2064-03-18
634	DOCTOR	1354	1362	D Gelder
636	MEDICALRECORD	0	11	6666204.MSI
636	PATIENT	12	23	Cira113216.
636	IDNUM	29	37	66R62044
636	DATE	53	62	19/3/2064	2064-03-19
636	DOCTOR	1299	1328	PO\nDOCTOR: ZC\nDATE: 18.3.64	2064-03-18
636	DOCTOR	1352	1358	S Odeh
637	IDNUM	13	23	40B4707569
637	MEDICALRECORD	24	34	400470.UOR
637	PATIENT	36	49	Levien, Tracy
637	IDNUM	59	67	40B47075
637	STREET	67	76	Pine Croe
637	CITY	78	125	WOOLGOOLGA\nSTATE: Western Australia\nZIP: 1240
637	DATE	138	148	28/10/1994	1994-10-28
637	DATE	168	177	18/3/2064	2064-03-18
637	DEPARTMENT	182	229	DAY SURGERY\nHOSPITAL: COLLIE DISTRICT HOSPITAL
637	DOCTOR	230	244	Ezra MarlinROE
637	DOCTOR	1843	1857	ALPHONSO UBLOG
637	DOCTOR	1913	1942	HN\nDOCTOR: TY\nDATE: 19.3.64	2064-03-19
637	DOCTOR	1966	1974	G Bedney
637	IDNUM	2082	2090	24O65140
637	DOCTOR	3217	3228	G Schwormer
639	IDNUM	14	24	45F352363X
639	MEDICALRECORD	25	36	4523523.QJX
639	PATIENT	38	53	Caradonna, HUGO
639	IDNUM	54	79	45F35236\nIDNUM: 45F35236
639	PATIENT	82	86	Lunn
639	CITY	86	123	DEVONPORT\nSTATE: Victoria\nZIP: 2319
639	DATE	147	156	18/3/1991	1991-03-18
639	DATE	176	185	21/1/2063	2063-01-21
639	DEPARTMENT	190	243	ENVOI Pathology\nHOSPITAL: THE QUEEN ELIZABETH CENTRE
639	DOCTOR	244	273	Celsa Cassi\nDATE: 16/11/2063	2063-11-16
639	AGE	326	328	77
639	DOCTOR	3779	3796	AS\nDATE: 22/1/63	2063-01-22
639	DOCTOR	3825	3832	L Ngoun
639	DOCTOR	5929	5938	L Ladhell
639	DATE	6594	6601	23/3/64	2064-03-23
641	IDNUM	13	23	93B373421G
641	MEDICALRECORD	24	35	9303734.FEG
641	PATIENT	37	52	LIZOTTE, ASHTON
641	IDNUM	53	111	93B37342\nIDNUM: 93B37342\nIDNUM: 93B37342\nPATIENT: PETER
641	STREET	81	90	Butterfly
641	CITY	90	120	ALDGATE\nSTATE: ACT\nZIP: 5640
641	DATE	141	150	20/8/1994	1994-08-20
641	DEPARTMENT	182	229	WEST GYNAECOLOGY\nHOSPITAL: BLACKWATER HOSPITAL
641	DOCTOR	232	257	CARISSA JAQUELINE SAMBERT
641	DOCTOR	313	321	Sansouci
641	AGE	332	334	73
641	DOCTOR	1110	1143	Z Rolstad\nTIME: 17.25 on 7/11/12	2012-11-07T17:25
641	DOCTOR	1612	1643	Z Fedor\nTIME: 17.45 on 7/11/12	2012-11-07T17:45
641	DOCTOR	4028	4045	VI\nDATE: 1/10/62	2062-01-10
641	DOCTOR	4077	4084	Z Giehl
641	DATE	6651	6660	23/3/2064	2064-03-23
641	DOCTOR	6700	6714	WINDY Hennings
642	MEDICALRECORD	2	13	5193935.UZP
642	PATIENT	14	27	STEAGELL, Fae
642	IDNUM	36	44	51X39357
642	DATE	60	69	24/3/2064	2064-03-24
642	DOCTOR	408	452	YN\nDOCTOR: T11\nTIME: 11:12.2014 at 11:12am	2014-01-15T11:12
642	DOCTOR	552	625	Trena\nDOCTOR: WB\nDOCTOR: BS\nDOCTOR: PW\nTIME: 11:27am on the 14.1.2014	2014-01-14T11:27
642	DOCTOR	752	781	JU\nDOCTOR: QM\nDATE: 18.3.64	2064-03-18
642	DOCTOR	805	812	O Behun
642	DOCTOR	1418	1451	O Carlin\nDOCTOR: KARITANE Centre
643	IDNUM	13	23	67Q435696G
643	MEDICALRECORD	24	35	6764356.YPG
643	PATIENT	37	57	Jowers, Keneth DAREN
643	IDNUM	68	76	67Q43569
643	STREET	77	83	Leaton
643	CITY	83	114	THIRLMERE\nSTATE: WA\nZIP: 3902
643	DATE	129	138	16/2/2007	2007-02-16
643	TIME	158	177	24/06/2013 at 10:58	2013-06-24T10:58
643	DEPARTMENT	177	221	SA Pathology\nHOSPITAL: MERCY HEALTH SERVICE
643	DOCTOR	226	247	SHELIA Harvey TRABERT
643	DOCTOR	1386	1403	EC\nDATE: 27/8/63	2063-08-27
643	DOCTOR	1433	1443	R Trevisan
644	IDNUM	13	23	08Y637302C
644	MEDICALRECORD	24	34	089637.KBH
644	PATIENT	35	54	Hardwick, Tamoxifen
644	IDNUM	63	71	08Y63730
644	PATIENT	72	78	Buffum
644	CITY	78	116	ULVERSTONE\nSTATE: Victoria\nZIP: 3113
644	DATE	131	141	24/12/1999	1999-12-24
644	TIME	161	180	21/03/2013 at 16:21	2013-03-21T16:21
644	DEPARTMENT	180	230	BILLINGTON CENTRE\nHOSPITAL: MOLONG HEALTH SERVICE
644	DOCTOR	235	242	Chaunce
644	DOCTOR	1883	1900	GZ\nDATE: 24/5/63	2063-05-24
644	DOCTOR	1899	1909	B Doeberte
645	IDNUM	14	24	72I486712X
645	MEDICALRECORD	25	36	7234867.CGX
645	PATIENT	38	51	Koors, Moises
645	IDNUM	62	70	72I48671
645	STREET	70	85	Northwest North
645	CITY	92	121	WINDSOR\nSTATE: NT\nZIP: 2073
645	DATE	136	145	30/5/2008	2008-05-30
645	TIME	165	184	26/04/2013 at 12:23	2013-04-26T12:23
645	DEPARTMENT	184	239	ACUTE CARE WARD\nHOSPITAL: BRUCE ROCK MEMORIAL HOSPITAL
645	DOCTOR	240	258	LAZARO I GOHDEMUTH
645	DOCTOR	1618	1634	FW\nDATE: 6/1/63	2063-06-01
645	DOCTOR	1674	1699	T Bucklew\nDATE: 7.4.2063	2063-04-07
646	MEDICALRECORD	1	11	301507.URB
646	PATIENT	12	32	COUNTS, Rickey ANGEL
646	IDNUM	33	41	30E50776
646	DATE	57	66	12/2/2062	2062-12-02
646	DOCTOR	1128	1156	XR\nDOCTOR: XM\nDATE: 9.2.62	2062-02-09
646	DOCTOR	1183	1194	I Gamberini
647	MEDICALRECORD	1	11	353389.KTT
647	PATIENT	11	18	Dorkett
647	IDNUM	28	36	35I38947
647	DATE	52	61	18/3/2063	2063-03-18
647	DOCTOR	515	532	WC\nDATE: 17/3/63	2063-03-17
647	DOCTOR	535	553	JW\nDATE: 3.3.2063	2063-03-03
648	IDNUM	14	24	09S129787Z
648	MEDICALRECORD	25	36	0961297.VSZ
648	PATIENT	37	61	Riddley, Judson RufANIEL
648	IDNUM	71	79	09S12978
648	PATIENT	80	90	Lazy Point
648	CITY	90	129	BELLINGEN\nSTATE: Queensland\nZIP: 5732
648	DATE	144	153	17/1/2010	2010-01-17
648	TIME	173	192	27/11/2012 at 18:56	2012-11-27T18:56
648	DEPARTMENT	192	224	WEST\nHOSPITAL: GEORFON HOSPITAL
648	DOCTOR	231	251	BRET HARLAND MCENANY
648	DOCTOR	1514	1543	IP\nDOCTOR: LJ\nDATE: 30/1/62	2062-01-30
648	DOCTOR	1567	1578	B Klemencic
649	IDNUM	13	23	67O249835I
649	MEDICALRECORD	24	35	6752498.KNI
649	PATIENT	37	54	HETTENHAUSEN, SON
649	IDNUM	55	80	67O24983\nIDNUM: 67O24983
649	STREET	82	89	Silovio
649	CITY	94	142	YARRAWONGA\nSTATE: Northern Territory\nZIP: 4371
649	DATE	166	176	12/11/1985	1985-11-12
649	TIME	196	215	26/11/2012 at 08:14	2012-11-26T08:14
649	DEPARTMENT	215	265	INTENSIVE CARE UNIT SOUTH\nHOSPITAL: ROMA HOSPITAL
649	DOCTOR	272	295	MADELINE Jindalee Kazmi
649	DOCTOR	917	986	Q Duff\nDOCTOR: Q Wadzinski\nDOCTOR: Q Siptak\nTIME: 10am on 26/11/12	2012-11-26T10:00
649	DOCTOR	2324	2341	YT\nDATE: 29/1/62	2062-01-29
649	DOCTOR	2373	2382	Q Edouard
649	DOCTOR	3571	3583	Q Cauterotti
649	DATE	4014	4020	2/6/62	2062-02-06
650	IDNUM	14	24	62S021442H
650	MEDICALRECORD	25	36	6270214.MFH
650	PATIENT	38	47	Moll, KEN
650	IDNUM	58	66	62S02144
650	PATIENT	67	71	Yale
650	CITY	71	104	ANDERGROVE\nSTATE: TAS\nZIP: 2042
650	DATE	119	128	10/3/2010	2010-03-10
650	DEPARTMENT	160	229	Pathology North\nHOSPITAL: WESTERN DISTRICT HEALTH SERVICE - HAMILTON
650	DOCTOR	230	242	Nick Lilyver
650	DOCTOR	304	311	MITCHEL
650	DATE	333	340	9.12.63	2063-09-12
650	DATE	363	369	3.2.63	2063-02-03
650	DATE	530	536	1/5/63	2063-05-01
650	DOCTOR	1085	1122	R Kultauer\nTIME: 11.00am on 02.01.13	2013-01-02T11:00
650	DOCTOR	1453	1501	Warner\nDOCTOR: R Ubl\nTIME: 12.55pm on 02.01.13	2013-01-02T12:55
650	DOCTOR	1900	1928	IF\nDOCTOR: PN\nDATE: 3.5.63	2063-05-03
650	DOCTOR	1925	1931	R Sway
650	DOCTOR	2774	2818	Freddie Iiems\nHOSPITAL: BRIDGETOWN HOSPITAL
650	DOCTOR	3967	4018	GENARO TREVOR\nHOSPITAL: COBRAMS\nHOSPITAL: COBRAMS
650	DATE	4425	4432	25.3.63	2063-03-25
650	DOCTOR	4545	4553	R Foller
650	DATE	5495	5501	3.2.63	2063-02-03
650	DOCTOR	5502	5557	Yarran HLADIK\nHOSPITAL: GRENFELL MULTI PURPOSE SERVICE
650	DATE	5826	5833	9.12.63	2063-09-12
650	DEPARTMENT	5835	5904	RHW\nHOSPITAL: TEXAS\nHOSPITAL: JASS\nHOSPITAL: JASS\nHOSPITAL: TEXAS
650	DOCTOR	5910	5938	HARRIS ENNES\nDOCTOR: Neapis
650	AGE	5971	5973	57
650	DOCTOR	12096	12104	R Mrecid
650	DOCTOR	12317	12353	Kedgei\nDEPARTMENT: QUILPIE HOSPITAL
650	DOCTOR	13783	13836	Arie\nDEPARTMENT: UMAP\nDEPARTMENT: UPER\nIDNUM: UPER
651	IDNUM	13	23	36B871751C
651	MEDICALRECORD	24	35	3608717.NEC
651	PATIENT	37	50	Bousum, MISTI
651	IDNUM	61	69	36B87175
651	STREET	69	77	Mc Neave
651	CITY	78	123	STANTHORPE\nSTATE: New South Wales\nZIP: 5410
651	DATE	138	147	24/8/2002	2002-08-24
651	DEPARTMENT	179	243	DICKINSON 3 SOUTH\nHOSPITAL: WAGGA WAGGA RURAL REFERRAL HOSPITAL
651	DOCTOR	246	275	Roselle KRIS\nDOCTOR: Delcuud
651	DOCTOR	1596	1613	SH\nDATE: 21.8.63	2063-08-21
651	DOCTOR	1642	1652	F Holladay
652	IDNUM	13	23	94X892819K
652	MEDICALRECORD	24	35	9498928.CZK
652	PATIENT	37	53	Prowant, Emanuel
652	IDNUM	64	72	94X89281
652	STREET	73	80	Maybank
652	CITY	80	112	YARRA GLEN\nSTATE: SA\nZIP: 6282
652	DATE	127	136	24/9/1996	1996-09-24
652	TIME	156	175	22/04/2013 at 13:42	2013-04-22T13:42
652	DEPARTMENT	175	227	2.23HR STAY SURGICAL UNIT\nHOSPITAL: GLENSIDE CAMPUS
652	DOCTOR	232	240	ADELAIDE
652	DOCTOR	1167	1184	ZV\nDATE: 25/6/63	2063-06-25
652	DOCTOR	1212	1221	Y Faulcon
653	MEDICALRECORD	2	12	990764.KER
653	PATIENT	13	29	Harkley, WOODROW
653	IDNUM	30	38	99B76441
653	DATE	54	63	22/8/2063	2063-08-22
653	DOCTOR	1087	1104	WE\nDATE: 19.8.63	2063-08-19
653	DOCTOR	1132	1144	Y Nordstrand
654	MEDICALRECORD	0	11	5797944.TSH
654	PATIENT	13	26	Pilat, Ashton
654	IDNUM	27	35	57Y79447
654	DATE	51	60	29/1/2062	2062-01-29
654	DOCTOR	643	672	QG\nDOCTOR: YB\nDATE: 28.1.62	2062-01-28
654	DOCTOR	699	706	N Lorah
654	IDNUM	1357	1365	57Y79447
655	IDNUM	13	23	21H534884N
655	MEDICALRECORD	23	34	2125348.VLZ
655	PATIENT	36	58	Holne, DORTHEA Gilbert
655	IDNUM	70	78	21H53488
655	STREET	78	83	Plaer
655	CITY	87	117	DROMANA\nSTATE: TAS\nZIP: 6931
655	DATE	132	141	23/7/1996	1996-07-23
655	TIME	161	180	24/04/2013 at 11:13	2013-04-24T11:13
655	DEPARTMENT	180	223	Lowy\nHOSPITAL: WALCHA MULTIPURPOSE SERVICE
655	DOCTOR	226	258	AUGUST Chang DIGIROLLO, CHEIROLA
655	DOCTOR	226	252	AUGUSTXS\nDOCTOR: DIGIROLA
655	DOCTOR	1933	1962	HV\nDOCTOR: MQ\nDATE: 28.6.63	2063-06-28
655	DOCTOR	1958	1970	F Rippsworth
657	IDNUM	14	24	26L316481M
657	MEDICALRECORD	25	36	2643164.XDM
657	PATIENT	37	51	SEAWELL, EHTEL
657	IDNUM	69	77	26L31648
657	STREET	78	88	Pelhamdale
657	CITY	88	117	WARWICK\nSTATE: SA\nZIP: 5138
657	DATE	132	142	16/11/2004	2004-11-16
657	DEPARTMENT	174	195	PaLORNS BASE HOSPITAL
657	DOCTOR	216	227	MICHAL Holt
657	DATE	280	287	25.3.64	2064-03-25
657	DOCTOR	620	662	IR\nDOCTOR: TD\nTIME: 15.1.2014 at 11:12am	2014-01-15T11:12
657	DOCTOR	764	846	LIZBETH Verant\nDOCTOR: QS\nDOCTOR: QS\nDOCTOR: QV\nTIME: 11:27am on the 14.1.2014	2014-01-14T11:27
657	DOCTOR	966	995	PT\nDOCTOR: WA\nDATE: 18.3.64	2064-03-18
657	DOCTOR	1019	1030	G Timperman
657	DOCTOR	1637	1679	Galez\nHOSPITAL: TIBOOBURRA HEALTH SERVICE
657	DATE	1982	1989	25.3.64	2064-03-25
658	MEDICALRECORD	0	11	8334387.MYV
658	PATIENT	13	29	LIPPOLD, BEAULAH
658	IDNUM	30	38	83H43744
658	DATE	54	63	25/3/2064	2064-03-25
658	DOCTOR	968	997	WE\nDOCTOR: NF\nDATE: 23.3.64	2064-03-23
658	DOCTOR	1021	1028	V Lubow
659	IDNUM	13	23	57R276859P
659	MEDICALRECORD	24	35	5762768.NXP
659	PATIENT	37	54	Vanschaick, VIARA
659	IDNUM	55	80	57R27685\nIDNUM: 57R27685
659	STREET	83	93	Windbridge
659	CITY	93	139	HEALESVILLE\nSTATE: South Australia\nZIP: 3025
659	DATE	163	172	29/9/1997	1997-09-29
659	TIME	192	211	20/01/2014 at 11:46	2014-01-20T11:46
659	DEPARTMENT	211	267	INTENSIVE CARE UNIT\nHOSPITAL: BROKEN HILL BASE HOSPITAL
659	DOCTOR	270	289	Tyesha ARIE Vavalek
659	DOCTOR	1741	1770	ZN\nDOCTOR: XM\nDATE: 23.3.64	2064-03-23
659	DOCTOR	1796	1802	N Muna
659	DOCTOR	2600	2609	N Eckberg
660	IDNUM	13	23	52V058465O
660	MEDICALRECORD	24	35	5280584.PPO
660	PATIENT	37	58	POQUE, MEGHAN Collene
660	IDNUM	59	118	52V05846\nIDNUM: 52V05846\nIDNUM: 52V05846\nIDNUM: 52V05846
660	CITY	93	122	COROWA\nSTATE: VIC\nZIP: 2179
660	DATE	146	155	29/4/2015	2015-04-29
660	DATE	175	184	23/3/2064	2064-03-23
660	DEPARTMENT	189	223	Envoi\nHOSPITAL: TOCUMWAL HOSPITAL
660	DOCTOR	226	241	LAURE EUN 3.0mm
660	DOCTOR	248	253	Vance
660	DOCTOR	2464	2481	UG\nDATE: 24/3/64	2064-03-24
660	DOCTOR	2514	2522	O Frittz
661	IDNUM	13	23	10R079414X
661	MEDICALRECORD	24	35	1060794.EKX
661	PATIENT	36	61	STEARMAN, CLARENCE SAVITY
661	IDNUM	74	82	10R07941
661	STREET	83	89	Sunset
661	CITY	94	130	HAHNDORF\nSTATE: Tasmania\nZIP: 4870
661	DATE	145	154	27/4/1985	1985-04-27
661	TIME	174	193	20/01/2014 at 12:30	2014-01-20T12:30
661	DEPARTMENT	193	247	ST VINCENT'S PATHOLOGY\nHOSPITAL: CRYSTAL BROOK CAMPUS
661	DOCTOR	248	265	MYRON DEE SCHANCZ
661	DOCTOR	856	880	D Maxed\nDOCTOR: D Maxed
661	DOCTOR	1636	1653	FT\nDATE: 23.3.64	2064-03-23
661	DOCTOR	1681	1690	D Gertner
662	IDNUM	14	24	84B929823S
662	MEDICALRECORD	25	36	8409298.GJS
662	PATIENT	38	51	NEELLY, ERICK
662	IDNUM	62	70	84B92982
662	STREET	71	83	North Salado
662	CITY	83	125	WYNDHAM\nSTATE: South Australia\nZIP: 4512
662	DATE	140	149	16/6/2021	2021-06-16
662	DEPARTMENT	181	229	DICKINSON 2 SOUTH\nHOSPITAL: STANTHORPE HOSPITAL
662	DOCTOR	234	249	BRAD EWAN CARIN
662	DOCTOR	1060	1108	Cole\nDOCTOR: V Merchen\nTIME: 10.15 on 14.03.13	2013-03-14T10:15
662	DOCTOR	1355	1407	Aristide\nDOCTOR: V Roertle\nTIME: 10.15 on 14.03.13	2013-03-14T10:15
662	DOCTOR	1882	1899	ZI\nDATE: 17.5.63	2063-05-17
662	DOCTOR	1928	1936	V Wynott
663	IDNUM	13	23	89F7914306
663	MEDICALRECORD	23	32	891791.OP
663	PATIENT	36	50	Ferreri, Eddie
663	IDNUM	61	69	89F79143
663	STREET	69	80	Croceq Yard
663	CITY	82	110	WESTON\nSTATE: SA\nZIP: 6940
663	DATE	125	133	6/4/1995	1995-06-04
663	TIME	151	170	22/01/2014 at 14:04	2014-01-22T14:04
663	DEPARTMENT	170	233	DICKINSON 2 SOUTH\nHOSPITAL: YAI AND DISTRICT MEMORIAL HOSPITAL
663	DOCTOR	234	250	VINCENZO AYRILLE
663	DATE	315	319	2063	2063
663	DATE	498	508	April 2063	2063
663	DATE	1847	1854	25/3/64	2064-03-25
663	DOCTOR	1855	1863	W Granti
663	IDNUM	3045	3053	89F79143
663	DOCTOR	3095	3109	W Vollenweiser
664	MEDICALRECORD	1	12	4707225.XWZ
664	PATIENT	13	26	Vegh, Melonie
664	IDNUM	27	35	47B72258
664	DATE	51	60	21/9/2063	2063-09-21
664	DOCTOR	716	787	Numbers\nDOCTOR: K Treider\nDOCTOR: K Pryniak\nTIME: 17.07.13 at 3:47pm	2013-07-17T15:47
664	DOCTOR	799	816	CS\nDATE: 20.9.63	2063-09-20
664	DOCTOR	844	853	K Fecteau
664	DATE	1226	1230	1763	2063
665	IDNUM	14	24	95X842546I
665	MEDICALRECORD	25	35	959842.OMS
665	PATIENT	36	46	HORAK, KAV
665	IDNUM	70	78	95X84254
665	STREET	79	89	Holly Dene
665	CITY	89	123	KIAMA DOWNS\nSTATE: VIC\nZIP: 2852
665	DATE	138	147	5/10/1989	1989-05-10
665	DEPARTMENT	179	245	MEDIC/SURGERYWARD\nHOSPITAL: LOURDES HOSPITAL & COMMUNITY SERVICES
665	DOCTOR	250	260	Elvis EARL
665	DOCTOR	1246	1262	CN\nDATE: 9.3.63	2063-09-03
665	DOCTOR	1262	1271	Z Sadplus
666	IDNUM	13	23	16O443405T
666	MEDICALRECORD	24	34	165443.LAN
666	PATIENT	35	49	WAREHIO, JESUS
666	IDNUM	62	70	16O44340
666	STREET	71	76	Wills
666	CITY	76	120	TOOWOOMBA\nSTATE: New South Wales\nZIP: 5141
666	DATE	135	143	5/7/2033	2033-05-07
666	DATE	163	173	22/10/2063	2063-10-22
666	DEPARTMENT	178	214	Hereditary\nHOSPITAL: DERBY HOSPITAL
666	DOCTOR	219	231	Theo Brenton
666	DOCTOR	2512	2542	WY\nDOCTOR: ZM\nDATE: 23.10.63	2063-10-23
666	DOCTOR	2584	2644	E Fallago\nDOCTOR: E Lueders\nDOCTOR: E Lough\nDATE: 20.8.13	2013-08-20
666	DOCTOR	2702	2711	E Neidert
667	IDNUM	13	23	74K464563C
667	MEDICALRECORD	24	35	7444645.PIC
667	PATIENT	37	48	Abed, FRITZ
667	IDNUM	59	67	74K46456
667	PATIENT	68	75	Kiernan
667	CITY	75	120	SCARNESS\nSTATE: Western Australia\nZIP: 2097
667	DATE	135	143	7/6/1987	1987-07-06
667	TIME	163	182	23/08/2013 at 16:03	2013-08-23T16:03
667	DEPARTMENT	182	228	SEALS Central\nHOSPITAL: LONGREER ELIZABETH II
667	DOCTOR	240	262	Eddy WALLACE Camparian
667	DATE	337	344	10.2.63	2063-02-10
667	DOCTOR	1780	1810	BQ\nDOCTOR: OW\nDATE: 28.10.63	2063-10-28
667	DOCTOR	1837	1846	S Thibert
667	DATE	3236	3243	10.2.63	2063-02-10
668	MEDICALRECORD	2	12	222485.OEE
668	PATIENT	13	29	Freudiger, Blake
668	IDNUM	30	38	22H48551
668	DATE	54	62	2/3/2064	2064-03-02
668	DATE	915	922	26/3/64	2064-03-26
668	DOCTOR	951	959	H Brazen
669	IDNUM	13	23	43Y186479W
669	MEDICALRECORD	24	35	4391864.TZW
669	PATIENT	37	54	HOLZNECHT, THOMAS
669	IDNUM	65	73	43Y18647
669	STREET	74	80	Medley
669	CITY	80	122	LISMORE\nSTATE: South Australia\nZIP: 3898
669	DATE	137	145	3/1/2011	2011-03-01
669	TIME	165	184	20/08/2013 at 11:13	2013-08-20T11:13
669	DEPARTMENT	184	235	ST VINCENT'S PATHOLOGY\nHOSPITAL: BARALABA HOSPITAL
669	DOCTOR	240	257	Roy ANDY Yurchiak
669	DOCTOR	1302	1320	DV\nDATE: 23/10/63	2063-10-23
669	DOCTOR	1325	1336	M Cartinger
669	DOCTOR	1648	1672	M Chudy\nDATE: 2/10/2063	2063-10-02
669	DOCTOR	1706	1763	M Lievano\nDOCTOR: N Lands\nDOCTOR: N Lands\nDOCTOR: Nels
669	DOCTOR	2077	2104	M Lauridsen\nDATE: 22/11/63	2063-11-22
670	MEDICALRECORD	2	12	017106.NIV
670	PATIENT	13	27	ONSTAD, ASHLIE
670	IDNUM	28	36	01U10653
670	DATE	52	62	15/11/2063	2063-11-15
670	DOCTOR	1381	1399	XW\nDATE: 14.11.63	2063-11-14
670	DOCTOR	1431	1443	A Hohenstein
671	IDNUM	13	23	58Q137586N
671	MEDICALRECORD	24	35	5861375.XQN
671	PATIENT	37	49	Donges, RENE
671	IDNUM	50	109	58Q13758\nIDNUM: 58Q13758\nIDNUM: 58Q13758\nIDNUM: 58Q13758
671	PATIENT	78	87	E Nichols
671	CITY	87	123	NATHALIA\nSTATE: Victoria\nZIP: 3853
671	DATE	147	156	17/9/1997	1997-09-17
671	DATE	176	186	25/12/2063	2063-12-25
671	DEPARTMENT	191	240	INTENSIVECARE UNIT\nHOSPITAL: CANTERBURY HOSPITAL
671	DOCTOR	247	263	ROLANDE OSMA Tur
671	AGE	361	363	71
671	DOCTOR	855	905	Forss\nDOCTOR: P Teller\nTIME: 12:40pm on 23.10.13	2013-10-23T12:40
671	DOCTOR	2233	2263	KF\nDOCTOR: VH\nDATE: 26.12.63	2063-12-26
671	DOCTOR	2290	2298	P Finnel
672	IDNUM	13	23	79I738444Y
672	MEDICALRECORD	24	34	793738.MLL
672	PATIENT	35	45	Noori, Chr
672	IDNUM	59	67	79I73844
672	PATIENT	67	76	Garra fat
672	CITY	77	114	TANUNDA\nSTATE: Queensland\nZIP: 6327
672	DATE	129	138	25/6/1983	1983-06-25
672	TIME	158	177	05/11/2013 at 12:43	2013-11-05T12:43
672	DEPARTMENT	177	224	ACUTECARE WARD\nHOSPITAL: WILLIAMSTOWN HOSPITAL
672	DOCTOR	225	245	Tyler\nDOCTOR: Tyler
672	DATE	321	328	14.1.63	2063-01-14
672	DOCTOR	1843	1871	QR\nDOCTOR: VD\nDATE: 8.1.63	2063-01-08
672	DOCTOR	1899	1907	D Levell
672	DATE	3002	3009	14.1.63	2063-01-14
673	MEDICALRECORD	1	12	3718595.AHG
673	PATIENT	14	28	REITLER, OZARA
673	IDNUM	29	37	37E85950
673	DATE	53	63	25/12/2063	2063-12-25
673	DOCTOR	883	913	PC\nDOCTOR: HA\nDATE: 16.12.63	2063-12-16
673	DOCTOR	908	920	I Bonnenberg
673	DOCTOR	1885	1896	Richard Jin
674	MEDICALRECORD	1	12	8508795.PCP
674	PATIENT	12	26	KOLP, YOLOSS U
674	IDNUM	32	40	85A87956
674	DATE	55	63	3/3/2064	2064-03-03
674	DOCTOR	233	275	Johnson\nDOCTOR: XNAS\nTIME: 3mm asSESSION
674	DOCTOR	1283	1300	YJ\nDATE: 26.3.64	2064-03-26
674	DOCTOR	1329	1337	X Vivyan
676	IDNUM	13	23	43W890619Y
676	MEDICALRECORD	24	35	4388906.EXY
676	PATIENT	37	56	GALLIHUGH, Valentin
676	IDNUM	73	81	43W89061
676	STREET	82	94	Diablo Vista
676	CITY	94	130	CEDUNA\nSTATE: Queensland\nZIP: 4307
676	DATE	145	154	13/7/1991	1991-07-13
676	DATE	174	183	16/1/2062	2062-01-16
676	DEPARTMENT	188	231	St Vincent\nHOSPITAL: PORT AUGUSTA HOSPITAL
676	DOCTOR	234	257	KENNINGTON Mikel Frayer
676	DOCTOR	312	319	Kapnick
676	DOCTOR	2016	2045	FS\nDOCTOR: HL\nDATE: 17.1.62	2062-01-17
676	DOCTOR	2075	2086	L Hillerman
676	DATE	2834	2841	20/3/63	2063-03-20
676	DATE	3067	3072	/3/64	2064-03-64
677	IDNUM	14	24	64O491577J
677	MEDICALRECORD	25	36	6454915.TTJ
677	PATIENT	37	69	Czarnecki, Paget&amp;#8217;CAOND
677	IDNUM	74	82	64O49157
677	STREET	83	96	Old Clubhouse
677	CITY	96	129	WELLINGTON\nSTATE: ACT\nZIP: 5462
677	DATE	144	153	11/9/2034	2034-11-09
677	TIME	173	192	29/01/2014 at 12:18	2014-01-29T12:18
677	DEPARTMENT	192	233	ONCOLOGY (GYNAE)\nHOSPITAL: TARA HOSPITAL
677	DOCTOR	240	260	GINO MITCHELL GIANNI
677	DOCTOR	3258	3274	GG\nDATE: 3/1/64	2064-03-01
677	DOCTOR	3305	3315	Q Mccawley
678	IDNUM	13	23	12K512535S
678	MEDICALRECORD	24	34	123512.PIO
678	PATIENT	35	56	THOMURE, SHAWN HEALTH
678	IDNUM	70	78	12K51253
678	STREET	78	91	Gonsight Fire
678	CITY	92	137	CAMPERDOWN\nSTATE: South Australia\nZIP: 4873
678	DATE	152	161	28/2/1992	1992-02-28
678	TIME	181	200	28/01/2014 at 19:48	2014-01-28T19:48
678	DEPARTMENT	200	253	PARKES 4 EAST\nHOSPITAL: ROYAL PRINCE ALFRED HOSPITAL
678	DOCTOR	260	276	GERRY Lupe SPUCK
678	DOCTOR	295	301	Weston
678	DOCTOR	2316	2332	KR\nDATE: 1/3/64	2064-01-03
678	DOCTOR	2364	2371	E Worek
679	IDNUM	13	23	33B113483D
679	MEDICALRECORD	24	35	3301134.WKD
679	PATIENT	37	52	ARRISON, Lenard
679	IDNUM	53	112	33B11348\nIDNUM: 33B11348\nIDNUM: 33B11348\nIDNUM: 33B11348
679	STREET	81	88	Sowerby
679	CITY	88	122	CASTLEMAINE\nSTATE: QLD\nZIP: 8011
679	DATE	146	155	3/12/2019	2019-03-12
679	DATE	175	184	23/3/2064	2064-03-23
679	DEPARTMENT	189	236	BILLINGTON CENTRE\nHOSPITAL: GUMERACHA HOSPITAL
679	DOCTOR	239	254	Sharolyn UrmORN
679	DOCTOR	1275	1335	J Schweitz\nDOCTOR: J Tagge\nDOCTOR: J Tagge\nDOCTOR: J Yann
679	TIME	1360	1381	0926hrs on 21.01.2014	2014-01-21T09:26
679	DOCTOR	3561	3590	TO\nDOCTOR: KD\nDATE: 24.3.64	2064-03-24
679	DOCTOR	3615	3623	J Shanaa
680	IDNUM	13	23	91X133542M
680	MEDICALRECORD	24	34	919133.NLF
680	PATIENT	36	55	MARTIG, Jack Nestor
680	IDNUM	66	74	91X13354
680	PATIENT	74	85	St Wilfrins
680	CITY	86	118	MOUNT ISA\nSTATE: QLD\nZIP: 1597
680	DATE	133	142	13/4/2020	2020-04-13
680	TIME	150	169	15/01/2014 at 13:48	2014-01-15T13:48
680	DEPARTMENT	180	222	EMERGENCY\nHOSPITAL: ROYAL HOBART HOSPITAL
680	DOCTOR	223	244	ANDRES JOESPH Tribisi
680	DOCTOR	387	391	Vath
680	DOCTOR	1920	1937	GG\nDATE: 18/3/64	2064-03-18
680	DOCTOR	1966	1975	Y Bethell
681	IDNUM	13	23	49T264500U
681	MEDICALRECORD	24	35	4972645.AAU
681	PATIENT	37	61	Cartelli, Carter TEODORO
681	IDNUM	62	87	49T26450\nIDNUM: 49T26450
681	PATIENT	90	99	Calverton
681	CITY	99	130	SAN REMO\nSTATE: QLD\nZIP: 4004
681	DATE	154	163	24/3/1973	1973-03-24
681	TIME	183	202	08/01/2014 at 19:40	2014-01-08T19:40
681	DEPARTMENT	202	253	Envoi Pathology\nHOSPITAL: COLLIE DISTRICT HOSPITAL
681	DOCTOR	260	275	Lyman RODGERSON
681	DATE	1848	1855	11/3/64	2064-03-11
681	DOCTOR	1886	1892	M Ebia
682	IDNUM	14	24	07Q285668D
682	MEDICALRECORD	25	36	0762856.PVD
682	PATIENT	37	63	STEINKAMP, HUONG PLOINKAMP
682	IDNUM	73	81	07Q28566
682	PATIENT	82	87	Gomez
682	CITY	87	116	NERANG\nSTATE: VIC\nZIP: 5262
682	DATE	131	140	15/2/1995	1995-02-15
682	DATE	160	168	5/2/2063	2063-05-02
682	DEPARTMENT	173	231	Peter Mac\nHOSPITAL: INGLEWOOD MULTIPURPOSE HEALTH SERVICE
682	DOCTOR	238	257	TYSON WALTON DOLHON
682	DOCTOR	1021	1056	B Brydds\nDOCTOR: B Mordiniat 12:00
682	DATE	4316	4322	4/3/64	2064-03-04
682	DOCTOR	4352	4359	B Olsby
683	IDNUM	13	23	28H8865165
683	MEDICALRECORD	24	35	2828865.ERO
683	PATIENT	36	53	Porrans, MADALOUS
683	IDNUM	55	233	28H88651\nIDNUM: 28H88651\nIDNUM: 28H88651\nPATIENT: H88651\nIDNUM: 28H88651\nPATIENT: H88651\nIDNUM: 28H88651\nPATIENT: H88651\nIDNUM: 28H88651\nPATIENT: H88651\nPATIENT: H88651
683	PATIENT	82	91	Conknight
683	CITY	91	120	CASINO\nSTATE: NSW\nZIP: 3704
683	DATE	140	149	24/5/2000	2000-05-24
683	DATE	169	178	24/3/2064	2064-03-24
683	DEPARTMENT	183	243	Hunter Area\nHOSPITAL: INGLEWOOD MULTIPURPOSE HEALTH SERVICE
683	DOCTOR	250	270	CRISTOPHER SCHELLING
683	DOCTOR	300	311	Weingartner
683	DOCTOR	966	1006	Moises\nDOCTOR: G Nusch\nDOCTOR: G Nusch
683	TIME	1032	1050	1:35pm on 22.01.14	2014-01-22T11:35
683	DOCTOR	4982	5011	PZ\nDOCTOR: WU\nDATE: 25.3.64	2064-03-25
683	DOCTOR	5006	5017	G Eisenbeus
683	DOCTOR	7602	7628	G Koebley\nDOCTOR: G Wrane
684	IDNUM	13	23	76D807674X
684	MEDICALRECORD	24	34	761807.PTM
684	PATIENT	36	50	Simard, ALYSHA
684	IDNUM	61	69	76D80767
684	CITY	80	125	GRENFELL\nSTATE: Western Australia\nZIP: 2825
684	DATE	140	149	12/6/1995	1995-12-06
684	TIME	169	188	28/01/2014 at 08:36	2014-01-28T08:36
684	DEPARTMENT	200	230	DELEGATE MULTI PURPOSE SERVICE
684	DOCTOR	230	241	MARLON Rawa
684	DOCTOR	416	444	Horacio GLYNN\nDATE: 28/1/14	2063-01-28
684	DOCTOR	3045	3062	OZ\nDATE: 30/3/64	2064-03-30
684	DOCTOR	3094	3103	U Ahlborn
685	IDNUM	14	24	33Z927632F
685	MEDICALRECORD	25	36	3399276.IHF
685	PATIENT	38	55	Schiffert, JOELLA
685	IDNUM	66	74	33Z92763
685	STREET	75	87	Wortley Moor
685	CITY	87	132	GRENFELL\nSTATE: Western Australia\nZIP: 2539
685	DATE	147	157	12/10/1987	1987-10-12
685	TIME	177	196	29/01/2014 at 09:51	2014-01-29T09:51
685	DEPARTMENT	196	251	DEPT OF CORRECTIVE SERVICES\nHOSPITAL: GAWNDAH HOSPITAL
685	DOCTOR	252	277	GRAHAM PHILLION SELTRECHT
685	DOCTOR	299	304	Emory
685	DATE	2147	2153	2/3/64	2064-03-02
685	DOCTOR	2186	2193	J Morck
688	IDNUM	13	23	54R528581R
688	MEDICALRECORD	24	35	5465285.WDR
688	PATIENT	37	50	LINFORD, LIEN
688	IDNUM	51	103	54R52858\nIDNUM: 54R52858\nIDNUM: 54R52858\nPATIENT:
688	PATIENT	79	86	Duckett
688	DATE	139	149	20/11/1995	1995-11-20
688	TIME	169	188	28/01/2014 at 16:27	2014-01-28T16:27
688	DEPARTMENT	188	240	ANATOMICAL PATHOLOGY\nHOSPITAL: WYALKATCHEM HOSPITAL
688	DOCTOR	247	265	MERIDITH ROSE Lowe
688	DOCTOR	1844	1860	OA\nDATE: 3/1/64	2064-01-03
688	DOCTOR	1893	1901	O Lenzen
689	IDNUM	13	23	02N549649Z
689	MEDICALRECORD	24	35	0255496.LYZ
689	PATIENT	37	58	Lowers, TEISHA Weston
689	IDNUM	69	77	02N54964
689	STREET	78	93	South Claremont
689	CITY	93	133	COBAR\nSTATE: New South Wales\nZIP: 4176
689	DATE	148	157	18/1/2012	2012-01-18
689	TIME	177	196	23/01/2014 at 15:19	2014-01-23T15:19
689	DEPARTMENT	196	276	MOLECULAR DIAGNOSTIC ONCOLOGY\nHOSPITAL: BALLARAT HEALTH SERVICES (BASE HOSPITAL
689	DOCTOR	282	303	Julian Keenan FINSTER
689	DATE	372	381	18 months	2012-09
689	DATE	461	464	Now	2067-03-08
689	DOCTOR	3513	3529	KQ\nDOCTOR: FROM
689	DOCTOR	3657	3686	EO\nDOCTOR: OOE\nDATE: 6.4.64	2064-04-06
689	DOCTOR	3680	3687	C Ratta
690	IDNUM	13	23	23E140497K
690	MEDICALRECORD	24	35	2311404.ZUK
690	PATIENT	37	56	Maddux, JERI Dillon
690	IDNUM	67	75	23E14049
690	STREET	75	87	L Wells Glen
690	CITY	86	131	STANLEY\nSTATE: Northern Territory\nZIP: 3104
690	DATE	146	155	26/6/2004	2004-06-26
690	TIME	175	194	18/12/2012 at 14:21	2012-12-18T14:21
690	DEPARTMENT	194	245	Envoi pathology\nHOSPITAL: MANNUM DISTRICT HOSPITAL
690	DOCTOR	250	269	Lindsey Elvin BIJOU
690	DOCTOR	2351	2368	SF\nDATE: 21.2.62	2062-02-21
690	DOCTOR	2397	2406	H Knoepke
690	DATE	4735	4742	18/3/63	2063-03-18
690	HOSPITAL	4757	4779	ORBOST REGIONAL HEALTH
690	HOSPITAL	4839	4844	TORF;
691	IDNUM	13	23	81A271555T
691	MEDICALRECORD	24	35	8102715.PPT
691	PATIENT	37	49	GEMES, GRACE
691	IDNUM	50	109	81A27155\nIDNUM: 81A27155\nIDNUM: 81A27155\nIDNUM: 81A27155
691	STREET	78	88	Grand Park
691	CITY	88	151	NOWRA-BOMADERRY\nSTATE: Australian Capital Territory\nZIP: 6907
691	DATE	172	181	10/5/1979	1979-10-05
691	DATE	201	209	4/7/2064	2064-07-04
691	DEPARTMENT	214	289	ACUTE CARE WARD\nHOSPITAL: MOUNT BARKER DISTRICT SOLDIERS MEMORIAL HOSPITAL
691	DOCTOR	292	322	Elvie Marisela\nTIME: 11.11.64	2064-11-11
691	DOCTOR	2647	2675	KC\nDOCTOR: WQ\nDATE: 4.8.64	2064-04-08
691	DOCTOR	2670	2693	W Vannors\nDATE: 3.5.63	2063-05-03
694	IDNUM	14	24	55K010865O
694	MEDICALRECORD	25	36	5540108.QOO
694	PATIENT	37	48	CHECA, Mayh
694	IDNUM	51	76	55K01086\nIDNUM: 55K01086
694	STREET	79	94	Brooktree Ranch
694	CITY	94	136	PENGUIN\nSTATE: South Australia\nZIP: 7119
694	DATE	157	166	17/2/1994	1994-02-17
694	TIME	186	205	25/06/2012 at 19:22	2012-06-25T19:22
694	DEPARTMENT	205	255	PRINCE OF WALESPRIVATE\nHOSPITAL: REDLAND HOSPITAL
694	DOCTOR	256	275	LETISHA MYRA Echrij
694	DATE	352	360	30.10.63	2063-10-30
694	AGE	375	377	72
694	DOCTOR	2494	2511	GE\nDATE: 28.8.62	2062-08-28
694	DOCTOR	2544	2554	O Wilhelmi
694	DATE	4270	4278	30.10.63	2063-10-30
695	IDNUM	13	23	50O892572N
695	MEDICALRECORD	24	35	5058925.SGN
695	PATIENT	37	56	Blatt, TAUNYA Pedro
695	IDNUM	67	75	50O89257
695	PATIENT	76	81	Lorie
695	CITY	81	124	MANDURAH\nSTATE: South Australia\nZIP: 2999
695	DATE	139	148	21/9/2001	2001-09-21
695	TIME	168	187	19/06/2012 at 20:09	2012-06-19T20:09
695	DEPARTMENT	187	235	STGEORGE PRIVATE\nHOSPITAL: SUNBURY DAY HOSPITAL
695	DOCTOR	238	274	LOURDES EVANGELINE CARDENIO CARDENOS
695	DOCTOR	2125	2142	QF\nDATE: 22/8/62	2062-08-22
695	DOCTOR	2172	2182	P Hollberg
695	DATE	2920	2928	27/12/62	2062-12-27
696	IDNUM	13	23	34Y632872I
696	MEDICALRECORD	24	35	3496328.TFI
696	PATIENT	37	59	SPEISER, LOVELLA POSEY
696	IDNUM	60	85	34Y63287\nIDNUM: 34Y63287
696	CITY	94	130	PEREGIAN BEACH\nSTATE: NT\nZIP: 3777
696	DATE	154	163	25/5/1992	1992-05-25
696	DATE	183	192	27/8/2062	2062-08-27
696	DEPARTMENT	197	246	RENAL CLINICAL\nHOSPITAL: COWRA DISTRICT HOSPITAL
696	DOCTOR	247	256	Chia RHEE
696	DATE	339	347	30.10.63	2063-10-30
696	AGE	362	364	75
696	DATE	442	445	Now	2063-09-03
696	DOCTOR	2256	2273	EL\nDATE: 28/8/62	2062-08-28
696	DOCTOR	2303	2309	D Fulp
696	DATE	4261	4269	30.10.63	2063-10-30
697	IDNUM	14	24	82U753930Q
697	MEDICALRECORD	25	36	8277539.IAQ
697	PATIENT	38	55	Zirker, Nathaniel
697	IDNUM	74	82	82U75393
697	STREET	82	91	Timberloo
697	CITY	92	125	TEA GARDENS\nSTATE: SA\nZIP: 6397
697	DATE	140	150	27/11/1988	1988-11-27
697	TIME	170	189	22/08/2012 at 16:35	2012-08-22T16:35
697	DEPARTMENT	189	240	Hereditary\nHOSPITAL: WARIALDA MULTIPURPOSE SERVICE
697	DOCTOR	243	260	Thanresonepharies
697	DATE	336	344	30.10.62	2062-10-30
697	DOCTOR	477	479	ZB
697	DOCTOR	1657	1675	CK\nDATE: 25.10.62	2062-10-25
697	DOCTOR	1706	1713	W Revel
697	DATE	3076	3084	30.10.62	2062-10-30
697	DATE	3105	3108	now	2066
698	IDNUM	13	23	87Y535547P
698	MEDICALRECORD	24	35	8795355.KSP
698	PATIENT	37	53	Brownle, RENALDO
698	IDNUM	64	72	87Y53554
698	STREET	73	78	Daned
698	CITY	78	114	RICHMOND\nSTATE: Tasmania\nZIP: 0800
698	DATE	129	138	18/2/1986	1986-02-18
698	TIME	158	177	03/09/2012 at 13:36	2012-09-03T13:36
698	DEPARTMENT	177	230	DICKINSON 2 NORTH\nHOSPITAL: CUNDERDIN HEALTH SERVICE
698	DOCTOR	231	248	STANFORD PUBLLAND
698	DOCTOR	379	407	AX\nDOCTOR: AX\nTIME: 1.4.63	2063-04-01
698	DOCTOR	3244	3261	WP\nDATE: 11.6.62	2062-06-11
698	DOCTOR	3323	3332	X Brandow
699	IDNUM	13	23	61H3848464
699	MEDICALRECORD	24	35	6123848.MRK
699	PATIENT	36	54	Larus, Brad CRISSY
699	IDNUM	66	74	61H38484
699	PATIENT	75	81	Animbo
699	CITY	81	124	DERBY\nSTATE: Northern Territory\nZIP: 4158
699	DATE	139	148	24/4/1987	1987-04-24
699	TIME	168	187	18/07/2012 at 10:29	2012-07-18T10:29
699	DEPARTMENT	187	222	IMVS\nHOSPITAL: NARRANDERA HOSPITAL
699	DOCTOR	225	245	Donn Turluku Cadbaum
699	AGE	309	311	80
699	DATE	437	440	Now	2063-09-03
699	DOCTOR	2085	2102	SW\nDATE: 21.9.62	2062-09-21
699	DOCTOR	2132	2144	Q Saltarelli
699	DOCTOR	3502	3515	Q Freudenberg
706	IDNUM	13	23	19D405904T
706	MEDICALRECORD	24	35	1914059.BMT
706	PATIENT	37	51	ILLAR, BRADLEY
706	IDNUM	62	70	19D40590
706	STREET	71	80	East Como
706	CITY	80	136	COOKTOWN\nSTATE: Australian Capital Territory\nZIP: 3906
706	DATE	151	160	10/7/1990	1990-07-10
706	TIME	180	199	04/11/2013 at 13:13	2013-11-04T13:13
706	DEPARTMENT	199	249	Anatomical Pathology\nHOSPITAL: NORMANTON HOSPITAL
706	DOCTOR	252	271	BRANT Scotty Algunn
706	DATE	349	356	13.4.64	2064-04-13
706	DOCTOR	2392	2406	YA\nDATE: 1/63	2063-01-01
706	DOCTOR	2972	2989	SYN\nDATE: 8/1/63	2063-01-08
706	DOCTOR	3528	3544	EG\nDATE: 7/1/63	2063-01-07
706	DOCTOR	3573	3581	E Lavere
706	DATE	6475	6482	13.4.64	2064-04-13
707	IDNUM	13	23	30V006763E
707	MEDICALRECORD	24	35	3080067.PIE
707	PATIENT	36	58	Searston, MARIA PENNIE
707	IDNUM	60	119	30V00676\nIDNUM: 30V00676\nIDNUM: 30V00676\nIDNUM: 30V00676
707	PATIENT	88	95	Dacosta
707	CITY	95	130	BOWEN\nSTATE: Queensland\nZIP: 6020
707	DATE	151	159	2/6/1988	1988-02-06
707	TIME	179	198	26/09/2012 at 12:10	2012-09-26T12:10
707	DEPARTMENT	198	251	SEALS Central\nHOSPITAL: MILDURA BASE PUBLIC HOSPITAL
707	DOCTOR	254	269	DOUGLASS Mandiz
707	DOCTOR	947	1012	J Staz\nDOCTOR: J Bodep\nDOCTOR: J Bodep\nTIME: 145pm on 26.09.12	2012-09-26T17:00
707	DOCTOR	2059	2077	GX\nDATE: 29.11.62	2062-11-29
707	DOCTOR	2108	2122	J Wickenhauser
708	IDNUM	14	24	97R027811M
708	MEDICALRECORD	25	36	9760278.EDM
708	PATIENT	38	60	KENNETH, Dudley JEMIMA
708	IDNUM	71	79	97R02781
708	PATIENT	80	87	Guilfoy
708	CITY	87	118	URRAWEEN\nSTATE: QLD\nZIP: 5171
708	DATE	133	142	15/6/2007	2007-06-15
708	TIME	162	181	20/02/2013 at 07:20	2013-02-20T07:20
708	DEPARTMENT	181	223	PARKES 9 EAST\nHOSPITAL: TOCUMWAL HOSPITAL
708	DOCTOR	228	246	PABLO DOYLE PONZIO
708	DATE	318	325	30.4.63	2063-04-30
708	DOCTOR	3203	3220	VJ\nDATE: 24.4.63	2063-04-24
708	DOCTOR	3222	3249	X Millikan\nDATE: 27.4.2063	2063-04-27
708	DATE	5956	5963	30.4.63	2063-04-30\nDOCTOR: X Rezak
709	MEDICALRECORD	0	11	1836287.TZY
709	PATIENT	11	36	WITHERSONLL, GERRY Samuel
709	IDNUM	35	60	18I62877\nIDNUM: 18I62877
709	DATE	69	78	4/12/2062	2062-12-04
709	DOCTOR	774	841	Zsof\nDOCTOR: D Moster\nDOCTOR: D Scherman\nTIME: 4:30pm on 26.9.12	2012-09-26T16:30
709	DOCTOR	3143	3161	KI\nDATE: 26.11.62	2062-11-26
709	DOCTOR	3163	3170	D Weyla
709	DOCTOR	5637	5648	D Pappajohn
710	IDNUM	14	24	66F7488372
710	MEDICALRECORD	25	36	6617488.IUG
710	PATIENT	37	54	Darmory, Casandra
710	IDNUM	63	122	66F74883\nIDNUM: 66F74883\nIDNUM: 66F74883\nIDNUM: 66F74883
710	STREET	91	98	N Gates
710	CITY	98	141	WESTON\nSTATE: Western Australia\nZIP: 1490
710	DATE	165	173	7/3/2011	2011-03-07
710	DATE	193	201	8/8/2062	2062-08-08
710	DEPARTMENT	206	268	OBSTETRICS\nHOSPITAL: MURRAY BRIDGE SOLDIERS MEMORIAL HOSPITAL
710	DOCTOR	275	301	Oswaldo Junior MIRCHANDANI
710	DOCTOR	1094	1164	R Melikian\nDOCTOR: R Melikian\nDOCTOR: R Oman\nTIME: 9.18am on 6/6/12	2012-06-06T09:18
710	DOCTOR	3231	3247	XO\nDATE: 8/9/62	2062-08-09
710	DOCTOR	3248	3257	R Stohard
711	IDNUM	13	23	87W349686R
711	MEDICALRECORD	24	35	8783496.WQR
711	PATIENT	36	58	FINAN, ALAYTON Felecia
711	IDNUM	69	77	87W34968
711	STREET	78	88	Crownstone
711	CITY	88	129	TEMORA\nSTATE: New South Wales\nZIP: 7012
711	DATE	144	153	8/10/1994	1994-08-10
711	DATE	173	182	15/1/2062	2062-01-15
711	DEPARTMENT	187	235	Molecular Oncology\nHOSPITAL: ST GEORGE HOSPITAL
711	DOCTOR	242	261	URSULA KRISTAL Raje
711	DATE	314	321	13.8.63	2063-08-13
711	HOSPITAL	431	474	WESTERN DISTRICT HEALTH SERVICE - COLERAINE
711	DOCTOR	1117	1154	W Oullette\nTIME: 15:05pm on 13.11.12	2012-11-13T15:05
711	DOCTOR	2933	2962	BH\nDOCTOR: AX\nDATE: 16.1.62	2062-01-16
711	DOCTOR	2989	2996	W Broas
711	DOCTOR	5213	5221	W Devall
711	DATE	5649	5656	13.8.63	2063-08-13
712	IDNUM	13	23	45S360744A
712	MEDICALRECORD	24	35	4573607.LLA
712	PATIENT	37	60	Conterras, Oriana KENNY
712	IDNUM	61	86	45S36074\nIDNUM: 45S36074
712	STREET	88	95	Carlsve
712	CITY	99	133	ALSTONVILLE\nSTATE: VIC\nZIP: 5279
712	DATE	157	166	19/8/2027	2027-08-19
712	DEPARTMENT	198	242	UROLOGY DAY ONLY\nHOSPITAL: WESTERN HOSPITAL
712	DOCTOR	249	261	Byron RONALD
712	DATE	315	322	25.9.63	2063-09-25
712	DOCTOR	934	969	K Prevento\nTIME: 16:45 on 12.12.12	2012-12-12T16:45
712	DOCTOR	2938	2967	LH\nDOCTOR: WE\nDATE: 15.2.62	2062-02-15
712	DOCTOR	2994	3004	K Maslonka
712	DATE	4813	4820	25.9.63	2063-09-25
713	IDNUM	14	24	93O381802J
713	MEDICALRECORD	25	36	9353818.AGJ
713	PATIENT	38	51	Ruud, SHANTAE
713	IDNUM	52	77	93O38180\nIDNUM: 93O38180
713	STREET	80	88	Hagerman
713	CITY	88	122	PORT HEDLAND\nSTATE: NT\nZIP: 2326
713	DATE	143	151	2/6/1980	1980-02-06
713	DATE	171	181	10/10/2062	2062-10-10
713	DEPARTMENT	186	227	4 JABIRU PLACE\nHOSPITAL: GATTON HOSPITAL
713	DOCTOR	228	276	Adolfo Quullah\nHOSPITAL: THIVIGO, CHANG FUCKURE
713	DOCTOR	880	934	Giuffriform\nDOCTOR: Z Conces\nTIME: 12.45pm on 8/8/12	2012-08-08T12:45
713	DOCTOR	2282	2300	ES\nDATE: 10/11/62	2062-11-10
713	DOCTOR	2328	2337	Z Bentler
713	DOCTOR	3301	3307	Z Hurt
714	IDNUM	13	23	14G082750U
714	MEDICALRECORD	24	35	1420827.PCU
714	PATIENT	37	62	CAVAGNARO, Yannick COOPER
714	IDNUM	63	88	14G08275\nIDNUM: 14G08275
714	STREET	91	98	W Adams
714	CITY	98	130	THIRLMERE\nSTATE: QLD\nZIP: 2445
714	DATE	154	163	3/11/1978	1978-11-03
714	TIME	183	202	19/12/2012 at 10:50	2012-12-19T10:50
714	DEPARTMENT	202	265	PARKES 4 EAST\nHOSPITAL: EUGOWRA MEMORIAL MULTI PURPOSE SERVICE
714	DOCTOR	268	373	MARYBELLE TIA\nDOCTOR: MARYBELLE TIA\nTIME: 11.5mm (posterior, posterior, anterior, posterior, posterior)
714	DOCTOR	595	641	Isle\nDOCTOR: E Basch\nTIME: 12:40 on 19.12.12	2012-12-19T12:40
714	DOCTOR	2275	2304	QC\nDOCTOR: KU\nDATE: 22.2.62	2062-02-22
714	DOCTOR	2333	2341	E Morini
714	DATE	3134	3141	25/3/64	2064-03-25
715	IDNUM	13	23	35X682519F
715	MEDICALRECORD	24	35	3596825.DXF
715	PATIENT	37	53	LIVERS, Ara LING
715	IDNUM	62	70	35X68251
715	STREET	71	80	High Lake
715	CITY	80	125	MADDINGLEY\nSTATE: South Australia\nZIP: 1138
715	DATE	140	148	7/7/2000	2000-07-07
715	TIME	168	187	30/01/2013 at 11:41	2013-01-30T11:41
715	DEPARTMENT	187	238	SA Pathology\nHOSPITAL: TASMAN MULTI-PURPOSE CENTRE
715	DOCTOR	241	267	FRANCISCA on FRANCISCABERT
715	DATE	443	447	2062	2062
715	DOCTOR	3430	3458	VE\nDOCTOR: QH\nDATE: 3.3.63	2063-03-03
715	DOCTOR	3495	3505	S Krolczyk
716	IDNUM	14	24	93T6136775
716	MEDICALRECORD	25	36	9376136.STO
716	PATIENT	37	53	Lautenberg, CHAR
716	IDNUM	65	73	93T61367
716	STREET	74	80	Thiele
716	CITY	80	126	DEVONPORT\nSTATE: Western Australia\nZIP: 3614
716	DATE	141	149	7/7/2000	2000-07-07
716	TIME	169	188	14/01/2013 at 12:46	2013-01-14T12:46
716	DEPARTMENT	188	239	Pathology West\nHOSPITAL: PAMBULA DISTRICT HOSPITAL
716	DOCTOR	242	265	FLORENE No: FLORENE BER
716	DOCTOR	1108	1173	X Hack\nDOCTOR: X Golson\nDOCTOR: X Stigs\nTIME: 14/1/13 at 15:15	2013-01-14T15:15
716	DOCTOR	2239	2256	XM\nDATE: 17/3/63	2063-03-17
716	DOCTOR	2286	2294	X Majano
716	DOCTOR	3696	3708	X Kemmerling
717	IDNUM	13	23	41P634725W
717	MEDICALRECORD	23	34	4166347.NOW
717	PATIENT	36	52	KEENETH, TERRani
717	IDNUM	62	87	41P63472\nIDNUM: 41P63472
717	STREET	89	98	Concordus
717	CITY	99	142	GREENWELL POINT\nSTATE: Victoria\nZIP: 3889
717	DATE	166	176	21/11/1090	2090-11-21
717	TIME	196	215	18/02/2013 at 09:44	2013-02-18T09:44
717	DEPARTMENT	215	311	MEDIC/SURGERY WARD\nHOSPITAL: JACARANDA PLACE V QUEENSLAND ADOLESCENT EXTENDED TREATMENT CENTRE
717	DOCTOR	314	332	Roder Beau TUGGLES
717	DOCTOR	501	507	Lazega
717	DOCTOR	1613	1681	Emons\nDOCTOR: M Frase\nDOCTOR: M Harroids\nTIME: 18/2/13 at 12.05pm	2013-02-18T12:05
717	DOCTOR	3261	3278	EO\nDATE: 21/4/63	2063-04-21
717	DOCTOR	3307	3313	M Poor
718	MEDICALRECORD	1	12	0947557.WJF
718	PATIENT	13	27	Strebe, Billie
718	IDNUM	27	86	09M75578\nIDNUM: 09M75578\nIDNUM: 09M75578\nIDNUM: 09M75578
718	DATE	70	79	14/9/2062	2062-09-14
718	DOCTOR	663	732	A Genna\nDOCTOR: A Bignall\nDOCTOR: A Deneen\nTIME: 3.13pm on 4/12/12	2012-12-04T15:13
718	DOCTOR	897	913	YI\nDATE: 7/2/62	2062-07-02
718	DOCTOR	945	953	A Pfoten
719	IDNUM	14	24	57I775841O
719	MEDICALRECORD	25	36	5737758.LEO
719	PATIENT	37	60	Concilio\nLOAD: Desiree
719	IDNUM	60	85	57I77584\nIDNUM: 57I77584
719	STREET	88	106	East Field Service
719	CITY	106	149	MANDURAH\nSTATE: New South Wales\nZIP: 3767
719	DATE	173	183	29/11/2007	2007-11-29
719	DATE	203	212	6/12/2063	2063-06-12
719	DEPARTMENT	217	278	Envoi pathology\nHOSPITAL: YEA AND DISTRICT MEMORIAL HOSPITAL
719	DOCTOR	285	307	Micheal ERWIN KERSCHER
719	DOCTOR	2363	2414	P Corbo\nDOCTOR: P Cooper\nTIME: 3.55pm on 10.04.13	2013-04-10T15:55
719	DOCTOR	3016	3045	VH\nDOCTOR: DV\nDATE: 13.6.63	2063-06-13
719	DOCTOR	3074	3082	P Kimbro
720	IDNUM	13	23	78Z376790Z
720	MEDICALRECORD	24	35	7893767.ZAZ
720	PATIENT	37	60	Windover, Emilio Edison
720	IDNUM	71	79	78Z37679
720	PATIENT	80	88	Podsmead
720	CITY	88	137	MOUNT ELIZA\nSTATE: Northern Territory\nZIP: 6256
720	DATE	152	161	7/11/2004	2004-11-07
720	TIME	181	200	18/03/2013 at 13:45	2013-03-18T13:45
720	DEPARTMENT	200	248	DICKINSON 3 NORTH\nHOSPITAL: KUNUNOPPIN HOSPITAL
720	DOCTOR	251	273	NICKI ESTRELLA Kriegen
720	DATE	354	361	15.8.63	2063-08-15
720	AGE	376	378	63
720	DOCTOR	1259	1360	LANNY Causby\nDOCTOR: U Zic\nDOCTOR: U Zic\nDOCTOR: U Zic\nDOCTOR: U Zic\nTIME: 16:38pm on 18/03/2013	2013-03-18T16:38
720	DOCTOR	3139	3156	GT\nDATE: 21.5.63	2063-05-21
720	DOCTOR	3186	3194	U Mceady
720	DATE	5178	5185	15.8.63	2063-08-15
721	IDNUM	14	24	36V397758H
721	MEDICALRECORD	25	36	3683977.PVH
721	PATIENT	37	60	Holck, WarrON RANDY JOE
721	IDNUM	63	88	36V39775\nIDNUM: 36V39775
721	CITY	95	126	BONGAREE\nSTATE: QLD\nZIP: 2217
721	DATE	150	160	23/11/1994	1994-11-23
721	DATE	180	188	8/7/2063	2063-07-08
721	DEPARTMENT	193	229	Orana\nHOSPITAL: CUNNAMULLA HOSPITAL
721	DOCTOR	236	252	Donny KOLASINSKI
721	DOCTOR	283	290	Alfonzo
721	DATE	336	343	16.7.63	2063-07-16
721	DATE	421	426	today	2066
721	DOCTOR	752	835	Dana\nDOCTOR: I Windham\nDOCTOR: I Lamphead\nDOCTOR: I Skok\nTIME: 2.50pm on 6/5/13	2013-05-06T14:50
721	DOCTOR	2954	2970	MR\nDATE: 9/7/63	2063-07-09
721	DOCTOR	2972	2978	I Prox
721	DOCTOR	5414	5422	I Vivyan
721	DATE	5990	5997	16.7.63	2063-07-16
722	IDNUM	13	23	56N098616T
722	MEDICALRECORD	24	35	5650986.DRT
722	PATIENT	37	56	Mcgowan, MULGA BILL
722	IDNUM	57	116	56N09861\nIDNUM: 56N09861\nIDNUM: 56N09861\nIDNUM: 56N09861
722	PATIENT	85	96	Fitzstephen
722	CITY	96	133	GILGANDRA\nSTATE: Tasmania\nZIP: 4821
722	DATE	157	166	18/8/2014	2014-08-18
722	DATE	186	195	7/10/2063	2063-10-07
722	DEPARTMENT	200	246	Peter Mac\nHOSPITAL: MURRUMBAH-HARDEN HOSPITAL
722	DOCTOR	253	272	LUCIEN KENNY GUIDOS
722	DATE	341	348	18/7/63	2063-07-18
722	DATE	477	483	9.8.13	2013-09-08
722	DOCTOR	1044	1097	Cremeans\nDOCTOR: N Doerleen\nTIME: 10:20am on 8.5.13	2013-05-08T10:20
722	DOCTOR	3831	3848	TO\nDATE: 7.11.63	2063-11-07
722	DOCTOR	3850	3859	N Kippart
722	DOCTOR	6728	6736	N Shonka
722	DATE	7531	7538	18/7/63	2063-07-18
723	IDNUM	13	23	04J0197740
723	MEDICALRECORD	24	34	043019.SSM
723	PATIENT	36	48	MISSEY, Dara
723	IDNUM	49	74	04J01977\nIDNUM: 04J01977
723	STREET	77	83	Galata
723	CITY	83	146	LAUNCHING PLACE\nSTATE: Australian Capital Territory\nZIP: 1240
723	DATE	170	179	3/11/2019	2019-11-03
723	TIME	199	218	21/03/2013 at 19:51	2013-03-21T19:51
723	DEPARTMENT	218	278	7.ACUTE CARE WARD\nHOSPITAL: ST VINCENT'S HOSPITAL (LISMORE)
723	DOCTOR	279	290	DAYSI NELLY
723	DOCTOR	302	339	Daggett\nDOCTOR: Sabatu\nDOCTOR: BOYT
723	DATE	393	397	2047	2047
723	DOCTOR	2098	2115	GZ\nDATE: 24/5/63	2063-05-24
723	DOCTOR	2146	2155	C Keleman
723	DOCTOR	3292	3300	C Inclen
724	MEDICALRECORD	2	12	250610.PGI
724	PATIENT	13	28	INGA, GARY Adam
724	IDNUM	29	37	25A61062
724	DATE	53	61	5/8/2063	2063-05-08
724	DOCTOR	877	906	YX\nDOCTOR: PR\nDATE: 30.7.63	2063-07-30
724	DOCTOR	930	938	Q Shanaa
725	IDNUM	13	23	83W640681V
725	MEDICALRECORD	24	35	8386406.VDV
725	PATIENT	36	47	Gonas, MARK
725	IDNUM	51	76	83W64068\nIDNUM: 83W64068
725	STREET	79	92	East Shalford
725	CITY	92	123	LOBETHAL\nSTATE: TAS\nZIP: 2594
725	DATE	147	156	10/5/1994	1994-10-05
725	TIME	176	195	16/07/2013 at 08:26	2013-07-16T08:26
725	DEPARTMENT	195	251	Radiation Oncology\nHOSPITAL: ALPINE HEALTH (MYRTLEFORD)
725	DOCTOR	254	282	Romelia Shanna\nDOCTOR: XPAP
725	AGE	314	316	73
725	DOCTOR	1055	1124	Rodney\nDOCTOR: V Fiorarez\nDOCTOR: V Eaglen\nTIME: 10.20 on 16.07.13	2013-07-16T10:20
725	DOCTOR	2320	2337	YH\nDATE: 19.9.63	2063-09-19
725	DOCTOR	2367	2373	V Last
726	IDNUM	13	23	04O341539G
726	MEDICALRECORD	24	35	0453415.KZG
726	PATIENT	37	51	Cheek, Palmira
726	IDNUM	62	70	04O34153
726	STREET	71	82	Hestercombe
726	CITY	82	111	BARGARA\nSTATE: WA\nZIP: 2652
726	DATE	126	135	10/3/2006	2006-03-10
726	DATE	155	164	6/11/2063	2063-11-06
726	DEPARTMENT	169	221	3HR STAY SURGICAL UNIT\nHOSPITAL: GREENWICH HOSPITAL
726	DOCTOR	224	250	Roscoe GRAHAM\nDOCTOR: GUN
726	DOCTOR	780	851	A Yampi\nDOCTOR: A Temblador\nDOCTOR: A Remley\nTIME: 9.5 on 04.09.2013	2013-09-04T09:50
726	DOCTOR	3194	3223	WF\nDOCTOR: XR\nDATE: 7.11.63	2063-11-07
726	DOCTOR	3248	3258	A Vaughner
727	IDNUM	14	24	52K362697P
727	MEDICALRECORD	25	36	5233626.ZUP
727	PATIENT	37	51	SCELZO, REELZO
727	IDNUM	60	68	52K36269
727	PATIENT	69	78	Judy Witt
727	CITY	78	119	DRUMMOND COVE\nSTATE: Tasmania\nZIP: 2114
727	DATE	134	144	11/11/2010	2010-11-11
727	TIME	164	183	13/08/2013 at 18:01	2013-08-13T18:01
727	DEPARTMENT	183	246	INTENSIVE CARE\nHOSPITAL: ALBURY WODONGA HEALTH - ALBURY CAMPUS
727	DOCTOR	249	272	DIERDREXLE RILEYEZREXLE
727	AGE	312	314	57
727	DOCTOR	3356	3374	CQ\nDATE: 16/10/63	2063-10-16
727	DOCTOR	3471	3478	O Tomas
727	DOCTOR	4149	4162	VANNESA Pabst
728	IDNUM	13	23	10G383655Y
728	MEDICALRECORD	24	35	1023836.OPY
728	PATIENT	37	55	BISSONETTE, HAROLD
728	IDNUM	66	74	10G38365
728	STREET	75	82	Lottery
728	CITY	82	111	NAIRNE\nSTATE: VIC\nZIP: 4422
728	DATE	126	135	30/6/1987	1987-06-30
728	DATE	155	163	7/4/2064	2064-07-04
728	DEPARTMENT	168	213	Peter Mac\nHOSPITAL: MURRAY DISTRICT HOSPITAL
728	DOCTOR	216	236	WYNETTE SALLY DEPPER
728	DATE	3382	3388	8.4.64	2064-04-08
728	DOCTOR	3420	3429	D Swayzer
729	IDNUM	13	23	31X984514J
729	MEDICALRECORD	23	33	319984.OCR
729	PATIENT	36	52	LAWTER, Hortense
729	IDNUM	64	72	31X98451
729	PATIENT	73	80	Jaypore
729	CITY	80	111	WILLUNGA\nSTATE: TAS\nZIP: 6317
729	DATE	126	134	3/3/2018	2018-03-03
729	TIME	154	173	27/11/2012 at 16:38	2012-11-27T16:38
729	DEPARTMENT	173	215	MACQUARIE WARD\nHOSPITAL: ROSEBUD HOSPITAL
729	DOCTOR	216	237	Jardi Adjura-BRUSCHKE
729	DOCTOR	3041	3058	NF\nDATE: 30/1/62	2062-01-30
729	DOCTOR	3057	3081	I Allen\nDOCTOR: I Allen
730	IDNUM	13	23	89U004662R
730	MEDICALRECORD	24	35	8970046.RGR
730	DOCTOR	36	73	Feliciano\nDOCTOR: OZ\nDATE: 30.11.63	2063-11-30
730	IDNUM	67	75	89U00466
730	STREET	76	90	Sterling Ranch
730	CITY	90	134	HADSPEN\nSTATE: Western Australia\nZIP: 4345
730	DATE	149	157	8/2/1996	1996-02-08
730	DATE	177	186	12/5/2062	2062-12-05
730	DEPARTMENT	191	233	SEALS central\nHOSPITAL: LAVERTON HOSPITAL
730	DOCTOR	236	280	BRYCE Chang T shooter\nDOCTOR: BRYCE RICKOLS
730	DOCTOR	2448	2465	TV\nDATE: 12.4.62	2062-12-04
730	DOCTOR	2498	2506	W Brizen
731	IDNUM	13	23	53D854972M
731	MEDICALRECORD	24	35	5318549.TFM
731	PATIENT	36	50	Klang, Alliter
731	IDNUM	51	76	53D85497\nIDNUM: 53D85497
731	CITY	84	118	GOONDIWINDI\nSTATE: VIC\nZIP: 2424
731	DATE	142	150	2/4/2025	2025-04-02
731	DEPARTMENT	182	948	Cure For Life Foundation Neuro-oncology\nHOSPITAL: ROYAL TALBOT REHABILITATION CENTRE - ROYAL TALBOT REHABILITATION CENTRE - ROYAL TALBOT REHABILITATION CENTRE - ROYAL TALBOT REHABILITATION CENTRE - ROYAL TALBOT REHABILITATION CENTRE - ROYAL TALBOT REHABILITATION CENTRE - ROYAL TALBOT REHABILITATION CENTRE - ROYAL TALBOT REHABILITATION CENTRE - ROYAL TALBOT REHABILITATION CENTRE - ROYAL TALBOT REHABILITATION CENTRE - ROYAL TALBOT REHABILITATION CENTRE - ROYAL TALBOT REHABILITATION CENTRE - ROYAL TALBOT REHABILITATION CENTRE - ROYAL TALBOT REHABILITATION CENTRE - ROYAL TALBOT REHABILITATION CENTRE - ROYAL TALBOT REHABILITATION CENTRE - ROYAL TALBOT REHABILITATION CENTRE - ROYAL TALBOT REHABILITATION CENTRE - ROYAL TALBOT REHABILITATION CENTRE - ROYAL TUMOUR
731	DOCTOR	294	316	BELVA JAIME JEMICOULAR
731	DOCTOR	346	352	Docimo
731	DOCTOR	1812	1830	GT\nDATE: 25.12.62	2062-12-25
731	DOCTOR	1859	1871	P Easterling
732	MEDICALRECORD	2	13	6826265.VXL
732	PATIENT	14	25	DANSER, KIP
732	IDNUM	25	50	68H62658\nIDNUM: 68H62658
732	DATE	59	69	21/12/2062	2062-12-21
732	DOCTOR	523	572	Haspel\nDOCTOR: Q Devoe\nTIME: 4:26pm on 16.10.12	2012-10-16T16:26
732	DOCTOR	972	990	ZW\nDATE: 19.12.62	2062-12-19
732	DOCTOR	1019	1025	Q Homa
733	IDNUM	13	23	16D747637U
733	MEDICALRECORD	24	35	1617476.KSU
733	PATIENT	37	51	Younce, REGGIE
733	IDNUM	52	93	16D74763\nIDNUM: 16D74763\nDATE: 16D74763	2063-07-16
733	STREET	80	88	S Orange
733	CITY	88	133	WAUCHOPE\nSTATE: Western Australia\nZIP: 4514
733	DATE	157	167	22/12/2007	2007-12-22
733	DATE	187	196	13/4/2064	2064-04-13
733	DEPARTMENT	201	266	POW L7 CONSULTING ROOMS\nHOSPITAL: DELEGATE MULTI PURPOSE SERVICE
733	DOCTOR	273	294	THOMASINA Dann ICARDO
733	DOCTOR	313	318	Keehn
733	DOCTOR	3080	3097	BV\nDATE: 14.4.64	2064-04-14
733	DOCTOR	3127	3136	E Platter
733	DOCTOR	4935	4944	E Rotunau
735	IDNUM	13	23	80N596946P
735	MEDICALRECORD	24	35	8055969.LRP
735	PATIENT	36	56	Vanderzende, BARRETT
735	IDNUM	59	84	80N59694\nIDNUM: 80N59694
735	CITY	98	129	BALLARAT\nSTATE: QLD\nZIP: 3739
735	DATE	153	163	22/12/2007	2007-12-22
735	DATE	183	192	13/4/2064	2064-04-13
735	DEPARTMENT	197	242	DICKINSON 3 SOUTH\nHOSPITAL: GAYNDAH HOSPITAL
735	DOCTOR	245	264	Cindy SHANDI PARKES
735	DOCTOR	271	280	Luedtfall
735	DOCTOR	3043	3060	JB\nDATE: 14.4.64	2064-04-14
735	DOCTOR	3096	3104	X Borumo
735	DOCTOR	4875	4882	X Stale
735	DATE	5386	5395	16/4/2064	2064-04-16
735	DATE	5435	5443	original	2013-02-06
748	IDNUM	13	23	95R378553O
748	MEDICALRECORD	24	35	9563785.NJO
748	PATIENT	36	58	LAURICELLA, TRACY SANC
748	IDNUM	72	80	95R37855
748	STREET	81	91	Brock Hill
748	CITY	91	124	HEALESVILLE\nSTATE: SA\nZIP: 6461
748	DATE	139	149	16/11/2004	2004-11-16
748	DEPARTMENT	180	242	OBSTETRICS\nHOSPITAL: MURRAY BRIDGE SOLDIERS MEMORIAL HOSPITAL
748	DOCTOR	247	263	Cameron CHAPPARO
748	DATE	313	320	29.4.64	2064-04-29
748	DATE	347	354	25.3.64	2064-03-25
748	DOCTOR	687	729	TC\nDOCTOR: XC\nTIME: 15.1.2014 at 11:12am	2014-01-15T11:12
748	DOCTOR	831	915	Kirsten LACOURSE\nDOCTOR: LE\nDOCTOR: VA\nDOCTOR: SW\nTIME: 11:27am on the 14.1.2014	2014-01-14T11:27
748	DOCTOR	1034	1063	TQ\nDOCTOR: BY\nDATE: 18.3.64	2064-03-18
748	DOCTOR	1087	1097	Y Wehmeyer
748	DOCTOR	1705	1769	Y Contreres\nHOSPITAL: CENTRAL GIPPSLAND HEALTH SERVICE (MAFFRA)
748	DATE	2067	2074	25.3.64	2064-03-25
748	DATE	2185	2192	29.4.64	2064-04-29
748	HOSPITAL	2218	2229	MATER ADULT
748	DOCTOR	2493	2503	Y Bostwick
749	MEDICALRECORD	1	12	4253996.CEW
749	PATIENT	13	27	HIBNER, LEIGHA
749	IDNUM	28	36	42N39961
749	DATE	52	61	19/4/2064	2064-04-19
749	DOCTOR	181	225	BOLESLAWS\nDOCTOR: CABOOLTURE\nTIME: 08.2.66	2066-02-08
749	DATE	1288	1295	15.4.64	2064-04-15
749	DOCTOR	1327	1337	M Reinhart
750	MEDICALRECORD	1	12	0034107.RZF
750	PATIENT	13	27	FASTLABEN, KUM
750	IDNUM	28	36	00J41076
750	DATE	52	61	27/4/2064	2064-04-27
750	DOCTOR	1286	1297	B Piganelli
750	DATE	1945	1952	27/4/64	2064-04-27
751	IDNUM	13	23	21B011528Q
751	MEDICALRECORD	24	34	210011.PGV
751	PATIENT	36	50	Rardin, SYDNEY
751	IDNUM	61	69	21B01152
751	PATIENT	70	75	Nadin
751	CITY	75	105	WALGETT\nSTATE: ACT\nZIP: 3067
751	DATE	120	129	26/2/2037	2037-02-26
751	TIME	149	168	25/02/2014 at 10:25	2014-02-25T10:25
751	DEPARTMENT	168	203	North\nHOSPITAL: KALAMUNDA HOSPITAL
751	DOCTOR	204	220	LINO Galen Des\n
751	DOCTOR	826	842	TZ\nDOCTOR: Jett
751	DOCTOR	2638	2647	G Tarallo
751	IDNUM	3299	3307	21B01152
751	DATE	3520	3529	29/4/2064	2064-04-29
754	IDNUM	13	23	79X031686Z
754	MEDICALRECORD	24	35	7980316.VQZ
754	PATIENT	37	52	MIZELL, Fabiola
754	IDNUM	63	71	79X03168
754	PATIENT	72	81	Barkworth
754	CITY	81	113	WATTLEGLEN\nSTATE: NT\nZIP: 4818
754	DATE	128	137	5/11/1997	1997-11-05
754	DEPARTMENT	169	201	DHM\nHOSPITAL: COLEDALE HOSPITAL
754	DOCTOR	208	227	Quincy Randy DICKEY
754	DOCTOR	3448	3465	QH\nDATE: 22/4/64	2064-04-22
754	DOCTOR	3498	3504	U Mais
755	MEDICALRECORD	1	12	5328819.WPT
755	PATIENT	12	30	Pergelon, WARRIGAL
755	IDNUM	32	40	53G88198
755	DATE	56	65	21/4/2064	2064-04-21
755	DOCTOR	1416	1445	KF\nDOCTOR: LI\nDATE: 20.4.64	2064-04-20
755	DOCTOR	1442	1451	N Linsway
755	HOSPITAL	2100	2114	ACUTECARE WARD
756	IDNUM	14	24	58K753592T
756	MEDICALRECORD	25	36	5847535.YHT
756	PATIENT	38	61	SEMBRAT, ERNIE Eldridge
756	IDNUM	72	80	58K75359
756	CITY	86	116	WINGHAM\nSTATE: QLD\nZIP: 2309
756	DATE	131	139	7/3/1984	1984-03-07
756	TIME	159	178	19/02/2014 at 06:43	2014-02-19T06:43
756	DEPARTMENT	178	220	RENAL CLINIC\nHOSPITAL: DOOMADGEE HOSPITAL
756	DOCTOR	226	249	DARREN LUCIANO Thielman
756	DOCTOR	2753	2764	N. Deshaene
756	DATE	4564	4573	23/4/2064	2064-04-23
757	IDNUM	13	23	06G784650B
757	MEDICALRECORD	24	35	0627846.NCB
757	PATIENT	37	50	DOMAS, Krissy
757	IDNUM	61	69	06G78465
757	DOCTOR	69	117	Wildley\nHOSPITAL: DORRIGO MULTI PURPOSE SERVICE
757	CITY	107	151	RASMUSSEN\nSTATE: South Australia\nZIP: 4812
757	DATE	166	175	6/12/1968	1968-06-12
757	TIME	195	214	13/02/2014 at 13:46	2014-02-13T13:46
757	DEPARTMENT	214	270	PaLMS\nHOSPITAL: CENTRAL GIPPSLAND HEALTH SERVICE (SALE)
757	DOCTOR	275	294	TAMA DUDLEY Poulsen
757	AGE	370	373	100
757	DATE	1613	1620	16/4/64	2064-04-16
757	DOCTOR	1652	1660	C Debiew
758	MEDICALRECORD	1	12	8065239.PBW
758	PATIENT	12	39	Kilfoley, GERMAINE CALANDRA
758	IDNUM	40	65	80Q52395\nIDNUM: 80Q52395
758	DATE	74	83	23/4/2064	2064-04-23
758	DOCTOR	1502	1531	DK\nDOCTOR: HX\nDATE: 22.4.64	2064-04-22
758	DOCTOR	1592	1599	V Selma
759	IDNUM	14	24	85U305667V
759	MEDICALRECORD	25	36	8573056.RTV
759	PATIENT	38	57	Struchen, AUGUSTINE
759	IDNUM	68	76	85U30566
759	STREET	77	88	Shaw Fields
759	CITY	88	133	DAYLESFORD\nSTATE: Western Australia\nZIP: 31
759	DATE	150	159	27/9/2019	2019-09-27
759	TIME	179	198	14/02/2014 at 13:58	2014-02-14T13:58
759	DEPARTMENT	198	247	NSW Health\nHOSPITAL: THE PRINCE CHARLES HOSPITAL
759	DOCTOR	248	264	Denis Garth Lehr
759	DATE	2755	2762	19.4.64	2064-04-19
759	DOCTOR	2793	2803	V Balancia
760	MEDICALRECORD	1	12	3364266.GOE
760	PATIENT	12	34	Chorebbe, PATRICK Rumi
760	IDNUM	36	44	33Q42662
760	DATE	60	69	28/4/2064	2064-04-28
760	DOCTOR	1714	1743	QG\nDOCTOR: HV\nDATE: 27.4.64	2064-04-27
760	DOCTOR	1767	1775	K Sansom
760	DOCTOR	2689	2702	PAUL SAKUMOTO
761	IDNUM	14	24	91M447783M
761	MEDICALRECORD	25	36	9144477.VJM
761	PATIENT	38	59	TANDUS, DAMION DORIAN
761	IDNUM	70	78	91M44778
761	STREET	79	87	Ivy Hill
761	CITY	87	123	MERRIMAC\nSTATE: Tasmania\nZIP: 5302
761	DATE	138	147	25/5/2022	2022-05-25
761	DATE	167	176	27/4/2064	2064-04-27
761	DEPARTMENT	181	237	OBSTETRICS\nHOSPITAL: WILSON MEMORIAL COMMUNITY HOSPITAL
761	DOCTOR	244	260	Mickey Jacquetta
761	DOCTOR	1287	1335	Reglin\nDOCTOR: JEROME\nTIME: 12:53 on 25.2.2014	2014-02-25T12:53
761	DOCTOR	4209	4238	MK\nDOCTOR: AN\nDATE: 28.4.64	2064-04-28
761	DOCTOR	4262	4269	Y Merna
761	DOCTOR	5768	5801	Deetta\nDOCTOR: JX\nTIME: 11.ARGO	2012-09-11T11:ARGO
762	IDNUM	13	23	59I468731V
762	MEDICALRECORD	24	35	5934687.KFV
762	PATIENT	37	54	Eschbaugh, JEWELL
762	IDNUM	65	73	59I46873
762	PATIENT	74	82	Stillson
762	CITY	82	112	KAMBALDA\nSTATE: SA\nZIP: 2102
762	DATE	127	135	5/2/1992	1992-05-02
762	TIME	155	174	20/02/2014 at 16:42	2014-02-20T16:42
762	DEPARTMENT	174	233	Hunter Area\nHOSPITAL: TRANGIE MULTI PURPOSE HEALTH SERVICE
762	DOCTOR	240	254	KUPARR Alfredo
762	DATE	1189	1196	23.4.64	2064-04-23
762	DOCTOR	2568	2597	VY\nDOCTOR: MX\nDATE: 23.4.64	2064-04-23
762	DOCTOR	2621	2631	N Pontillo
762	DOCTOR	4299	4310	E Salisbury
762	ORGANIZATION	4449	4503	New York Life Insurance\nHOSPITAL: NARRANDERA HOSPITAL
763	IDNUM	13	23	60A169690G
763	MEDICALRECORD	24	35	6001696.YAG
763	PATIENT	37	54	COTTRELL, LYNELLE
763	IDNUM	73	81	60A16969
763	STREET	82	91	Bullivant
763	CITY	91	137	BATHURST\nSTATE: Northern Territory\nZIP: 2469
763	DATE	152	162	27/12/2013	2013-12-27
763	TIME	182	201	16/01/2014 at 10:23	2014-01-16T10:23
763	DEPARTMENT	213	240	DEPT OF CORRECTIVE SERVICES
763	DOCTOR	240	767	Rod ALEJANDRO HARDEBIO HARDEBIO HARDEBIO HARDEBIO HARDEBIO HARDEBIO HARDEBIO HARDEBIO HARDEBIO HARDEBIO HARDEBIO HARDEBIO HARDEBIO HARDEBIO HARDEBIO HARDEBIO HARDEBIO HARDEBIO HARDEBIO HARDEBIO HARDEBIO HARDEBIO HARDEBIO HARDEBIO HARDEBIO HARDEBIO HARDEBIO HARDEBIO HARDEBIO HARDEBIO HARDEBIO HARDEBIO HARDEBIO HARDEBIO HARDEBIO HARDEBIO HARDEBIO HARDEBIO HARDEBIO HARDEBIO HARDEBIO HARDEBIE OPTIONE MYO HARDEBIO HARDEBIO HARDEBIO HARDEBIO HARDEBIO HARDEBIO HARDEBIO HARDEBIO HARDEBIO HARDEBIO HARDEBIO HARDEBIO HARDEBIVICHELIK
763	DOCTOR	240	580	HARDEBIO HARDEBIO HARDEBIO HARDEBIO HARDEBIO HARDEBIO HARDEBIO HARDEBIO HARDEBIO HARDEBIO HARDEBIO HARDEBIO HARDEBIO HARDEBIVICHSO HARDEBIO HARDEBIO HARDEBIO HARDEBIO HARDEBIO HARDEBIO HARDEBIO HARDEBIO HARDEBIO HARDEBIO HARDEBIO HARDEBIO HARDEBIO HARDEBIO HARDEBIE PATHOLOGY REPORT: HARDEBIO HARDEBIO HARDEBIE PATHOLOGY REPORT TOBY5: MATER
763	DOCTOR	717	748	Laurice PANGILINAN\nTIME: 1017H
763	DATE	5804	5811	23/3/64	2064-03-23
764	IDNUM	14	24	27W189758P
764	MEDICALRECORD	25	36	2781897.NVP
764	PATIENT	37	55	Gorsky, Nathan and
764	IDNUM	66	74	27W18975
764	STREET	75	86	Wilson Fold
764	CITY	86	130	INGHAM\nSTATE: Northern Territory\nZIP: 5234
764	DATE	145	154	12/2/2001	2001-02-12
764	DATE	174	183	28/4/2064	2064-04-28
764	DEPARTMENT	188	245	ST GEORGE PRIVATE\nHOSPITAL: PENOLA WAR MEMORIAL HOSPITAL
764	DOCTOR	252	273	Malcom HORACIO Strose
764	DOCTOR	273	291	Mcneff\nDOCTOR: QV
764	DOCTOR	3796	3813	KJ\nDATE: 29/4/64	2064-04-29
764	DOCTOR	3842	3851	G Pearson
766	IDNUM	13	23	48N780606A
766	MEDICALRECORD	24	35	4857806.CRA
766	PATIENT	37	64	Cichowski, Sebastian WILBUR
766	IDNUM	75	83	48N78060
766	PATIENT	84	92	Gafzelle
766	CITY	92	123	INVERLOCH\nSTATE: SA\nZIP: 6951
766	DATE	137	146	19/2/1996	1996-02-19
766	TIME	166	185	13/02/2014 at 09:50	2014-02-13T09:50
766	DEPARTMENT	185	226	PARKES 4 EAST\nHOSPITAL: ANGLISS HOSPITAL
766	DOCTOR	227	251	EMMITT ANDERSON ROBBYson
766	DATE	3482	3489	20/4/64	2064-04-20
766	HOSPITAL	3503	3548	South Western Area\nDEPARTMENT: QuONPI6seeing
768	IDNUM	13	23	06K711664I
768	MEDICALRECORD	24	35	0637116.RMI
768	PATIENT	36	51	BEEVERS, Catana
768	IDNUM	63	71	06K71166
768	PATIENT	72	79	Currong
768	CITY	79	118	NEWCASTLE\nSTATE: Queensland\nZIP: 7262
768	DATE	133	141	2/5/1992	1992-02-05
768	TIME	161	180	20/02/2014 at 16:42	2014-02-20T16:42
768	DEPARTMENT	180	249	BILLINGTON CENTRE\nHOSPITAL: MONASH MEDICAL CENTRE - MOORABBIN CAMPUS
768	DOCTOR	252	277	Woodrow LOREN WOODROW-BVD
768	DATE	370	376	5.5.64	2064-05-05
768	DATE	1523	1530	23.4.64	2064-04-23
768	DOCTOR	2907	2936	AE\nDOCTOR: WC\nDATE: 23.4.64	2064-04-23
768	DOCTOR	2960	2969	A Strader
768	DOCTOR	4633	4642	A Yearick
768	ORGANIZATION	4781	4822	Yahoo\nHOSPITAL: VICTORIAN HEART HOSPITAL
772	MEDICALRECORD	1	12	5428327.GIR
772	PATIENT	13	26	Tomich, Daryl
772	IDNUM	27	35	54G83272
772	DATE	51	59	5/6/2064	2064-06-05
772	DOCTOR	538	567	XG\nDOCTOR: GY\nDATE: 30.4.64	2064-04-30
772	DOCTOR	591	599	O Tugman
774	MEDICALRECORD	1	12	7594336.UDC
774	STREET	12	17	Dueid
774	IDNUM	28	36	75X43367
774	DATE	52	60	5/6/2064	2064-06-05
774	DOCTOR	538	567	ZH\nDOCTOR: QG\nDATE: 30.4.64	2064-04-30
774	DOCTOR	591	601	T Kluemper
775	IDNUM	14	24	33T4536394
775	MEDICALRECORD	25	36	3374536.JYL
775	PATIENT	38	64	Rickenbacker, DERICK RANAE
775	IDNUM	75	83	33T45363
775	STREET	84	95	North Texas
775	CITY	95	132	MANSFIELD\nSTATE: Victoria\nZIP: 6390
775	DATE	147	155	9/4/2027	2027-04-09
775	DATE	173	181	4/4/2059	2059-04-04
775	DEPARTMENT	186	237	MACQUARIEWARD\nHOSPITAL: RONG HAMPTON BASE HOSPITAL
775	DOCTOR	241	258	EMMITT WEISENFLUH
775	DOCTOR	868	920	Simler\nDOCTOR: H Zorykos\nTIME: 14.01pm on 02.02.09	2013-02-02T14:01
775	DOCTOR	1381	1436	Grwin\nDOCTOR: H Maschfallge\nTIME: 15.00pm on 02.02.09	2013-02-02T15:00
775	DOCTOR	3293	3309	UA\nDATE: 5.4.59	2059-04-05
775	DOCTOR	3316	3323	H Conry
776	IDNUM	13	23	07D293049G
776	MEDICALRECORD	24	35	0712930.KXG
776	PATIENT	37	50	HACKE, Keenan
776	IDNUM	67	75	07D29304
776	PATIENT	76	81	Moons
776	CITY	81	110	MOONIE\nSTATE: QLD\nZIP: 3414
776	DATE	125	133	9/8/1987	1987-09-08
776	TIME	153	172	20/02/2014 at 14:18	2014-02-20T14:18
776	DEPARTMENT	172	230	DICKINSON 2 NORTH\nHOSPITAL: BARRABA MULTI PURPOSE SERVICE
776	DOCTOR	235	254	DEWEY HANK Nunziato
776	DOCTOR	1742	1759	XX\nDATE: 23.4.64	2064-04-23
776	DOCTOR	1759	1786	A Sudbury\nDOCTOR: A Manusy
777	IDNUM	13	23	02H175646F
777	MEDICALRECORD	24	34	022175.QMP
777	DOCTOR	38	49	ESNER, ERIK
777	IDNUM	59	67	02H17564
777	ORGANIZATION	67	88	FirstName Corporation
777	CITY	90	124	ARMIDALETAS\nSTATE: Tas\nZIP: 3005
777	DATE	139	148	26/7/1983	1983-07-26
777	TIME	168	187	25/02/2014 at 08:28	2014-02-25T08:28
777	DEPARTMENT	187	238	Immunology\nHOSPITAL:ESPERANCE MULTI PURPOSE CENTRE
777	DOCTOR	240	256	CHANG JAMAL NUTA
777	DATE	1921	1928	28.4.64	2064-04-28
777	DOCTOR	1958	1966	B Driere
778	IDNUM	14	24	76Q925955A
778	MEDICALRECORD	25	36	7669259.OOA
778	PATIENT	38	54	GRENNAY, LIZETTE
778	IDNUM	65	73	76Q92595
778	STREET	74	85	Putney High
778	CITY	85	124	MAITLAND\nSTATE: Queensland\nZIP: 38569
778	DATE	138	147	27/8/2024	2024-08-27
778	DATE	167	176	4/12/2064	2064-12-04
778	DEPARTMENT	181	226	OPERATING THEATRES\nHOSPITAL: NEWMAN HOSPITAL
778	DOCTOR	233	251	Pura PAMULA KOPPES
778	DOCTOR	270	275	Gaudy
778	AGE	413	415	20
778	DOCTOR	2784	2813	GG\nDOCTOR: GS\nDATE: 13.4.64	2064-04-13
778	DOCTOR	2808	2815	P Tales
778	DOCTOR	3648	3656	P Moisey
779	IDNUM	13	23	34N945013I
779	MEDICALRECORD	24	35	3459450.DJI
779	PATIENT	37	49	MAZZARA, Val
779	IDNUM	60	68	34N94501
779	STREET	69	79	Blackhurst
779	CITY	79	135	SEA LAKE\nSTATE: Australian Capital Territory\nZIP: 5505
779	DATE	150	159	5/11/1992	1992-11-05
779	TIME	179	198	10/02/2014 at 11:20	2014-02-10T11:20
779	DEPARTMENT	198	264	INTENSIVECARE UNIT\nHOSPITAL: TRANGIE MULTI PURPOSE HEALTH SERVICE
779	DOCTOR	271	281	Von MERLIN
779	DOCTOR	3015	3032	HE\nDATE: 13.4.64	2064-04-13
779	DOCTOR	3032	3056	I Enrino\nDOCTOR: I Kall
780	IDNUM	14	24	39R717620H
780	MEDICALRECORD	25	36	3967176.FBH
780	PATIENT	38	55	Fryson, CLEVELAND
780	IDNUM	66	74	39R71762
780	STREET	75	86	Carrs Ridge
780	CITY	86	115	BUNBURY\nSTATE: SA\nZIP: 3659
780	DATE	130	139	24/3/2008	2008-03-24
780	TIME	159	178	07/02/2014 at 15:23	2014-02-07T15:23
780	DEPARTMENT	178	223	SOUTH SURGICAL UNIT\nHOSPITAL: BOWEN HOSPITAL
780	DOCTOR	239	250	Brooks Pete
780	DOCTOR	2222	2251	KS\nDOCTOR: RH\nDATE: 12.4.64	2064-04-12
780	DOCTOR	2246	2271	J Coots\nDOCTOR: J Bingen
780	DOCTOR	3029	3039	J Mclinton
780	DOCTOR	4585	4607	J Magos\nDATE: 21/4/64	2064-04-21
780	DOCTOR	4683	4691	J Warntz
780	DOCTOR	5089	5096	J Panak
781	IDNUM	13	23	03A667920C
781	MEDICALRECORD	24	34	030667.ZGA
781	PATIENT	36	48	Syck, KEENAN
781	IDNUM	59	67	03A66792
781	PATIENT	68	73	Labau
781	CITY	73	114	BONNY HILLS\nSTATE: Queensland\nZIP: 5262
781	DATE	129	137	4/3/2003	2003-04-03
781	TIME	157	176	07/02/2014 at 14:20	2014-02-07T14:20
781	DEPARTMENT	176	243	OPERATING THEATRES\nHOSPITAL: ALBURY WODONGA HEALTH - ALBURY CAMPUS
781	DOCTOR	248	266	Doyle Brock-GEHMAN
781	DATE	1529	1536	12.4.64	2064-04-12
781	DOCTOR	1567	1575	B Messer
782	IDNUM	13	23	61W688088L
782	MEDICALRECORD	24	35	6186880.VVL
782	PATIENT	37	60	Hattub, LEOPOLDO DANIAL
782	IDNUM	71	79	61W68808
782	STREET	80	89	Southwest
782	CITY	98	131	RED CLIFFS\nSTATE: QLD\nZIP: 3555
782	DATE	146	154	2/4/2038	2038-04-02
782	DATE	174	182	4/8/2064	2064-08-04
782	DEPARTMENT	187	229	Southern IML\nHOSPITAL: DEUNOINGTON CENTRE
782	DOCTOR	257	276	CORNELIUS SHEPDTONY
782	DOCTOR	2575	2603	DU\nDOCTOR: QS\nDATE: 4.9.64	2064-04-09
782	DOCTOR	2627	2635	Q Sanden
783	IDNUM	14	24	81O289936W
783	MEDICALRECORD	25	35	815289.YKR
783	PATIENT	37	52	Buzby, VALENTIN
783	IDNUM	63	71	81O28993
783	STREET	71	83	Beulang Park
783	CITY	83	114	COCKATOO\nSTATE: ACT\nZIP: 3317
783	DATE	128	136	6/6/2002	2002-06-06
783	TIME	156	175	06/02/2014 at 09:20	2014-02-06T09:20
783	DEPARTMENT	175	244	Douglas Hanly Moir\nHOSPITAL: CENTRAL GIPPSLAND HEALTH SERVICE (SALE)
783	DOCTOR	249	267	BRITT ELIJAH PENHA
783	DATE	2307	2313	4.8.64	2064-08-04
783	DOCTOR	2315	2345	V Sagallume\nDOCTOR: V Caldist
784	MEDICALRECORD	1	12	3933099.ZME
784	PATIENT	13	31	SCHLEMMER, Dorthey
784	IDNUM	32	40	39K30999
784	DATE	56	64	7/4/2064	2064-07-04
784	DOCTOR	1743	1773	SZ\nDOCTOR: EY\nDATE: 19.12.63	2063-12-19
784	DOCTOR	1768	1776	J Touran
785	IDNUM	13	23	50B900853Q
785	MEDICALRECORD	24	34	500900.WNI
785	PATIENT	36	50	ULRICH, Irving
785	IDNUM	61	69	50B90085
785	PATIENT	69	74	Alder
785	CITY	76	111	WINGHAM\nSTATE: Victoria\nZIP: 3105
785	DATE	126	135	22/3/2014	2014-03-22
785	TIME	155	174	01/02/2014 at 16:33	2014-02-01T16:33
785	DEPARTMENT	174	245	MEDIC/SURGERY WARD\nHOSPITAL: COLLINSVILLE MULTI-PURPOSE HEALTH SERVICE
785	DOCTOR	250	269	Freddy Royal MARCOS
785	DATE	2888	2894	4.5.64	2064-05-04
785	DOCTOR	2895	2924	Y Chumbley\nDOCTOR: Y Simmers
786	IDNUM	14	24	18X921911Y
786	MEDICALRECORD	25	35	189921.YCD
786	PATIENT	36	50	Prader, Conrad
786	IDNUM	61	69	18X92191
786	PATIENT	69	75	Neuhts
786	CITY	78	111	MEEKATHARRA\nSTATE: WA\nZIP: 3054
786	DATE	126	134	1/9/2003	2003-01-09
786	TIME	154	173	30/01/2014 at 13:48	2014-01-30T13:48
786	DEPARTMENT	173	218	DAYSURGERY UNIT\nHOSPITAL: ALEXANDRA HOSPITAL
786	DOCTOR	228	247	WARNERDOCTOR-BEYSER
786	DOCTOR	2604	2632	IJ\nDOCTOR: CQ\nDATE: 3.3.64	2064-03-03
786	DOCTOR	2658	2665	D Ducey
786	ORGANIZATION	4022	4073	Parker Hannifa\nHOSPITAL: SWAN HILL DISTRICT HEALTH
787	IDNUM	13	23	39P522869J
787	MEDICALRECORD	24	35	3955228.RZJ
787	PATIENT	37	53	DOLPHIN, BRONWYN
787	IDNUM	64	72	39P52286
787	STREET	73	83	Twin Creek
787	CITY	83	126	HAMILTON\nSTATE: South Australia\nZIP: 2204
787	DATE	141	150	14/1/1984	1984-01-14
787	DATE	170	178	1/3/2064	2064-01-03
787	DEPARTMENT	183	225	Envoi Pathology\nHOSPITAL: BOONAH HOSPITAL
787	DOCTOR	226	240	Cordell MalJJD
787	DOCTOR	640	675	Chester Schweikert\nDOCTOR: I Matti
787	DOCTOR	936	975	I Buzzard\nDOCTOR: I Ziff\nTIME: 4.05pm	2012-09-04T16:05
787	DOCTOR	2794	2822	DE\nDOCTOR: JA\nDATE: 3.2.64	2064-03-02
787	DOCTOR	2850	2857	R Tynan
788	MEDICALRECORD	1	12	8746538.GUS
788	PATIENT	13	36	ELLIES, CARINA NICHOLAS
788	IDNUM	37	45	87L65382
788	DATE	61	69	3/3/2064	2064-03-03
788	DATE	1130	1136	3.2.64	2064-03-02
788	DOCTOR	1138	1148	W Sellesor
789	MEDICALRECORD	2	13	4526739.VPB
789	PATIENT	13	28	Mabane, NATASHA
789	IDNUM	30	38	45H67398
789	DATE	54	63	15/4/2064	2064-04-15
789	DATE	105	114	15.4.2064	2064-04-15
789	DOCTOR	1861	1877	PE\nDATE: 2.3.64	2064-03-02
789	DOCTOR	1877	1886	L Cheeben
789	DOCTOR	3521	3535	Julian CHIPMAN
789	DATE	4452	4461	15.4.2064	2064-04-15
789	DOCTOR	4466	4474	L Vosmus
789	DOCTOR	4474	4495	MONICA Tinn\nIDNUM: 0
790	MEDICALRECORD	1	11	669274.VJL
790	PATIENT	12	25	VERNON, MERRI
790	IDNUM	26	34	66Y27483
790	DATE	50	58	3/2/2064	2064-02-03
790	DOCTOR	724	740	JB\nDATE: 3.1.64	2064-01-03
790	DOCTOR	739	745	Q Hork
791	IDNUM	0	10	14V295991U
791	MEDICALRECORD	25	36	1482958.YGU
791	PATIENT	38	59	Marcon, Tyrone Milton
791	IDNUM	69	77	14V29589
791	STREET	77	85	Leiemair
791	CITY	85	116	GUNNEDAH\nSTATE: ACT\nZIP: 1106
791	DATE	131	140	25/3/2040	2040-03-25
791	TIME	160	179	28/01/2014 at 14:23	2014-01-28T14:23
791	DEPARTMENT	179	246	DARLING POINT\nHOSPITAL: SOUTH WEST HEALTHCARE - WARRNAMBOOL CAMPUS
791	DOCTOR	251	260	Cruz Dohm
791	DATE	1336	1342	1/3/64	2064-03-01
791	DOCTOR	1373	1382	E Gniewek
792	IDNUM	13	23	72R316950D
792	MEDICALRECORD	24	34	726316.YNB
792	PATIENT	35	46	YANEK, TARA
792	IDNUM	58	66	72R31695
792	CITY	73	104	HAY\nSTATE: Victoria\nZIP: 3043
792	DATE	119	128	4/12/2022	2022-12-04
792	DATE	148	157	26/3/2064	2064-03-26
792	DEPARTMENT	162	208	PARKES 8\nHOSPITAL: THE QUEEN ELIZABETH CENTRE
792	DOCTOR	213	238	JEROMY STACEY Mac-DIAMICO
792	DOCTOR	766	814	Louge\nDOCTOR: Garret\nTIME: 0933 on the 24/1/14	2063-01-24T09:00
792	DOCTOR	1888	1917	XN\nDOCTOR: SY\nDATE: 20.3.64	2064-03-20
792	DOCTOR	1912	1922	T Oyemaker
793	IDNUM	13	23	20N336018M
793	MEDICALRECORD	24	35	2053360.CXM
793	PATIENT	37	49	Kwek, Marvin
793	IDNUM	50	75	20N33601\nIDNUM: 20N33601
793	PATIENT	78	85	Bartram
793	CITY	85	123	CABOOLTURE\nSTATE: Tasmania\nZIP: 4365
793	DATE	144	153	27/2/2032	2032-02-27
793	DATE	173	182	29/3/2064	2064-03-29
793	DEPARTMENT	187	242	ST VINCENT'S PATHOLOGY\nHOSPITAL: THE MORNINGTON CENTRE
793	DOCTOR	247	271	VIRGILIO Blake FRANSISCO
793	DOCTOR	302	307	Masin
793	DOCTOR	775	824	Adjamath\nDOCTOR: H Todey\nTIME: 11:10 on 27/1/14	2014-01-27T11:10
793	DATE	1747	1754	30/3/64	2064-03-30
793	DOCTOR	1755	1766	H Foradanin
794	IDNUM	14	24	41E937867X
794	MEDICALRECORD	25	35	411937.XRS
794	PATIENT	37	49	Hipp, WENDIE
794	IDNUM	60	68	41E93786
794	PATIENT	69	74	Calow
794	CITY	74	92	PENGUIN\nZIP: 1429
794	DATE	116	126	13/11/1997	1997-11-13
794	TIME	146	165	23/01/2014 at 08:13	2014-01-23T08:13
794	DEPARTMENT	165	217	Radiation Oncology\nHOSPITAL: DENTAL HEALTH SERVICES
794	DOCTOR	231	255	Dannie Kendrick BARRANCA
794	DATE	304	310	1.3.64	2064-03-01
794	DOCTOR	324	364	Cappleman\nHOSPITAL: DONNYBROOK HOSPITAL
794	DOCTOR	1723	1740	TE\nDATE: 25/3/64	2064-03-25
794	DOCTOR	1770	1780	M Mountain
794	DATE	3743	3749	1.3.64	2064-03-01
795	MEDICALRECORD	1	11	090968.YGO
795	STREET	12	32	Surface, Cassi Hyman
795	IDNUM	33	41	09A96892
795	DATE	57	66	30/3/2064	2064-03-30
795	DATE	127	130	Now	2013-03-09
795	DOCTOR	727	756	CY\nDOCTOR: SG\nDATE: 25.3.64	2064-03-25
795	DOCTOR	780	786	A Gaal
796	IDNUM	13	23	20S659873R
796	MEDICALRECORD	24	35	2076598.UJR
796	PATIENT	37	52	DURETTE, Shelby
796	IDNUM	63	71	20S65987
796	STREET	72	84	Lake Potomac
796	CITY	84	119	DAMPIER\nSTATE: Victoria\nZIP: 2049
796	DATE	134	143	6/12/2004	2004-06-12
796	TIME	162	181	22/01/2014 at 15:47	2014-01-22T15:47
796	DEPARTMENT	181	249	PaLH\nHOSPITAL: EXPRESSBOROUGH DISTRICT HEALTH SERVICE (MARYBOROUGH)
796	DOCTOR	252	265	COLIN HAUSNER
796	DATE	334	341	14.4.64	2064-04-14
796	DATE	384	392	Previous	2063-11-03
796	DOCTOR	882	909	Johnathon\nDOCTOR: G Paynes
796	DOCTOR	928	997	G Mccalebb\nDOCTOR: G Junge\nDOCTOR: G Aroon\nTIME: 16:16 on 22.01.14	2014-01-22T16:20
796	DOCTOR	1558	1587	VD\nDOCTOR: NL\nDATE: 23.3.64	2064-03-23
796	DOCTOR	1582	1594	G Momplaisix
796	IDNUM	3424	3450	20S65987\nIDNUM: 20S65987B
796	DATE	4304	4311	14.4.64	2064-04-14
796	IDNUM	4367	4375	20S65987
797	IDNUM	14	24	77O680931Z
797	MEDICALRECORD	25	36	7756809.JEZ
797	PATIENT	38	50	Bunts, POLLY
797	IDNUM	59	84	77O68093\nIDNUM: 77O68093
797	STREET	87	94	Kingman
797	CITY	94	130	CENTRAL COAST\nSTATE: QLD\nZIP: 3025
797	DATE	154	163	10/3/1978	1978-03-10
797	DATE	183	192	24/3/2064	2064-03-24
797	DEPARTMENT	197	241	8 GOOLAGONG CRESCENT\nHOSPITAL: LAURA CAMPUS
797	DOCTOR	244	275	Una Saoirce\nDOCTOR: XCophannes
797	DOCTOR	267	274	Demeris
797	AGE	353	355	55
797	DOCTOR	954	1001	FO\nDOCTOR: U Snorton\nTIME: 24th of March 2064	2064-07-24T20:
797	DOCTOR	3481	3510	UY\nDOCTOR: KJ\nDATE: 25.3.64	2064-03-25
797	DOCTOR	3505	3516	U Engleffen
798	IDNUM	13	23	35K6009903
798	MEDICALRECORD	24	34	354600.ZYA
798	PATIENT	35	68	Elford\nHOSPITAL: CATHLEEN VIVIEN
798	IDNUM	70	78	35K60099
798	PATIENT	79	87	Hernando
798	CITY	87	129	CAMPBELLTOWN\nSTATE: Queensland\nZIP: 2229
798	DATE	144	153	28/2/2014	2014-02-28
798	DATE	173	182	23/3/2064	2064-03-23
798	DEPARTMENT	187	234	DAYSURGERY UNIT\nHOSPITAL: DAVID BERRY HOSPITAL
798	DOCTOR	235	246	Asa Beauver
798	DOCTOR	729	761	Renita Byron\nDOCTOR: I MDecided
798	DATE	1955	1962	24.3.64	2064-03-24
798	DOCTOR	1964	1989	I Nore\nDOCTOR: I Prenatt
799	MEDICALRECORD	1	12	5602018.MVT
799	PATIENT	13	31	KADLUBOWSKI, LEILA
799	IDNUM	31	56	56C20184\nIDNUM: 56C20184
799	DATE	65	74	26/3/2064	2064-03-26
799	DOCTOR	551	584	N Dado\nTIME: 17:10pm on 20.01.14	2014-01-20T17:10
799	DOCTOR	974	991	SK\nDATE: 25/3/64	2064-03-25
799	DOCTOR	1049	1078	XQ\nDOCTOR: VO\nDATE: 23.3.64	2064-03-23
799	DOCTOR	1102	1109	N Ocano
800	IDNUM	11	21	04Y3229060
800	MEDICALRECORD	21	31	049322.XDR
800	PATIENT	34	50	CONCATELLI, EMIL
800	IDNUM	61	69	04Y32290
800	PATIENT	70	79	Markovich
800	CITY	79	99	SOUTHPORT\nZIP: 3186
800	DATE	123	133	20/12/1987	1987-12-20
800	TIME	153	172	19/01/2014 at 16:17	2014-01-19T16:17
800	DEPARTMENT	172	213	Pathology West\nHOSPITAL: WARREN HOSPITAL
800	DOCTOR	214	224	LANNY WARD
800	DOCTOR	336	345	Fercamast
800	DOCTOR	2057	2086	VJ\nDOCTOR: NP\nDATE: 22.3.64	2064-03-22
800	DOCTOR	2114	2120	C Nath
801	IDNUM	13	23	25P923864N
801	MEDICALRECORD	24	34	256923.UQM
801	PATIENT	36	45	Stratman,
801	IDNUM	62	70	25P92386
801	PATIENT	71	79	N Harvey
801	CITY	79	117	POINT VERNONAS\nSTATE: TZYA\nZIP: 6506
801	DATE	127	136	30/8/2003	2003-08-30
801	TIME	156	175	17/01/2014 at 08:56	2014-01-17T08:56
801	DEPARTMENT	175	253	Tissue Pathology and Diagnostic Oncology\nHOSPITAL: ROYAL NORTH SHORE HOSPITAL
801	DOCTOR	254	387	Keith REFUGIOY BUGIOY BUGIOY BUGIOY BUGIOY BUGIOY BUGIOY BUGIOY BUGIOY BUGIOY BUGIOY BUGIOY BUGIOY BUGIOY BUGIOY BUGIOY BUGIOY BUGIOY
801	DOCTOR	254	282	Keith\nDOCTOR: BUGIOY BUGIOY
801	DOCTOR	1967	1984	LZ\nDATE: 19/3/64	2064-03-19
801	DOCTOR	2115	2122	H Junor
801	DOCTOR	2301	2363	H Delaud\nDOCTOR: H Fe\nDOCTOR: H Delauder\nDOCTOR: H Delauder
802	IDNUM	14	24	83L944823W
802	MEDICALRECORD	25	36	8349448.FHW
802	PATIENT	38	53	CARABALLO, Liam
802	IDNUM	54	79	83L94482\nIDNUM: 83L94482
802	PATIENT	82	89	Nillera
802	CITY	89	136	CONDOBOLIN\nSTATE: Western Australia\nZIP: 3235
802	DATE	157	166	21/9/1984	1984-09-21
802	DEPARTMENT	198	269	3HR STAY SURGICAL UNIT\nHOSPITAL: WEST WIMMERA HEALTH SERVICE - RAINBOW
802	DOCTOR	272	295	Norene Mickey MACHESSKY
802	DOCTOR	2584	2601	OE\nDATE: 16/1/14	2063-01-16
802	DOCTOR	2629	2637	V Teters
803	IDNUM	13	23	31H064971E
803	MEDICALRECORD	24	34	313064.XUD
803	PATIENT	36	58	BOULTINGHOUSE, STEPHAN
803	IDNUM	69	77	31H06497
803	STREET	78	88	W Burville
803	CITY	88	110	KOO-WEE-RUP\nZIP: 3174
803	DATE	134	143	23/3/1988	1988-03-23
803	TIME	163	182	14/01/2014 at 11:33	2014-01-14T11:33
803	DEPARTMENT	182	248	Forensic Medicine\nHOSPITAL: ALBURY WODONGA HEALTH - ALBURY CAMPUS
803	DOCTOR	249	279	Monroe Emanuel\nTIME: 11:00:11	2011-06-11
803	DATE	1431	1439	17/32064	2064-08-17
803	DOCTOR	1844	1861	GS\nDATE: 15.3.64	2064-03-15
803	DOCTOR	2412	2430	YC\nDATE: 17/32064	2064-32064
803	DOCTOR	2461	2469	K Hatman
804	MEDICALRECORD	1	11	529665.UIY
804	PATIENT	11	37	BARNDT, FERMIN LUIGIEFRAIN
804	PATIENT	12	32	BARNDT, FERMIN LUIGI
804	IDNUM	48	56	52Z66583
804	DATE	72	81	18/3/2064	2064-03-18
804	DATE	1740	1747	16/3/64	2064-03-16
804	DOCTOR	1778	1787	Y Derting
805	IDNUM	14	24	10V696897Y
805	MEDICALRECORD	25	35	108696.WXT
805	IDNUM	65	73	10V69689
805	CITY	82	100	THE OAKS\nZIP:1004
805	DATE	124	133	11/7/2001	2001-07-11
805	DATE	153	162	12/3/2064	2064-03-12
805	DEPARTMENT	167	202	IMVS\nHOSPITAL: BRIDGETOWN HOSPITAL
805	DOCTOR	207	219	COLBY Irving
805	DOCTOR	281	288	RANDALL
805	DOCTOR	547	549	CQ
805	DOCTOR	635	687	D Lengacher\nTIME: 10:40 on the 10th of January 2013	2013-01-10T10:40
805	DOCTOR	1790	1807	WA\nDATE: 15.3.64	2064-03-15
805	DOCTOR	1806	1815	D Rueback
805	ORGANIZATION	2733	2777	Target Corporation\nHOSPITAL: DERBY HOSPITAL
806	IDNUM	13	23	68R617945H
806	MEDICALRECORD	24	35	6866179.MPH
806	STREET	36	60	Meals\nDEPARTMENT: Cliff
806	IDNUM	60	68	68R61794
806	PATIENT	69	77	Lancraft
806	CITY	77	122	NARACOORTE\nSTATE: New South Wales\nZIP: 5308
806	DATE	135	144	18/8/1992	1992-08-18
806	TIME	164	183	18/12/2013 at 10:40	2013-12-18T10:40
806	DEPARTMENT	183	244	DICKINSON 2 NORTH\nHOSPITAL: TAMWORTH RURAL REFERRAL HOSPITAL
806	DOCTOR	245	265	LESLIE ALONSO MccIFT
806	DOCTOR	994	1023	MM\nDOCTOR: MK\nDATE: 21.2.63	2063-02-21
806	DOCTOR	1049	1057	S Nannen
807	IDNUM	13	23	89J318804S
807	MEDICALRECORD	24	35	8933188.BKS
807	PATIENT	36	64	Suchecki, COLLEN CristIN NAL
807	IDNUM	77	85	89J31880
807	STREET	86	92	Bridle
807	CITY	97	139	WARWICK\nSTATE: South Australia\nZIP: 4694
807	DATE	154	163	27/7/2033	2033-07-27
807	TIME	183	202	12/04/2012 at 14:22	2012-04-12T14:22
807	DEPARTMENT	202	256	St Vincent\nHOSPITAL: TUMBARUMBA MULTI PURPOSE SERVICE
807	DOCTOR	257	277	NOLAN Thaddererectum
807	DATE	603	607	2062	2062
807	DOCTOR	2412	2429	EO\nDATE: 14.6.62	2062-06-14
807	DOCTOR	2458	2468	X Petretti
807	DOCTOR	3126	3160	LOU ARENSTAM\nDOCTOR: LOU ARENSTAM
808	IDNUM	0	10	47F338838B
808	MEDICALRECORD	25	35	472338.WQG
808	PATIENT	36	52	Selvig, Antonoun
808	IDNUM	64	72	47F33886
808	STREET	73	80	Rowhook
808	CITY	80	100	THIRLMERE\nZIP: 6229
808	DATE	124	132	3/8/2009	2009-03-08
808	TIME	152	171	03/09/2012 at 09:21	2012-09-03T09:21
808	DEPARTMENT	171	275	Cure For Life Foundation Neuro-oncology Laboratory Adult Cancer\nHOSPITAL: TRUNDLE MULTI PURPOSE SERVICE
808	DOCTOR	280	304	JOHNATHON VINCENZO BURGY
808	DOCTOR	458	510	RH\nDOCTOR: RH\nDOCTOR: RH\nDOCTOR: RH\nTIME: 1.3.63	2063-01-03
808	DOCTOR	1839	1856	UH\nDATE: 5/11/62	2062-11-05
808	DOCTOR	1892	1903	L Klingaman
809	IDNUM	13	23	68W939710M
809	MEDICALRECORD	24	34	688939.TEB
809	PATIENT	36	47	Niten, BILL
809	IDNUM	58	66	68W93971
809	STREET	67	85	West Linden Church
809	CITY	85	133	KORUMBURRA\nSTATE: Northern Territory\nZIP: 4107
809	DATE	148	157	4/10/1997	1997-10-04
809	TIME	177	196	03/09/2012 at 09:24	2012-09-03T09:24
809	DEPARTMENT	196	277	Pathology West\nHOSPITAL: ROBINVALE DISTRICT HEALTH SERVICES - MANANGATANG CAMPUS
809	DOCTOR	282	299	BURTON Duane MOIR
809	DOCTOR	299	323	Penhall\nDOCTOR: STEWART
809	DOCTOR	474	476	XU
809	DOCTOR	2101	2118	KP\nDATE: 11.5.62	2062-05-11
809	DOCTOR	2151	2163	Z Bruckmeier
810	IDNUM	14	24	52X370978S
810	MEDICALRECORD	25	36	5293709.UWS
810	PATIENT	37	60	Echinton, JACKLYN AFTON
810	IDNUM	61	120	52X37097\nIDNUM: 52X37097\nIDNUM: 52X37097\nIDNUM: 52X37097
810	PATIENT	89	98	Rodriques
810	CITY	98	137	ULLADULLA\nSTATE: Queensland\nZIP: 5307
810	DATE	161	170	11/5/1991	1991-11-05
810	TIME	190	209	10/09/2012 at 14:16	2012-09-10T14:16
810	DEPARTMENT	209	257	MEDIC/SURGERY WARD\nHOSPITAL: BUNDABERG HOSPITAL
810	DOCTOR	264	282	ERIN Minga ZEGARRA
810	DOCTOR	302	307	Somes
810	DOCTOR	446	471	YQ\nDOCTOR: YQ\nTIME: 11:
810	DOCTOR	1968	1986	RP\nDATE: 15.11.62	2062-11-15
810	DOCTOR	2248	2266	RA\nDATE: 13/11/62	2062-11-13
810	DOCTOR	2301	2314	O Kranawetter
810	DOCTOR	4021	4031	O Haarstad
811	MEDICALRECORD	1	12	9426727.XNO
811	PATIENT	13	28	Pasquale, Rusty
811	IDNUM	28	53	94G67278\nIDNUM: 94G67278
811	DATE	62	71	11/9/2062	2062-09-11
811	DOCTOR	1423	1440	RT\nDATE: 11.7.62	2062-07-11
811	DOCTOR	1439	1449	Y Al-mansa
812	IDNUM	13	23	42C692843X
812	MEDICALRECORD	24	35	4206928.MJX
812	PATIENT	37	53	Celmer, CHER LEE
812	IDNUM	64	72	42C69284
812	STREET	73	87	Fashion Island
812	CITY	87	123	CESSNOCK\nSTATE: Victoria\nZIP: 3855
812	DATE	138	147	16/9/2002	2002-09-16
812	TIME	167	186	05/09/2012 at 19:24	2012-09-05T19:24
812	DEPARTMENT	186	252	Forensic Medicine\nHOSPITAL: LOURDES HOSPITAL & COMMUNITY SERVICES
812	DOCTOR	255	270	Efolds Mcdicald
812	DOCTOR	306	314	Everette
812	DOCTOR	3944	3961	TB\nDATE: 8.11.62	2062-11-08
812	DOCTOR	3961	3974	M Clukenstein
812	DATE	5146	5153	22/4/64	2064-04-22
813	MEDICALRECORD	2	12	471143.BCD
813	PATIENT	13	26	BLUTO, Golden
813	IDNUM	27	35	47D14300
813	DATE	51	61	13/11/2062	2062-11-13
813	DOCTOR	164	166	NK
813	DOCTOR	1262	1279	HH\nDATE: 8/11/62	2062-11-08
813	DOCTOR	1312	1323	K Burkowski
814	IDNUM	13	23	95Z164169L
814	MEDICALRECORD	24	35	9591641.RYL
814	PATIENT	36	48	CALLES, XAND
814	IDNUM	58	83	95Z16416\nIDNUM: 95Z16416
814	STREET	86	92	Throne
814	CITY	92	124	INVERLOCH\nSTATE: TAS\nZIP: 3813
814	DATE	148	157	1/11/1994	1994-11-01
814	DATE	174	184	11/12/2062	2062-11-12
814	DEPARTMENT	189	234	CPC Pathology\nHOSPITAL: ROYAL PERTH HOSPITAL
814	DOCTOR	237	260	Terader DERRICK Carrico
814	DATE	337	344	29.4.64	2064-04-29
814	DOCTOR	414	429	GI\nDOCTOR: RUF
814	DOCTOR	2778	2796	SW\nDATE: 13.11.62	2062-11-13
814	DOCTOR	2845	2863	KW\nDATE: 14.11.62	2062-11-14
814	DOCTOR	2894	2903	Z Gaulden
814	DATE	4671	4678	29.4.64	2064-04-29
815	IDNUM	13	23	16Q765027X
815	MEDICALRECORD	24	35	1667650.FUX
815	PATIENT	37	58	BARKETT, HAMISH TWANA
815	IDNUM	69	77	16Q76502
815	STREET	78	92	Warburton Oaks
815	CITY	92	129	STAWELL\nSTATE: Queensland\nZIP: 2607
815	DATE	144	153	23/6/1997	1997-06-23
815	DATE	173	183	12/11/2062	2062-12-11
815	DEPARTMENT	188	237	Med Onc\nHOSPITAL: BARADINE MULTI PURPOSE SERVICE
815	DOCTOR	238	250	RORY Ariston
815	DOCTOR	510	512	AR
815	DOCTOR	1289	1323	E Cambria\nTIME: 14.12 on 10.09.12	2012-09-10T14:12
815	DOCTOR	3357	3375	DQ\nDATE: 13.11.62	2062-11-13
815	DOCTOR	3404	3413	E Braziel
816	IDNUM	14	24	74N785076F
816	MEDICALRECORD	25	36	7457850.UPF
816	PATIENT	38	51	Wela, Milovan
816	IDNUM	62	70	74N78507
816	PATIENT	71	80	Luddenham
816	CITY	80	111	INVERELL\nSTATE: TAS\nZIP: 2401
816	DATE	126	135	11/5/2015	2015-11-05
816	TIME	155	174	12/09/2012 at 09:49	2012-09-12T09:49
816	DEPARTMENT	174	213	Hereditary\nHOSPITAL: CORRIGIN HOSPITAL
816	DOCTOR	214	240	Arlie BENTON PATTON PINDIR
816	DOCTOR	238	262	MITCHEL\nDOCTOR: MITCHEL
816	DOCTOR	427	429	IJ
816	DOCTOR	852	870	JS\nDATE: 15.11.62	2062-11-15
816	DOCTOR	901	911	S Spearing
817	IDNUM	13	23	22J806134O
817	MEDICALRECORD	24	35	2238061.JKO
817	PATIENT	36	52	SCHWEIM, CandOTT
817	IDNUM	54	79	22J80613\nIDNUM: 22J80613
817	STREET	82	87	Osmer
817	CITY	87	128	CENTRAL COAST\nSTATE: Victoria\nZIP: 4703
817	DATE	152	160	7/1/2000	2000-01-07
817	TIME	180	199	12/09/2012 at 18:10	2012-09-12T18:10
817	DEPARTMENT	199	246	Anatomical Pathology\nHOSPITAL: WARREN HOSPITAL
817	DOCTOR	253	260	Tammera
817	DATE	344	351	4.12.62	2062-12-04
817	DOCTOR	448	450	IX
817	DOCTOR	3856	3874	YO\nDATE: 15.11.62	2062-11-15
817	DOCTOR	3905	3915	G Hermenau
817	DATE	5900	5907	4.12.62	2062-12-04\nDOCTOR: G Scheu
817	DATE	6004	6012	26.11.62	2062-11-26
818	MEDICALRECORD	1	12	2756887.LCN
818	PATIENT	12	23	KRUL, Brack
818	IDNUM	24	49	27N68874\nIDNUM: 27N68874
818	DATE	58	68	16/11/2062	2062-11-16
818	DOCTOR	827	895	H Conti\nDOCTOR: H Salameh\nDOCTOR: H Twardy\nTIME: 9.30 on 12.09.12	2012-09-12T09:30
818	DOCTOR	2675	2693	VO\nDATE: 15.11.62	2062-11-15
818	DOCTOR	2724	2732	H Notley
819	IDNUM	14	24	85J609709W
819	MEDICALRECORD	25	36	8536097.AYW
819	PATIENT	38	50	NUTTER, Khad
819	IDNUM	70	78	85J60970
819	PATIENT	79	88	Leechpool
819	CITY	88	124	ALICE SPRINGS\nSTATE: TAS\nZIP: 2902
819	DATE	139	148	21/3/1997	1997-03-21
819	TIME	168	187	14/09/2012 at 18:41	2012-09-14T18:41
819	DEPARTMENT	187	231	SEALS central\nHOSPITAL: WOLLONGONG HOSPITAL
819	DOCTOR	236	256	Freeman Myles Potvin
819	DOCTOR	501	503	QS
819	DOCTOR	2268	2286	KU\nDATE: 19/11/62	2062-11-19
819	DOCTOR	2317	2325	W Bailey
820	IDNUM	13	23	43F730867E
820	MEDICALRECORD	24	35	4327308.PTE
820	PATIENT	37	46	MEDI, RAY
820	IDNUM	57	65	43F73086
820	PATIENT	66	70	Raub
820	CITY	70	97	TUMUT\nSTATE: SA\nZIP: 5332
820	DATE	112	121	10/5/1996	1996-10-05
820	TIME	141	160	18/09/2012 at 13:14	2012-09-18T13:14
820	DEPARTMENT	160	224	DICKINSON 3 SOUTH\nHOSPITAL: WAGGA WAGGA RURAL REFERRAL HOSPITAL
820	DOCTOR	225	248	Jeffery AUGUSTINA DYITH
820	DATE	304	311	4.12.62	2062-12-04
820	DOCTOR	455	457	QI
820	DOCTOR	1590	1608	LO\nDATE: 21.11.62	2062-11-21
820	DOCTOR	1637	1644	K Kiesz
820	DOCTOR	2110	2118	K Raczka
820	DATE	2923	2930	4.12.62	2062-12-04
821	MEDICALRECORD	2	12	648320.TEO
821	PATIENT	13	26	Gregoire, SAM
821	IDNUM	27	35	64W32071
821	DATE	51	59	5/8/2064	2064-05-08
821	DATE	118	126	5.8.2064	2064-05-08
821	DATE	1878	1885	19/3/64	2064-03-19
821	DOCTOR	1916	1929	Y Jasionowski
821	DOCTOR	2108	2134	Y Halonen\nDOCTOR: Y 91552
821	DATE	3602	3610	5.8.2064	2064-05-08
821	HOSPITAL	3625	3673	AUSTIN HEALTH - HEIDELBERG REPATRIATION HOSPITAL
821	DOCTOR	3687	3707	Bash\nDATE: 5.6.2064	2064-05-06
821	HOSPITAL	3749	3775	HILLSTON DISTRICT HOSPITAL
822	IDNUM	13	23	11T351773Y
822	MEDICALRECORD	24	35	1173517.TKY
822	PATIENT	36	52	LASEMENT, SHONNA
822	IDNUM	63	71	11T35177
822	PATIENT	72	79	Periton
822	CITY	79	110	REDCLIFFE\nSTATE: WA\nZIP: 1160
822	DATE	124	133	15/6/1986	1986-06-15
822	TIME	153	172	04/03/2014 at 16:23	2014-03-04T16:23
822	DEPARTMENT	172	222	Orana\nHOSPITAL: CRANBOURNE INTEGRATED CARE CENTRE
822	DOCTOR	229	253	JINGALU GASTON Marasigan
822	DOCTOR	1428	1456	LV\nDOCTOR: XU\nDATE: 7.5.64	2064-05-07
822	DOCTOR	1481	1489	E Grossi
823	MEDICALRECORD	1	12	8511911.UJT
823	PATIENT	12	25	TidLOW, Helga
823	IDNUM	39	64	85C19117\nIDNUM: 85C19117
823	DATE	73	81	5/9/2064	2064-05-09
823	DOCTOR	1466	1494	XE\nDOCTOR: HX\nDATE: 5.7.64	2064-07-05
823	DOCTOR	1517	1526	S Luchini
826	IDNUM	14	24	90G9737807
826	MEDICALRECORD	25	36	9029737.WBS
826	PATIENT	37	53	Giffach, Pennies
826	IDNUM	63	71	90G97378
826	PATIENT	72	78	Yalkin
826	CITY	78	120	LAKES ENTRANCE\nSTATE: Victoria\nZIP: 5033
826	DATE	135	145	11/10/2000	2000-11-10
826	TIME	165	184	06/02/2014 at 13:30	2014-02-06T13:30
826	DEPARTMENT	184	250	ACUTECARE WARD\nHOSPITAL: MONASH MEDICAL CENTRE - MOORABBIN CAMPUS
826	DOCTOR	251	263	X\nENDED_XAP
826	DOCTOR	5585	5592	X Chill
826	DATE	9919	9926	13/4/64	2064-04-13
826	ORGANIZATION	9954	10006	Wachovia Corporation\nDEPARTMENT: KALAMUNDA HOSPITAL
826	DATE	10857	10863	5/6/64	2064-06-05
827	IDNUM	13	23	48C094848A
827	MEDICALRECORD	24	35	4810948.LWA
827	PATIENT	37	53	LINTHICUM, TEDDY
827	IDNUM	64	72	48C09484
827	STREET	73	86	Lower Bedford
827	CITY	87	116	INGHAM\nSTATE: QLD\nZIP: 3889
827	DATE	131	140	11/9/2000	2000-09-11
827	TIME	160	179	23/01/2014 at 11:30	2014-01-23T11:30
827	DEPARTMENT	179	218	UROLOGY OPD\nHOSPITAL: BUNBURY HOSPITAL
827	DOCTOR	224	236	KIETH HACKEN
827	DATE	5368	5374	3/3/64	2064-03-03
828	IDNUM	13	23	12M8331588
828	MEDICALRECORD	24	35	1248331.NVV
828	IDNUM	62	70	12M83315
828	STREET	71	85	Southern Night
828	CITY	85	119	GEORGE TOWN\nSTATE: VIC\nZIP: 3448
828	DATE	134	143	30/3/1989	1989-03-30
828	TIME	163	182	30/01/2014 at 14:00	2014-01-30T14:00
828	DEPARTMENT	182	232	Envoi Pathology\nHOSPITAL: COBAR DISTRICT HOSPITAL
828	DOCTOR	233	256	CHRISTOPHER DELMAR VILL
828	DOCTOR	2803	2809	Cessor
828	DATE	5335	5341	5/4/64	2064-05-04
829	IDNUM	14	24	27Q615755U
829	MEDICALRECORD	25	36	2766157.PNU
829	PATIENT	38	49	STYERS, Del
829	IDNUM	60	68	27Q61575
829	PATIENT	69	75	Blease
829	CITY	75	106	NARROGIN\nSTATE: VIC\nZIP: 3758
829	DATE	121	129	9/2/2012	2012-09-02
829	TIME	149	168	21/01/2014 at 10:24	2014-01-21T10:24
829	DEPARTMENT	168	232	POW L7 CONSULTING ROOMS\nHOSPITAL: MERRIWA MULTI PURPOSE SERVICE
829	DOCTOR	233	263	JACINTO Emerson\nDOCTOR: JACIN
829	DOCTOR	623	645	F Sacks\nDATE: 23.3.64	2064-03-23
829	DOCTOR	1917	1927	F Bighetti
829	DATE	3280	3287	26/3/64	2064-03-26
830	IDNUM	13	23	75M7368131
830	MEDICALRECORD	24	35	7547368.EID
830	PATIENT	36	50	STABS, Maryl G
830	IDNUM	62	70	75M73681
830	STREET	71	79	Blackmar
830	CITY	79	126	SUFFOLK PARK\nSTATE: South Australia\nZIP: 4374
830	DATE	141	150	28/3/2024	2024-03-28
830	TIME	170	189	19/12/2013 at 18:00	2013-12-19T18:00
830	DEPARTMENT	189	234	INTENSIVECARE UNIT\nHOSPITAL: GANVON HOSPITAL
830	DOCTOR	238	257	Marion HASSIE MOCZY
830	DATE	6629	6636	26/2/63	2063-02-26
831	IDNUM	13	23	49W586122Y
831	MEDICALRECORD	24	35	4985861.FHY
831	PATIENT	37	53	Picciano, Nestor
831	IDNUM	64	72	49W58612
831	PATIENT	73	81	Bouterse
831	CITY	81	109	NERANG\nSTATE: SA\nZIP: 2229
831	DATE	124	133	26/2/2031	2031-02-26
831	TIME	153	172	17/12/2013 at 12:10	2013-12-17T12:10
831	DEPARTMENT	172	223	DICKINSON 2 NORTH\nHOSPITAL: KARRATHA HEALTH CAMPUS
831	DOCTOR	229	245	Dwain GAIL Hasse
831	DATE	349	352	Now	2013-09-03
831	DATE	4362	4372	19/12/2060	2060-12-19
831	DATE	5226	5233	25/2/63	2063-02-25\nDATE: 12/2/63=>2063-06-02
832	MEDICALRECORD	2	13	5403687.HZX
832	DOCTOR	13	35	Oillard\nDOCTOR: WOUDS
832	IDNUM	32	40	54A36872
832	DATE	56	65	19/2/2063	2063-02-19
832	DOCTOR	1637	1646	N. Aiello
832	DATE	2679	2686	15/2/63	2063-02-15
833	IDNUM	13	23	02W388887F
833	MEDICALRECORD	24	35	0283888.WUF
833	PATIENT	36	50	RINDONE, ELMER
833	IDNUM	61	69	02W38888
833	PATIENT	70	78	Mishawum
833	CITY	78	126	ENCOUNTER BAY\nSTATE: South Australia\nZIP: 1314
833	DATE	141	149	9/1/2027	2027-01-09
833	TIME	169	188	12/12/2013 at 12:00	2013-12-12T12:00
833	DEPARTMENT	188	237	UROLOGY OPD\nHOSPITAL: ST GEORGE'S HEALTH SERVICE
833	DOCTOR	238	258	SCOT VIRGILIO LEADOR
833	DATE	3881	3888	19/2/63	2063-02-19
834	IDNUM	13	23	76F2281970
834	MEDICALRECORD	23	34	7622281.XTV
834	PATIENT	36	47	Tedesko,ARY
834	IDNUM	61	69	76F22819
834	STREET	70	75	Rooke
834	CITY	75	104	BUNBURY\nSTATE: WA\nZIP: 2304
834	DATE	119	128	24/9/2014	2014-09-24
834	TIME	148	167	11/12/2013 at 09:34	2013-12-11T09:34
834	DEPARTMENT	167	219	MACQUARIEWARD\nHOSPITAL: LEIGH CREEK HEALTH SERVICES
834	DOCTOR	220	255	KIRK Joesol\nHOSPITAL: CHIRK Joesol
834	DOCTOR	487	507	Mcfangam\nDOCTOR: U.
834	STREET	603	610	Landrey
834	DOCTOR	809	827	Rebold\nDOCTOR: U.
834	DOCTOR	1028	1075	Homme\nDOCTOR: Homme\nTIME: 10:28am on 11/12/13	2013-12-11T10:28
834	DOCTOR	1274	1289	VILL\nDOCTOR: V
834	DOCTOR	1497	1544	Yelling\nDOCTOR: Yel\nTIME: 10:28am on 11/12/13	2013-12-11T10:28
834	DOCTOR	2195	2213	Kai\nTIME: 01.5.13	2013-05-01T01:K
834	DATE	4757	4766	20/2/2063	2063-02-20
835	IDNUM	14	24	81J0007949
835	MEDICALRECORD	25	36	8130007.ZLZ
835	PATIENT	38	46	Montfort
835	IDNUM	65	73	81J00079
835	PATIENT	73	81	Porsford
835	CITY	83	143	QUAKERS HILL\nSTATE: Australian Capital Territory\nZIP: 4873
835	DATE	158	167	17/7/2009	2009-07-17
835	TIME	187	206	05/12/2013 at 13:17	2013-12-05T13:17
835	DEPARTMENT	206	270	OPERATING THEATRES\nHOSPITAL: MANILLO DISTRICT MEMORIAL HOSPITAL
835	DOCTOR	284	306	Judson\nDOCTOR: ABVORA
835	DOCTOR	1672	1683	V Gonterman
835	DATE	3294	3301	2/12/63	2063-02-12
835	DATE	3534	3541	18/2/63	2063-02-18
836	IDNUM	13	23	55T840103U
836	MEDICALRECORD	24	35	5578401.BKU
836	PATIENT	36	51	Eisten, ARNOLDO
836	IDNUM	65	73	55T84010
836	PATIENT	74	83	Levington
836	CITY	83	128	SPRINGWOOD\nSTATE: South Australia\nZIP: 2576
836	DATE	143	153	23/12/2036	2036-12-23
836	TIME	173	192	04/12/2013 at 12:00	2013-12-04T12:00
836	DEPARTMENT	192	232	Envoi Specialist\nHOSPITAL: LAURA CAMPUS
836	DOCTOR	233	264	Pablo CLARKES DISTRICT HOSPITAL
836	DOCTOR	2680	2691	N Hergenier
836	DATE	4144	4151	13/2/63	2063-02-13
837	IDNUM	13	23	02P970162D
837	MEDICALRECORD	24	34	025970.EQF
837	PATIENT	36	53	EBERHART, SHEILAH
837	IDNUM	64	72	02P97016
837	STREET	72	81	Alkbackie
837	CITY	81	105	SAINT GEORGES\nZIP: 2365
837	DATE	135	144	25/9/1999	1999-09-25
837	TIME	164	183	25/06/2013 at 08:59	2013-06-25T08:59
837	DEPARTMENT	183	244	ST GEORGE PRIVATE\nHOSPITAL: SIMANTUM MORTLAKE HEALTH SERVICE
837	DOCTOR	249	256	Derrick
837	DATE	316	323	10/9/63	2063-09-10
837	DOCTOR	2060	2077	DQ\nDATE: 27/8/63	2063-08-27
837	DOCTOR	2109	2119	C Mcdevitt
837	DATE	4121	4128	30/8/63	2063-08-30
837	DATE	4684	4691	10.9.63	2063-09-10
837	HOSPITAL	4692	4734	ROYAL HOSPITAL FOR WOMEN\nDOCTOR: C Citill
837	HOSPITAL	4860	4876	B5\nHOSPITAL: B8
838	IDNUM	0	27	23G57101\nIDNUM: 23G571010O
838	MEDICALRECORD	25	35	232571.BEB
838	PATIENT	36	56	MEZZANOTZRE, Pearlie
838	IDNUM	67	75	23G57101
838	STREET	75	81	Winlow
838	CITY	83	116	KORUMBURRA\nSTATE: VIC\nZIP: 3144
838	DATE	131	140	27/5/2036	2036-05-27
838	TIME	160	179	09/07/2013 at 12:19	2013-07-09T12:19
838	DEPARTMENT	179	226	DICKINSON 3 NORTH\nHOSPITAL: PETER JAMES CENTRE
838	DOCTOR	227	255	Alonso Robie Adan-NEY MESTOR
838	DATE	325	332	18/9/63	2063-09-18
838	DOCTOR	1897	1926	KF\nDOCTOR: TQ\nDATE: 12.9.63	2063-09-12
838	DOCTOR	1951	1959	D Tinkle
838	DATE	3518	3525	18/9/63	2063-09-18
838	DATE	3692	3699	24.9.63	2063-09-24
838	HOSPITAL	3721	3759	EAST WIMMERA HEALTH SERVICE - CHARLTON
839	IDNUM	13	23	81D592178W
839	MEDICALRECORD	24	35	8115921.TWW
839	PATIENT	36	64	Steinberg\nPATIENT: Katherly
839	IDNUM	72	80	81D59217
839	STREET	81	94	Lower Bedford
839	CITY	95	123	GOOLWA\nSTATE: WA\nZIP: 2047
839	DATE	138	147	16/4/2022	2022-04-16
839	TIME	167	186	05/10/2012 at 14:57	2012-10-05T14:57
839	DEPARTMENT	186	232	UROLOGY OPD\nHOSPITAL: TUMUT DISTRICT HOSPITAL
839	DOCTOR	233	250	Jeremiah ELMO FAV
839	DOCTOR	289	296	Brittle
839	DOCTOR	501	503	MP
839	DOCTOR	2268	2286	HF\nDATE: 12.10.62	2062-12-10
839	DOCTOR	2321	2329	V Sultan
839	DATE	5007	5015	18.10.63	2063-10-18
839	DEPARTMENT	5060	5070	DAYSURGERY
839	DOCTOR	6009	6070	Stewart\nDOCTOR: V Papaic\nHOSPITAL: NAMBOUR GENERAL HOSPITAL
840	IDNUM	14	24	39Z513136F
840	MEDICALRECORD	25	35	399513.EIR
840	PATIENT	37	52	KRALIK, Claudio
840	IDNUM	63	71	39Z51313
840	STREET	72	80	Mcdewell
840	CITY	80	126	HAHNDORF\nSTATE: Northern Territory\nZIP: 6628
840	DATE	141	150	13/2/2007	2007-02-13
840	TIME	170	189	19/09/2012 at 13:56	2012-09-19T13:56
840	DEPARTMENT	189	247	Douglass Hanly Moir\nHOSPITAL: ST HELENS DISTRICT HOSPITAL
840	DOCTOR	252	266	MILES Jeremiah
840	DATE	320	327	17.1.62	2062-01-17
840	DATE	354	362	28.12.62	2062-12-28
840	DOCTOR	486	488	KD
840	DOCTOR	1368	1386	TZ\nDATE: 22.11.62	2062-11-22
840	DOCTOR	1415	1424	K Robbins
840	DOCTOR	3400	3436	K Magnan\nDOCTOR: OPERATING THEATRES
840	DATE	3679	3687	21.12.62	2062-12-21
840	DOCTOR	3693	3722	FAUSTO KX\nDOCTOR: Anatomical
840	DOCTOR	4877	4903	JA\nDOCTOR: DONN\nTIME: 19
840	DATE	5978	5982	2061	2061
840	DOCTOR	6415	6423	Violette
840	DATE	6435	6443	previous	2061-12-09
840	DATE	6674	6682	28.12.62	2062-12-28
840	DOCTOR	6684	6728	K Tuffey\nHOSPITAL: VICTORIAN HEART HOSPITAL
840	HOSPITAL	6889	6904	GATTON HOSPITAL
840	DATE	7355	7362	17.1.62	2062-01-17
840	DOCTOR	7826	7833	K Bruss
841	MEDICALRECORD	1	11	441495.UKJ
841	PATIENT	12	26	MOUNGER, BRYAN
841	IDNUM	27	35	44D49574
841	DATE	51	60	16/7/2063	2063-07-16
841	DOCTOR	621	783	SOF; 7 to 11 - the entire specimen AE; 11 to 13 - representative sections of tumour; 13 - representative section of tumour; 14 - representative section of tumour.
841	DOCTOR	621	624	SOF
841	DOCTOR	790	797	K Sharr
841	IDNUM	1285	1293	44D49574
842	MEDICALRECORD	1	12	1842341.MIZ
842	PATIENT	13	29	Mcgaughan, CYRUS
842	IDNUM	30	38	18M23414
842	DATE	54	64	22/11/2062	2062-11-22
842	DOCTOR	194	196	MO
842	DOCTOR	621	639	YE\nDATE: 21.11.62	2062-11-21
842	DOCTOR	668	677	D Sumstad
843	MEDICALRECORD	2	13	6632551.BDH
843	PATIENT	14	24	Chor, VINA
843	IDNUM	25	33	66I25510
843	DATE	49	59	29/11/2062	2062-11-29
843	DOCTOR	820	838	LR\nDATE: 26/11/62	2062-11-26
843	DOCTOR	839	847	R Nberry
844	MEDICALRECORD	1	11	714037.UDV
844	PATIENT	11	26	MimA, SATURNINA
844	IDNUM	28	53	71M03771\nIDNUM: 71M03771
844	DATE	62	72	29/11/2062	2062-11-29
844	DATE	132	136	2056	2056
844	DOCTOR	260	262	IU
844	DOCTOR	557	608	Ramjan\nDOCTOR: S Schmunk\nTIME: 16:20pm on 21.9.12	2012-09-21T16:20
844	DOCTOR	775	793	JS\nDATE: 26.11.62	2062-11-26
844	DOCTOR	825	836	S Schmucker
845	IDNUM	13	23	29J158876P
845	MEDICALRECORD	24	35	2931588.SQP
845	PATIENT	36	64	Saluben, Clifford\nZIP: 3364
845	IDNUM	66	74	29J15887
845	CITY	81	124	SEA LAKE\nSTATE: New South Wales\nZIP: 2404
845	DATE	139	148	20/9/2013	2013-09-20
845	TIME	168	187	24/09/2012 at 19:59	2012-09-24T19:59
845	DEPARTMENT	199	217	MEDIC/SURGERY WARD
845	DOCTOR	217	239	ROYAL WILBUR Entrieman
845	DOCTOR	1637	1655	KR\nDATE: 27.11.62	2062-11-27
845	DOCTOR	1684	1693	H Behanna
846	IDNUM	14	24	87F179924Y
846	MEDICALRECORD	25	36	8721799.HLY
846	PATIENT	38	52	PLAINY, KAREEN
846	IDNUM	63	71	87F17992
846	PATIENT	72	79	Storrie
846	CITY	79	122	BOWRAL\nSTATE: Western Australia\nZIP: 4163
846	DATE	137	145	8/5/1988	1988-05-08
846	DATE	165	175	26/11/2062	2062-11-26
846	DEPARTMENT	180	231	MOLECULAR AND PUBLICION\nHOSPITAL: GOSFORD HOSPITAL
846	DOCTOR	284	298	DONNY Columbus
846	DOCTOR	1458	1476	YD\nDATE: 27.11.62	2062-11-27
846	DOCTOR	1897	1909	V Rajaratnam
847	IDNUM	13	23	08W779782J
847	MEDICALRECORD	24	35	0887797.VHJ
847	PATIENT	37	51	Morgia, Karrak
847	IDNUM	52	77	08W77978\nIDNUM: 08W77978
847	STREET	80	89	Bass Lake
847	CITY	89	120	BELLINGEN\nSTATE: NT\nZIP: 3563
847	DATE	144	153	19/3/1990	1990-03-19
847	TIME	173	192	25/09/2012 at 16:47	2012-09-25T16:47
847	DEPARTMENT	192	239	Molecular Oncology\nHOSPITAL: KONDININ HOSPITAL
847	DOCTOR	242	288	VANITA LAREE McGEE\nDOCTOR: VANITA LAREE McGEE
847	DOCTOR	388	390	PT
847	DOCTOR	2664	2682	ZK\nDATE: 29.11.62	2062-11-29
847	DOCTOR	2682	2689	A Joins
848	MEDICALRECORD	1	11	567700.WKC
848	IDNUM	28	36	56S70084
848	DATE	37	45	2/4/2062	2062-02-04
848	DOCTOR	1523	1541	IU\nDATE: 29/11/62	2062-11-29
848	DOCTOR	1573	1580	P Neddo
849	IDNUM	14	24	20C640140M
849	MEDICALRECORD	25	36	2006401.MBM
849	PATIENT	38	56	ASMAN, TARKA SHAWN
849	IDNUM	67	75	20C64014
849	STREET	76	85	Ravenhill
849	CITY	85	124	GLADSTONE\nSTATE: Queensland\nZIP: 2793
849	DATE	139	148	20/2/1999	1999-02-20
849	DEPARTMENT	180	251	MEDIC/SURGERYWARD\nHOSPITAL: GOULBURN VALLEY HEALTH - SHEPPARTON CAMPUS
849	DOCTOR	252	276	Malcolm JEROLD GOUSSKHOR
849	DOCTOR	636	638	JM
849	DOCTOR	2247	2265	KZ\nDATE: 30.11.62	2062-11-30
849	DOCTOR	2297	2306	D Balcomb
849	DATE	4104	4108	2059	2059
849	DOCTOR	5864	5869	D Kun
850	IDNUM	13	23	35G422857L
850	MEDICALRECORD	24	35	3524228.OTL
850	PATIENT	37	50	URSERY, Irvin
850	IDNUM	61	69	35G42285
850	PATIENT	70	75	Rance
850	CITY	75	112	GREENWELL POINT\nSTATE: SA\nZIP: 3956
850	DATE	127	136	27/4/1981	1981-04-27
850	TIME	156	175	03/10/2012 at 09:52	2012-10-03T09:52
850	DEPARTMENT	175	215	Immunology\nHOSPITAL: LONGREACH HOSPITAL
850	DOCTOR	216	231	CLAUD LIZATTACH
850	DOCTOR	429	431	XU
850	DOCTOR	2399	2416	KP\nDATE: 5/12/62	2062-12-05
850	DOCTOR	2444	2453	I Hodgdon
851	IDNUM	14	24	82C443815U
851	MEDICALRECORD	25	36	8204438.DOU
851	PATIENT	38	51	POLKA, SHARYN
851	IDNUM	52	104	82C44381\nIDNUM: 82C44381\nIDNUM: 82C44381\nPATIENT:
851	PATIENT	80	86	Lovers
851	CITY	86	123	DEVONPORT\nSTATE: Victoria\nZIP: 3777
851	DATE	147	155	3/3/1995	1995-03-03
851	DEPARTMENT	187	232	DICKINSON 3 NORTH\nHOSPITAL: WHYALLA HOSPITAL
851	DOCTOR	239	260	Lynell TOMIKA SADVARY
851	DATE	332	340	12.11.63	2063-12-11
851	DOCTOR	2070	2099	LV\nDOCTOR: PZ\nDATE: 15.1.62	2062-01-15
851	DOCTOR	2128	2137	W Kaldahl
851	DATE	3933	3941	12.11.63	2063-12-11
852	IDNUM	13	23	66M382115P
852	MEDICALRECORD	24	35	6643821.ENP
852	PATIENT	36	59	STOYER, Cristese Arquea
852	IDNUM	60	119	66M38211\nIDNUM: 66M38211\nIDNUM: 66M38211\nIDNUM: 66M38211
852	PATIENT	88	93	Escot
852	CITY	93	127	PICTON\nSTATE: Tasmania\nZIP: 3717
852	DATE	151	160	17/6/2001	2001-06-17
852	TIME	180	199	08/10/2012 at 16:16	2012-10-08T16:16
852	DEPARTMENT	199	240	EMERGENCY\nHOSPITAL: HEYWOOD RURAL HEALTH
852	DOCTOR	247	262	Eldridge SCHMAL
852	DOCTOR	2467	2485	IQ\nDATE: 12/10/62	2062-12-10
852	DOCTOR	2516	2525	P Parnell
853	IDNUM	13	23	61Q164822O
853	MEDICALRECORD	24	35	6161648.GFO
853	PATIENT	37	48	Guay, LUCIE
853	IDNUM	59	67	61Q16482
853	PATIENT	68	77	W Goodman
853	CITY	77	112	COLAC\nSTATE: Queensland\nZIP: 6509
853	DATE	127	136	12/3/2000	2000-03-12
853	TIME	156	175	04/10/2012 at 20:01	2012-10-04T20:01
853	DEPARTMENT	175	223	Douglas Hanly Moir\nHOSPITAL: MOUNT ISA HOSPITAL
853	DOCTOR	225	249	Is1I LOU Kerry-HARDSTONE
853	DOCTOR	540	542	FC
853	DOCTOR	1838	1855	DS\nDATE: 12.7.62	2062-12-07
853	DOCTOR	1889	1898	Q Wraight
853	DATE	4375	4383	19.12.62	2062-12-19
853	HOSPITAL	4569	4616	BARWON HEALTH - SOUTH GEELONG RENAL UNIT CAMPUS
853	DOCTOR	5072	5107	MILTON Holsoney\nHOSPITAL: 18.12.62	2062-12-18
854	IDNUM	14	24	35Z914131J
854	MEDICALRECORD	25	36	3599141.IEJ
854	PATIENT	38	57	Bohn, VIATRIX ESTER
854	IDNUM	68	76	35Z91413
854	STREET	77	83	Widdin
854	CITY	83	113	QUIRINDI\nSTATE: NT\nZIP: 0834
854	DATE	128	137	24/7/2013	2013-07-24
854	TIME	157	176	04/10/2012 at 04:30	2012-10-04T04:30
854	DEPARTMENT	176	215	West\nHOSPITAL: COBAR DISTRICT HOSPITAL
854	DOCTOR	218	244	PETE MILLARD DEAN-MENT-OMY
854	DOCTOR	487	489	CG
854	DOCTOR	1800	1817	KJ\nDATE: 7/12/62	2062-12-07
854	DOCTOR	1846	1859	J Stolzenberg
854	DATE	4466	4474	19.12.62	2062-12-19
854	HOSPITAL	4519	4536	CROSSING HOSPITAL
854	DOCTOR	4992	5014	King\nDATE: 18.12.2062	2062-12-18
855	IDNUM	13	23	93V935289R
855	MEDICALRECORD	24	35	9389352.XZR
855	PATIENT	36	47	ZICARI, MAN
855	IDNUM	63	71	93V93528
855	STREET	72	82	Birkenhead
855	CITY	82	141	ANDERGROVE\nSTATE: Australian Capital Territory\nZIP: 50033
855	DATE	155	163	9/3/2010	2010-09-03
855	TIME	183	202	04/10/2012 at 15:44	2012-10-04T15:44
855	DEPARTMENT	202	256	Pathwest\nHOSPITAL: BAIRNSDALE REGIONAL HEALTH SERVICE
855	DOCTOR	257	268	TERRY Orvon
855	DOCTOR	477	479	JG
855	DOCTOR	1748	1765	HO\nDATE: 12/7/62	2062-12-07
855	DOCTOR	1794	1803	X Turnbow
856	IDNUM	13	23	04N636048C
856	MEDICALRECORD	24	35	0456360.LVC
856	PATIENT	36	51	TIPLER, Orvette
856	IDNUM	63	71	04N63604
856	PATIENT	71	81	Hasel-type
856	CITY	82	112	HADSPEN\nSTATE: ACT\nZIP: 1490
856	DATE	127	136	15/1/1990	1990-01-15
856	DEPARTMENT	168	211	RENAL CLINICAL\nHOSPITAL: GOODOOGA HOSPITAL
856	DOCTOR	210	223	KOREY Leonelo
856	DOCTOR	2071	2089	KR\nDATE: 20/12/62	2062-12-20
856	DOCTOR	2127	2137	Y Eckerman
857	IDNUM	14	24	62J656106L
857	MEDICALRECORD	25	35	623656.EAQ
857	PATIENT	37	58	BUELER, Ching WENDELL
857	IDNUM	69	77	62J65610
857	STREET	78	87	Brookfall
857	CITY	87	107	SINGLETON\nZIP: 4550
857	DATE	131	140	18/9/1994	1994-09-18
857	TIME	160	179	22/10/2012 at 09:37	2012-10-22T09:37
857	DEPARTMENT	179	240	OBSTETRICS\nHOSPITAL: BALLARAT HEALTH SERVICES (BASE HOSPITAL
857	DOCTOR	242	249	Tjing46
857	DOCTOR	269	288	Ames\nDOCTOR: Meary
857	DOCTOR	1351	1381	FP\nDOCTOR: FP\nDATE: 24.12.62	2062-12-24
857	DOCTOR	1406	1416	Q Sorenson
858	IDNUM	13	23	20F677264U
858	MEDICALRECORD	24	34	202677.FPL
858	PATIENT	36	52	WENSKOSKI, DAVIS
858	IDNUM	63	71	20F67726
858	DOCTOR	80	86	Dement
858	CITY	86	142	QUIRINDI\nSTATE: Australian Capital Territory\nZIP: 2844
858	DATE	157	166	13/5/2005	2005-05-13
858	DEPARTMENT	198	245	Envoi\nHOSPITAL: BARADINE MULTI PURPOSE SERVICE
858	DOCTOR	246	262	ANTONIA JESUSti
858	DOCTOR	1834	1852	IO\nDATE: 25.12.62	2062-12-25
858	DOCTOR	1881	1891	F Groetsch
859	IDNUM	13	23	41W278112F
859	MEDICALRECORD	24	35	4182781.EHF
859	PATIENT	36	51	Keitsock, CSTON
859	IDNUM	65	73	41W27811
859	STREET	74	81	Raccoon
859	CITY	81	130	BEACONSFIELD\nSTATE: Western Australia\nZIP: 3165
859	DATE	145	153	2/1/2024	2024-01-02
859	DEPARTMENT	185	235	PRINCE OF WALESPRIVATE\nHOSPITAL: BONALBO HOSPITAL
859	DOCTOR	236	258	HOLLIS JULIO-ELDONSTER
859	DATE	338	344	4.1.62	2062-01-04
859	DOCTOR	741	801	JINGALU-O,ION.92\nDOCTOR: K Pechsterk\nTIME: 17.05 o18.10.12	2012-05-17T17:00
859	DOCTOR	2397	2427	UL\nDOCTOR: JC\nDATE: 21.12.62	2062-12-21
859	DOCTOR	2452	2459	K Danby
859	DATE	4997	5003	4.1.62	2062-01-04
859	DOCTOR	5109	5119	K Marwello
860	IDNUM	13	23	99T399171N
860	MEDICALRECORD	24	34	997399.ETC
860	PATIENT	36	49	Armson, Viara
860	IDNUM	60	68	99T39917
860	PATIENT	69	74	Weant
860	CITY	74	117	URRAWEEN\nSTATE: New South Wales\nZIP: 3793
860	DATE	132	142	27/11/1982	1982-11-27
860	TIME	162	181	17/10/2012 at 20:55	2012-10-17T20:55
860	DEPARTMENT	193	222	MERRIWA MULTI PURPOSE SERVICE
860	DOCTOR	222	245	BENJAMIN NormaryleERBOO
860	DOCTOR	1429	1447	YQ\nDATE: 21.12.62	2062-12-21
860	DOCTOR	1449	1458	Y Vallley
861	IDNUM	13	23	10K990029Z
861	MEDICALRECORD	24	34	104990.BHY
861	PATIENT	36	50	Paone, Kendall
861	IDNUM	61	69	10K99002
861	STREET	70	81	Sunny Hills
861	CITY	81	115	NEW NORFOLK\nSTATE: VIC\nZIP: 3999
861	DATE	130	138	5/1/1994	1994-01-05
861	TIME	158	177	24/10/2012 at 16:43	2012-10-24T16:43
861	DEPARTMENT	177	245	L7 CONSULTING ROOMS\nHOSPITAL: BIGGENDEN MULTIPURPOSE HEALTH SERVICE
861	DOCTOR	246	287	Edgardo\nDOCTOR: JAS\nTIME: 02AIAH JASMIN
861	DOCTOR	1360	1378	OA\nDATE: 27/12/62	2062-12-27
861	DOCTOR	1916	1934	BN\nDATE: 27.12.62	2062-12-27
861	DOCTOR	1963	1971	D Steier
861	DOCTOR	3407	3453	Gerald SPANICEK\nHOSPITAL: PROSERPINE HOSPITAL
861	DATE	3907	3916	28/1/2062	2062-01-28
861	DOCTOR	3918	3962	Stefan\nHOSPITAL: WEE WAA COMMUNITY HOSPITAL
862	IDNUM	14	24	78G910187H
862	MEDICALRECORD	25	36	7829101.WTH
862	PATIENT	38	51	TAMAYO, DONTE
862	IDNUM	62	70	78G91018
862	STREET	71	81	Creek Tree
862	CITY	81	124	GUNNEDAH\nSTATE: New South Wales\nZIP: 7215
862	DATE	139	148	22/7/2004	2004-07-22
862	DATE	168	178	25/12/2062	2062-12-25
862	DEPARTMENT	183	228	ST GEORGE PRIVATE\nHOSPITAL: AUGUSTA HOSPITAL
862	DOCTOR	229	245	COLTON StAHBSATH
862	AGE	288	290	63
862	DOCTOR	748	786	S Chavillin\nTIME: 11:50am on 23.10.12	2012-10-23T11:50
862	DATE	2077	2085	27/12/62	2062-12-27
862	DATE	2562	2570	26.12.62	2062-12-26
862	DATE	3119	3127	27.12.62	2062-12-27
862	DOCTOR	3158	3170	S Allegretti
863	IDNUM	13	23	25C941145Q
863	MEDICALRECORD	24	34	251941.ELO
863	PATIENT	35	50	TOURVILLE, Maja
863	IDNUM	59	84	25C94114\nIDNUM: 25C94114
863	STREET	87	97	Rock Coast
863	CITY	97	129	HERVEY BAY\nSTATE: NT\nZIP: 3617
863	DATE	153	162	18/3/2015	2015-03-18
863	TIME	182	201	26/10/2012 at 20:12	2012-10-26T20:12
863	DEPARTMENT	213	230	DICKINSON 2 SOUTH
863	DOCTOR	230	253	SANTIAGO LUCIUS MOHCTOR
863	DOCTOR	257	279	Ochsky\nDOCTOR: Tupsky
863	DOCTOR	1791	1808	VN\nDATE: 1.12.62	2062-12-01
863	DOCTOR	1838	1845	G Bugna
864	IDNUM	13	23	46U642004B
864	MEDICALRECORD	24	35	4676420.AKB
864	PATIENT	36	56	Colone, EUMARRAH AYY
864	IDNUM	73	81	46U64200
864	STREET	82	95	East Highland
864	CITY	95	125	STAWELL\nSTATE: TAS\nZIP: 5158
864	DATE	140	149	7/11/1989	1989-11-07
864	TIME	169	188	30/10/2012 at 12:32	2012-10-30T12:32
864	DEPARTMENT	188	240	North\nHOSPITAL: WEST WIMMERA HEALTH SERVICE - NHILL
864	DOCTOR	245	265	RALPH GENE TURNBAUGH
864	DOCTOR	986	1002	ZJ\nDATE: 3.1.62	2062-01-03
864	DOCTOR	1565	1570	LJING
865	IDNUM	14	24	04Q663152K
865	MEDICALRECORD	25	36	0466631.PFK
865	PATIENT	38	52	Ludden, Maizie
865	IDNUM	63	71	04Q66315
865	PATIENT	72	78	Beulah
865	CITY	78	109	COOKTOWN\nSTATE: QLD\nZIP: 5455
865	DATE	124	133	5/11/2013	2013-11-05
865	DATE	153	162	3/12/2062	2062-12-03
865	DEPARTMENT	167	215	ACT Genetic\nHOSPITAL: KEMPSEY DISTRICT HOSPITAL
865	DOCTOR	222	235	KAYLEEN Dodie
865	DOCTOR	271	278	Jackley
865	DATE	324	331	29.4.64	2064-04-29
865	DATE	358	364	6.1.63	2063-06-01
865	DOCTOR	1946	1974	SC\nDOCTOR: SC\nDATE: 3.1.62	2062-01-03
865	DOCTOR	1970	1977	A Seter
865	DATE	3558	3564	6.1.63	2063-06-01
865	DATE	3933	3940	29.4.64	2064-04-29
866	IDNUM	13	23	25H264010V
866	MEDICALRECORD	24	35	2522640.DBV
866	PATIENT	37	63	KOLODZIESKI, ADAM BENEDICT
866	IDNUM	74	82	25H26401
866	PATIENT	82	91	Mydrawell
866	CITY	92	143	NAMBUCCA HEADS\nSTATE: Western Australia\nZIP: 4383
866	DATE	158	167	29/7/2027	2027-07-29
866	TIME	187	206	29/10/2012 at 18:54	2012-10-29T18:54
866	DEPARTMENT	206	263	2.23HR STAY SURGICAL UNIT\nHOSPITAL: MERCY HEALTH SERVICE
866	DOCTOR	270	293	YSABELLA LESLI STICKLEN
866	DOCTOR	3497	3526	PG\nDOCTOR: TI\nDATE: 2.12.62	2062-02-12
866	DOCTOR	3551	3558	F Dover
867	IDNUM	13	23	73D284078E
867	MEDICALRECORD	24	34	731284.BSW
867	PATIENT	36	51	Celani, AGUSTIN
867	IDNUM	62	70	73D28407
867	STREET	71	80	Maplehill
867	CITY	80	112	REDCLIFFE\nSTATE: QLD\nZIP: 5451
867	DATE	127	136	16/2/2010	2010-02-16
867	TIME	156	175	31/10/2012 at 13:59	2012-10-31T13:59
867	DEPARTMENT	175	220	Radiation Oncology\nHOSPITAL: WARREN HOSPITAL
867	DOCTOR	225	246	Phillip Ronald BULLEN
867	DOCTOR	1880	1896	OT\nDATE: 1.3.62	2062-01-03
867	DOCTOR	1896	1907	T Hochstale
867	DOCTOR	3351	3375	T Erxleen\nDATE: 16.1.62	2062-01-16
867	HOSPITAL	3443	3462	DONNYBROOK HOSPITAL
867	DOCTOR	3917	3942	T Soderman\nDATE: 15.1.62	2062-01-15
868	IDNUM	0	10	31A305117M
868	MEDICALRECORD	25	35	310305.DHR
868	PATIENT	36	58	Geherry, LAURI-DARLINE
868	IDNUM	68	76	31A30512
868	PATIENT	76	93	Crisques Crisques
868	CITY	85	116	BAY VIEW\nSTATE: TAS\nZIP: 5044
868	DATE	131	141	23/10/2008	2008-10-23
868	DATE	161	170	3/12/2062	2062-12-03
868	DEPARTMENT	175	229	INTENSIVE CARE UNIT\nHOSPITAL: NABOUR GENERAL HOSPITAL
868	DOCTOR	235	248	Lyman JAMISON
868	DATE	332	339	16.1.62	2062-01-16
868	DOCTOR	2378	2394	KJ\nDATE: 3/1/62	2062-01-03
868	DOCTOR	3052	3068	KJ\nDATE: 3.1.62	2062-01-03
868	DOCTOR	3098	3111	I Hendricksen
868	HOSPITAL	5206	5234	COOLAH MULTI PURPOSE SERVICE
868	DATE	5851	5858	16.1.62	2062-01-16
868	HOSPITAL	5877	5893	WARWICK HOSPITAL
868	DOCTOR	5982	5990	I Honour
869	IDNUM	13	23	52R906085X
869	MEDICALRECORD	24	34	526906.AVN
869	PATIENT	36	50	HAYERTZ, Abram
869	IDNUM	61	69	52R90608
869	PATIENT	69	74	Nilj
869	CITY	77	125	BEECHWORTH\nSTATE: Northern Territory\nZIP: 7185
869	DATE	140	149	22/2/2007	2007-02-22
869	TIME	169	188	07/11/2012 at 09:05	2012-11-07T09:05
869	DEPARTMENT	188	224	Envoi\nHOSPITAL: STANTHORPE HOSPITAL
869	DOCTOR	225	235	Zack WandN
869	DOCTOR	1527	1555	NF\nDOCTOR: AF\nDATE: 1.9.62	2062-01-09
869	DOCTOR	1583	1592	N Roseman
870	IDNUM	14	24	73I507933J
870	MEDICALRECORD	25	35	733507.XKJ
870	STREET	36	57	Clopper\nZIP: Taunhua
870	IDNUM	63	71	73I50793
870	PATIENT	72	83	Birch Knoll
870	CITY	83	124	ENCOUNTER BAY\nSTATE: Tasmania\nZIP: 3373
870	DATE	139	148	30/6/1975	1975-06-30
870	TIME	168	187	08/11/2012 at 12:03	2012-11-08T12:03
870	DEPARTMENT	187	235	CORONARYCARE UNIT\nHOSPITAL: WOLLONGONG HOSPITAL
870	DOCTOR	236	259	LAVONA GLEN HERMANRETER
870	DOCTOR	1711	1740	PG\nDOCTOR: PG\nDATE: 1.11.62	2062-11-01
870	DOCTOR	1765	1774	S Ahlberg
871	IDNUM	13	23	21E528991R
871	MEDICALRECORD	24	34	211528.ZZE
871	PATIENT	36	46	PADRO, GUS
871	IDNUM	57	65	21E52899
871	STREET	66	76	West Woods
871	CITY	76	94	SUNBURY\nZIP: 3546
871	DATE	118	127	13/6/1981	1981-06-13
871	TIME	147	166	12/11/2012 at 09:18	2012-11-12T09:18
871	DEPARTMENT	166	228	POST OPERATIVE RECOVERY\nHOSPITAL: CROOKWELL DISTRICT HOSPITAL
871	DOCTOR	233	253	ARNULFO JOE BRANNICK
871	DOCTOR	302	326	G Kings\nDATE: 14.2.2062	2062-02-14
871	DOCTOR	1050	1067	ZW\nDATE: 10/1/62	2062-01-10
871	DOCTOR	1070	1096	G Taranto\nDATE: 16.1.2062	2062-01-16
871	DOCTOR	2639	2664	G Braget\nDATE: 14.2.2062	2062-02-14
871	DOCTOR	2688	2690	By
872	IDNUM	13	23	89B648059A
872	MEDICALRECORD	24	35	8906480.OZA
872	PATIENT	37	56	BEAVIN, EFFIE Hyman
872	IDNUM	67	75	89B64805
872	STREET	76	85	Moon Hall
872	CITY	85	128	ALICE SPRINGS\nSTATE: Queensland\nZIP: 4106
872	DATE	143	152	24/2/1982	1982-02-24
872	TIME	172	191	09/11/2012 at 11:13	2012-11-09T11:13
872	DEPARTMENT	191	248	DHM\nHOSPITAL: UPPER MURRAY HEALTH AND COMMUNITY SERVICES
872	DOCTOR	253	271	MAUD Danny Demiter
872	DOCTOR	2003	2020	JQ\nDATE: 14/1/62	2062-01-14
872	DOCTOR	2175	2204	LZ\nDOCTOR: FF\nDATE: 14.1.62	2062-01-14
872	DOCTOR	2234	2241	V Miley
873	IDNUM	14	24	37X679018I
873	MEDICALRECORD	25	36	3786790.DUI
873	PATIENT	38	54	PAULSEN, JUNIPER
873	IDNUM	71	79	37X67901
873	PATIENT	80	85	Tryna
873	CITY	85	132	JINDABYNE\nSTATE: Northern Territory\nZIP: 3170
873	DATE	147	156	13/3/2002	2002-03-13
873	DATE	176	185	24/1/2062	2062-01-24
873	DEPARTMENT	202	209	Laverty
873	DOCTOR	209	227	Jerald TOMMY Thorn
873	DOCTOR	347	368	J Denis\nDATE: 5.6.62	2062-06-05
873	DATE	1518	1525	25.1.62	2062-01-25
873	DOCTOR	1559	1566	J Matot
873	DATE	3233	3241	5.6.2062	2062-06-05
873	DOCTOR	3545	3556	VINCENT OFF
874	IDNUM	13	23	95T690176R
874	MEDICALRECORD	24	35	9576901.SQR
874	PATIENT	36	54	Bub, Kenneth Nubed
874	IDNUM	66	74	95T69017
874	STREET	75	84	Fernville
874	CITY	84	119	BANORA POINT\nSTATE: TAS\nZIP: 5211
874	DATE	134	143	15/3/2008	2008-03-15
874	TIME	163	182	27/11/2012 at 02:58	2012-11-27T02:58
874	DEPARTMENT	182	224	ACUTECARE WARD\nHOSPITAL: KALEEYA HOSPITAL
874	DOCTOR	231	245	Davida Whitney
874	DOCTOR	2544	2573	AU\nDOCTOR: OQ\nDATE: 29/1/62	2062-01-29
874	DOCTOR	2600	2608	X Millen
874	IDNUM	3076	3082	95T690
875	IDNUM	13	23	16K391024C
875	MEDICALRECORD	24	34	164391.AGL
875	PATIENT	35	47	Raeve, Maram
875	IDNUM	49	74	16K39102\nIDNUM: 16K39102
875	STREET	77	85	Log Hill
875	CITY	85	124	BELLINGEN\nSTATE: Queensland\nZIP: 3689
875	DATE	145	154	28/5/2019	2019-05-28
875	DATE	174	183	30/1/2062	2062-01-30
875	DEPARTMENT	188	230	DARLING POINT\nHOSPITAL: GOODOOGA HOSPITAL
875	DOCTOR	237	256	LAVERNE SON PROMISE
875	DATE	401	404	now	2066-06-09
875	DOCTOR	932	966	Hangartner\nTIME: 10am on 28.11.12	2012-11-28T10:00
875	DOCTOR	2388	2404	EF\nDATE: 1.1.62	2062-01-01
875	DOCTOR	2406	2413	C Edgar
875	DATE	3430	3436	7/2/62	2062-07-02
876	IDNUM	14	24	64H311082L
876	MEDICALRECORD	25	35	642311.CVG
876	PATIENT	37	49	BORYS, Taryn
876	IDNUM	60	68	64H31108
876	STREET	69	78	Greenwing
876	CITY	78	109	QUIRINDI\nSTATE: ACT\nZIP: 4817
876	DATE	124	133	29/6/1997	1997-06-29
876	DATE	153	162	30/1/2062	2062-01-30
876	DEPARTMENT	167	220	3HR STAY SURGICALUNIT\nHOSPITAL: CHARLEVILLE HOSPITAL
876	DOCTOR	225	247	BRADLY BENEDICT Sammer
876	DATE	301	307	1.8.62	2062-08-01
876	DOCTOR	336	342	3.9.63	2063-09-03
876	DOCTOR	1943	1971	RR\nDOCTOR: RR\nDATE: 1/1/62	2062-01-01
876	DOCTOR	2001	2010	R Gilliss
876	DATE	6111	6117	1.8.62	2062-08-01
876	DOCTOR	6120	6128	R Blyody
876	DOCTOR	6315	6321	3.9.63	2063-09-03
876	DOCTOR	6323	6358	R Soula\nHOSPITAL: QUILPIE HOSPITAL
877	MEDICALRECORD	1	12	8599129.KCW
877	PATIENT	13	29	ABELLERA, KUPARR
877	IDNUM	30	38	85Y91293
877	DATE	54	63	14/8/2062	2062-08-14
877	DOCTOR	1228	1244	KQ\nDATE: 2/6/62	2062-02-06
877	DOCTOR	1247	1272	W Keath\nDOCTOR: W Persch
878	IDNUM	13	23	42U933099F
878	MEDICALRECORD	24	35	4279330.ZXF
878	PATIENT	37	49	RONAN, Davis
878	IDNUM	60	68	42U93309
878	STREET	69	78	Fawn Wood
878	CITY	78	104	MOE\nSTATE: TAS\nZIP: 2197
878	DATE	119	128	11/1/1986	1986-01-11
878	TIME	148	167	10/05/2013 at 18:46	2013-05-10T18:46
878	DEPARTMENT	167	214	NSW Health\nHOSPITAL: MILTON ULLADULLA HOSPITAL
878	DOCTOR	215	238	Malcolm BASIL Strausker
878	DATE	314	321	18.7.63	2063-07-18
878	DOCTOR	1782	1811	VJ\nDOCTOR: AJ\nDATE: 15.7.63	2063-07-15
878	DOCTOR	1838	1848	K Mcauliff
878	DATE	3186	3193	18.7.63	2063-07-18
878	DATE	3195	3203	8/9/2066	2066-08-09
878	DATE	3314	3317	now	2066-12-06
879	IDNUM	14	24	63L5349576
879	MEDICALRECORD	25	36	6345349.NTQ
879	PATIENT	38	49	AGGAS, Nick
879	IDNUM	60	68	63L53495
879	PATIENT	69	77	Greybert
879	CITY	77	107	PENGUIN\nSTATE: VIC\nZIP: 3461
879	DATE	120	129	24/9/2009	2009-09-24
879	TIME	149	168	28/11/2012 at 21:57	2012-11-28T21:57
879	DEPARTMENT	168	221	Laverty\nHOSPITAL: BAIRNSDALE REGIONAL HEALTH SERVICE
879	DOCTOR	222	237	LUCIEN Jeflyrey
879	DOCTOR	552	555	T1b
879	DOCTOR	2940	2956	RR\nDATE: 1/1/62	2062-01-01
879	DOCTOR	2988	2997	P Pitorak
880	MEDICALRECORD	1	12	1136559.COY
880	PATIENT	13	23	RAMBO, Kai
880	IDNUM	24	32	11I65591
880	DATE	48	57	14/9/2062	2062-09-14
880	DOCTOR	1582	1598	PW\nDATE: 7/2/62	2062-07-02
880	DOCTOR	1629	1640	E Ochiltree
881	IDNUM	14	24	32Z256864K
881	MEDICALRECORD	25	35	329256.WRK
881	IDNUM	61	69	32Z25686
881	PATIENT	70	75	Espie
881	CITY	75	105	WHYALLA\nSTATE: TAS\nZIP: 4879
881	DATE	121	130	3/11/1990	1990-11-03
881	TIME	150	169	04/12/2012 at 09:15	2012-12-04T09:15
881	DEPARTMENT	169	215	Laverty Pathology\nHOSPITAL: GOODOOGA HOSPITAL
881	DOCTOR	216	254	ABDULarius defense\nDOCTOR: ABDULarius
881	DOCTOR	2467	2495	RR\nDOCTOR: RR\nDATE: 6.2.62	2062-06-02
881	DOCTOR	2493	2518	J Soni\nDOCTOR: J Templer
881	DATE	4130	4137	23/2/62	2062-02-23
881	DOCTOR	4139	4175	J Cuffy\nHOSPITAL: RIVERTON HOSPITAL
882	IDNUM	-1	9	90V276922V
882	MEDICALRECORD	24	34	908276.YGF
882	PATIENT	36	53	Virzi, VELVA Troy
882	IDNUM	64	72	90V27692
882	STREET	73	81	Vivienne
882	CITY	81	111	OLD BAR\nSTATE: ACT\nZIP: 4347
882	DATE	126	135	24/6/2022	2022-06-24
882	TIME	155	174	06/12/2012 at 09:26	2012-12-06T09:26
882	DEPARTMENT	174	236	PARKES 4 EAST\nHOSPITAL: LAKE CARGELLIGO MULTI PURPOSE SERVICE
882	DOCTOR	241	272	Manual NATHANAEL KUPARR-BRAUMAN
882	DOCTOR	648	684	X Felicano\nTIME: 10:00am on 6.12.12	2012-12-06T10:00
882	DOCTOR	919	969	X Rame\nDOCTOR: X Rowran\nTIME: 10:00am on 6.12.12	2012-12-06T10:00
882	DOCTOR	2452	2468	VR\nDATE: 2.9.62	2062-02-09
882	DOCTOR	2499	2508	X Vautier
882	HOSPITAL	5311	5334	MOREE DISTRICT HOSPITAL
882	DATE	5408	5417	26/2/2062	2062-02-26
882	HOSPITAL	5442	5471	DORRIGO MULTI PURPOSE SERVICE
882	DOCTOR	6024	6031	X Seyal
883	MEDICALRECORD	1	12	6421262.HEN
883	PATIENT	13	28	FALKER, Marlena
883	IDNUM	29	37	64F12622
883	DATE	53	62	19/3/2063	2063-03-19
883	DOCTOR	1430	1446	JA\nDATE: 2.9.62	2062-02-09
883	DOCTOR	1477	1486	Q Whiddon
884	IDNUM	14	24	69J908838M
884	MEDICALRECORD	25	35	693908.WJW
884	PATIENT	36	52	BailORIA-ROGELIO
884	IDNUM	73	81	69J90883
884	CITY	89	118	GOSFORD\nSTATE: WA\nZIP: 2869
884	DATE	132	140	4/3/2018	2018-03-04
884	TIME	160	179	06/12/2012 at 09:08	2012-12-06T09:08
884	DEPARTMENT	179	238	Pathology North\nHOSPITAL: ARMIDALE RURAL REFERRAL HOSPITAL
884	DOCTOR	239	253	GENARO Tjangle
884	DOCTOR	1829	1845	RR\nDATE: 2/8/62	2062-02-08
884	DOCTOR	1875	1885	R Iannuzzi
885	MEDICALRECORD	1	12	3377482.KVH
885	PATIENT	13	23	Smola, KEN
885	IDNUM	23	48	33S74824\nIDNUM: 33S74824
885	DATE	57	66	14/2/2062	2062-02-14
885	DOCTOR	1460	1489	XB\nDOCTOR: BH\nDATE: 13.2.62	2062-02-13
885	DOCTOR	1514	1521	J Gomey
886	IDNUM	13	23	91O768206Q
886	MEDICALRECORD	24	35	9157682.AQQ
886	PATIENT	37	51	STELLO, VIRGIL
886	IDNUM	57	82	91O76820\nIDNUM: 91O76820
886	PATIENT	85	94	Craigweil
886	CITY	94	122	DERBY\nSTATE: ACT\nZIP: 2610
886	DATE	146	156	28/10/2005	2005-10-28
886	TIME	176	195	05/12/2012 at 17:48	2012-12-05T17:48
886	DEPARTMENT	195	244	South Eastern Area\nHOSPITAL: MILLMERRAN HOSPITAL
886	DOCTOR	247	265	Chae Claude-ELSTON
886	DOCTOR	3167	3195	HZ\nDOCTOR: SQ\nDATE: 2/8/62	2062-02-08
886	DOCTOR	3223	3231	Y Rabelo
886	DATE	4432	4438	5/8/64	2064-05-08
887	IDNUM	14	24	96S640803P
887	MEDICALRECORD	25	36	9676408.CIP
887	PATIENT	38	52	Federer, Jaxon
887	IDNUM	71	79	96S64080
887	PATIENT	79	83	Nosp
887	CITY	85	122	BUSSELTON\nSTATE: Victoria\nZIP: 1240
887	DATE	137	146	11/3/1997	1997-03-11
887	TIME	163	182	06/12/2012 at 15:43	2012-12-06T15:43
887	DEPARTMENT	182	216	Laverty\nHOSPITAL: WINTON HOSPITAL
887	DOCTOR	221	241	Duane OREN DEMERITTE
887	DATE	400	404	2046	2046
887	DOCTOR	2467	2483	ED\nDATE: 2.9.62	2062-09-02
887	DOCTOR	2485	2495	Z Zaldenga
888	IDNUM	13	23	60C480212J
888	MEDICALRECORD	24	34	600480.FDH
888	PATIENT	36	55	Dolce, Gerry FELIPE
888	IDNUM	66	74	60C48021
888	PATIENT	75	82	Olivera
888	CITY	82	110	URUNGA\nSTATE: SA\nZIP: 6509
888	DATE	125	133	1/4/1983	1983-01-04
888	TIME	153	172	07/12/2012 at 16:40	2012-12-07T16:40
888	DEPARTMENT	172	214	Envoi pathology\nHOSPITAL: BOONAH HOSPITAL
888	DOCTOR	219	243	EMILIO MELVIN DEVILLIERS
888	DOCTOR	1359	1388	CL\nDOCTOR: JU\nDATE: 2.12.62	2062-02-12
888	DOCTOR	1413	1424	R Pyanowski
889	IDNUM	13	23	28Y411271S
889	MEDICALRECORD	24	35	2894112.SCS
889	PATIENT	37	59	Plesha, DWAYNE Charity
889	IDNUM	70	78	28Y41127
889	STREET	79	84	Gamay
889	CITY	84	140	CURLEWIS\nSTATE: Australian Capital Territory\nZIP: 2490
889	DATE	153	162	14/9/2014	2014-09-14
889	DEPARTMENT	194	232	SXR\nHOSPITAL: TUMUT DISTRICT HOSPITAL
889	DOCTOR	235	250	RICHMARLIN KITZ
889	DOCTOR	3410	3439	YX\nDOCTOR: VM\nDATE: 13.2.62	2062-02-13
889	DOCTOR	3463	3471	G Minott
890	IDNUM	13	23	49Q012129D
890	MEDICALRECORD	23	34	4970121.GYD
890	PATIENT	36	53	MODESTE, LASHanda
890	IDNUM	55	80	49Q01212\nIDNUM: 49Q01212
890	PATIENT	81	88	Maddock
890	CITY	88	135	MOUNT MORGAN\nSTATE: New South Wales\nZIP: 3623
890	DATE	159	168	14/4/1985	1985-04-14
890	DATE	187	196	12/2/2062	2062-12-02
890	DEPARTMENT	201	240	UROLOGY OPD\nHOSPITAL: GAYNDAH HOSPITAL
890	DOCTOR	243	269	KRISTOPHER KELLEY NEWCASTK
890	DOCTOR	1965	1994	YH\nDOCTOR: AJ\nDATE: 14.1.62	2062-01-14
890	DOCTOR	2019	2028	H Hadsall
891	IDNUM	13	23	96M132287M
891	MEDICALRECORD	24	34	964132.GVT
891	PATIENT	35	52	Schmeiser, HANTDE
891	IDNUM	63	71	96M13228
891	STREET	72	81	Greystead
891	CITY	81	142	DRUMMOND COVE\nSTATE: Australian Capital Territory\nZIP: 7277
891	DATE	157	166	12/4/1988	1988-12-04
891	DATE	186	195	2/12/2062	2062-02-12
891	DEPARTMENT	212	224	RENAL CLINIC
891	DOCTOR	224	247	LEONEL Lyndon LACKERMAN
891	DATE	356	363	19.3.62	2062-03-19
891	DOCTOR	364	373	Z Vanteck
891	DOCTOR	2047	2064	LO\nDATE: 13/2/62	2062-02-13
891	DOCTOR	2064	2090	Z Mcindoe\nDATE: 14.2.2062	2062-02-14
891	DOCTOR	4570	4575	Boori
891	DATE	5338	5345	19.3.62	2062-03-19
891	DOCTOR	5350	5359	Z Kastner
891	HOSPITAL	5359	5401	SCOTT MEMORIAL HOSPITAL\nHOSPITAL: JARROW,
892	MEDICALRECORD	2	13	3883340.YLI
892	PATIENT	13	32	IACUZIO, Jerady WAN
892	IDNUM	34	42	38U33409
892	DATE	57	66	14/2/2062	2062-02-14
892	DATE	526	533	12.2.62	2062-12-02
892	DOCTOR	564	571	J Dutil
893	IDNUM	13	23	96R355052R
893	MEDICALRECORD	24	35	9663550.NGR
893	PATIENT	37	57	PHANTHANOUVON, Harry
893	IDNUM	68	76	96R35505
893	STREET	77	89	George River
893	CITY	89	123	MOUNT BORGAN\nSTATE: SA\nZIP: 0907
893	DATE	138	147	25/9/1991	1991-09-25
893	DEPARTMENT	179	221	OBSTETRICS\nHOSPITAL: CAIRNS BASE HOSPITAL
893	DOCTOR	226	248	FLORENCIO BURTON ZIEMS
893	DATE	555	562	13/2/62	2062-02-13
893	DOCTOR	1851	1868	ZV\nDATE: 14/2/62	2062-02-14
893	DOCTOR	1900	1907	Y Eclar
894	IDNUM	13	23	17I956900C
894	MEDICALRECORD	24	34	173956.YCC
894	PATIENT	36	51	Janeiro, SONDRA
894	IDNUM	62	70	17I95690
894	CITY	82	127	CONDOBOLIN\nSTATE: New South Wales\nZIP: 6842
894	DATE	142	152	19/12/2003	2003-12-19
894	TIME	172	191	11/12/2012 at 20:07	2012-12-11T20:07
894	DEPARTMENT	191	245	Laverty Pathology\nHOSPITAL: NARACOORTE HEALTH SERVICE
894	DOCTOR	246	280	Patrice ALAN Colone-Golecystectomy
894	DATE	358	360	16	2016-08-16
894	DOCTOR	1945	1962	HP\nDATE: 14.2.62	2062-02-14
894	DOCTOR	1993	2001	M Brands
894	DATE	3327	3333	4/3/63	2063-03-04
894	DOCTOR	3335	3375	M Branyon\nHOSPITAL: BARWON HEALTH NORTH
895	IDNUM	14	24	65E077068L
895	MEDICALRECORD	25	35	651077.ARX
895	PATIENT	37	56	Lauderdale, Silvana
895	IDNUM	67	75	65E07706
895	STREET	76	83	Timahoe
895	CITY	83	116	SAINT\nSTATE: Tasmania\nZIP: 1680
895	DATE	138	146	6/8/2007	2007-08-06
895	DATE	166	175	13/2/2062	2062-02-13
895	DEPARTMENT	180	254	SOUTH SURGICAL UNIT\nHOSPITAL: WESTERN DISTRICT HEALTH SERVICE - COLERAINE
895	DOCTOR	266	296	Duncan RONNIE MOHRONNIE MOHRIS
895	DATE	368	376	2.2.2062	2062-02-02
895	DATE	480	484	2060	2060
895	DOCTOR	1601	1630	RR\nDOCTOR: RR\nDATE: 13/2/62	2062-02-13
895	DOCTOR	1642	1665	R Fray\nDATE: 15.2.2062	2062-02-15
895	DATE	2953	2961	2.2.2062	2062-02-02
895	DOCTOR	2976	2998	Magoun\nDOCTOR: Magoun
896	MEDICALRECORD	1	11	868677.XFS
896	PATIENT	12	26	SANGES, Orinda
896	IDNUM	27	35	86W67792
896	DATE	51	60	25/3/2063	2063-03-25
896	DATE	128	132	2062	2062
896	DATE	167	171	2060	2060
896	DATE	183	187	2058	2058
896	DOCTOR	862	879	DE\nDATE: 24/3/63	2063-03-24
896	DOCTOR	878	906	G Lasecki\nDOCTOR: G Seficik
896	IDNUM	1276	1284	23A09702
897	IDNUM	13	23	44S698975F
897	MEDICALRECORD	24	35	4476989.UOF
897	PATIENT	37	55	SNETSINGER, KRISTI
897	IDNUM	56	81	44S69897\nIDNUM: 44S69897
897	CITY	92	120	TUMUT\nSTATE: VIC\nZIP: 3841
897	DATE	144	154	25/11/2000	2000-11-25
897	TIME	174	193	12/12/2012 at 10:29	2012-12-12T10:29
897	DEPARTMENT	193	247	CPC Pathology\nHOSPITAL: COOTAMUNDRA DISTRICT HOSPITAL
897	DOCTOR	254	276	JODY JIMMIE Pignatelli
897	DATE	348	355	28.8.63	2063-08-28
897	DATE	437	442	today	2066-09-03
897	DOCTOR	2723	2752	XL\nDOCTOR: YX\nDATE: 15.2.62	2062-02-15
897	DOCTOR	2747	2768	L Hiro\nDOCTOR: L Zel
897	IDNUM	5201	5209	44S69897
897	DATE	5516	5523	28.8.63	2063-08-28
897	IDNUM	5655	5664	44S69897O
898	IDNUM	14	24	92O719033N
898	MEDICALRECORD	25	36	9257190.JJN
898	PATIENT	38	53	MORRISON, Gerda
898	IDNUM	64	72	92O71903
898	PATIENT	73	78	Radha
898	CITY	78	111	STANTHORPE\nSTATE: QLD\nZIP: 3244
898	DATE	126	136	14/12/2002	2002-12-14
898	DATE	155	164	14/2/2062	2062-02-14
898	DEPARTMENT	169	214	Envoi\nHOSPITAL: GLEN INNES DISTRICT HOSPITAL
898	DOCTOR	217	235	WAYNE Adolph OCran
898	DOCTOR	340	366	Z Silveio\nDATE: 17.3.2063	2063-03-17
898	DOCTOR	1942	1959	SC\nDATE: 15.2.62	2062-02-15
898	DOCTOR	1988	1996	Z Babson
899	MEDICALRECORD	1	12	5047400.YEW
899	PATIENT	13	29	Cloepfil, Turlku
899	IDNUM	30	38	50K74009
899	DATE	54	63	22/2/2062	2062-02-22
899	DOCTOR	245	252	Fickett
899	DOCTOR	1040	1057	JS\nDATE: 16.2.62	2062-02-16
899	DOCTOR	1087	1096	O Ruschel
900	MEDICALRECORD	1	12	0827601.NZE
900	PATIENT	12	29	Traut in, Donovan
900	IDNUM	39	47	08G76015
900	DATE	63	72	20/2/2062	2062-02-20
900	DOCTOR	644	661	AJ\nDATE: 16.2.62	2062-02-16
900	DOCTOR	692	698	C Sowl
901	IDNUM	13	23	29Y361008Q
901	MEDICALRECORD	24	35	2993610.CVQ
901	PATIENT	37	52	STALLS, MICHEAL
901	IDNUM	63	71	29Y36100
901	STREET	72	80	Redhills
901	CITY	80	110	WOODSIDE\nSTATE: SA\nZIP: 4102
901	DATE	125	134	12/7/1999	1999-07-12
901	TIME	154	173	14/12/2012 at 15:43	2012-12-14T15:43
901	DEPARTMENT	173	227	MEDIC/SURGERY WARD\nHOSPITAL: VICTORIAN HEART HOSPITAL
901	DOCTOR	232	247	ROCCO Chantelle
901	DOCTOR	1609	1638	TX\nDOCTOR: TI\nDATE: 19.2.62	2062-02-19
901	DOCTOR	1665	1675	H Ravenell
902	IDNUM	14	24	87U482066Y
902	MEDICALRECORD	25	36	8774820.RQY
902	PATIENT	38	56	Huie, KATHRYN YUNA
902	IDNUM	67	75	87U48206
902	PATIENT	76	80	Keim
902	CITY	80	108	BOURKE\nSTATE: WA\nZIP: 3620
902	DATE	123	132	25/8/1973	1973-08-25
902	TIME	152	171	17/12/2012 at 09:08	2012-12-17T09:08
902	DEPARTMENT	171	218	PARKES8\nHOSPITAL: THE QUEEN ELIZABETH HOSPITAL
902	DOCTOR	219	237	HOBERT HEATH SILTS
902	DOCTOR	2158	2187	ED\nDOCTOR: ED\nDATE: 19/2/62	2062-02-19
902	DOCTOR	2212	2222	V Eckmeyer
903	MEDICALRECORD	1	11	084083.ZFM
903	PATIENT	12	32	SCHOLLMEYER, MERISSA
903	IDNUM	33	41	08L08392
903	DATE	57	66	22/2/2062	2062-02-22
903	DOCTOR	516	575	LIONEL-Longwith\nDOCTOR: A Hollerman\nTIME: 5pm on 17.12.12	2012-12-17T17:12
903	DOCTOR	1852	1869	UA\nDATE: 19.2.62	2062-02-19
903	DOCTOR	1898	1906	A Fabian
904	IDNUM	13	23	55H004072S
904	MEDICALRECORD	24	34	552004.BUH
904	PATIENT	36	53	GRIVAS, Penni Hal
904	IDNUM	64	72	55H00407
904	CITY	77	107	KYABRAM\nSTATE: TAS\nZIP: 2621
904	DATE	122	130	3/1/2013	2013-03-01
904	DATE	150	159	20/2/2062	2062-02-20
904	DEPARTMENT	164	204	HAPS\nHOSPITAL: PORTLAND DISTRICT HEALTH
904	DOCTOR	205	216	KOORI Louce
904	DATE	307	314	25/3/63	2063-03-25
904	DOCTOR	728	788	AUGUST YONTS\nDOCTOR: P Manocchia\nTIME: 15.40pm on 19/12/12	2012-12-19T15:40
904	DATE	2388	2413	25 superficial/metastatic	2062-02-25
904	DOCTOR	2784	2813	HG\nDOCTOR: TO\nDATE: 21/2/62	2062-02-21
904	DOCTOR	2842	2849	P Berta
904	DATE	9990	9997	25/3/63	2063-03-25\nDOCTOR: P Armbour\nDATE: 25/3/63=>2063-03-25
904	DATE	10577	10584	25/3/63	2063-03-25
904	HOSPITAL	10605	10632	QUIRINDI COMMUNITY HOSPITAL
904	DOCTOR	10668	10676	P Keeler
904	DOCTOR	10701	10723	P Kues\nDOCTOR: P Kues
904	DOCTOR	11703	11709	P Cran
904	DATE	11716	11723	18/3/63	2063-03-18
905	MEDICALRECORD	2	13	7696059.IDD
905	PATIENT	13	26	SPEG, Clarita
905	IDNUM	30	38	76Z60593
905	DATE	54	63	23/2/2062	2062-02-23
905	DATE	101	110	23.2.2062	2062-02-23
905	DOCTOR	135	145	U Burstein
905	DOCTOR	1086	1103	RR\nDATE: 21.2.62	2062-02-21
905	DOCTOR	1133	1142	U Behrend
905	DATE	2899	2908	23.2.2062	2062-02-23
905	DOCTOR	2933	2939	U Oyen
906	IDNUM	13	23	34V725999M
906	MEDICALRECORD	24	34	348725.ZXY
906	PATIENT	36	51	LINSDAU, JEROLD
906	IDNUM	62	70	34V72599
906	PATIENT	70	78	Dowdall,
906	CITY	79	113	ALSTONVILLE\nSTATE: ACT\nZIP: 4744
906	DATE	126	135	29/8/2010	2010-08-29
906	TIME	155	174	18/12/2012 at 09:03	2012-12-18T09:03
906	DEPARTMENT	174	233	Med Onc\nHOSPITAL: MONASH MEDICAL CENTRE - MOORABBIN CAMPUS
906	DOCTOR	234	255	Jean KENDALL ROOSEANO
906	DOCTOR	1898	1915	YO\nDATE: 20/2/62	2062-02-20
906	DOCTOR	1914	1924	I Szopelli
906	HOSPITAL	6137	6155	MACQUARIE HOSPITAL
906	DATE	6229	6238	19/3/2063	2063-03-19
906	HOSPITAL	6262	6278	GIN GIN HOSPITAL
906	DOCTOR	6832	6840	I Shirer
907	IDNUM	13	23	08E575398H
907	MEDICALRECORD	24	35	0815753.ZXH
907	PATIENT	36	52	Langsdale, YELOP
907	IDNUM	54	79	08E57539\nIDNUM: 08E57539
907	STREET	82	89	Raiders
907	CITY	89	120	ROBINVALE\nSTATE: NT\nZIP: 6415
907	DATE	144	153	11/2/1990	1990-02-11
907	DATE	173	182	21/2/2062	2062-02-21
907	DEPARTMENT	187	275	Tissue Pathology and Diagnostic Oncology\nHOSPITAL: EIDSVOLD MULTIPURPOSE HEALTH SERVICE
907	DOCTOR	282	291	LYLE GAZO
907	DOCTOR	3164	3193	CY\nDOCTOR: QF\nDATE: 22/1/62	2062-01-22
907	DOCTOR	3218	3230	B Westerhoff
908	IDNUM	14	24	03I347905G
908	MEDICALRECORD	25	36	0333479.BPG
908	PATIENT	38	55	MURANAKA, NOELENE
908	IDNUM	66	74	03I34790
908	STREET	74	85	Alderhawnel
908	CITY	86	123	LONGFORD\nSTATE: Tasmania\nZIP: 2.5mm
908	DATE	137	146	27/5/1999	1999-05-27
908	DEPARTMENT	178	220	ENVOI Pathology\nHOSPITAL: COOPER HOSPITAL
908	DOCTOR	237	272	Lazaro Dudley\nDOCTOR: Yong-Yeatman
908	DATE	365	372	25/3/63	2063-03-25
908	DATE	3620	3627	22.2.62	2062-02-22
908	DOCTOR	3659	3668	C Markert
908	DATE	8695	8702	23/3/63	2063-03-23
908	HOSPITAL	8763	8780	BLACKALL HOSPITAL
908	DOCTOR	8817	8825	C Emilio
908	DOCTOR	8861	8888	Hexion\nDOCTOR: TOOSEY AGED
908	HOSPITAL	8951	8959	PippVARY
908	HOSPITAL	9107	9122	WANTIRNA HEALTH
908	DOCTOR	9624	9626	C.
908	DATE	9640	9647	19/3/63	2063-03-19
908	DATE	9648	9656	19/32063	2063-320-19
909	MEDICALRECORD	1	12	6114789.QKO
909	PATIENT	12	31	BERTONCINI, MAGALIS
909	IDNUM	35	60	61F47896\nIDNUM: 61F47896
909	DATE	69	78	14/4/2063	2063-04-14
909	DOCTOR	695	730	Q Caughorn\nTIME: 10.10am on 2/1/13	2013-01-02T10:10
909	DOCTOR	2021	2037	LJ\nDATE: 3/5/63	2063-05-03
909	DOCTOR	2067	2074	Q Guill
909	DOCTOR	3752	3762	Q Ankersen
909	DATE	3991	3998	17/3/63	2063-03-17
910	IDNUM	14	24	35O2173633
910	MEDICALRECORD	25	36	3552173.RJJ
910	PATIENT	38	53	WANGER, KATELIN
910	IDNUM	64	72	35O21736
910	STREET	73	82	W Newport
910	CITY	82	113	LEONGATHA\nSTATE: WA\nZIP: 3549
910	DATE	128	137	19/2/2003	2003-02-19
910	TIME	157	176	01/01/2013 at 17:01	2013-01-01T17:01
910	DEPARTMENT	176	227	INTENSIVECARE UNIT\nHOSPITAL: WAR MEMORIAL HOSPITAL
910	DOCTOR	232	257	FREDRICK Geoffrey Barrack
910	DOCTOR	1414	1430	RR\nDATE: 4/3/63	2063-04-03
910	DOCTOR	1462	1471	J Horuath
911	IDNUM	13	23	30S099970I
911	MEDICALRECORD	24	34	307099.YTB
911	PATIENT	36	50	WEAR, Ezequiel
911	IDNUM	61	69	30S09997
911	PATIENT	70	76	Tilson
911	CITY	76	117	COROWA\nSTATE: South Australia\nZIP: 6398
911	DATE	132	141	10/4/2004	2004-10-04
911	DATE	161	169	5/3/2063	2063-05-03
911	DEPARTMENT	174	223	DARLING POINT\nHOSPITAL: CUNDERDIN HEALTH SERVICE
911	DOCTOR	228	242	Hayden GLASPIE
911	DATE	314	320	2.3.63	2063-03-02
911	DOCTOR	681	730	Disalvi\nDOCTOR: K Mervin\nTIME: 3.59pm on 3.1.13	2013-01-03T15:59
911	DOCTOR	1268	1284	TK\nDATE: 6/3/63	2063-06-03
911	DOCTOR	1316	1324	K Sweets
911	DOCTOR	2090	2134	MARLIN DOCKERY\nHOSPITAL: ST GEORGE HOSPITAL
911	HOSPITAL	2225	2248	COBAR DISTRICT HOSPITAL
911	DATE	2621	2628	17.3.63	2063-03-17
911	DOCTOR	2630	2675	K Beverton\nDOCTOR: SEALS\nTIME: 4: 18/ermark
911	DOCTOR	2691	2732	LOH\nDATE: 19th\nDATE: 19th\nDATE: 19th\n	2033
911	DATE	3598	3604	2.3.63	2063-03-02
911	DOCTOR	3605	3666	Aristide\nHOSPITAL: CENTRAL GIPPSLAND HEALTH SERVICE (MAFFRA)
912	IDNUM	13	23	14C839280D
912	MEDICALRECORD	24	35	1408392.VAD
912	PATIENT	36	51	Candano, JULIET
912	IDNUM	65	73	14C83928
912	STREET	74	84	Old Canada
912	CITY	84	139	MULWALA\nSTATE: Australian Capital Territory\nZIP: 6733
912	DATE	154	163	3/10/1981	1981-03-10
912	TIME	183	202	07/01/2013 at 03:10	2013-01-07T03:10
912	DEPARTMENT	202	247	Pathology North\nHOSPITAL: MOUNT ISA HOSPITAL
912	DOCTOR	253	273	MERVIN MAXWELL LENIG
912	DOCTOR	1167	1183	HH\nDATE: 9/3/63	2063-09-03
912	DOCTOR	1215	1223	C Nahari
913	MEDICALRECORD	2	13	6299603.KVM
913	PATIENT	13	19	Muller
913	IDNUM	32	40	62Y96033
913	DATE	56	65	23/8/2063	2063-08-23
913	DOCTOR	1069	1086	CA\nDATE: 21/8/63	2063-08-21
913	DOCTOR	1086	1094	R Weyman
913	IDNUM	1343	1351	62Y96033
914	IDNUM	13	23	83P551296X
914	MEDICALRECORD	24	34	836551.GYR
914	PATIENT	36	49	Arms, TANGELA
914	IDNUM	60	68	83P55129
914	PATIENT	69	75	Russet
914	CITY	75	92	NEWMAN\nZIP: 6262
914	DATE	116	125	8/12/2023	2023-12-08
914	TIME	145	164	07/01/2013 at 08:58	2013-01-07T08:58
914	DEPARTMENT	164	220	ONCOLOGY\nHOSPITAL: WIMMERA HEALTH CARE GROUP - DIMBOOLA
914	DOCTOR	233	254	KENTON Sol STROBRIDGE
914	DOCTOR	254	272	Facey\nDOCTOR: Von
914	DOCTOR	2067	2083	KV\nDATE: 3/9/63	2063-09-03
914	DOCTOR	2085	2113	S Guildhaus\nDATE: 3.10.2063	2063-10-03
915	IDNUM	13	23	41L581254F
915	MEDICALRECORD	24	34	414581.HNM
915	PATIENT	36	50	Harty, Woodrow
915	IDNUM	61	69	41L58125
915	PATIENT	70	78	Waelchli
915	CITY	78	103	ANTHONY LAGOON\nZIP: 3220
915	DATE	127	136	14/7/1994	1994-07-14
915	TIME	156	175	04/01/2013 at 16:47	2013-01-04T16:47
915	DEPARTMENT	175	213	Pathwest\nHOSPITAL: LONGREACH HOSPITAL
915	DOCTOR	218	235	MONTE Lane JOBSON
915	DOCTOR	2575	2591	EF\nDATE: 9/3/63	2063-09-03
915	DOCTOR	2626	2634	K Herner
915	DATE	2867	2870	now	2066-03-16
916	MEDICALRECORD	2	13	9935023.CHO
916	PATIENT	13	54	EISENBARTH, Jaz\nPATIENT: EISENBARTH, Jaz
916	IDNUM	33	41	99I50231
916	DATE	57	66	3/11/2063	2063-11-03
916	DOCTOR	644	672	ED\nDOCTOR: ED\nDATE: 3/9/63	2063-09-03
916	DOCTOR	668	678	Z Delossen
917	IDNUM	13	23	94M484919N
917	MEDICALRECORD	24	34	944484.YEZ
917	PATIENT	35	52	Cappelli, Alphira
917	IDNUM	65	73	94M48491
917	PATIENT	73	82	Stockfoot
917	CITY	83	112	CASINO\nSTATE: QLD\nZIP: 5273
917	DATE	127	136	29/5/1993	1993-05-29
917	DATE	156	164	3/9/2063	2063-09-03
917	DEPARTMENT	169	201	Envoi\nHOSPITAL: BAMAGA HOSPITAL
917	DOCTOR	206	225	MOHAMMED ADAN BAKES
917	DOCTOR	1260	1277	OI\nDATE: 3/10/63	2063-10-03
917	DOCTOR	1309	1319	Z Vellucci
918	IDNUM	-1	28	51I4050778\nIDNUM: 51I4050778
918	MEDICALRECORD	24	35	5134050.TUW
918	PATIENT	37	53	Stiehl, FLETCHER
918	IDNUM	64	72	51I40507
918	STREET	73	81	Mossrock
918	CITY	81	117	COONABARABRAN\nSTATE: TAS\nZIP: 6335
918	DATE	132	142	16/12/1983	1983-12-16
918	TIME	162	181	08/01/2013 at 09:02	2013-01-08T09:02
918	DEPARTMENT	181	258	3HR STAY SURGICALUNIT\nHOSPITAL: ROCHESTER AND ELMORE DISTRICT HEALTH SERVICE
918	DOCTOR	259	279	Gale Lazaro Braverau
918	DOCTOR	2282	2311	KC\nDOCTOR: ZN\nDATE: 3.10.63	2063-10-03
918	DOCTOR	2339	2348	O Metrick
919	IDNUM	14	24	25R2443876
919	MEDICALRECORD	25	35	256244.JVT
919	PATIENT	36	48	Leave, LAMAR
919	IDNUM	61	69	25R24438
919	CITY	81	111	DAMPIER\nSTATE: TAS\nZIP: 6385
919	DATE	124	133	27/8/1998	1998-08-27
919	DATE	153	162	10/3/2063	2063-03-10
919	DEPARTMENT	167	256	DEPT OF CORRECTIVE SERVICES\nHOSPITAL: ROBINVALE DISTRICT HEALTH SERVICES - MANANT CAMPUS
919	DOCTOR	266	284	Cory KIRBY Wanberg
919	DOCTOR	1858	1887	ED\nDOCTOR: ED\nDATE: 11/3/63	2063-11-03
919	DOCTOR	1914	1925	H Finlayson
920	MEDICALRECORD	1	11	308026.ZXL
920	PATIENT	12	25	LEVICK, ELMER
920	IDNUM	26	34	30V02698
920	DATE	50	59	12/3/2063	2063-03-12
920	DOCTOR	1816	1833	DO\nDATE: 11/3/63	2063-03-11
920	DOCTOR	1865	1875	H Bekerman
921	IDNUM	14	24	04F9663944
921	MEDICALRECORD	25	35	042966.HYK
921	PATIENT	36	46	Gorey, ASO
921	IDNUM	61	69	04F96639
921	STREET	70	85	Babylon Farming
921	CITY	89	134	NOWRA-BOMADERRY\nSTATE: Queensland\nZIP: 4515
921	DATE	149	158	14/8/2013	2013-08-14
921	TIME	178	197	08/01/2013 at 13:46	2013-01-08T13:46
921	DEPARTMENT	197	246	MACQUARIE WARD\nHOSPITAL: PORT ALEXANDRA HOSPITAL
921	DOCTOR	250	279	Mason ULYSSES NAPOLEON-MCSTAY
921	DOCTOR	1595	1612	ED\nDATE: 11/3/63	2063-11-03
921	DOCTOR	1614	1638	A Reedy\nDATE: 12.3.2063	2063-12-03
921	DOCTOR	2986	2996	A Glausier
922	MEDICALRECORD	1	12	5209973.NFT
922	PATIENT	13	27	BOTHMAN, MALIA
922	IDNUM	40	65	52B99735\nIDNUM: 52B99735
922	DATE	74	83	13/3/2063	2063-03-13
922	DOCTOR	1534	1563	FY\nDOCTOR: WR\nDATE: 3.12.63	2063-03-12
922	DOCTOR	1590	1600	O Strecker
923	IDNUM	13	23	73S598200E
923	MEDICALRECORD	23	34	7375982.CBB
923	PATIENT	36	59	SPERANZA, Tracey Karemm
923	IDNUM	71	79	73S59820
923	CITY	92	119	BERRI\nSTATE: SA\nZIP: 2606
923	DATE	134	143	20/2/2008	2008-02-20
923	DATE	163	172	3/10/2063	2063-10-03
923	DEPARTMENT	177	241	PARKES 4 EAST\nHOSPITAL: CENTRAL GIPPSLAND HEALTH SERVICE (SALE)
923	DOCTOR	242	264	ZACKARY Jarred DSSIRES
923	DOCTOR	322	327	Plona
923	DOCTOR	829	876	T Rudl\nDOCTOR: T Sheen\nTIME: 1720hr on 8/1/13	2013-01-08T17:00
923	DOCTOR	1196	1247	T Halpror\nDOCTOR: T Maginn\nTIME: 1730hr on 8/1/13	2013-01-08T17:30
923	DOCTOR	3141	3158	PN\nDATE: 3/11/63	2063-11-03
923	DOCTOR	3188	3202	T Fleischacker
924	IDNUM	14	24	31O618368N
924	MEDICALRECORD	25	35	315618.IRW
924	PATIENT	37	60	PROVENZO, Lovella BRANT
924	IDNUM	71	79	31O61836
924	STREET	80	87	Loreley
924	CITY	87	127	JUNEE\nSTATE: South Australia\nZIP: 2705
924	DATE	142	152	18/11/2011	2011-11-18
924	DATE	172	181	11/3/2063	2063-03-11
924	DEPARTMENT	186	227	PARKES 4 EAST\nHOSPITAL: DENMARK HOSPITAL
924	DOCTOR	244	263	Cortez ERIC WHIPPIE
924	DATE	350	359	26.3.2063	2063-03-26
924	DOCTOR	3123	3140	RR\nDATE: 12/3/63	2063-12-03
924	DOCTOR	3187	3243	I Claerson\nDOCTOR: I Loginsuke\nTIME: 11.39am on 9/1/13	2013-01-09T11:39
924	DOCTOR	3276	3301	I Malawy\nDATE: 13.3.2063	2063-03-13
924	DATE	7735	7744	26.3.2063	2063-03-26
924	DOCTOR	7749	7759	I Sharplin
924	DOCTOR	7759	7799	I Danner\nDEPARTMENT: BUSSELTON HOSPITAL
925	IDNUM	13	23	89L639326V
925	MEDICALRECORD	24	34	894639.JGR
925	PATIENT	36	50	LAZARZ, GISELE
925	IDNUM	61	69	89L63932
925	STREET	70	82	North Willow
925	CITY	82	127	BURPENGARY\nSTATE: New South Wales\nZIP: 1141
925	DATE	142	152	24/11/2017	2017-11-24
925	TIME	172	191	09/01/2013 at 15:38	2013-01-09T15:38
925	DEPARTMENT	191	238	Forensic Medicine\nHOSPITAL: FRANKSTON HOSPITAL
925	DOCTOR	239	255	Lewis Jira Deurp
925	DOCTOR	323	329	Trudms
925	DOCTOR	1757	1786	DF\nDOCTOR: BW\nDATE: 3.12.63	2063-12-03
925	DOCTOR	1782	1793	W Poczobule
926	IDNUM	13	23	94P411933U
926	MEDICALRECORD	24	34	945411.ZIJ
926	PATIENT	36	51	Canary, Michiko
926	IDNUM	62	70	94P41193
926	STREET	71	79	Burnwood
926	CITY	79	115	CAMDEN\nSTATE: Queensland\nZIP: 3567
926	DATE	130	140	24/11/2017	2017-11-24
926	TIME	160	179	06/05/2013 at 09:20	2013-05-06T09:20
926	DEPARTMENT	179	220	2.PARKES 8\nHOSPITAL: IPGENN SyH HOSPITAL
926	DOCTOR	222	242	ADALBERTO KASEY GALO
926	DOCTOR	2839	2867	YJ\nDOCTOR: EV\nDATE: 7.8.63	2063-07-08
926	DOCTOR	2866	2872	X Klum
927	MEDICALRECORD	1	12	4244320.XPD
927	PATIENT	14	31	ODIN, WARRIYANGGA
927	IDNUM	31	90	42L43208\nIDNUM: 42L43208\nIDNUM: 42L43208\nIDNUM: 42L43208
927	DATE	65	74	13/3/2063	2063-03-13
927	DOCTOR	1541	1570	RR\nDOCTOR: RR\nDATE: 12/3/63	2063-12-03
927	DOCTOR	1596	1604	M Maline
928	IDNUM	13	23	00H553040M
928	MEDICALRECORD	24	35	0025530.MAM
928	PATIENT	36	55	Lopilatos, ANNMARIE
928	IDNUM	66	74	00H55304
928	CITY	82	125	WORRAGEE\nSTATE: New South Wales\nZIP: 2745
928	DATE	140	148	7/8/2009	2009-08-07
928	DEPARTMENT	180	224	Peter Mac\nHOSPITAL: NORTH MIDLANDS HOSPITAL
928	DOCTOR	231	240	JASON IRA
928	DATE	329	336	26.3.63	2063-03-26
928	DOCTOR	1725	1754	WE\nDOCTOR: FL\nDATE: 13/3/63	2063-03-13
928	DOCTOR	1779	1790	A Leibowitz
928	DATE	3685	3692	26.3.63	2063-03-26
928	DOCTOR	3813	3823	A Kapichok
929	IDNUM	13	23	58D5731087
929	MEDICALRECORD	24	34	581573.EBV
929	PATIENT	36	56	OLIGSCHLAEGER, JARED
929	IDNUM	67	75	58D57310
929	CITY	87	124	HOWLONG\nSTATE: Queensland\nZIP: 2289
929	DATE	139	147	6/2/1987	1987-02-06
929	TIME	167	186	14/01/2013 at 09:16	2013-01-14T09:16
929	DEPARTMENT	186	226	EMERGENCY\nHOSPITAL: SYDNEY HOSPITAL AND
929	DOCTOR	251	271	Jarrod WALTER KOPFER
929	DOCTOR	1969	1998	KL\nDOCTOR: NX\nDATE: 16.3.63	2063-03-16
929	DOCTOR	2023	2031	O Arentz
930	IDNUM	13	23	79V174066F
930	MEDICALRECORD	24	34	798174.BPQ
930	PATIENT	36	54	DEBARTOLO, BALADJI
930	IDNUM	65	73	79V17406
930	PATIENT	74	81	Finnell
930	CITY	81	115	BOURKE\nSTATE: Victoria\nZIP: 2999
930	DATE	130	138	5/7/1985	1985-07-05
930	TIME	158	177	14/01/2013 at 09:17	2013-01-14T09:17
930	DEPARTMENT	177	223	StVincent\nHOSPITAL: BALLINA DISTRICT HOSPITAL
930	DOCTOR	228	240	BARNEY Carol
930	DOCTOR	248	262	Elias\nDOCTOR:
930	DOCTOR	1459	1476	YS\nDATE: 16.3.63	2063-03-16
930	DOCTOR	1476	1505	D Plouffe\nDOCTOR: D Johnstad
933	MEDICALRECORD	1	11	366195.CEM
933	PATIENT	12	27	BLEICH, WILLIAN
933	IDNUM	28	36	36R19511
933	DATE	52	61	18/3/2063	2063-03-18
933	DOCTOR	515	571	I Mulstrand\nDOCTOR: I Landacre\nTIME: 13.45 on 11.01.13	2013-01-11T13:45
933	DOCTOR	611	619	I Svinth
934	IDNUM	14	24	57I896973Z
934	MEDICALRECORD	25	36	5738969.THZ
934	STREET	37	50	MOMPER, WayEL
934	IDNUM	74	99	57I89697\nIDNUM: 57I89697
934	STREET	102	114	Jones Branch
934	CITY	114	144	COOKTOWN\nSTATE: NT\nZIP: 3996
934	DATE	165	174	13/3/1996	1996-03-13
934	TIME	194	213	29/01/2013 at 20:42	2013-01-29T20:42
934	DEPARTMENT	213	259	OPERATING THEATRES\nHOSPITAL: BUNBURY HOSPITAL
934	DOCTOR	262	280	NILSA VERTIE CZOEK
934	DOCTOR	303	308	AARON
934	DOCTOR	2147	2163	LM\nDATE: 3/2/63	2063-03-02
934	DOCTOR	2195	2203	W Varaza
934	DOCTOR	2857	2864	W Chafe
935	IDNUM	13	23	05E827031I
935	MEDICALRECORD	24	34	051827.BID
935	PATIENT	35	50	Dastlick, ERROL
935	IDNUM	61	69	05E82703
935	STREET	70	88	Holme Wood Heysham
935	CITY	88	132	BROADFORD\nSTATE: New South Wales\nZIP: 0815
935	DATE	147	156	16/6/1997	1997-06-16
935	TIME	176	195	17/01/2013 at 08:58	2013-01-17T08:58
935	DEPARTMENT	195	242	ONCOLOGY (GYNAE)\nHOSPITAL: HERVEY BAY HOSPITAL
935	DOCTOR	243	260	ZACHARIAH MONROEZ
935	DATE	347	355	4.7.2063	2063-07-04
935	DOCTOR	380	388	B Garbar
935	DOCTOR	2092	2109	KK\nDATE: 19.3.63	2063-03-19
935	DOCTOR	2109	2135	B Mcfarle\nDATE: 20.3.2063	2063-03-20
936	IDNUM	13	23	63A847189Q
936	MEDICALRECORD	24	34	630847.CXY
936	PATIENT	36	49	Dumas, JONELL
936	IDNUM	60	68	63A84718
936	PATIENT	68	75	Zouther
936	CITY	75	107	COOM\nSTATE: Victoria\nZIP: 1825
936	DATE	123	133	23/12/2036	2036-12-23
936	TIME	153	172	17/01/2013 at 08:57	2013-01-17T08:57
936	DEPARTMENT	172	239	MEDIC/SURGERY WARD\nHOSPITAL: NARROMINE HOSPITAL & COMMUNITY HEALTH
936	DOCTOR	240	262	DHIRRIL Felix BOSCIOUS
936	DOCTOR	2139	2156	OD\nDATE: 19/3/63	2063-03-19
936	DOCTOR	2499	2516	UJ\nDATE: 18/3/63	2063-03-18
936	DOCTOR	2547	2554	Q Blain
937	IDNUM	14	24	84S4480470
937	MEDICALRECORD	25	36	8474480.LTC
937	PATIENT	38	50	OLIVE, KEIKO
937	IDNUM	51	103	84S44804\nIDNUM: 84S44804\nIDNUM: 84S44804\nPATIENT:
937	STREET	79	85	Gondek
937	CITY	85	117	RUTHERFORD\nSTATE: WA\nZIP: 6074
937	DATE	141	150	17/5/2003	2003-05-17
937	TIME	170	189	23/01/2013 at 19:07	2013-01-23T19:07
937	DEPARTMENT	189	238	DICKINSON 2 SOUTH\nHOSPITAL: OMEO DISTRICT HEALTH
937	DOCTOR	241	248	Ja Vera
937	DOCTOR	3363	3392	FP\nDOCTOR: FP\nDATE: 25.3.63	2063-03-25
937	DOCTOR	3418	3426	V Rothge
937	DATE	4314	4321	16/1/63	2063-01-16
938	MEDICALRECORD	1	12	3255690.APK
938	PATIENT	13	24	SPAR, ABDUL
938	IDNUM	25	33	32O56900
938	DATE	49	58	25/3/2063	2063-03-25
938	DOCTOR	598	615	LF\nDATE: 20/3/63	2063-03-20
938	DOCTOR	721	768	J Regner\nDOCTOR: J Forzan\nDOCTOR: J Foradanin
939	MEDICALRECORD	1	12	0693093.COF
939	PATIENT	12	24	BIERLE, Norz
939	IDNUM	30	38	06Y30930
939	DATE	54	63	24/3/2063	2063-03-24
939	DOCTOR	740	757	XN\nDATE: 20/3/63	2063-03-20
939	DOCTOR	789	800	C Rosenfeld
940	IDNUM	13	23	11B181012E
940	MEDICALRECORD	24	35	1101810.EGE
940	PATIENT	37	56	FAZZI, CLAYTON'EMMA
940	IDNUM	67	75	11B18101
940	STREET	75	83	Cityhens
940	CITY	85	120	CENTRAL COAST\nSTATE: SA\nZIP: 5601
940	DATE	135	144	17/2/2009	2009-02-17
940	DATE	164	173	19/3/2063	2063-03-19
940	DEPARTMENT	178	227	POST OPERATIVE RECOVERY\nHOSPITAL: DALBY HOSPITAL
940	DOCTOR	243	273	Desmond Carol\nDOCTOR: Desmond
940	DATE	338	344	2.3.63	2063-03-02
940	DOCTOR	2415	2432	TS\nDATE: 20/3/63	2063-03-20
940	DOCTOR	2482	2511	D Harnage\nDOCTOR: D Ruffaner
940	DATE	4545	4551	2/3/63	2063-03-02
940	DOCTOR	4553	4617	D Cuariansa\nHOSPITAL: COLLINSVILLE MULTI-PURPOSE HEALTH SERVICE
941	MEDICALRECORD	1	12	8540303.FEZ
941	PATIENT	13	27	Stuever, LOUIE
941	IDNUM	28	36	85L03032
941	DATE	52	61	26/3/2063	2063-03-26
941	DOCTOR	1509	1538	JM\nDOCTOR: KP\nDATE: 23/3/63	2063-03-23
941	DOCTOR	1565	1572	R Welms
941	DOCTOR	2154	2193	LEIGHANN HYSON\nDOCTOR: William DIFFore
942	IDNUM	14	24	33H051470I
942	MEDICALRECORD	25	35	332051.KUA
942	PATIENT	37	55	SCHWARTZBACH, Mell
942	IDNUM	69	77	33H05147
942	STREET	77	86	Brambleye
942	CITY	88	112	YARRAGONTAS\nSTATE: T332
942	DATE	132	140	5/6/2014	2014-06-05
942	TIME	160	179	18/01/2013 at 12:21	2013-01-18T12:21
942	DEPARTMENT	179	236	CORONARYCARE UNIT\nHOSPITAL: CONDOBOLIN DISTRICT HOSPITAL
942	DOCTOR	241	254	EFRAIN Kamila
942	AGE	321	323	53
942	DOCTOR	872	921	K Allen\nDOCTOR: K Dedaj\nTIME: 2.30pm on 18/1/13	2013-01-18T14:30
942	DOCTOR	943	972	RR\nDOCTOR: RR\nDATE: 20/3/63	2063-03-20
942	DATE	1224	1231	23/3/63	2063-03-23
942	DOCTOR	1266	1274	K Reifel
943	IDNUM	13	23	48L823086H
943	MEDICALRECORD	24	35	4848230.WSH
943	PATIENT	37	55	RUSHTON, FILIBERTO
943	IDNUM	66	74	48L82308
943	STREET	75	85	East Huron
943	CITY	85	115	WESTBURY\nSTATE: WA\nZIP: 2209
943	DATE	130	138	7/8/1989	1989-07-08
943	TIME	158	177	21/01/2013 at 09:11	2013-01-21T09:11
943	DEPARTMENT	177	230	StVincent\nHOSPITAL: JERILDERIE MULTI PURPOSE SERVICE
943	DOCTOR	231	258	Kennedley BERNARDO PLATANIA
943	DATE	332	339	26.3.63	2063-03-26
943	IDNUM	442	450	48L82308
943	DOCTOR	2311	2340	UA\nDOCTOR: SH\nDATE: 23/3/63	2063-03-23
943	DOCTOR	2335	2342	L Leigh
943	DATE	4563	4570	26.3.63	2063-03-26
944	IDNUM	13	23	96H854045P
944	MEDICALRECORD	24	35	9638540.LNP
944	PATIENT	36	55	LUCAS, SAMUAL-SANTH
944	IDNUM	67	75	96H85404
944	STREET	76	89	N Rock Spring
944	CITY	89	119	GOULBURN\nSTATE: WA\nZIP: 4407
944	DATE	134	143	16/8/2022	2022-08-16
944	DEPARTMENT	175	218	HAPS\nHOSPITAL: SACRED HEART HEALTH SERVICE
944	DOCTOR	223	245	MITCHEL WALTON Hollack
944	DOCTOR	915	944	CE\nDOCTOR: VD\nDATE: 25.3.63	2063-03-25
944	DOCTOR	1052	1059	Z Mokis
945	IDNUM	14	24	54E974103Y
945	MEDICALRECORD	25	36	5419741.AIY
945	PATIENT	37	60	Costin, FOSTER Eiletern
945	IDNUM	69	77	54E97410
945	PATIENT	78	89	Balderstone
945	CITY	89	133	BUNBURY\nSTATE: Western Australia\nZIP: 4208
945	DATE	148	156	7/5/1994	1994-07-05
945	DATE	176	185	25/3/2063	2063-03-25
945	DEPARTMENT	190	268	PRINCE OF WALESPRIVATE\nHOSPITAL: SPRID THWEST HEALTHCARE - WARRNAMBOOL CAMPUS
945	DOCTOR	267	305	Tynison SAFFRON LEBERT STEFISON DELORP
945	DATE	345	352	22.7.63	2063-07-22
945	DOCTOR	2756	2773	FP\nDATE: 25/3/63	2063-03-25
945	DOCTOR	2778	2785	N Golla
945	DATE	5190	5193	now	2066-09-03
945	DATE	5255	5262	22.7.63	2063-07-22
946	IDNUM	13	23	74V575051J
946	MEDICALRECORD	24	35	7485750.PEJ
946	PATIENT	37	55	WESTLUND, MAGNOLIA
946	IDNUM	70	78	74V57505
946	STREET	78	92	Netherley Hall
946	CITY	96	138	SUFFOLK\nSTATE: New South Wales\nZIP: 1237
946	DATE	158	166	9/3/2034	2034-03-09
946	DATE	186	195	13/4/2063	2063-04-13
946	DEPARTMENT	200	234	Envoi\nHOSPITAL: NORSEMAN HOSPITAL
946	DOCTOR	241	261	HONEY KEITHA Tabbert
946	DATE	494	498	2059	2059
946	DOCTOR	1182	1233	Filsinger\nDOCTOR: S Balius\nTIME: 13:42 on 11/2/13	2013-02-11T13:42
946	DOCTOR	1553	1586	S Percell\nTIME: 14:07 on 11/2/13	2013-02-11T14:07
946	DOCTOR	5026	5055	PT\nDOCTOR: LE\nDATE: 14/4/63	2063-04-14
946	DOCTOR	5079	5085	C Afan
947	IDNUM	13	23	22R596019S
947	MEDICALRECORD	24	35	2265960.EZS
947	PATIENT	36	43	Morabad
947	IDNUM	66	74	22R59601
947	PATIENT	75	83	S Bruner
947	CITY	83	113	YEPPOON\nSTATE: VIC\nZIP: 3120
947	DATE	128	136	4/2/1974	1974-02-04
947	DATE	156	165	24/3/2063	2063-03-24
947	DEPARTMENT	170	229	POW L7 CONSULTING ROOMS\nHOSPITAL: PORTLAND DISTRICT HEALTH
947	DOCTOR	234	249	Hugh Ken DICKEL
947	DOCTOR	1194	1211	WS\nDATE: 25/3/63	2063-03-25
947	DOCTOR	1243	1254	H Langsdale
948	IDNUM	14	24	80N5171770
948	MEDICALRECORD	25	36	8055171.TUA
948	PATIENT	38	52	Sybert, Calvin
948	IDNUM	67	75	80N51717
948	CITY	80	117	BLI BLI\nSTATE: Queensland\nZIP: 2569
948	DATE	132	141	27/7/2039	2039-07-27
948	DATE	161	170	25/3/2063	2063-03-25
948	DEPARTMENT	175	226	DICKINSON 2 SOUTH\nHOSPITAL: BENTLEY HEALTH SERVICE
948	DOCTOR	229	260	Diedra Hilde\nHOSPITAL: Timpson
948	DOCTOR	731	784	V Vanosda\nDOCTOR: V Vanosda\nTIME: 9:55am on 23/1/13	2013-01-23T09:55
948	DOCTOR	3438	3467	FP\nDOCTOR: FP\nDATE: 25.3.63	2063-03-25
948	DOCTOR	3462	3469	V Jurgo
949	IDNUM	13	23	01F2180264
949	MEDICALRECORD	24	35	0112180.HQL
949	PATIENT	37	54	Kilgallon, Lavera
949	IDNUM	55	80	01F21802\nIDNUM: 01F21802
949	STREET	83	96	Lincoln Knoll
949	CITY	96	134	NUMURKAH\nSTATE: Queensland\nZIP: 6172
949	DATE	158	167	30/5/1997	1997-05-30
949	DATE	187	196	25/3/2063	2063-03-25
949	DEPARTMENT	201	234	IMVS\nHOSPITAL: MENINGIE HOSPITAL
949	DOCTOR	241	262	NILDA SELINA AL-FAHAD
949	DOCTOR	2719	2771	A Binger\nDOCTOR: A Marple\nTIME: 1.20pm on 23.01.13	2013-01-23T11:20
949	DOCTOR	3093	3122	KR\nDOCTOR: AF\nDATE: 26.3.63	2063-03-26
949	DOCTOR	3149	3156	A Slown
950	IDNUM	14	24	59B238084U
950	MEDICALRECORD	25	36	5902380.WLU
950	PATIENT	37	57	Embed, Pedro Scottie
950	IDNUM	70	78	59B23808
950	PATIENT	78	84	Rissel
950	CITY	86	124	CESSNOCK\nSTATE: Queensland\nZIP: 5061
950	DATE	139	149	27/11/1979	1979-11-27
950	TIME	169	188	24/01/2013 at 17:30	2013-01-24T17:30
950	DEPARTMENT	188	227	UROLOGY OPD\nHOSPITAL: MULLEWA HOSPITAL
950	DOCTOR	228	245	JEAN Tyrone Pathy
950	DATE	369	373	2061	2061
950	DOCTOR	2843	2860	RR\nDATE: 27/3/63	2063-03-27
950	DOCTOR	2892	2902	P Barcello
950	IDNUM	4297	4304	59B2380
950	DOCTOR	4369	4379	P Brundage
951	IDNUM	-1	9	33K086493P
951	MEDICALRECORD	24	35	3340884.XKP
951	PATIENT	37	55	Boehler, Alexandra
951	IDNUM	72	80	33K08849
951	STREET	81	87	Yeadon
951	CITY	87	118	ROSEBERY\nSTATE: QLD\nZIP: 6913
951	DATE	133	143	16/11/2004	2004-11-16
951	TIME	163	182	25/01/2013 at 17:25	2013-01-25T17:25
951	DEPARTMENT	182	231	ST GEORGE PRIVATE\nHOSPITAL: GOONDIWINDI HOSPITAL
951	DOCTOR	236	255	MICHAEL Gary TESLOW
951	DOCTOR	1454	1470	ND\nDATE: 1/3/63	2063-01-03
951	DOCTOR	1472	1496	H Hebron\nDATE: 2.3.2063	2063-03-02
951	DOCTOR	3607	3620	H Mardirosian
952	IDNUM	13	23	38O850000O
952	MEDICALRECORD	24	34	385850.AAC
952	PATIENT	35	97	FEIGHNER, ALFREDO RURAL REPORT: FEIGHNER, ALFREDO RURAL REPORT
952	IDNUM	72	80	38O85000
952	CITY	87	129	HEDDON GRETA\nSTATE: Queensland\nZIP: 4230
952	DATE	149	157	2/5/2010	2010-02-05
952	TIME	177	196	31/01/2013 at 09:16	2013-01-31T09:16
952	DEPARTMENT	196	250	Hunter Area Pathology\nHOSPITAL: ST VINCENT'S HOSPITAL
952	DOCTOR	261	281	Ian Reinaldo slice 1
952	DOCTOR	2913	2929	BN\nDATE: 3.3.63	2063-03-03
952	DOCTOR	2931	2953	I Boley\nDOCTOR: I Bon
952	DATE	4854	4865	7th Edition	2060
953	IDNUM	14	24	86L981059W
953	MEDICALRECORD	25	35	864981.CPX
953	PATIENT	37	54	SPELLER, Roy KIRK
953	IDNUM	65	73	86L98105
953	PATIENT	74	78	Keli
953	CITY	78	104	GREENWELL POINT\nZIP: 3177
953	DATE	128	137	12/7/2007	2007-12-07
953	TIME	145	164	25/07/2013 at 08:56	2013-07-25T08:56
953	DEPARTMENT	175	242	DICKINSON 3 SOUTH\nHOSPITAL: EAST WIMMERA HEALTH SERVICE - CHARLTON
953	DOCTOR	247	270	ROSENDO Lenny SCHLUSSEL
953	DOCTOR	270	291	Brady\nDOCTOR: Gutirz
953	DATE	359	367	15/10/63	2063-10-15
953	IDNUM	578	586	86L98105
953	DOCTOR	2798	2815	RR\nDATE: 27/9/63	2063-09-27
953	DOCTOR	2850	2859	X Bobzien
953	DATE	5219	5227	15/10/63	2063-10-15
954	IDNUM	13	23	92D922275O
954	MEDICALRECORD	24	35	9219222.TNO
954	PATIENT	37	52	Caffee, Xandria
954	IDNUM	63	71	92D92227
954	STREET	72	82	Shake Tree
954	CITY	82	126	IPSWICH\nSTATE: Western Australia\nZIP: 5290
954	DATE	141	151	27/11/1989	1989-11-27
954	DEPARTMENT	183	234	RENAL CLINIC\nHOSPITAL: GUYRA MULTI PURPOSE SERVICE
954	DOCTOR	235	250	ARNOLDO NIGELOO
954	DOCTOR	1379	1395	EC\nDATE: 9/1/63	2063-01-09
954	DOCTOR	1424	1431	Z Filip
955	IDNUM	13	23	50Z043233W
955	MEDICALRECORD	24	35	5090432.IJW
955	PATIENT	37	49	NESTEL, Jann
955	IDNUM	60	68	50Z04323
955	PATIENT	69	78	Lark Song
955	CITY	78	115	CHARTERS TOWERS\nSTATE: WA\nZIP: 2629
955	DATE	130	138	2/2/2004	2004-02-02
955	TIME	158	177	30/07/2013 at 08:58	2013-07-30T08:58
955	DEPARTMENT	177	211	IMVS\nHOSPITAL: MOUNT ISA HOSPITAL
955	DOCTOR	217	224	Ernesto
955	DOCTOR	1243	1259	DW\nDATE: 9/2/63	2063-02-09
955	DOCTOR	1287	1295	O Declet
956	IDNUM	14	24	18V0643812
956	MEDICALRECORD	25	36	1880643.XEF
956	PATIENT	38	53	GEBO, JAMES SAM
956	IDNUM	64	72	18V06438
956	STREET	73	78	Grave
956	CITY	78	109	ROSEBERYV\nSTATE: WA\nZIP: 2453
956	DATE	122	131	17/7/2011	2011-07-17
956	TIME	151	170	27/02/2014 at 11:04	2014-02-27T11:04
956	DEPARTMENT	170	226	MOLECULAR DIAGNOSTIC ONCOLOGY\nHOSPITAL: INJUNE HOSPITAL
956	DOCTOR	232	249	Finn Duane RACITI
956	DOCTOR	680	713	Leconey\nDOCTOR: Huge\nTIME: 110H
956	DOCTOR	891	923	Hagler\nTIME: 1217H11 on 27.2.14	2014-02-27T12:00
956	DOCTOR	1104	1134	Babs\nTIME: 1245Hrs on 27.2.14	2014-02-27T12:45
956	DOCTOR	2361	2369	C Venske
956	DATE	3870	3876	7/5/64	2064-05-07
958	IDNUM	13	23	65R095349O
958	MEDICALRECORD	24	35	6560953.MZO
958	PATIENT	37	48	Fore, Wyatt
958	IDNUM	59	67	65R09534
958	STREET	68	80	Rocky Spring
958	CITY	80	123	MOAMA\nSTATE: Northern Territory\nZIP: 3608
958	DATE	138	146	1/3/2010	2010-03-01
958	DEPARTMENT	178	221	MACQUARIE WARD\nHOSPITAL: JANDOWAE HOSPITAL
958	DOCTOR	222	241	Olen KAREEM SHAanda
958	DATE	315	322	14.5.64	2064-05-14
958	DATE	1684	1691	20.4.64	2064-04-20
958	DOCTOR	1725	1734	R Accetta
958	HOSPITAL	2353	2403	GREAT OCEAN ROAD HEALTH - LORNE COMMUNITY HOSPITAL
958	DATE	2538	2545	14.5.64	2064-05-14
958	DEPARTMENT	2559	2586	WALCHA MULTIPURPOSE SERVICE
959	MEDICALRECORD	1	12	2351154.BUW
959	PATIENT	13	28	PAVOLINI, JANET
959	IDNUM	28	53	23N11540\nIDNUM: 23N11540
959	DATE	62	70	6/5/2064	2064-06-05
959	DATE	1715	1722	28.4.64	2064-04-28
959	DOCTOR	1723	1732	F Vonsoen
960	IDNUM	13	23	44F716366H
960	MEDICALRECORD	24	34	442716.IPQ
960	PATIENT	36	46	Volk, JAME
960	IDNUM	47	72	44F71636\nIDNUM: 44F71636
960	STREET	75	86	Borers Arms
960	CITY	86	114	DUBBO\nSTATE: TAS\nZIP: 1314
960	DATE	135	143	5/4/2000	2000-05-04
960	DATE	163	172	12/5/2064	2064-05-12
960	DEPARTMENT	177	250	ONCOLOGY (GYNAE)\nHOSPITAL: RURAL NORTHWEST HEALTH - WARRACKNABEAL CAMPUS
960	DOCTOR	251	340	ANTONE CARMINE ANTONE CARMINE ANTONE CARMINE ANTONE CARMINE ANTONE CARMINE ANTONE CARMINE
960	DOCTOR	251	280	ANTONE CARMINE ANTONE CARMINE
960	DOCTOR	1098	1149	K Sangren\nDOCTOR: K Morro\nTIME: 4:10pm on 10.3.14	2014-03-10T16:10
960	DOCTOR	1700	1768	K Rosset\nDOCTOR: K Rossett\nDOCTOR: K Buda\nTIME: 4:20pm on 10.3.14	2014-03-10T16:20
960	DATE	4837	4844	13.5.64	2064-05-13
960	DOCTOR	4875	4884	K Kinnier
961	IDNUM	13	23	92B737314Q
961	MEDICALRECORD	24	35	9207373.ELQ
961	PATIENT	37	48	Seta, Ketur
961	IDNUM	61	69	92B73731
961	STREET	70	78	Bull Run
961	CITY	90	132	CAMPBELLTOWN\nSTATE: Queensland\nZIP: 2079
961	DATE	147	155	9/5/1999	1999-09-05
961	DATE	175	183	5/7/2064	2064-05-07
961	DEPARTMENT	188	235	MEDIC/SURGERY WARD\nHOSPITAL: YARRAWONGA HEALTH
961	DOCTOR	238	258	Ismael DERICK HERARD
961	DOCTOR	316	325	ALEJANDRO
961	DATE	348	355	13.5.64	2064-05-13
961	DATE	1554	1560	5/8/64	2064-05-08
961	DOCTOR	1591	1599	Y Hosten
961	DATE	2854	2861	13.5.64	2064-05-13
962	IDNUM	14	24	13S338272B
962	MEDICALRECORD	25	36	1373382.THB
962	PATIENT	37	46	RAHIB, D2
962	IDNUM	67	75	13S33827
962	STREET	76	87	Slumberland
962	CITY	87	124	RASMUSSEN\nSTATE: Victoria\nZIP: 2570
962	DATE	139	148	2/10/2027	2027-10-02
962	DATE	168	177	20/4/2064	2064-04-20
962	DEPARTMENT	182	226	ONCOLOGY (GYNAE)\nHOSPITAL: WUDINNA HOSPITAL
962	DOCTOR	233	251	Angelique JUDE Flo
962	DATE	3708	3715	22/4/64	2064-04-22
962	DOCTOR	3748	3755	E Renda
963	IDNUM	13	23	71P459330K
963	MEDICALRECORD	24	35	7154593.ICK
963	STREET	36	69	Meynard\nHOSPITAL: HUNTER Jeffrey
963	IDNUM	71	79	71P45933
963	CITY	91	136	WELLINGTON\nSTATE: New South Wales\nZIP: 3315
963	DATE	151	160	8/10/2022	2022-10-08
963	DEPARTMENT	192	250	DEPT OF CORRECTIVE SERVICES\nHOSPITAL: LAKE GRACE HOSPITAL
963	DOCTOR	251	276	PHILLIONAS ONFACK ORGOVAN
963	DOCTOR	855	911	S Galuppo\nDOCTOR: S Pinheiro\nTIME: 10:20am on 10.03.14	2014-03-10T10:20
963	DOCTOR	5167	5196	MZ\nDOCTOR: OZ\nDATE: 13.5.64	2064-05-13
963	DOCTOR	5256	5263	S Steel
974	MEDICALRECORD	1	12	2944794.XXV
974	PATIENT	14	33	OGILVIE, Louie Marc
974	IDNUM	37	62	29L47948\nIDNUM: 29L47948
974	DATE	71	80	16/5/2064	2064-05-16
974	DATE	1778	1785	15.5.64	2064-05-15
974	DOCTOR	1818	1827	G Lantaff
976	IDNUM	13	23	87H400447B
976	MEDICALRECORD	24	35	8724004.MSB
976	PATIENT	36	55	OER, ROLANDO Jackie
976	IDNUM	58	83	87H40044\nIDNUM: 87H40044
976	STREET	85	100	Gibbons Station
976	CITY	99	145	GLADSTONE\nSTATE: Western Australia\nZIP: 6917
976	DATE	169	178	18/8/2014	2014-08-18
976	DATE	198	207	7/10/2063	2063-10-07
976	DEPARTMENT	211	250	RECOVERY\nHOSPITAL: BARCALDINE HOSPITAL
976	DOCTOR	257	273	REGGIE Granville
976	DATE	347	354	18/7/63	2063-07-18
976	DATE	484	490	9.8.13	2013-09-08
976	DOCTOR	1049	1102	Logston\nDOCTOR: V Roshannon\nTIME: 10:20am on 8.5.13	2013-05-08T10:20
976	DOCTOR	3835	3852	QG\nDATE: 7.11.63	2063-11-07
976	DOCTOR	3884	3893	V Phegley
976	DOCTOR	6732	6741	V Stfleur
976	DATE	7536	7543	18/7/63	2063-07-18
976	DATE	7750	7759	19/5/2064	2064-05-19
978	MEDICALRECORD	1	12	8242720.OKA
978	PATIENT	12	38	SBARRA, Jin ANTONIA OTONIO
978	IDNUM	40	65	82L27205\nIDNUM: 82L27205
978	DATE	73	82	20/5/2064	2064-05-20
978	DOCTOR	1763	1792	FD\nDOCTOR: PW\nDATE: 15.5.64	2064-05-15
978	DOCTOR	1820	1828	W Hoppel
978	DOCTOR	2282	2310	W Huffstetler\nDATE: 20.5.64	2064-05-20
979	IDNUM	14	24	56U1224638
979	MEDICALRECORD	25	36	5681224.PJV
979	PATIENT	37	56	PINK, AURORE AURORE
979	IDNUM	67	75	56U12246
979	PATIENT	76	82	Raptor
979	CITY	82	124	OLD BAR\nSTATE: New South Wales\nZIP: 6030
979	DATE	139	149	12/11/2000	2000-11-12
979	TIME	169	188	11/03/2014 at 11:30	2014-03-11T11:30
979	DEPARTMENT	188	249	SOUTH SURGICAL RECESSMENT UNIT\nHOSPITAL: BARCALDINE HOSPITAL
979	DOCTOR	250	268	Randy KIESHA Ebert
979	DATE	5253	5260	16/5/64	2064-05-16
980	MEDICALRECORD	1	12	1461424.EED
980	PATIENT	13	32	Uzdygan, Jewel DYAN
980	IDNUM	33	41	14R14241
980	DATE	57	66	20/5/2064	2064-05-20
980	HOSPITAL	104	132	Liberty\nDOCTOR: D Serapilla
980	IDNUM	174	231	14R14241\nIDNUM: 14J14241\nDATE: 14R14241\nDATE: 14R14241	2023
980	DOCTOR	781	788	D Trent
980	DATE	795	804	20.5.2064	2064-05-20
981	IDNUM	14	24	19V924028D
981	MEDICALRECORD	25	36	1989240.GWD
981	PATIENT	38	55	Kinlock, STERLING
981	IDNUM	82	90	19V92402
981	STREET	91	97	Stones
981	CITY	97	132	THE ENTRANCE\nSTATE: VIC\nZIP: 1314
981	DATE	147	157	20/12/2013	2013-12-20
981	TIME	177	196	12/03/2014 at 11:14	2014-03-12T11:14
981	DEPARTMENT	196	236	Anatomical\nHOSPITAL: ESPERANCE HOSPITAL
981	DOCTOR	241	260	Willis CEDRICK-Pong
981	DATE	2832	2839	15.5.64	2064-05-15
981	DOCTOR	2872	2882	D Rabenold
981	ORGANIZATION	4439	4483	American Standards\nHOSPITAL: MONTO HOSPITAL
983	IDNUM	13	23	77R045186L
983	MEDICALRECORD	24	35	7760451.VRL
983	PATIENT	36	51	Neawham, RICKIE
983	IDNUM	78	86	77R04518
983	STREET	87	93	Centre
983	CITY	93	124	GRIFFITH\nSTATE: VIC\nZIP: 5022
983	DATE	139	149	20/12/2013	2013-12-20
983	TIME	169	188	12/03/2014 at 11:14	2014-03-12T11:14
983	DEPARTMENT	188	220	West\nHOSPITAL: BILOELA HOSPITAL
983	DOCTOR	225	231	Edison
983	DOCTOR	2853	2870	DD\nDATE: 15.5.64	2064-05-15
983	DOCTOR	2901	2911	S Guterman
983	ORGANIZATION	4468	4534	Pfable\nHOSPITAL: AUSTIN HEALTH - HEIDELBERG REPATRIATION HOSPITAL
984	IDNUM	13	23	40A885486G
984	MEDICALRECORD	24	35	4008854.XQG
984	PATIENT	37	50	Doucet, Lilly
984	IDNUM	51	100	40A885,40A88545\nIDNUM: 40A88548\nIDNUM: 40A88548
984	STREET	78	93	Vineyard County
984	CITY	92	141	PEREGIAN BEACH\nSTATE: New South Wales\nZIP: 0839
984	DATE	165	174	5/10/1987	1987-10-05
984	DEPARTMENT	206	260	CPC Pathology\nHOSPITAL: SOUTH COAST DISTRICT HOSPITAL
984	DOCTOR	263	283	PARKER MERISSA VANNA
984	AGE	370	372	81
984	DOCTOR	3614	3631	SO\nDATE: 8.10.63	2063-10-08
984	DOCTOR	3630	3638	G Gantel
985	IDNUM	14	24	45E667093F
985	MEDICALRECORD	25	35	451667.CZI
985	PATIENT	36	64	Horikoshi, GEORGIE Hanikooti
985	IDNUM	66	91	45E66709\nIDNUM: 45E66709
985	STREET	94	101	Phleger
985	CITY	101	139	GLEN INNES\nSTATE: Tasmania\nZIP: 2331
985	DATE	160	169	21/1/1997	1997-01-21
985	DATE	189	198	19/5/2064	2064-05-19
985	DEPARTMENT	202	259	Anatomical Pathology\nHOSPITAL: KEMPSEY DISTRICT HOSPITAL
985	DOCTOR	266	283	ALDA YAWURU EVERT
985	DOCTOR	1072	1100	Tad Clarthy\nDATE: 19.5.2064	2064-05-19
985	DATE	2625	2632	20.5.64	2064-05-20
985	DOCTOR	2662	2669	L Kapps
988	IDNUM	13	23	03A687151O
988	MEDICALRECORD	24	35	0306871.OEO
988	PATIENT	36	53	GROSSHANS, LYSART
988	IDNUM	67	92	03A68715\nIDNUM: 03A68715
988	CITY	106	137	REDCLIFFS\nSTATE: NT\nZIP: 4514
988	DATE	159	169	15/11/2004	2004-11-15
988	DATE	189	198	20/5/2064	2064-05-20
988	DEPARTMENT	203	272	South Western Area\nHOSPITAL: EDENHOPE AND DISTRICT MEMORIAL HOSPITAL
988	DOCTOR	275	303	DENVER Jamaica\nTIME: 0915IE
988	DATE	411	415	2059	2059
988	DATE	1079	1085	33.5mm	2059
988	DOCTOR	1206	1264	Gallbladder\nDOCTOR: A Fieldhouse\nTIME: 9:30am on 18/3/14	2014-03-18T09:30
988	DATE	1821	1828	21/5/64	2064-05-21
988	DOCTOR	1859	1868	A Cocuzza
988	HOSPITAL	2230	2246	AUGUSTA HOSPITAL
988	IDNUM	2455	2463	03A68715
989	MEDICALRECORD	1	12	5187082.DZW
989	PATIENT	12	25	Weihe, Dwaugh
989	IDNUM	27	35	51X70821
989	DATE	51	60	22/5/2064	2064-05-22
989	DOCTOR	379	408	XA\nDOCTOR: GM\nDATE: 16.5.64	2064-05-16
989	DOCTOR	406	434	O Lunford\nDOCTOR: O Montero
990	IDNUM	13	23	19T7392772
990	MEDICALRECORD	24	35	1977392.SUF
990	PATIENT	36	52	Hainband, FALLON
990	IDNUM	64	72	19T73927
990	STREET	73	83	S Crandall
990	CITY	83	115	COONAMBLE\nSTATE: QLD\nZIP: 2118
990	DATE	130	138	3/9/1987	1987-09-03
990	TIME	158	177	12/03/2014 at 13:15	2014-03-12T13:15
990	DEPARTMENT	177	221	Southern IML\nHOSPITAL: ROXBY DOWNS HOSPITAL
990	DOCTOR	226	240	JUDE MASTROLIA
990	DOCTOR	676	728	D Hagler\nDOCTOR: D Gurimal\nTIME: 14.40 on 12.03.14	2014-03-12T14:40
990	DOCTOR	952	969	OZ\nDATE: 15.5.64	2064-05-15
990	DOCTOR	969	975	D Tley
991	IDNUM	13	23	67P750326N
991	MEDICALRECORD	24	34	675750.IHP
991	PATIENT	35	48	ROBBIE, ashes
991	IDNUM	68	76	67P75032
991	STREET	77	83	Delton
991	CITY	83	120	KYABRAM\nSTATE: Queensland\nZIP: 2168
991	DATE	135	145	27/11/2003	2003-11-27
991	TIME	165	184	28/01/2014 at 15:03	2014-01-28T15:03
991	DEPARTMENT	184	226	DARLING POINT\nHOSPITAL: WALLAROO HOSPITAL
991	DOCTOR	229	257	Maria GRADY MCLATY PRAUGHLAN
991	DOCTOR	274	279	LIAM,
991	DOCTOR	1732	1748	MZ\nDATE: 1.3.64	2064-01-03
991	DOCTOR	1776	1784	A Seiler
991	ORGANIZATION	3232	3273	Beazer\nHOSPITAL: WERRIBEE MERCY HOSPITAL
993	IDNUM	14	24	09Y051132K
993	MEDICALRECORD	25	35	099051.CKH
993	PATIENT	37	55	Herington, Quinton
993	IDNUM	66	74	09Y05113
993	PATIENT	75	83	Wakemore
993	CITY	83	116	CAMPERDOWN\nSTATE: TAS\nZIP: 5151
993	DATE	131	140	30/8/2003	2003-08-30
993	TIME	160	179	17/01/2014 at 08:56	2014-01-17T08:56
993	DEPARTMENT	179	231	3HR STAY SURGICALUNIT\nHOSPITAL: BARWON HEALTH NORTH
993	DOCTOR	236	257	Merrill Virgil Ereaux
993	DATE	356	364	8.5.2064	2064-05-08
993	DATE	2114	2121	19/3/64	2064-03-19
993	DOCTOR	2123	2130	B Zerte
993	DOCTOR	2339	2368	B Depung\nDOCTOR: B 099051133
993	DATE	3827	3835	8.5.2064	2064-05-08
993	HOSPITAL	3850	3893	KINGAROY HOSPITAL & COMMUNITY HEALTH CENTRE
993	DOCTOR	3907	3928	Riede\nDATE: 6.5.2064	2064-06-05
993	HOSPITAL	3970	3990	SANDRINGHAM HOSPITAL
994	IDNUM	13	23	67U072190S
994	MEDICALRECORD	24	35	6770721.ZCS
994	PATIENT	37	52	Denni, Madalene
994	IDNUM	63	71	67U07219
994	CITY	81	113	FRANKSTON\nSTATE: VIC\nZIP: 3977
994	DATE	128	137	10/5/1987	1987-10-05
994	TIME	157	176	20/03/2014 at 14:54	2014-03-20T14:54
994	DEPARTMENT	176	205	PaLMS\nHOSPITAL: ESK HOSPITAL
994	DOCTOR	212	229	PHILLIP AUGUSTINE
994	DATE	2717	2724	23/5/64	2064-05-23
994	DOCTOR	2757	2764	Q Eynon
994	ORGANIZATION	3761	3823	United Parcel\nHOSPITAL: SHOALHAVEN DISTRICT MEMORIAL HOSPITAL
995	IDNUM	13	23	15Q093259B
995	MEDICALRECORD	24	34	156093.FOX
995	PATIENT	36	49	OLSTEN, Hilar
995	IDNUM	69	77	15Q09325
995	STREET	78	87	Montville
995	CITY	87	124	PENGUIN\nSTATE: Queensland\nZIP: 2650
995	DATE	137	145	6/3/2024	2024-06-03
995	DEPARTMENT	177	250	Pathology West\nHOSPITAL: BLUE MOUNTAINS DISTRICT ANZAC MEMORIAL HOSPITAL
995	DOCTOR	253	277	Artoselesby Randy-SENTEB
995	DATE	2368	2375	23/5/64	2064-05-23
995	DOCTOR	2376	2387	E Smeatherm
995	HOSPITAL	4115	4125	BAIRNSDALE
997	MEDICALRECORD	2	12	734114.HDS
997	PATIENT	13	26	Teagle, Moira
997	IDNUM	27	35	73M11421
997	DATE	51	60	27/5/2064	2064-05-27
997	DATE	92	99	27.5.64	2064-05-27
997	DATE	768	774	3.1.64	2064-03-01
997	DOCTOR	775	784	S Aswagon
997	DATE	1150	1157	27.5.64	2064-05-27
998	IDNUM	13	23	94E715165V
998	MEDICALRECORD	24	35	9417151.ROV
998	PATIENT	37	51	BASSETT, JASON
998	IDNUM	52	77	94E71516\nIDNUM: 94E71516
998	CITY	89	138	NAMBUCCA HEADS\nSTATE: South Australia\nZIP: 4709
998	DATE	162	172	13/11/1995	1995-11-13
998	TIME	192	211	03/04/2013 at 14:56	2013-04-03T14:56
998	DEPARTMENT	211	291	INTENSIVE CARE UNIT SOUTH\nHOSPITAL: CAPRICORN COAST HOSPITAL AND HEALTH SERVICE
998	DOCTOR	296	319	WADJARRI RAYMON OPATRNY
998	DOCTOR	3540	3568	OZ\nDOCTOR: DU\nDATE: 6.6.63	2063-06-06
998	DOCTOR	3596	3604	H Voeltz
999	IDNUM	13	23	42A735223D
999	MEDICALRECORD	24	35	4207352.GJD
999	PATIENT	37	52	AARONSON, VALDA
999	IDNUM	53	78	42A73522\nIDNUM: 42A73522
999	STREET	81	87	Jossie
999	CITY	87	122	COONABARABRAN\nSTATE: SA\nZIP: 6640
999	DATE	146	154	7/5/1992	1992-05-07
999	TIME	174	193	03/04/2013 at 08:58	2013-04-03T08:58
999	DEPARTMENT	193	242	3HR STAY SURGICALUNIT\nHOSPITAL: WOOMERA HOSPITAL
999	DOCTOR	245	264	Julianna DixIEGZELL
999	DATE	344	351	24.6.63	2063-06-24
999	DOCTOR	2053	2069	CY\nDATE: 6/6/63	2063-06-06
999	DOCTOR	2100	2109	M Zirkles
999	DATE	2803	2810	24.6.63	2063-06-24
file10073	IDNUM	8	18	09W766281M
file10073	MEDICALRECORD	27	35	09876628
file10073	HOSPITAL	47	70	SCOTT MEMORIAL HOSPITAL
file10073	IDNUM	115	166	09W76628\nIDNUM: 09W766281M\nPATIENT: GOLOM, Oriane
file10073	DOCTOR	807	822	Mardell Tackett
file10073	DOCTOR	1117	1120	F.S
file10073	DOCTOR	1217	1248	Hour\nTIME: 12:37pm on 21/12/14	2014-12-21T12:37
file10073	DOCTOR	1435	1478	MELIDA FEURTADO\nDOCTOR: MELIDA\nDOCTOR: A.
file10073	DOCTOR	1539	1576	Vandervort\nTIME: 12:37pm on 22/11/18	2016-11-22T12:37
file10073	DOCTOR	1726	1741	F/S\nDOCTOR: X.
file10073	TIME	1840	1859	12:37pm on 25/11/17	2017-11-25T12:37
file10073	DOCTOR	2132	2136	Mira
file10073	TIME	2164	2183	12:37pm on 22/12/18	2016-12-22T12:37
file10073	DOCTOR	4584	4593	A. Slider
file10073	DATE	6507	6516	30/1/2068	2068-01-30
file10249	HOSPITAL	36	58	GOULBURN BASE HOSPITAL
file10249	PATIENT	71	77	Cagnon
file10249	IDNUM	86	96	57S887349V
file10249	MEDICALRECORD	103	109	577887
file10249	DATE	235	242	7.10.68	2068-10-07
file10249	DATE	268	274	5.8.66	2066-05-08
file10249	DATE	3018	3024	8/7/69	2069-07-08
file10249	DOCTOR	3056	3064	P Ranney
file10249	DATE	5460	5466	4.8.68	2068-04-08
file10249	DATE	5853	5860	4.11.69	2069-11-04
file10249	TIME	6187	6200	2018/2/2/2063	2017-02-02T00:00
file10249	PATIENT	6219	6229	Benintendi
file12618	HOSPITAL	36	60	PARKES DISTRICT HOSPITAL
file12618	STREET	73	82	Lieberman
file12618	IDNUM	91	101	78J4882982
file12618	MEDICALRECORD	108	114	783488
file12618	PATIENT	167	173	Reazer
file12618	IDNUM	224	297	78J48829\nIDNUM: 78J48829\nIDNUM: 78J4882982\nPATIENT: RIEKE, LOREN Marie
file12618	HOSPITAL	289	324	DONGARA MULTI-PURPOSE HEALTH CENTRE
file12618	DOCTOR	746	778	Lewis\nTIME: 3:45pm on 3/04/2019	2019-04-03T15:45
file12618	DATE	2834	2842	6/7/2071	2071-07-06
file12618	DOCTOR	2848	2859	U. Loughlin
file12618	DATE	5639	5647	6/8/2070	2070-08-06
file12618	DATE	6077	6081	2018	2013-02-03
file12618	DOCTOR	6129	6138	U Haffner
file12618	DATE	6145	6152	14.5.74	2074-05-14
file12618	TIME	6179	6188	2019/3/29	2019-03-09T00:00:00
file12618	STREET	6209	6217	Bisected
file12740	HOSPITAL	36	72	EIDSVOLD MULTIPURPOSE HEALTH SERVICE
file12740	PATIENT	85	88	SOL
file12740	IDNUM	97	107	36G4082565
file12740	MEDICALRECORD	114	120	362408
file12740	STREET	173	179	Draime
file12740	IDNUM	230	309	36G40825\nIDNUM: 36G40825\nIDNUM: 36G4082565\nPATIENT: Seebstone, JEFFEREY AMYA
file12740	HOSPITAL	307	326	NARRANDERA HOSPITAL
file12740	DOCTOR	1469	1491	NOLAN DYS\nDOCTOR: Drs
file12740	DATE	1525	1532	29.7/22	2022-07-29
file12740	DATE	2256	2265	29/8/2069	2069-08-29
file12740	DATE	2336	2344	6/9/2069	2069-06-09
file12740	DOCTOR	2350	2360	I Habearer
file12740	DATE	3963	3971	8/6/2070	2070-08-06
file12740	TIME	4002	4011	2019/6/30	2019-06-09T00:00:00
file1291	HOSPITAL	36	51	WINTON HOSPITAL
file1291	PATIENT	63	72	Grosswils
file1291	IDNUM	83	93	57X0091140
file1291	MEDICALRECORD	100	106	579009
file1291	IDNUM	210	260	57X00911\nIDNUM: 57X0091140\nPATIENT: HARROW, KIND
file1291	HOSPITAL	271	289	DOOMADGEE HOSPITAL
file1291	DATE	662	671	20/4/2071	2071-04-20
file1291	DATE	3210	3218	6/5/2071	2071-06-05
file1291	DOCTOR	3244	3253	N. Living
file1291	TIME	5274	5293	2818-09-14 00:00:00	2818-09-14T00:00:00
file1291	PATIENT	5306	5313	SANFORD
file13206	HOSPITAL	36	83	BARWON HEALTH - SOUTH GEELONG RENAL UNIT CAMPUS
file13206	PATIENT	96	103	Hershey
file13206	IDNUM	112	122	05T1202623
file13206	MEDICALRECORD	129	134	57120
file13206	IDNUM	239	306	05T12026\nIDNUM: 05T12026\nIDNUM: 05T1202623\nPATIENT: RAGO, Rosita
file13206	HOSPITAL	298	313	BOOLEROO CAMPUS
file13206	DOCTOR	654	673	C.\nDATE: 29/4/2069	2069-04-29
file13206	DATE	3235	3243	4/5/2070	2070-04-05
file13206	DOCTOR	3269	3278	C. Schadt
file13206	TIME	5300	5309	2019/2/24	2024-02-24
file13536	HOSPITAL	36	56	MARYBOROUGH HOSPITAL
file13536	PATIENT	69	74	Navas
file13536	IDNUM	83	93	63P141221R
file13536	MEDICALRECORD	100	107	6361412
file13536	AGE	245	247	79
file13536	DOCTOR	890	896	Q Nipp
file13536	DOCTOR	1356	1364	Q Manfre
file13536	DOCTOR	1978	1986	Q Easdon
file13536	DOCTOR	4157	4164	Q Banco
file13536	DOCTOR	4562	4569	Q Armon
file13536	DATE	4625	4631	7/1/73	2073-01-07
file13536	DOCTOR	4663	4671	Q Halama
file13536	DATE	7606	7614	8/8/2070	2070-08-08
file13536	TIME	7876	7885	2020/5/30	2030-05-20
file13536	PATIENT	7907	7911	Lime
file14038	HOSPITAL	36	60	ROYAL HOSPITAL FOR WOMEN
file14038	PATIENT	73	80	Kosinar
file14038	IDNUM	89	99	11M1723890
file14038	MEDICALRECORD	106	112	114172
file14038	IDNUM	216	283	11M17238\nIDNUM: 11M17238\nIDNUM: 11M17238\nPATIENT: MCKOR, PRESENT
file14038	HOSPITAL	278	295	COLEDALE HOSPITAL
file14038	DOCTOR	683	701	Lucien\nDOCTOR: E.
file14038	DOCTOR	716	747	Langford\nTIME: 28.3.20 at 2:46	2067-03-28T14:46
file14038	DATE	2300	2308	6/5/2071	2071-06-05
file14038	DOCTOR	2334	2342	E Bogosh
file14038	DATE	4513	4521	6/5/2070	2070-06-05
file14038	TIME	4550	4568	2020/2/28 00:00:00	2066-02-08T00:00:00
file14038	PATIENT	4582	4592	Casstevens
file15971	HOSPITAL	36	59	THE CHILDREN'S HOSPITAL
file15971	PATIENT	84	92	Spaziani
file15971	IDNUM	101	111	32D8722374
file15971	MEDICALRECORD	118	124	321872
file15971	STREET	177	182	Walby
file15971	IDNUM	233	307	32D87223\nIDNUM: 32D87223\nIDNUM: 32D8722374\nPATIENT: PATA, ALLEN Raylene
file15971	HOSPITAL	299	322	LAMEROO HEALTH SERVICES
file15971	DOCTOR	744	777	Cortez\nTIME: 3:45pm on 3/04/2020	2020-04-03T15:45
file15971	DATE	2831	2839	8/6/2069	2069-06-08
file15971	DOCTOR	2865	2874	J. Pilger
file15971	DATE	5634	5642	8/5/2069	2069-08-05
file15971	DATE	6072	6076	2018	2013-02-03
file15971	DOCTOR	6124	6133	J Barcley
file15971	DATE	6140	6147	16.5.73	2073-05-16
file15971	TIME	6173	6190	2019/3/2 00:00:00	2019-03-02T00:00:00
file15971	PATIENT	6205	6215	Monteagudo
file16093	HOSPITAL	36	64	PENOLA WAR MEMORIAL HOSPITAL
file16093	STREET	77	81	Tory
file16093	IDNUM	90	100	90Z8933957
file16093	MEDICALRECORD	107	113	909893
file16093	PATIENT	165	174	Breitweum
file16093	IDNUM	225	291	90Z89339\nIDNUM: 90Z89339\nIDNUM: 90Z8933957\nPATIENT: Pioche, ZIE
file16093	HOSPITAL	301	319	DANDENONG HOSPITAL
file16093	DOCTOR	1462	1484	STEVE Rux\nDOCTOR: Drs
file16093	DATE	1538	1545	26.6.22	2022-06-26
file16093	DATE	2248	2257	30/9/2071	2071-09-30
file16093	DATE	2328	2336	6/5/2069	2069-06-05
file16093	DOCTOR	2361	2370	Y Comnick
file16093	DATE	3955	3963	9/6/2071	2071-06-09
file16093	TIME	3994	4003	2019/3/31	2031-03-11
file16093	PATIENT	4025	4030	TYLER
file1637	HOSPITAL	36	55	KUNUNOPPIN HOSPITAL
file1637	PATIENT	67	71	Licz
file1637	IDNUM	81	91	11Q4941541
file1637	MEDICALRECORD	98	104	116494
file1637	IDNUM	208	260	11Q49415\nIDNUM: 11Q4941541\nPATIENT: PIRRELLO, OAMD
file1637	HOSPITAL	271	290	MILDURA BASE PUBLIC
file1637	DOCTOR	640	659	D.\nDATE: 21/4/2069	2069-04-21
file1637	DATE	3218	3226	4/6/2070	2070-06-04
file1637	DOCTOR	3252	3262	D. Gouldie
file1637	TIME	5283	5302	2818-09-14 00:00:00	2818-09-14T00:00:00
file1637	STREET	5315	5321	Waylon
file1732	IDNUM	12	20	1.99505E
file1732	HOSPITAL	36	63	LAUNCESTON GENERAL HOSPITAL
file1732	PATIENT	76	82	Elliot
file1732	IDNUM	91	101	69N415212N
file1732	MEDICALRECORD	108	115	6954152
file1732	PATIENT	168	175	Modesto
file1732	DATE	1339	1346	28/9/72	2072-09-28
file1732	DOCTOR	1349	1355	R Good
file1732	TIME	3805	3822	2737/9/3 00:00:00	2737-09-03T00:00:00
file1732	STREET	3837	3842	Sirko
file18432	HOSPITAL	36	60	HARVEY DISTRICT HOSPITAL
file18432	IDNUM	90	100	27J5363608
file18432	MEDICALRECORD	107	113	273536
file18432	IDNUM	217	289	27J53636\nIDNUM: 27J53636\nIDNUM: 27J5373608\nPATIENT: Clemmon, WILLETTE
file18432	HOSPITAL	281	309	BOURKE MULTI PURPOSE SERVICE
file18432	DOCTOR	714	758	Taste\nDOCTOR: XO\nTIME: 3:20pm on 5/06/2021	2017-06-05T15:20
file18432	DATE	2251	2259	8/8/2069	2069-08-08
file18432	DOCTOR	2285	2294	G. Schehr
file18432	DATE	7013	7021	9/5/2070	2070-09-05
file18432	TIME	7052	7070	2019/5/27 00:00:00	2756-05-21T00:00:00
file18432	STREET	7084	7090	Hilles
file19280	IDNUM	8	18	48A136228H
file19280	MEDICALRECORD	27	35	48013622
file19280	HOSPITAL	47	79	FRANKSTON PUBLIC SURGICAL CENTRE
file19280	IDNUM	124	179	48A13622\nIDNUM: 48A136228H\nPATIENT: Risden, BABS KIRK
file19280	DOCTOR	715	716	L
file19280	DOCTOR	717	735	Faurot\nDOCTOR: L.
file19280	DATE	745	754	30.6.2065	2065-06-30
file19280	DOCTOR	1221	1222	L
file19280	DOCTOR	1236	1237	L
file19280	DATE	1254	1263	28.7.2068	2068-07-28
file19280	DOCTOR	2463	2470	L. Peri
file19280	DATE	3575	3584	30/7/2069	2069-07-30
file1933	HOSPITAL	36	50	BENALLA HEALTH
file1933	STREET	63	69	Mckoon
file1933	IDNUM	78	88	95W1572866
file1933	MEDICALRECORD	95	101	958157
file1933	IDNUM	205	257	95W15728\nIDNUM: 95W1572866\nPATIENT: VESSELL, Selby
file1933	HOSPITAL	266	282	WHYALLA HOSPITAL
file1933	DATE	655	664	20/4/2070	2070-04-20
file1933	DATE	3205	3213	5/6/2069	2069-06-05
file1933	DOCTOR	3239	3249	Z. Krenzke
file1933	TIME	5270	5289	2818-09-14 00:00:00	2818-09-14T00:00:00
file1933	PATIENT	5302	5308	DARWIN
file20430	HOSPITAL	36	59	MOREE DISTRICT HOSPITAL
file20430	PATIENT	72	78	Rodger
file20430	IDNUM	87	97	16O758135B
file20430	IDNUM	216	278	16O75813\nIDNUM: 16O75813\nIDNUM: 16O758135B\nPATIENT: Banbury
file20430	HOSPITAL	276	299	MATER MOTHER'S HOSPITAL
file20430	DATE	579	586	20/5/70	2070-05-20
file20430	DOCTOR	613	620	Lipsitz
file20430	DATE	863	870	24/4/69	2069-04-24
file20430	DOCTOR	871	906	Jingauroend\nDOCTOR: of endometrium
file20430	DATE	998	1010	1100 24/4/69	2069-04-24
file20430	DOCTOR	1271	1273	O.
file20430	DATE	1273	1279	11.5am	2065-02-11
file20430	DATE	1580	1587	20.2.20	20202-02-20
file20430	DATE	3868	3877	21/4/2071	2071-04-21
file20430	DOCTOR	3903	3915	O. Frederico
file20430	DATE	6124	6133	28/4/2070	2070-04-28
file20430	DATE	6162	6173	2020/2/2065	2065-02-20
file20430	PATIENT	6194	6199	Rudis
file20783	DATE	12	20	20251213	2025-12-13
file20783	HOSPITAL	32	54	GRIFFITH BASE HOSPITAL
file20783	IDNUM	83	93	74K879293K
file20783	MEDICALRECORD	100	106	743879
file20783	IDNUM	210	287	74K87929\nIDNUM: 74K87929\nIDNUM: 74K87929\nIDNUM: 74K879291K\nPATIENT: KIED,
file20783	HOSPITAL	267	292	SWAN HILL DISTRICT HEALTH
file20783	DOCTOR	658	691	Sheaff\nTIME: 2:29pm on 4/03/2063	2063-04-03T14:29
file20783	DATE	1856	1864	5/6/2071	2071-06-05
file20783	DOCTOR	1890	1900	T. Collums
file20783	DATE	4385	4394	9/11/2071	2071-11-09
file20783	TIME	4423	4440	2021/3/4 00:00:04	2020-03-04T00:00:00
file20783	PATIENT	4455	4463	Adamczak
file20864	IDNUM	8	18	22G800251S
file20864	MEDICALRECORD	27	35	22280025
file20864	HOSPITAL	47	74	WENTWORTH DISTRICT HOSPITAL
file20864	IDNUM	119	173	22G80025\nIDNUM: 22G800251S\nPATIENT: LUSCAVAGE, Dierd
file20864	DATE	268	275	18/2/67	2067-02-18
file20864	DATE	3633	3642	30/6/2065	2065-06-30
file20864	DATE	5045	5052	19/2/65	2065-02-19
file20980	IDNUM	8	18	43X400109D
file20980	MEDICALRECORD	27	35	43940010
file20980	HOSPITAL	47	65	BLACKTOWN HOSPITAL
file20980	IDNUM	110	165	43X40010\nIDNUM: 43X400109D\nPATIENT: Diploado, JANGALA
file20980	DOCTOR	424	442	Maiers\nDOCTOR: M.
file20980	DATE	487	494	26/4/15	2015-04-26
file20980	DATE	2815	2824	29/9/2068	2068-09-29
file20980	DOCTOR	2850	2860	M Fielding
file20980	DATE	4951	4959	1/9/2068	2068-09-01
file20986	DATE	12	19	2.00103	2066-02-11
file20986	HOSPITAL	36	83	BLUE MOUNTAINS DISTRICT ANZAC MEMORIAL HOSPITAL
file20986	IDNUM	111	121	01U4212684
file20986	MEDICALRECORD	128	135	1742126
file20986	IDNUM	240	292	01U42126\nIDNUM: 01U4212684\nPATIENT: HENCHEL, ROOKE
file20986	HOSPITAL	304	351	COOLAMON-GANMAIN MULTI PURPOSE SERVICE HOSPITAL
file20986	DATE	3787	3795	9/6/2070	2070-09-06
file20986	DOCTOR	4151	4153	B.
file20986	STREET	4154	4161	Carcamo
file20986	DATE	6948	6951	Now	2013-03-01
file20986	DATE	8032	8041	16/6/2071	2071-06-16
file20986	TIME	8425	8436	2020/4/2066	2066-04-02
file20986	PATIENT	8457	8460	Sol
file21189	DATE	12	19	2.00103	2066-02-11
file21189	HOSPITAL	36	62	HOLBROOK DISTRICT HOSPITAL
file21189	IDNUM	90	100	59Q5422268
file21189	MEDICALRECORD	107	115	59654222
file21189	IDNUM	219	284	59Q54222\nIDNUM: 59Q5422\nIDNUM: 59Q542268\nPATIENT: SILCOX, DORE
file21189	HOSPITAL	282	319	CASINO AND DISTRICT MEMORIAL HOSPITAL
file21189	DATE	3755	3763	6/6/2070	2070-06-06
file21189	DOCTOR	4119	4121	P.
file21189	STREET	4122	4130	Cartland
file21189	DATE	6917	6920	Now	2013-03-01
file21189	DATE	8001	8010	17/8/2069	2069-08-17
file21189	TIME	8394	8408	2019/6/12/2066	2066-06-12T00:00
file21189	PATIENT	8426	8431	Ricky
file21297	IDNUM	8	18	17M563384D
file21297	MEDICALRECORD	27	33	174563
file21297	HOSPITAL	45	62	LAVERTON HOSPITAL
file21297	IDNUM	106	174	17M56338\nIDNUM: 17M56338\nIDNUM: 17M563384D\nPATIENT: OGLESBY, ADAN
file21297	DATE	213	221	14/10/65	2065-10-14
file21297	DATE	243	251	20/10/68	2068-10-20
file21297	DATE	273	281	22/10/69	2069-10-22
file21297	DATE	751	760	7.10.2068	2068-07-10
file21297	DATE	2227	2236	10/9/2065	2065-09-10
file21297	DOCTOR	2262	2271	D Swanger
file21297	DATE	4530	4540	14/10/2065	2065-10-14
file21297	DATE	4566	4573	17/9/65	2065-09-17
file21297	DATE	5229	5237	15/10/65	2065-10-15
file21297	DATE	5262	5269	18/9/65	2065-09-18
file21297	DATE	5974	5981	17/9/66	2066-09-17
file21297	DATE	6006	6013	21/6/66	2066-06-21
file21297	DEPARTMENT	6013	6048	McGimsCA\nHOSPITAL: FRANSIS BOHanni
file21297	DATE	6365	6372	22/6/70	2070-06-22
file21392	HOSPITAL	36	88	BERRIGAN WAR MEMORIAL HOSPITAL/MULTI PURPOSE SERVICE
file21392	PATIENT	100	107	Bartlow
file21392	IDNUM	117	127	38D1642325
file21392	MEDICALRECORD	134	142	38116423
file21392	IDNUM	246	298	38D16423\nIDNUM: 38D1642325\nPATIENT: GARONE, DEANNA
file21392	HOSPITAL	307	325	GREENWICH HOSPITAL
file21392	DATE	3761	3769	6/8/2070	2070-08-06
file21392	DOCTOR	4125	4127	I.
file21392	PATIENT	4128	4136	Jakobsen
file21392	DATE	6923	6926	Now	2013-03-01
file21392	DATE	8007	8016	16/6/2071	2071-06-16
file21392	TIME	8401	8410	2020/5/27	2027-05-17
file21392	PATIENT	8432	8441	Alejandro
file21703	IDNUM	8	18	86Z2842909
file21703	MEDICALRECORD	27	34	8692842
file21703	HOSPITAL	46	69	BARMERA HEALTH SERVICES
file21703	IDNUM	161	238	86Z28429\nIDNUM: 86Z28429\nIDNUM: 86Z2842909\nPATIENT: UBRY, JOHNATHON Jerald
file21703	DOCTOR	557	576	Fairyak\nDOCTOR: X.
file21703	PATIENT	653	660	Harapat
file21703	DATE	3879	3888	24/9/2068	2068-09-24
file21703	DOCTOR	4453	4461	X Angove
file21703	DATE	7180	7189	28/9/2068	2068-09-28
file21703	ORGANIZATION	7214	7240	Sprints\nDEPARTMENT: Orana
file21703	DATE	8034	8042	9/1/2069	2069-01-09
file2179	DATE	12	18	2.0131	2011-02-01
file2179	HOSPITAL	36	64	LOCKHART & DISTRICT HOSPITAL
file2179	PATIENT	76	81	Hager
file2179	IDNUM	91	101	07R8851593
file2179	MEDICALRECORD	108	113	76885
file2179	PATIENT	166	169	ROD
file2179	IDNUM	222	300	07R88515\nIDNUM: 07R88515\nIDNUM: 07R8851593\nPATIENT: Muncey\nPATIENT: Munise
file2179	HOSPITAL	289	314	PAMBULA DISTRICT HOSPITAL
file2179	DOCTOR	736	768	Wayne\nTIME: 3:45pm on 5/03/2019	2019-03-05T15:45
file2179	DATE	2822	2830	6/6/2069	2069-06-06
file2179	DOCTOR	2856	2869	C. Desrosiers
file2179	DATE	5629	5637	6/6/2069	2069-06-06
file2179	DATE	6067	6071	2018	2013-02-03
file2179	DOCTOR	6119	6125	C Lill
file2179	DATE	6132	6139	14.6.73	2073-06-14
file2179	TIME	6165	6183	2080/4/11 00:00:11	2067-04-11T00:00:11
file2179	STREET	6197	6203	Pelech
file21863	HOSPITAL	36	63	ALEXANDRA DISTRICT HOSPITAL
file21863	PATIENT	76	81	BRYAN
file21863	IDNUM	90	100	65N8062076
file21863	MEDICALRECORD	107	113	655806
file21863	IDNUM	217	267	65N80620\nIDNUM: 65N8062076\nPATIENT: BARCIK, KERA
file21863	HOSPITAL	276	308	NUMURKAH DISTRICT HEALTH SERVICE
file21863	DOCTOR	713	727	Q.\nDOCTOR: Q.
file21863	DATE	2249	2258	4/10/2071	2071-10-04
file21863	DOCTOR	2284	2293	Q. Silver
file21863	DATE	7017	7026	5/11/2069	2069-11-05
file21863	TIME	7057	7074	2019/3/5 00:00:00	2019-03-05T00:00:00
file21863	PATIENT	7089	7093	Gerl
file22205	DATE	12	19	2.00103	2066-02-11
file22205	HOSPITAL	36	57	OSBORNE PARK HOSPITAL
file22205	STREET	70	78	Alterman
file22205	IDNUM	87	97	23J8372659
file22205	MEDICALRECORD	104	112	23383726
file22205	IDNUM	216	268	23J83726\nIDNUM: 23J8372659\nPATIENT: FICHTNER, Lita
file22205	HOSPITAL	277	294	GOODOOGA HOSPITAL
file22205	DATE	3730	3738	9/5/2070	2070-09-05
file22205	DOCTOR	4094	4095	F
file22205	STREET	4096	4103	Snecler
file22205	DATE	6890	6893	Now	2013-03-01
file22205	DATE	7974	7983	15/8/2069	2069-08-15
file22205	TIME	8367	8384	2019/6/7 00:00:07	2019-06-07T00:00:07
file22205	PATIENT	8398	8404	Elrich
file22269	IDNUM	8	18	70F957323I
file22269	MEDICALRECORD	27	34	7029573
file22269	HOSPITAL	46	84	MUNDUBBERA MULTIPURPOSE HEALTH SERVICE
file22269	IDNUM	129	181	70F95732\nIDNUM: 70F957323I\nPATIENT: SIGWART, PAULA
file22269	DATE	629	638	27/6/2068	2068-06-27
file22269	DOCTOR	1351	1372	Minh\nDOCTOR: Anatest
file22269	DOCTOR	2183	2203	Dante\nDOCTOR: Aaest
file22269	DOCTOR	2559	2623	Greber\nDOCTOR: Vooper\nDOCTOR: TO\nTIME: 11:43hrs on 29.08.2016	2016-08-29T11:43
file22269	DATE	7058	7066	1/8/2065	2065-08-01
file22402	MEDICALRECORD	12	20	20251214
file22402	HOSPITAL	32	49	MENINGIE HOSPITAL
file22402	IDNUM	74	84	91X558271T
file22402	MEDICALRECORD	91	97	918558
file22402	IDNUM	201	266	91X558\nIDNUM: 91X55827\nIDNUM: 91X558271T\nPATIENT: BRUMLOW, DEL
file22402	HOSPITAL	260	307	KING ISLAND DISTRICT HOSPITAL AND HEALTH CENTRE
file22402	DOCTOR	662	692	Bogie\nDOCTOR: Bak\nDOCTOR: Y.
file22402	DATE	1856	1864	6/6/2069	2069-06-06
file22402	DOCTOR	1890	1898	Y. Margo
file22402	DATE	4383	4391	5/7/2070	2070-07-05
file22402	TIME	4420	4429	2019/4/03	2019-04-03T00:00
file22402	STREET	4452	4459	Chaidez
file22499	IDNUM	8	18	59T579230C
file22499	MEDICALRECORD	27	34	5975792
file22499	HOSPITAL	46	85	EDENHOPE AND DISTRICT MEMORIAL HOSPITAL
file22499	IDNUM	130	184	59T57923\nIDNUM: 59T579230C\nPATIENT: MAENHOUT, ARTURO
file22499	DOCTOR	567	585	Tengan\nDOCTOR: N.
file22499	HOSPITAL	615	636	Mccaslin\nTIME: 1320H	2013-11-12T13:00
file22499	DATE	672	681	17/2/2069	2069-02-17
file22499	DATE	2062	2071	13/1/2068	2068-01-13
file22499	DATE	2240	2249	17/1/2066	2066-01-17
file22499	DOCTOR	2274	2281	N Yeary
file22499	DATE	3369	3378	16/1/2065	2065-01-16
file22604	IDNUM	8	18	07P590398L
file22604	MEDICALRECORD	27	33	075590
file22604	HOSPITAL	45	62	CORRIGIN HOSPITAL
file22604	DOCTOR	106	133	B Hillseth\nDATE: 29/1/2066	2066-01-29
file22604	IDNUM	178	244	07P59039\nIDNUM: 07P59039\nIDNUM: 07P59039\nPATIENT: Myslim, ROSIO
file22604	DOCTOR	651	693	B Titzer\nDOCTOR: B Tanson\nTIME: 11.11.60	2060-11-11
file22604	DOCTOR	1001	1038	Robertson\nTIME: 6:15pm on 15.11.2016	2016-11-15T16:15
file22604	PATIENT	1068	1074	Marley
file22604	DATE	3650	3659	22/2/2065	2065-02-22
file22604	DOCTOR	7009	7033	B Dibule\nDATE: 1/2/2068	2068-01-02
file2301	HOSPITAL	36	84	EASTERN EYRE HEALTH AND AGED CARE - KIMBA CAMPUS
file2301	PATIENT	97	102	GARRY
file2301	IDNUM	111	121	28G2912568
file2301	MEDICALRECORD	128	134	282291
file2301	PATIENT	186	195	Montuarta
file2301	IDNUM	246	322	28G29125\nIDNUM: 28G29125\nIDNUM: 28G2912568\nPATIENT: BOHM, ANDREW Adrianne
file2301	HOSPITAL	323	355	FRANKSTON PUBLIC SURGICAL CENTRE
file2301	DOCTOR	1498	1524	Emilio KLUTTZ\nDOCTOR: Drs
file2301	DATE	1556	1563	26.6.66	2066-06-26
file2301	DATE	2290	2299	30/9/2071	2071-09-30
file2301	DATE	2370	2379	6/10/2071	2071-06-10
file2301	DOCTOR	2404	2412	G Devany
file2301	DATE	3997	4005	8/7/2070	2070-08-07
file2301	TIME	4036	4045	2764/9/30	2764-09-27T00:00:30
file2301	STREET	4066	4072	Aristo
file23518	IDNUM	8	18	86D211304E
file23518	MEDICALRECORD	27	33	861211
file23518	HOSPITAL	45	68	SCOTT MEMORIAL HOSPITAL
file23518	IDNUM	112	182	86D21130\nIDNUM: 86D21130\nIDNUM: 86D211304E\nPATIENT: REHART, FlOSSie
file23518	DATE	3216	3225	17/2/2069	2069-02-17
file23518	DOCTOR	3231	3239	V Rigman
file23518	DATE	6505	6514	14/1/2069	2069-01-14
file23991	IDNUM	8	18	34Z242362N
file23991	MEDICALRECORD	27	33	349242
file23991	HOSPITAL	45	60	INJUNE HOSPITAL
file23991	IDNUM	104	176	34Z24236\nIDNUM: 34Z24236\nIDNUM: 34Z242362N\nPATIENT: HERCEG, WILLODEAN
file23991	IDNUM	232	240	34Z24236
file23991	DATE	2131	2139	4/5/2066	2066-05-04
file23991	DATE	2800	2808	7/5/2066	2066-07-05
file23991	DOCTOR	2833	2843	J Mccalebb
file23991	DATE	6216	6224	8/4/2066	2066-08-04
file24860	IDNUM	8	18	55Q843221Y
file24860	MEDICALRECORD	27	34	5568432
file24860	HOSPITAL	46	64	PETER JAMES CENTRE
file24860	AGE	136	138	67
file24860	DATE	261	265	2067	2067
file24860	DOCTOR	653	654	O
file24860	DOCTOR	655	688	O Pishner\nTIME: 11:33 on 26/2/15	2015-02-26T11:33
file24860	DATE	3199	3206	29/5/66	2066-05-29
file24860	DOCTOR	3238	3248	O Overholt
file24860	DATE	4137	4143	5/6/65	2065-06-05
file25723	IDNUM	8	18	13M964379H
file25723	MEDICALRECORD	27	34	1349643
file25723	HOSPITAL	34	51	KUNUNURA HOSPITAL
file25723	DATE	2768	2777	23/5/2066	2066-05-23
file25723	DOCTOR	2808	2815	C Clerc
file25723	DATE	4049	4055	5/7/65	2065-07-05
file25723	DOCTOR	4544	4545	C
file25723	DATE	4556	4562	5/7/65	2065-07-05
file26049	IDNUM	8	18	61I985337P
file26049	MEDICALRECORD	27	34	6139853
file26049	HOSPITAL	46	64	KATHERINE HOSPITAL
file26049	DATE	1919	1928	18/6/2066	2066-06-18
file26049	DOCTOR	1960	1967	R Doxon
file26094	IDNUM	8	18	82A5852950
file26094	MEDICALRECORD	27	34	8205852
file26094	HOSPITAL	46	85	GOULBURN VALLEY HEALTH - WARANGA CAMPUS
file26094	DATE	1678	1687	19/7/2066	2066-07-19
file26094	DOCTOR	1690	1700	W Beriaton
file26144	IDNUM	8	18	40W606354J
file26144	MEDICALRECORD	27	34	4086063
file26144	HOSPITAL	46	69	COWRA DISTRICT HOSPITAL
file26144	DATE	2445	2454	16/7/2069	2069-07-16
file26144	DOCTOR	2486	2492	K Nest
file26174	IDNUM	8	18	61N207202U
file26174	MEDICALRECORD	27	33	615207
file26174	HOSPITAL	45	81	MIDLANDS MULTI PURPOSE HEALTH CENTRE
file26174	DATE	2625	2634	21/6/2066	2066-06-21
file26174	DOCTOR	2637	2664	P Brabat\nDOCTOR: P Gillard
file26174	DATE	4031	4038	24/7/68	2068-07-24
file26174	DOCTOR	4040	4077	P Grunwald\nDOCTOR: BROO\nDOCTOR: Hit
file2618	DATE	12	20	2.00502E	2000-02-11
file2618	HOSPITAL	36	62	HILLSTON DISTRICT HOSPITAL
file2618	PATIENT	75	79	Kehm
file2618	IDNUM	88	98	18K228260D
file2618	MEDICALRECORD	105	111	183228
file2618	PATIENT	164	169	Jesse
file2618	IDNUM	219	275	18K22826\nIDNUM: 18K2288260D\nPATIENT: LEITE, BAMBI ELLA
file2618	HOSPITAL	283	321	MUNDUBBERA MULTIPURPOSE HEALTH SERVICE
file2618	DATE	3964	3972	3/6/2071	2071-06-03
file2618	TIME	9373	9386	2792/5/8/2066	2066-08-05
file2618	STREET	9405	9410	Haake
file26211	IDNUM	8	18	76G249328M
file26211	MEDICALRECORD	27	35	76224932
file26211	HOSPITAL	47	62	WARREN HOSPITAL
file26211	AGE	134	136	54
file26211	DATE	2293	2302	20/7/2068	2068-07-20
file26211	DOCTOR	2334	2342	S Fadely
file26310	IDNUM	8	18	97X949277X
file26310	MEDICALRECORD	27	34	9799492
file26310	HOSPITAL	46	69	WERRIBEE MERCY HOSPITAL
file26310	DATE	153	160	10.7.65	2065-07-10
file26310	DATE	186	193	22.9.69	2069-09-22
file26310	DATE	219	225	6.1.68	2068-01-06
file26310	DOCTOR	645	700	X Odill\nDOCTOR: X Kildare\nTIME: 10:50am on 22/04/2019	2019-04-22T10:50
file26310	DOCTOR	1143	1218	X Manard\nDOCTOR: X Staner\nDOCTOR: X Swindall\nTIME: 10:50am on 19/05/2019	2019-05-19T10:50
file26310	DATE	4992	5001	24/6/2069	2069-06-24
file26310	DOCTOR	5033	5041	X Bulcao
file26310	DOCTOR	7417	7426	X Gerlock
file26310	DATE	7901	7907	6.3.69	2069-06-03
file26310	DATE	8245	8252	19.8.66	2066-08-19
file26310	DATE	8358	8365	8.11.68	2068-11-08
file26354	IDNUM	8	18	61H799586S
file26354	MEDICALRECORD	27	34	6127995
file26354	HOSPITAL	46	60	BENALLA HEALTH
file26354	DOCTOR	785	855	Q Ladovich\nDOCTOR: Q Ladl\nDOCTOR: Q Lerund\nTIME: 10:11am on 23/4/19	2013-04-23T10:11
file26354	DATE	2806	2813	23/6/69	2069-06-23
file26354	DOCTOR	2845	2852	Q Godbe
file26396	IDNUM	8	18	19D710634A
file26396	MEDICALRECORD	27	34	1917106
file26396	HOSPITAL	46	62	EXMOUTH HOSPITAL
file26396	DATE	1190	1197	22.7.65	2065-07-22
file26396	DOCTOR	1229	1236	E Buddy
file26430	IDNUM	8	18	24H592241Z
file26430	MEDICALRECORD	27	34	2425922
file26430	HOSPITAL	46	62	WHYALLA HOSPITAL
file26430	DATE	2415	2422	25.7.66	2066-07-25
file26430	DOCTOR	2454	2461	F Quant
file26486	IDNUM	8	18	72D613209I
file26486	MEDICALRECORD	27	33	721613
file26486	HOSPITAL	45	69	MORUYA DISTRICT HOSPITAL
file26486	DATE	1338	1345	28.6.65	2065-06-28
file26486	DOCTOR	1377	1387	U Weisholz
file26543	IDNUM	8	18	46N4526191
file26543	MEDICALRECORD	27	35	46545261
file26543	HOSPITAL	47	63	BILOELA HOSPITAL
file26543	DATE	148	156	7.8.2066	2066-08-07
file26543	DOCTOR	693	733	M Clippinger\nTIME: 11:58am on 24.5.2019	2019-05-24T11:58
file26543	DATE	2383	2390	24.7.66	2066-07-24
file26543	DOCTOR	2422	2431	M Anagnos
file26543	DOCTOR	3087	3111	M Stoeke\nDATE: 7.5.2066	2066-05-07
file26574	IDNUM	8	18	51R234216C
file26574	MEDICALRECORD	27	34	5162342
file26574	HOSPITAL	34	85	ROBINVALE DISTRICT HEALTH SERVICES - MANANSA CAMPUS
file26574	DATE	1600	1607	29/7/68	2068-07-29
file26574	DOCTOR	1639	1649	N Cabreros
file26611	IDNUM	8	18	09N255274K
file26611	MEDICALRECORD	27	34	0952552
file26611	HOSPITAL	46	77	COONABARABRAN DISTRICT HOSPITAL
file26611	DATE	2061	2069	2/7/2069	2069-07-02
file26611	DOCTOR	2101	2110	B Carneal
file26656	IDNUM	8	18	67J386332T
file26656	MEDICALRECORD	27	35	67338633
file26656	HOSPITAL	47	81	ROYAL TALBOT REHABILITATION CENTRE
file26656	DATE	1868	1877	11/1/2069	2069-11-01
file26656	DOCTOR	1909	1917	Q Dicara
file26656	DATE	3134	3142	7/8/2066	2066-07-08
file26745	IDNUM	8	18	88A977280E
file26745	MEDICALRECORD	27	35	88097728
file26745	HOSPITAL	47	66	MILLMERRAN HOSPITAL
file26745	AGE	138	140	79
file26745	DATE	2417	2425	7/7/2066	2066-07-07
file26745	DOCTOR	2458	2466	V Morron
file26869	IDNUM	8	18	36W907249N
file26869	MEDICALRECORD	27	33	368907
file26869	HOSPITAL	45	67	ALPINE HEALTH (BRIGHT)
file26869	DATE	150	157	10.4.66	2066-10-04
file26869	DATE	183	189	6.4.68	2068-06-04
file26869	DATE	2933	2939	6/4/69	2069-06-04
file26869	DOCTOR	2971	2981	J Brachman
file26869	DATE	5377	5383	5.7.65	2065-07-05
file26869	DATE	5770	5777	11.4.68	2068-11-04
file26941	IDNUM	8	18	09G847658I
file26941	MEDICALRECORD	27	35	09284765
file26941	HOSPITAL	47	74	ROCKINGHAM GENERAL HOSPITAL
file26941	DOCTOR	829	900	Walt\nDOCTOR: C Buckwalter\nDOCTOR: C Linn\nTIME: 11:42am on 06/05/2016	2016-05-06T11:42
file26941	DOCTOR	3819	3870	C Deloach\nDOCTOR: C Tabatabah\nDOCTOR: C Wallblott
file26941	DATE	4607	4613	5/8/66	2066-05-08
file26941	DOCTOR	4645	4656	C Panzarino
file26964	IDNUM	8	18	14K629265H
file26964	MEDICALRECORD	27	34	1446292
file26964	HOSPITAL	46	86	EAST WIMMERA HEALTH SERVICE - WYCHEPROOF
file26964	DATE	1226	1232	9/4/65	2065-09-04
file26964	DOCTOR	1264	1272	D Plumer
file27008	IDNUM	8	18	62G640313P
file27008	MEDICALRECORD	27	34	6226403
file27008	HOSPITAL	46	85	TWEDDLE CHILD AND FAMILY HEALTH SERVICE
file27008	DATE	321	325	2057	2057
file27008	DATE	1912	1921	15/5/2065	2065-05-15
file27008	DOCTOR	1924	1931	R Szido
file27008	IDNUM	1983	1991	62G64031
file27008	DATE	2660	2667	20/4/69	2069-04-20
file27038	IDNUM	8	18	36Q4996234
file27038	MEDICALRECORD	27	34	3664996
file27038	HOSPITAL	46	62	NANANGO HOSPITAL
file27038	DATE	1562	1569	25.4.69	2069-04-25
file27038	DOCTOR	1572	1600	K Cheramory\nDOCTOR: K Seafe
file27038	IDNUM	2528	2536	36Q49962
file27064	IDNUM	8	18	41U3612303
file27064	MEDICALRECORD	27	33	417361
file27064	HOSPITAL	45	86	COLLINSVILLE MULTI-PURPOSE HEALTH SERVICE
file27064	DATE	748	754	5/6/65	2065-06-05
file27064	DOCTOR	786	794	L Pietig
file27086	IDNUM	8	18	15D111539E
file27086	MEDICALRECORD	27	34	1511115
file27086	HOSPITAL	34	52	ALEXANDRA HOSPITAL
file27086	AGE	145	147	61
file27086	DATE	843	850	18/6/69	2069-06-18
file27086	DOCTOR	882	890	D Sowell
file27134	IDNUM	8	18	73Z132698N
file27134	MEDICALRECORD	27	34	7391326
file27134	HOSPITAL	46	89	YOUTH PREVENTION AND RECOVERY CARE (Y-PARC)
file27134	DOCTOR	696	749	S Suterfe\nDOCTOR: S Dechico\nTIME: 3:41pm on 10/5/17	2017-05-10T15:41
file27134	DATE	1887	1894	13/7/67	2067-07-13
file27134	DOCTOR	1897	1905	S Pitman
file27158	IDNUM	8	18	78D914204M
file27158	MEDICALRECORD	27	35	78191420
file27158	HOSPITAL	47	62	ALBANY HOSPITAL
file27158	DOCTOR	235	241	T Klyn
file27158	DATE	2488	2495	16.9.68	2068-09-16
file27158	DOCTOR	2498	2560	T Dewess\nDOCTOR: T Cordoba\nDOCTOR: T Cordoba\nTIME: 11.11.66	2066-11-11T14:00
file27158	DOCTOR	4304	4315	T Alleruzzo
file27263	IDNUM	8	18	42N853504G
file27263	MEDICALRECORD	27	35	42585350
file27263	HOSPITAL	47	68	THE MORNINGTON CENTRE
file27263	DOCTOR	1199	1204	Bursi
file27263	DATE	2983	2990	19/9/68	2068-09-19
file27263	DOCTOR	3022	3029	L Kiehm
file27263	DATE	5646	5653	29/9/68	2068-09-29
file27297	IDNUM	-1	9	00J874642P
file27297	MEDICALRECORD	27	34	0038746
file27297	HOSPITAL	46	62	GAYNDAH HOSPITAL
file27297	DOCTOR	574	607	A Thode\nTIME: 12:24pm on 15/5/17	2017-05-15T12:24
file27297	DATE	2303	2310	18/7/67	2067-07-18
file27297	DOCTOR	2313	2339	A Moir\nDOCTOR: A Bavenitz
file27384	IDNUM	8	18	05N656279O
file27384	MEDICALRECORD	27	34	0556562
file27384	HOSPITAL	34	99	WIMMERA HEALTH CARE GROUP - DIMBOOLA HEALTH CARE GROUP - DIMBOOLA
file27384	DATE	2095	2102	16/9/68	2068-09-16
file27384	DOCTOR	2289	2298	A Winners
file27384	ORGANIZATION	2980	3019	WEST GYNAECOLOGY\nHOSPITAL: TOOSEY AGED
file27413	IDNUM	8	18	79X496679J
file27413	MEDICALRECORD	27	34	7984966
file27413	HOSPITAL	46	58	LAURA CAMPUS
file27413	DOCTOR	2486	2540	T Digerolano\nDOCTOR: T Lammy\nTIME: 1:40pm on 17/5/17	2017-05-17T13:40
file27413	DATE	2692	2699	20/7/67	2067-07-20
file27413	DOCTOR	2731	2742	T Marciniak
file27447	IDNUM	8	18	37T526637R
file27447	MEDICALRECORD	27	35	37752663
file27447	HOSPITAL	47	63	NORTHAM HOSPITAL
file27447	IDNUM	202	216	61C\nIDNUM: 61
file27447	DATE	1683	1690	26/6/69	2069-06-26
file27447	DOCTOR	1723	1731	H Rients
file27447	DOCTOR	2554	2559	H Suh
file27478	IDNUM	8	18	32X398244Q
file27478	MEDICALRECORD	27	34	3283982
file27478	HOSPITAL	46	70	WAIKERIE HEALTH SERVICES
file27478	DATE	1902	1909	26/8/66	2066-08-26
file27478	DATE	2307	2314	27.5.68	2068-05-27
file27478	DOCTOR	2344	2356	I Bennington
file27478	DATE	3176	3182	6/9/68	2068-06-09
file27506	IDNUM	8	18	05G148653L
file27506	MEDICALRECORD	27	34	0521486
file27506	HOSPITAL	46	73	QUIRINDI COMMUNITY HOSPITAL
file27506	AGE	145	147	55
file27506	DOCTOR	390	398	Zacharia
file27506	DATE	1125	1132	26.8.65	2065-08-26
file27506	DOCTOR	1165	1175	X Calvello
file27619	IDNUM	8	18	63D269601U
file27619	MEDICALRECORD	27	35	63126960
file27619	HOSPITAL	47	61	ALPHA HOSPITAL
file27619	AGE	133	135	75
file27619	DATE	3102	3109	30/8/68	2068-08-30
file27619	DOCTOR	3112	3122	P Wallaker
file27672	IDNUM	8	18	68H041218T
file27672	MEDICALRECORD	27	34	6820412
file27672	HOSPITAL	34	62	CRANBOURNE INTEGRATED CENTRE
file27672	DATE	191	199	6.9.2066	2066-06-09
file27672	DOCTOR	203	212	Q Treamer
file27672	DATE	2315	2321	9/2/65	2065-02-09
file27672	DOCTOR	2354	2361	Q Valer
file27672	DOCTOR	3056	3068	Q Bencivenga
file27672	DATE	3713	3721	2.7.2066	2066-07-02
file27672	DOCTOR	3772	3778	Q Nuen
file27729	IDNUM	8	18	16D062377B
file27729	MEDICALRECORD	27	34	1610623
file27729	HOSPITAL	46	71	BROKEN HILL BASE HOSPITAL
file27729	DATE	170	178	9.7.2068	2068-07-09
file27729	AGE	191	193	71
file27729	DATE	2366	2372	3/8/68	2068-03-08
file27729	DOCTOR	2375	2384	F Broborg
file27729	DATE	4164	4173	10.9.2065	2065-10-09
file27759	IDNUM	8	18	90M801676W
file27759	MEDICALRECORD	27	34	9048016
file27759	HOSPITAL	46	95	EMMAVILLE - VEGETABLE CREEK RESIDENTIAL AGED CARE
file27759	DATE	1780	1786	6/6/69	2069-06-06
file27759	DATE	1964	1970	6/4/68	2068-04-06
file27759	DOCTOR	1971	1982	X Lundglass
file27759	DATE	2641	2648	6/10/68	2068-10-06
file27784	IDNUM	8	18	95Q783283V
file27784	MEDICALRECORD	27	34	9567832
file27784	HOSPITAL	46	62	GOSFORD HOSPITAL
file27784	DATE	2125	2131	6/5/66	2066-06-05
file27784	DOCTOR	2134	2142	Y Perada
file27807	IDNUM	8	18	69A523693Q
file27807	MEDICALRECORD	27	34	6905236
file27807	HOSPITAL	46	65	STANTHORPE HOSPITAL
file27807	DATE	2155	2162	10/6/65	2065-06-10
file27807	DOCTOR	2194	2203	R Cordner
file27850	IDNUM	8	18	27W554651Z
file27850	MEDICALRECORD	27	35	27855465
file27850	HOSPITAL	35	107	LISMORE BASE HOSPITAL - RIVERLANDS DRUG\nDOCTOR: LM\nDOCTOR: UHOL PROLIC
file27850	DOCTOR	674	752	Hayden SEVENX\nDOCTOR: F Warnburgh\nDOCTOR: F Larow\nTIME: 11:25am on 4/4/2016	2016-04-04T11:25
file27850	DATE	3298	3304	7/6/65	2065-07-06
file27850	DOCTOR	3336	3342	F Haen
file27886	IDNUM	8	18	22A326258Y
file27886	MEDICALRECORD	27	34	2203262
file27886	HOSPITAL	46	69	MOREE DISTRICT HOSPITAL
file27886	AGE	158	160	87
file27886	DATE	2187	2195	11/10/65	2065-10-11
file27886	DOCTOR	2227	2236	G Reznick
file27886	DOCTOR	3138	3163	G Lamana\nDATE: 23/9/2065	2065-09-23
file27926	IDNUM	8	18	80W456316G
file27926	MEDICALRECORD	27	34	8084563
file27926	HOSPITAL	46	67	BOORT DISTRICT HEALTH
file27926	DOCTOR	660	716	Freddie\nDOCTOR: U Mda\nDOCTOR: U Delsavio\nTIME: 3:48pm	2016-08-05T15:48
file27926	DATE	743	750	6/10/66	2066-10-06
file27926	DATE	3833	3840	6/10/66	2066-10-06
file27926	DOCTOR	3872	3882	U Vaclavik
file27999	IDNUM	8	18	54G296625B
file27999	MEDICALRECORD	27	35	54229662
file27999	HOSPITAL	47	72	DUNGOG COMMUNITY HOSPITAL
file27999	DOCTOR	395	429	N Helaire\nTIME: 9/8/16 at 17:15pm	2016-10-09T17:15
file27999	DATE	2049	2056	8/11/67	2067-11-08
file27999	DOCTOR	2059	2083	N Sutph\nDATE: 12.1.2063	2063-01-12
file27999	DEPARTMENT	3228	3270	SA Pathology\nHOSPITAL: BALAKLAVA HOSPITAL
file28041	IDNUM	8	18	59K078222A
file28041	MEDICALRECORD	27	35	59307822
file28041	HOSPITAL	47	62	NEWMAN HOSPITAL
file28041	DATE	146	155	18.6.2069	2069-06-18
file28041	DATE	1500	1507	9/10/69	2069-10-09
file28041	DOCTOR	1539	1547	O Leidig
file28041	DATE	2621	2630	18.6.2069	2069-06-18
file28095	IDNUM	8	18	23T818632V
file28095	MEDICALRECORD	27	35	23781863
file28095	HOSPITAL	47	86	EDENHOPE AND DISTRICT MEMORIAL HOSPITAL
file28095	DOCTOR	873	908	G Sang\nTIME: 11:18am on 14.05.2016	2016-05-14T11:18
file28095	DATE	2429	2437	14/10/66	2066-10-14
file28095	DATE	2486	2493	18/9/69	2069-09-18
file28095	DOCTOR	2525	2535	G Bouillon
file28095	DOCTOR	3447	3454	G Zumbo
file28140	IDNUM	8	18	80P938690E
file28140	MEDICALRECORD	27	35	80693869
file28140	HOSPITAL	47	75	MILDURA BASE PUBLIC HOSPITAL
file28140	DATE	2995	3002	17/7/69	2069-07-17
file28140	DOCTOR	3034	3040	V Chee
file28164	IDNUM	8	18	85T710307D
file28164	MEDICALRECORD	27	35	85771030
file28164	HOSPITAL	47	84	NARROMINE HOSPITAL & COMMUNITY HEALTH
file28164	DATE	2911	2918	18/6/68	2068-06-18
file28164	DOCTOR	2948	2958	W Chrisley
file28227	IDNUM	8	18	59D560607X
file28227	MEDICALRECORD	27	34	5915606
file28227	HOSPITAL	46	73	CALVARY PUBLIC HOSPITAL ACT
file28227	DATE	2763	2770	19/9/65	2065-09-19
file28227	DOCTOR	2815	2852	O Chandra\nTIME: 1:20pm on 15/04/2018	2018-04-15T13:20
file28227	DOCTOR	2899	2938	O Forrester\nTIME: 1:25pm on 12/07/2017	2019-07-12T13:25
file28227	DOCTOR	2996	3005	O Gretter
file28270	IDNUM	8	18	17Z681765G
file28270	MEDICALRECORD	27	34	1796817
file28270	HOSPITAL	46	60	BENALLA HEALTH
file28270	DOCTOR	1079	1135	Nicky\nDOCTOR: NERISSA FARVE\nTIME: 12:08pm on 18/8/2019	2019-08-18T12:08
file28270	DATE	2343	2350	21/7/68	2068-07-21
file28270	DOCTOR	2382	2390	D Greeno
file28322	IDNUM	8	18	12D453372F
file28322	MEDICALRECORD	27	35	12145337
file28322	HOSPITAL	47	71	WAIKERIE HEALTH SERVICES
file28322	DATE	3292	3299	26.7.69	2069-07-26
file28322	DOCTOR	3303	3310	E Butor
file28322	DATE	4668	4675	1/10/65	2065-10-01
file28387	IDNUM	8	18	70Z483320O
file28387	MEDICALRECORD	27	35	70948332
file28387	HOSPITAL	47	75	LOCKHART & DISTRICT HOSPITAL
file28387	DOCTOR	603	623	S Berg\nHOSPITAL: 16
file28387	DOCTOR	811	871	LEON Galanicae\nDOCTOR: S Kunishigs\nTIME: 4:20pm on 23/4/19	2013-04-23T16:20
file28387	DOCTOR	1056	1090	S Hibner\nTIME: 16:20pm on 24/8/18	2016-08-24T16:20
file28387	DOCTOR	1245	1295	S Hal\nDOCTOR: S Halperin\nTIME: 4:30pm on 21/5/16	2016-05-21T16:30
file28387	DATE	3493	3501	23/10/68	2068-10-23
file28387	DOCTOR	3533	3543	S Swindell
file28387	DOCTOR	7977	7986	S Tessman
file28387	DOCTOR	8109	8118	S Perotti
file28387	STREET	8203	8214	Von Meyburg
file28430	IDNUM	8	18	28V404488W
file28430	MEDICALRECORD	27	33	288404
file28430	HOSPITAL	45	70	FITZROY CROSSING HOSPITAL
file28430	DATE	166	175	27.9.2066	2066-09-27
file28430	DOCTOR	176	184	G Valamo
file28430	DATE	1783	1790	29/7/69	2069-07-29
file28430	DOCTOR	1793	1820	G Behring\nDOCTOR: G Nikach
file28430	DATE	2982	2991	26.7.2066	2066-07-26
file28430	DOCTOR	2996	3005	G Wieloch
file28517	IDNUM	8	18	49N105346H
file28517	MEDICALRECORD	27	34	4951053
file28517	HOSPITAL	46	83	NARROMINE HOSPITAL & COMMUNITY HEALTH
file28517	DOCTOR	276	298	PABLO BREAULT\nCITY: 9
file28517	DATE	2935	2941	1.9.66	2066-01-09
file28517	DOCTOR	2973	2984	L Samuelsen
file28517	ORGANIZATION	3765	3807	3/9 JENNIE COX\nHOSPITAL: WOOMERA HOSPITAL
file28517	DATE	5289	5299	30/11/2068	2068-11-30
file28554	IDNUM	8	18	07J126304Q
file28554	MEDICALRECORD	27	35	07312630
file28554	HOSPITAL	47	70	MARGARET RIVER HOSPITAL
file28554	DATE	168	177	6.10.2065	2065-06-10
file28554	DATE	1664	1671	29/7/66	2066-07-29
file28554	DOCTOR	1703	1713	A Affolter
file28554	DOCTOR	2864	2887	A Daw\nDATE: 10.11.2068	2068-11-10
file28577	IDNUM	8	18	55F146453Z
file28577	MEDICALRECORD	27	34	5521464
file28577	HOSPITAL	46	77	DENTAL HEALTH SERVICES VICTORIA
file28577	DATE	1192	1200	30/10/65	2065-10-30
file28577	DOCTOR	1230	1237	O Duvel
file28606	IDNUM	8	18	13B267411H
file28606	MEDICALRECORD	27	35	13026741
file28606	DATE	1048	1055	30/9/69	2069-09-30
file28606	DOCTOR	1058	1068	D Wefapter
file28630	IDNUM	8	18	61X298579Q
file28630	MEDICALRECORD	27	34	6192985
file28630	HOSPITAL	46	88	WESTERN DISTRICT HEALTH SERVICE - HAMILTON
file28630	DATE	944	951	10/1/69	2069-01-10
file28630	DOCTOR	983	992	R Panakos
file28662	IDNUM	8	18	82P8994270
file28662	MEDICALRECORD	27	34	8258994
file28662	HOSPITAL	46	61	INGHAM HOSPITAL
file28662	DATE	1670	1676	8/8/65	2065-08-08
file28662	DOCTOR	1708	1717	W Mckenzy
file28715	IDNUM	8	18	49L810585K
file28715	MEDICALRECORD	27	34	4948105
file28715	HOSPITAL	46	94	EASTERN EYRE HEALTH AND AGED CARE - KIMBA CAMPUS
file28715	DATE	2748	2754	8/7/68	2068-07-08
file28715	DOCTOR	2816	2863	Hiram\nDOCTOR: L Ostroot\nTIME: 10:45 on 6/6/15	2015-06-06T10:45
file28715	DOCTOR	2918	2926	L Dicola
file28715	DOCTOR	3208	3214	L Petr
file28751	IDNUM	8	18	97H930543S
file28751	MEDICALRECORD	27	35	97293054
file28751	HOSPITAL	47	76	COOTAMUNDRA DISTRICT HOSPITAL
file28751	DATE	160	167	16.7.69	2069-07-16
file28751	DATE	1093	1099	9.6.67	2067-06-09
file28751	DOCTOR	1131	1141	Z Escobedo
file28751	DATE	2101	2109	15.10.66	2066-10-15
file28751	DATE	2173	2181	15.10.66	2066-10-15
file28788	IDNUM	8	18	55D951602B
file28788	MEDICALRECORD	27	34	5519516
file28788	HOSPITAL	46	82	ARMADALE KELMSCOTT MEMORIAL HOSPITAL
file28788	DATE	228	232	2066	2066
file28788	DATE	1875	1883	9/8/2067	2067-08-09
file28788	DOCTOR	1932	1978	Rudolf\nDOCTOR: N Rorer\nTIME: 13:52 on 3/7/17	2017-07-03T13:52
file28788	DATE	2014	2020	9/6/67	2067-06-09
file28788	DOCTOR	2023	2052	N Napihaem\nDOCTOR: N Mechler
file28788	DOCTOR	3303	3314	N Manocchio
file28818	IDNUM	8	18	76V552550M
file28818	MEDICALRECORD	27	34	7685525
file28818	HOSPITAL	46	61	ROBINA HOSPITAL
file28818	DATE	1626	1633	10/8/65	2065-10-08
file28818	DOCTOR	1665	1673	S Bratek
file28856	IDNUM	8	18	24R573518V
file28856	MEDICALRECORD	27	34	2465735
file28856	HOSPITAL	46	65	DUBBO BASE HOSPITAL
file28856	DOCTOR	912	979	Radu\nDOCTOR: H Perver\nDOCTOR: H Garrels\nTIME: 15:50hrs on 4/6/18	2018-06-04T15:50
file28856	DATE	1433	1439	6/8/65	2065-08-06
file28856	DOCTOR	1442	1452	H Blocksak
file28941	IDNUM	8	18	45I274476G
file28941	MEDICALRECORD	27	34	4532744
file28941	HOSPITAL	46	88	TRESILLIAN FAMILY CARE CENTRE - WILLOUGHBY
file28941	DATE	2530	2537	10/8/69	2069-08-10
file28941	DOCTOR	2569	2580	M Dieckmann
file28941	ORGANIZATION	3358	3402	Hunter Area\nHOSPITAL: BOORT DISTRICT HEALTH
file28965	IDNUM	8	18	03E294525P
file28965	MEDICALRECORD	27	34	0312945
file28965	HOSPITAL	46	90	ROYAL MELBOURNE HOSPITAL - ROYAL PARK CAMPUS
file28965	DATE	1792	1800	13/11/65	2065-11-13
file28965	DOCTOR	1832	1840	A Heholt
file29054	IDNUM	8	18	51B225583X
file29054	MEDICALRECORD	27	34	5102255
file29054	HOSPITAL	46	65	CANTERBURY HOSPITAL
file29054	DOCTOR	1206	1278	P Shimkus\nDOCTOR: P Gaskin\nDOCTOR: P Fooning\nTIME: 10:00am on 12.9.19	2013-09-12T10:00
file29054	DATE	4449	4457	17/10/69	2069-10-17
file29054	DOCTOR	4489	4499	P Faragoza
file29126	IDNUM	8	18	72S826441I
file29126	MEDICALRECORD	27	34	1983466
file29126	HOSPITAL	46	73	TINGHA MULTIPURPOSE SERVICE
file29126	AGE	145	147	79
file29126	DATE	4612	4620	17/11/65	2065-11-17
file29126	DOCTOR	4652	4658	D Reap
file292	HOSPITAL	36	60	MERCY HOSPITAL FOR WOMEN
file292	PATIENT	72	80	Gerawery
file292	IDNUM	89	99	67T367609P
file292	MEDICALRECORD	106	113	6773676
file292	PATIENT	166	174	Gattison
file292	TIME	412	433	26/08/2018 at 17:10hr	2018-08-26T17:10
file292	DATE	1848	1855	28/8/66	2066-08-28
file292	DOCTOR	1858	1882	S Neen\nDOCTOR: S S Woen
file292	TIME	3649	3658	2761/4/09	2012-04-09T00:00:00
file29216	IDNUM	8	18	88K967557A
file29216	MEDICALRECORD	27	34	8849675
file29216	HOSPITAL	46	67	ST VINCENT'S HOSPITAL
file29216	DATE	1603	1610	21/7/68	2068-07-21
file29216	DOCTOR	1643	1651	X Scrape
file29216	DEPARTMENT	3318	3381	SA Pathology\nHOSPITAL: TWEDDLE CHILD AND FAMILY HEALTH SERVICE
file29331	IDNUM	8	18	46G988616I
file29331	MEDICALRECORD	27	35	46298861
file29331	HOSPITAL	47	70	COBAR DISTRICT HOSPITAL
file29331	DATE	2203	2210	24/7/69	2069-07-24
file29331	DOCTOR	2242	2252	L Litchard
file29469	IDNUM	8	18	67Y689574U
file29469	MEDICALRECORD	27	34	6796895
file29469	HOSPITAL	46	83	CASINO AND DISTRICT MEMORIAL HOSPITAL
file29469	DATE	167	174	23/5/67	2067-05-23
file29469	DOCTOR	1003	1062	Q Yohn\nDOCTOR: Q Crohn\nDOCTOR: Q Lohart\nDOCTOR: Q Horens
file29469	TIME	1111	1131	1:35pm on 22.06.2018	2018-06-22T11:35
file29469	DOCTOR	1754	1781	Q Colling\nDOCTOR: Q Wietto
file29469	DATE	1852	1862	25.08.2018	2018-08-25T11:40
file29469	DATE	4838	4846	25/11/69	2069-11-25
file29469	DOCTOR	4878	4886	Q Raskin
file29469	DOCTOR	6968	6978	Q Zielesch
file29469	DATE	7929	7936	10.2.65	2065-02-10
file29469	DATE	8373	8380	23/5/71	2071-05-23
file29469	DOCTOR	8382	8411	OMER Landr\nDOCTOR: OMER Land
file29494	IDNUM	8	18	14U600522C
file29494	MEDICALRECORD	27	34	1476005
file29494	HOSPITAL	46	60	MOURA HOSPITAL
file29494	DATE	2301	2308	27/7/69	2069-07-27
file29494	DOCTOR	2341	2349	E Weafer
file29494	DOCTOR	2988	2996	E Labary
file29518	IDNUM	8	18	72Q6316804
file29518	MEDICALRECORD	27	34	7266316
file29518	HOSPITAL	46	62	HEATHCOTE HEALTH
file29518	DATE	677	684	30/8/66	2066-08-30
file29518	DOCTOR	716	726	T Viessman
file29589	IDNUM	8	18	30M751748T
file29589	MEDICALRECORD	27	33	304751
file29589	HOSPITAL	45	75	KANGAROO ISLAND HEALTH SERVICE
file29589	DATE	1918	1925	1/11/65	2065-11-01
file29589	DOCTOR	1957	1964	H Horak
file29667	IDNUM	8	18	09A373655N
file29667	MEDICALRECORD	27	34	0903736
file29667	HOSPITAL	46	84	EUGOWRA MEMORIAL MULTI PURPOSE SERVICE
file29667	TIME	332	353	25/09/2015 at 17:10hr	2015-09-25T17:10
file29667	DATE	1768	1775	30/8/65	2065-08-30
file29667	DOCTOR	1778	1805	B Brumby\nDOCTOR: B B Dubey
file29737	IDNUM	8	18	67W394713W
file29737	MEDICALRECORD	27	35	67839471
file29737	HOSPITAL	47	59	LAURA CAMPUS
file29737	DOCTOR	554	592	P Duk\nTIME: 10:20am on the 25.08.2016	2016-08-25T10:20
file29737	DOCTOR	1052	1096	P Mackinnon\nTIME: 10:20am on the 28.08.2018	2018-08-28T10:20
file29737	DOCTOR	1530	1589	P Blocks\nDOCTOR: P Blocks\nTIME: 10:20am on the 27.08.2019	2019-08-27T10:20
file29737	DATE	5039	5046	27/7/68	2068-07-27
file29737	DOCTOR	5076	5084	P Fenley
file29737	DATE	6649	6656	10/8/68	2068-10-08
file29802	IDNUM	8	18	78N995671H
file29802	MEDICALRECORD	27	34	7859956
file29802	HOSPITAL	46	71	DUNGOG COMMUNITY HOSPITAL
file29802	DATE	171	179	9.6.2065	2065-06-09
file29802	DOCTOR	184	194	U Delagado
file29802	DATE	2583	2590	28/8/65	2065-08-28
file29802	DOCTOR	2643	2669	U Himmel\nDOCTOR: U Himmel
file29802	DOCTOR	2757	2766	U Bushong
file29802	DOCTOR	4571	4580	U Palonte
file29903	IDNUM	8	18	36K015629Q
file29903	MEDICALRECORD	27	34	3630156
file29903	HOSPITAL	46	95	GOULBURN VALLEY HEALTH - CENTRE FOR OLDER PERSONS
file29903	AGE	168	170	71
file29903	DATE	3234	3241	1/11/68	2068-11-01
file29903	DOCTOR	3244	3268	J Mongeon\nDOCTOR: J Jhe
file29949	IDNUM	8	18	94G0367889
file29949	MEDICALRECORD	27	35	94203678
file29949	HOSPITAL	47	78	LONG JETTY HEALTH CARE FACILITY
file29949	IDNUM	228	236	94G03678
file29949	DATE	4052	4059	10/6/69	2069-06-10
file29949	DOCTOR	4062	4068	X Kyer
file29985	IDNUM	8	18	42C067746H
file29985	MEDICALRECORD	27	35	42006774
file29985	HOSPITAL	47	63	QUILPIE HOSPITAL
file29985	AGE	135	137	72
file29985	DATE	354	359	today	2066-09-03
file29985	IDNUM	429	460	42\nIDNUM: 42-CC\nDATE: 7462989
file29985	DATE	2030	2036	7/9/66	2066-07-09
file29985	DOCTOR	2068	2077	L Himenez
file30028	IDNUM	8	18	47G939353G
file30028	MEDICALRECORD	27	33	472939
file30028	HOSPITAL	45	71	WINGHAM COMMUNITY HOSPITAL
file30028	DATE	1675	1682	7/10/65	2065-07-10
file30028	DOCTOR	1732	1785	M Raiger\nDOCTOR: M Dobbins\nTIME: 18:14 on 6/07/2019	2019-07-06T18:14
file30028	DOCTOR	1824	1833	M Burtell
file30112	IDNUM	8	18	05C969411P
file30112	MEDICALRECORD	27	35	05096941
file30112	HOSPITAL	47	66	SPRINGWOOD HOSPITAL
file30112	DATE	150	160	23.10.2071	2071-10-23
file30112	DATE	198	205	19.9.69	2069-09-19
file30112	DOCTOR	1098	1139	B Kuehnle\nTIME: 12:30pm on 12.30pm at 06	2016-07-12T06:30
file30112	DATE	2959	2965	8/9/69	2069-08-09
file30112	DOCTOR	2997	3006	B Humphry
file30112	DOCTOR	3907	3915	B Loncer
file30112	DATE	5205	5212	16.9.65	2065-09-16
file30112	DATE	5545	5554	24.9.2071	2071-09-24
file30112	DATE	5662	5670	23.10.68	2068-10-23
file30177	IDNUM	8	18	78M709710J
file30177	MEDICALRECORD	27	34	7847097
file30177	HOSPITAL	46	61	MURGON HOSPITAL
file30177	DATE	1782	1790	19/10/69	2069-10-19
file30177	DOCTOR	1822	1830	T Meiste
file30231	IDNUM	8	18	10U001527G
file30231	MEDICALRECORD	27	34	1080015
file30231	HOSPITAL	46	78	NUMURKAH DISTRICT HEALTH SERVICE
file30231	DATE	1976	1983	16/9/66	2066-09-16
file30231	DOCTOR	2041	2093	E Simison\nDOCTOR: E Simison\nTIME: 12:10 on 12/7/15	2015-07-12T12:10
file30231	DOCTOR	2141	2150	E Kulling
file30292	IDNUM	8	18	78R0226855
file30292	MEDICALRECORD	27	35	78602268
file30292	HOSPITAL	47	71	COLLIE DISTRICT HOSPITAL
file30292	DATE	155	163	27.10.68	2068-10-27
file30292	DATE	324	331	15/9/66	2066-09-15
file30292	DOCTOR	402	407	Spier
file30292	DATE	2146	2153	16/9/65	2065-09-16
file30292	DOCTOR	2156	2163	S Yover
file30292	DOCTOR	4103	4111	S Bladez
file30292	DATE	4181	4188	26.9.69	2069-09-26\nDOCTOR: S Teixe.
file30319	IDNUM	8	18	99I623534A
file30319	MEDICALRECORD	27	34	9936235
file30319	HOSPITAL	46	70	VICTORIAN HEART HOSPITAL
file30319	DATE	1407	1415	20/10/65	2065-10-20
file30319	DOCTOR	1448	1454	X Smay
file30416	IDNUM	8	18	47E643592I
file30416	MEDICALRECORD	27	35	47164359
file30416	HOSPITAL	47	85	CLONCURRY MULTI-PURPOSE HEALTH SERVICE
file30416	AGE	157	159	78
file30416	DATE	3335	3342	20/9/69	2069-09-20
file30416	DOCTOR	3374	3385	L Schoolman
file30416	STREET	4877	4883	Donuts
file30453	IDNUM	8	18	05A764650R
file30453	MEDICALRECORD	27	34	0507646
file30453	HOSPITAL	46	86	HUNTER NEW ENGLAND MENTAL HEALTH SERVICE
file30453	DOCTOR	376	394	RIGOBERTO PINKOROW
file30453	DATE	563	571	21/10/68	2068-10-21
file30453	DATE	1858	1866	21/10/66	2066-10-21
file30453	DOCTOR	1898	1909	A Shiminski
file30453	DOCTOR	3966	3972	A Lyeb
file30453	DOCTOR	4147	4153	Rowher
file30453	DOCTOR	4693	4718	A Erenrich\nDATE: 5.10.69	2069-10-05
file30500	IDNUM	8	18	26S365518C
file30500	MEDICALRECORD	27	33	266365
file30500	HOSPITAL	45	73	BOURKE MULTI PURPOSE SERVICE
file30500	DATE	156	163	30.9.66	2066-09-30
file30500	DATE	1525	1532	22/9/65	2065-09-22
file30500	DOCTOR	1564	1572	O Mclure
file30500	DATE	2596	2603	29.9.69	2069-09-29
file30591	IDNUM	8	18	74O396566L
file30591	MEDICALRECORD	27	35	74539656
file30591	HOSPITAL	47	70	THOMAS EMBLING HOSPITAL
file30591	AGE	142	144	63
file30591	DURATION	232	239	6 weeks	P6Y
file30591	DATE	2275	2282	24/9/68	2068-09-24
file30591	DOCTOR	2315	2322	T Payan
file30635	IDNUM	8	18	32K4166257
file30635	MEDICALRECORD	27	35	32441662
file30635	HOSPITAL	47	67	ROYAL PERTH HOSPITAL
file30635	DOCTOR	728	762	I Bowser\nTIME: 10:19am on 22/7/15	2015-07-22T10:19
file30635	DATE	1913	1920	25/9/69	2069-09-25
file30635	DOCTOR	1952	1960	I Haaker
file30635	DOCTOR	2224	2239	ALECIA Pershall
file30635	DOCTOR	2746	2761	VIVIANA Stock\n
file30728	IDNUM	8	18	80G437683C
file30728	MEDICALRECORD	27	34	8024376
file30728	HOSPITAL	46	60	MOURA HOSPITAL
file30728	AGE	132	134	93
file30728	DATE	3219	3227	26/10/65	2065-10-26
file30728	DOCTOR	3230	3237	W Kanni
file30728	DOCTOR	7406	7411	W Wei
file30759	IDNUM	8	18	01Y038531N
file30759	MEDICALRECORD	27	35	01903853
file30759	HOSPITAL	47	75	BOURKE MULTI PURPOSE SERVICE
file30759	DATE	2116	2124	28/10/66	2066-10-28
file30759	DOCTOR	2156	2167	B Mirabelli
file30779	IDNUM	8	18	69U059699W
file30779	MEDICALRECORD	27	34	6970596
file30779	HOSPITAL	46	64	MAROONDAH HOSPITAL
file30779	DATE	1834	1842	25/10/68	2068-10-25
file30779	DOCTOR	1872	1879	Q Gekas
file30810	IDNUM	8	18	17Q170757E
file30810	MEDICALRECORD	27	35	17617075
file30810	HOSPITAL	47	78	BRAIDWOOD MULTI PURPOSE SERVICE
file30810	AGE	150	152	60
file30810	DOCTOR	769	825	E Dominantly\nDOCTOR: E Eccles\nTIME: 22/7/18 at 22/7/18	2018-07-22T22:07
file30810	DATE	1158	1165	27/9/66	2066-09-27
file30810	DOCTOR	1197	1206	E Tatters
file3691	HOSPITAL	36	54	TOOWOOMBA HOSPITAL
file3691	STREET	67	72	Sanna
file3691	IDNUM	81	91	37H7705166
file3691	MEDICALRECORD	98	104	372770
file3691	IDNUM	208	281	37H77051\nIDNUM: 37H77051\nIDNUM: 37H7705166\nPATIENT: Olaughlin, Ernesto
file3691	HOSPITAL	273	306	THE KILMORE AND DISTRICT HOSPITAL
file3691	DOCTOR	694	716	Lindsay\nDOCTOR: J. J.
file3691	DATE	742	749	29.3.23	2023-03-29
file3691	DATE	2313	2321	4/5/2070	2070-05-04
file3691	DOCTOR	2327	2334	J Sosky
file3691	DATE	4528	4536	7/5/2071	2071-05-07
file3691	TIME	4565	4583	2819/2/13 00:00:00	2013-02-28T16:00:00
file3691	PATIENT	4597	4603	Moerbe
file4096	IDNUM	8	18	95D701664Y
file4096	MEDICALRECORD	27	33	951701
file4096	HOSPITAL	45	89	ROYAL MELBOURNE HOSPITAL - ROYAL PARK CAMPUS
file4096	IDNUM	133	141	95D71765
file4096	MEDICALRECORD	196	206	951701.RRL
file4096	PATIENT	229	258	Margarito, 039 Wynter JAHNCKE
file4096	IDNUM	258	283	95D70166\nIDNUM: 95D70166
file4096	PATIENT	301	307	Sharpe
file4096	CITY	329	378	CROMICALRANALD\nSTATE: South Australia\nZIP: 3741
file4096	DATE	489	497	9/7/1991	1991-09-07
file4096	TIME	544	563	27/05/2018 at 09:36	2017-05-27T09:36
file4096	DEPARTMENT	575	580	PaLMS
file4096	DOCTOR	606	621	Truman Lijewski
file4096	ORGANIZATION	640	658	The possibility of
file4096	DATE	754	760	1/8/65	2065-08-01
file4096	DOCTOR	3746	3770	ARDEN AUSTIN\nDOCTOR: X.
file4096	DATE	3807	3814	24.7.65	2065-07-24
file4096	DOCTOR	3898	3904	X Hohm
file4096	DATE	7304	7312	6/1/2065	2065-01-06
file4096	DATE	7358	7365	12/8/68	2068-08-12
file4096	DOCTOR	7412	7419	Ngarigo
file4096	DATE	7641	7648	12/7/68	2068-07-12
file414	IDNUM	8	18	16V302522J
file414	MEDICALRECORD	27	34	1683025
file414	HOSPITAL	46	64	GERALDTON HOSPITAL
file414	MEDICALRECORD	127	138	1683025.GHJ
file414	PATIENT	138	151	Goulette,andy
file414	IDNUM	155	180	16V30252\nIDNUM: 16V30252
file414	DATE	189	198	11/5/2062	2062-05-11
file414	DOCTOR	227	247	SURNAME\nSTATE: LIED
file414	DATE	272	279	5/11/33	3380-11-05
file414	IDNUM	294	326	43A722722N\nDOCTOR: A.M.O. Heide
file414	DATE	397	404	25/9/63	2063-09-25
file414	DATE	530	537	25/9/65	2065-09-25
file414	HOSPITAL	560	587	ROCKINGHAM GENERAL HOSPITAL
file414	DEPARTMENT	1472	1519	Mayhice\nDEPARTMENT: Mayhice\nHOSPITAL: Mayhice
file414	HOSPITAL	1511	1524	REGGIE HUDILY
file414	DOCTOR	2063	2075	Kamala NERIS
file414	DOCTOR	2101	2112	NOBLE Schan
file5118	IDNUM	8	18	64R4236807
file5118	MEDICALRECORD	27	34	6464236
file5118	HOSPITAL	46	59	ROMA HOSPITAL
file5118	IDNUM	104	158	64R42368\nIDNUM: 64R4236807\nPATIENT: WOFFORD, ROSETTA
file5118	DOCTOR	727	732	T.1.0	2065-03-01
file5118	DATE	847	853	7/6/68	2068-07-06
file5118	DOCTOR	1148	1157	R Belllin
file5118	DATE	1991	2000	7/11/2064	2064-07-11
file5124	HOSPITAL	36	58	COBRAM DISTRICT HEALTH
file5124	PATIENT	71	76	Corle
file5124	IDNUM	85	95	22N444639B
file5124	MEDICALRECORD	102	109	2254446
file5124	AGE	247	249	79
file5124	DOCTOR	879	889	F Kaneelka
file5124	DOCTOR	1362	1374	F Wiltberger
file5124	DOCTOR	1975	1983	F Muszel
file5124	DOCTOR	4180	4187	F Comee
file5124	DOCTOR	4570	4582	F Blachowski
file5124	DATE	4638	4644	2/6/72	2072-06-02
file5124	DOCTOR	4676	4683	F Itani
file5124	DATE	7618	7626	8/6/2071	2071-06-08
file5124	TIME	7887	7905	2846-12-08 00:00:8	2846-12-08T00:00:00
file5124	STREET	7919	7926	Endsley
file5168	IDNUM	8	18	70J464797J
file5168	MEDICALRECORD	27	34	7034647
file5168	HOSPITAL	46	70	MERCY HOSPITAL FOR WOMEN
file5168	IDNUM	132	205	70J46479\nIDNUM: 70J46479\nIDNUM: 70J464797J\nPATIENT: MONhollen, ORIELLE
file5168	DOCTOR	777	779	U.
file5168	DATE	794	801	10.8.65	2065-10-08
file5168	DOCTOR	2233	2239	U. Asa
file5168	DATE	2967	2975	9/8/2068	2068-09-08
file5220	HOSPITAL	36	64	MILDURA BASE PUBLIC HOSPITAL
file5220	PATIENT	76	81	Quale
file5220	IDNUM	91	101	38F5857557
file5220	MEDICALRECORD	108	115	3825857
file5220	STREET	168	175	Meroney
file5220	DATE	1451	1458	26/9/66	2066-09-26
file5220	DOCTOR	1461	1471	I Mudramam
file5220	TIME	3127	3146	2706-03-23 00:00:00	2706-03-23T00:00:00
file5220	PATIENT	3159	3165	Mathew
file5423	DATE	12	19	2.00709	2069-02-11
file5423	HOSPITAL	36	86	GREAT OCEAN ROAD HEALTH - LORNE COMMUNITY HOSPITAL
file5423	PATIENT	99	104	ROYAL
file5423	IDNUM	113	123	59X186613D
file5423	MEDICALRECORD	130	136	598186
file5423	AGE	253	255	66
file5423	DOCTOR	450	457	Solomon
file5423	DOCTOR	914	987	Renouf\nDOCTOR: N Dumhire\nDOCTOR: N Dumhire\nTIME: 10:55am on 16/03/2015	2015-03-16T10:55
file5423	DOCTOR	1425	1514	Oliver\nDOCTOR: XRodrick\nDOCTOR: XRoditch\nDOCTOR: XRodrick\nTIME: 12:10pm on 19/04/2017	2019-04-19T12:10
file5423	DOCTOR	1774	1822	Salita\nDOCTOR: X Decarmene\nDOCTOR: X Dec 15/17
file5423	DOCTOR	2941	2994	Minelli\nDOCTOR: XBailey\nTIME: 12:50pm on 19/04/2018	2018-04-19T12:50
file5423	DATE	6333	6342	24/6/2069	2069-06-24
file5423	DOCTOR	6374	6381	X Sopry
file5423	DOCTOR	16758	16766	X Mainly
file5423	DOCTOR	16936	16943	Rogelio
file5423	DOCTOR	18308	18351	X Belski\nDOCTOR: X Lizama\nDATE: X Javales
file5423	DOCTOR	18401	18411	X Jernigan
file5423	TIME	18438	18456	2512/10/2066:00:00	2066-10-25T00:00:00
file5533	DATE	12	20	2.00203E	2013-02-02
file5533	HOSPITAL	36	83	KING ISLAND DISTRICT HOSPITAL AND HEALTH CENTRE
file5533	PATIENT	96	103	Kisicki
file5533	IDNUM	112	122	07T107761M
file5533	MEDICALRECORD	129	136	7710776
file5533	AGE	267	269	76
file5533	DATE	1208	1216	6/6/2068	2068-06-06
file5533	DOCTOR	1248	1257	C Donmore
file5533	TIME	3110	3127	2050/1/4 00:00:00	2050-01-04T00:00:00
file5533	STREET	3142	3149	Shearer
file5794	IDNUM	8	18	65P1377297
file5794	MEDICALRECORD	27	34	6561377
file5794	HOSPITAL	46	87	GEORGE TOWN HOSPITAL AND COMMUNITY CENTRE
file5794	IDNUM	132	184	65P13772\nIDNUM: 65P1377297\nPATIENT: MAUSS, CORDELL
file5794	DOCTOR	625	676	Q Nacht\nDOCTOR: W Nogland\nTIME: 2.10pm on 21.5.15	2015-05-21T14:10
file5794	DOCTOR	5196	5208	Q Campoverde
file6094	IDNUM	8	18	13L258888D
file6094	MEDICALRECORD	27	34	1342588
file6094	HOSPITAL	46	62	ROSEBUD HOSPITAL
file6094	IDNUM	107	163	13L25888\nIDNUM: 13L258888D\nPATIENT: Ti, TRACY LAWRENCE
file6094	HOSPITAL	202	219	BX\nDATE: 30/6/65	2065-06-30
file6094	DOCTOR	644	664	Heron\nTIME: 34.1.16	2016-01-34T16:00
file6094	DOCTOR	4368	4379	E. Bourlier
file6094	TIME	7057	7076	31/07/2017 03:36:00	2017-03-11T16:00
file6094	AGE	7095	7097	46
file6094	IDNUM	7380	7456	85N11888\nIDNUM: 90N11888\nIDNUM: 90N11888\nIDNUM: 90N11888\nIDNUM: 90N11888
file6094	HOSPITAL	7465	7490	KEMPSEY DISTRICT HOSPITAL
file6094	PATIENT	7549	7553	NCBI
file6094	MEDICALRECORD	7682	7707	NM\nMEDICALRECORD: 004985
file6094	DATE	7739	7748	16/1/2065	2065-01-16
file7016	IDNUM	8	18	34D859736O
file7016	MEDICALRECORD	27	35	34185973
file7016	HOSPITAL	47	67	MATER ADULT HOSPITAL
file7016	IDNUM	112	166	34D85973\nIDNUM: 34D859736O\nPATIENT: FREEDMAN, Terrie
file7016	DOCTOR	3561	3569	J Crehan
file7016	DATE	6178	6188	14/10/2065	2065-10-14
file7054	HOSPITAL	36	52	AUGUSTA HOSPITAL
file7054	STREET	65	73	Sauceman
file7054	IDNUM	82	92	92Z870794X
file7054	MEDICALRECORD	99	107	92987079
file7054	DOCTOR	211	239	Y Trapasso\nDATE: 19.11.2068	2068-11-19
file7054	DATE	1724	1731	11/6/72	2072-06-11
file7054	DOCTOR	1764	1773	Y Komatsu
file7054	DOCTOR	3592	3619	Y Garibay\nDATE: 19.10.2070	2070-10-19
file7054	TIME	3930	3949	2051-10-02 00:00:00	2051-10-02T00:00:00
file7054	PATIENT	3962	3971	Tassinari
file7405	IDNUM	12	23	1.99809E+11
file7405	HOSPITAL	36	54	FRANKSTON HOSPITAL
file7405	IDNUM	84	94	12Q471652I
file7405	MEDICALRECORD	101	108	1264716
file7405	AGE	246	248	79
file7405	DOCTOR	891	898	D Knust
file7405	DOCTOR	1358	1368	D Wickline
file7405	DOCTOR	1982	1991	D Voetsch
file7405	DOCTOR	4175	4187	D Caffarelli
file7405	DOCTOR	4570	4583	D Mccambridge
file7405	DATE	4639	4645	3/7/72	2072-07-03
file7405	DOCTOR	4677	4686	D Munhall
file7405	DATE	7621	7629	5/8/2070	2070-05-08
file7405	TIME	7890	7908	2846-12-08 00:00:8	2846-12-08T00:00:00
file7405	STREET	7922	7928	Mamman
file7445	IDNUM	8	18	60M591711R
file7445	MEDICALRECORD	27	33	604591
file7445	HOSPITAL	45	60	GLENSIDE CAMPUS
file7445	IDNUM	104	145	60M59171\nIDNUM: 60M59173\nIDNUM: 60M5917
file7445	DOCTOR	2692	2701	R. Dierks
file7445	DATE	4203	4213	16/11/2064	2064-11-16
file7445	ORGANIZATION	4272	4293	Orana MORAWA HOSPITAL
file8067	HOSPITAL	36	52	MAREEBA HOSPITAL
file8067	PATIENT	65	70	Diego
file8067	IDNUM	79	89	28J5128699
file8067	MEDICALRECORD	96	102	283512
file8067	PATIENT	155	164	Stockhoff
file8067	IDNUM	215	284	28J51286\nIDNUM: 28J51286\nIDNUM: 28J5128699\nPATIENT: CANION, ROBENA
file8067	HOSPITAL	293	311	MACQUARIE HOSPITAL
file8067	DOCTOR	1454	1484	Moses DELAGUARDIA\nDOCTOR: Drs
file8067	DATE	2243	2252	28/8/2070	2070-08-28
file8067	DATE	2323	2331	5/6/2071	2071-06-05
file8067	DOCTOR	2356	2367	G Cucchiara
file8067	DATE	3952	3960	7/9/2071	2071-07-09
file8067	TIME	3991	4000	2764/9/30	2764-09-27T00:00:30
file8067	PATIENT	4022	4027	AMADO
file8088	IDNUM	8	18	76F543827I
file8088	MEDICALRECORD	27	33	762543
file8088	HOSPITAL	45	94	GOULBURN VALLEY HEALTH - CENTRE FOR OLDER PERSONS
file8088	IDNUM	138	205	76F54382\nIDNUM: 76F54382\nIDNUM: 76F543827I\nPATIENT: PACHLA, CODY
file8088	DOCTOR	2833	2840	U Pries
file8088	DATE	4343	4352	14/1/2067	2067-01-14
file8088	ORGANIZATION	4377	4418	SA Pathology\nDEPARTMENT: CAMDEN HOSPITAL
file8088	DATE	5203	5210	15.2.67	2067-02-15
file8786	IDNUM	8	18	81J3154342
file8786	MEDICALRECORD	27	34	8133154
file8786	HOSPITAL	46	64	HERBERTON HOSPITAL
file8786	IDNUM	109	167	81J31543\nIDNUM: 81J3154342\nPATIENT: FITZ, Garrett DARELL
file8786	DOCTOR	958	960	V.
file8786	DOCTOR	960	992	Towery\nTIME: 1010am on 26.12.18	2012-12-26T11:00
file8786	DOCTOR	2975	2984	V Strimel
file8786	DATE	4462	4471	12/6/2067	2067-06-12
file9042	HOSPITAL	36	81	RURAL NORTHWEST HEALTH - WARRACKNABEAL CAMPUS
file9042	IDNUM	107	117	55S264833C
file9042	MEDICALRECORD	124	130	557264
file9042	AGE	247	249	66
file9042	DOCTOR	444	447	Lon
file9042	DOCTOR	904	957	LeonDS\nDOCTOR: O Tarras\nTIME: 10:55am on 20/04/2018	2018-04-20T10:55
file9042	DOCTOR	1418	1482	Valen\nDOCTOR: OB\nDOCTOR: OBladder\nTIME: 12:10pm on 18/03/2019	2019-03-18T12:10
file9042	DOCTOR	1763	1833	Steveson\nDOCTOR: C00ace\nDOCTOR: O Spade\nTIME: 12:10pm on 18/04/2017	2017-04-18T12:10
file9042	DOCTOR	2931	2982	Mccal\nDOCTOR: JJarrod\nTIME: 12:50pm on 17/03/2016	2016-03-17T12:50
file9042	DATE	6322	6331	21/6/2066	2066-06-21
file9042	DOCTOR	6334	6345	J Inocolic-
file9042	DOCTOR	16749	16760	J Monophase
file9042	DOCTOR	16928	16935	Gonzalo
file9042	DOCTOR	18300	18325	J Godch\nDOCTOR: J Grinac
file9042	TIME	18427	18445	2512/10/2066:00:00	2066-10-25T00:00:00
file9042	STREET	18459	18468	Lighthart
file9392	IDNUM	8	18	03O285892K
file9392	MEDICALRECORD	27	35	03528589
file9392	HOSPITAL	47	86	GOULBURN VALLEY HEALTH - WARANGA CAMPUS
file9392	IDNUM	131	184	03O28589\nIDNUM: 03O285892K\nPATIENT: Vandevelde, LEO
file9392	DOCTOR	754	772	C Blott\nDOCTOR: C
file9392	DATE	835	841	1/1/67	2067-01-01
file9392	DOCTOR	6631	6639	C. Mcgaw
file9392	DATE	9003	9011	6/2/2068	2068-02-06
file9392	ORGANIZATION	9036	9091	MACQUARIE WARD\nHOSPITAL: WARIE WARD NORMANTON HOSPITAL
file9762	IDNUM	12	23	1.99306E+11
file9762	HOSPITAL	36	79	CENTRAL HIGHLANDS RURAL HEALTH - DAYLESFORD
file9762	IDNUM	105	115	18S067408J
file9762	MEDICALRECORD	122	129	1870674
file9762	PATIENT	182	187	Bober
file9762	TIME	425	446	25/05/2015 at 17:10hr	2015-05-25T17:10
file9762	DATE	1861	1868	28/8/68	2068-08-28
file9762	DOCTOR	1871	1898	D Scobie\nDOCTOR: D D Toren
file9762	TIME	3663	3674	2015/5/2066	2066-05-09
